FORT BIDWELL, Modoc, CA03, -120.157, 41.872, 4739, 48.4, 1.27
GASQUET RS, Del Norte, CA01, -123.965, 41.845, 387, M, 7.13
FORT DICK RIVER, Del Norte, CA01, -124.135, 41.881, -, M, 6.12
TULELAKE, Siskiyou, CA01, -121.474, 41.960, 4038, 46.6, 0.96
COPCO NO 1 DAM, Siskiyou, CA01, -122.338, 41.980, 2665, M, 1.69
ELK VALLEY, Del Norte, CA01, -123.718, 41.988, 1708, M, 6.48
PACIFICA 4 SSE, San Mateo, CA04, -122.472, 37.592, 475, 58.0, 3.73
BARSTOW, San Bernardino, CA07, -117.022, 34.893, 2220, 66.6, 0.60
INYOKERN, Kern, CA07, -117.821, 35.651, 2430, 65.3, 0.00
PEARBLOSSOM, Los Angeles, CA07, -117.897, 34.503, 3101, 63.6, 0.18
EL CAJON, San Diego, CA06, -116.928, 32.801, 495, 65.7, 1.28
MARKLEY COVE, Napa, CA02, -122.124, 38.492, 480, 61.6, 3.02
CORONADO FIRE DEPT, San Diego, CA06, -117.177, 32.692, 18, 64.8, 1.63
CUYAMACA RANCHO ST PARK, San Diego, CA06, -116.559, 32.927, 4870, 57.9, 0.31
FALLBROOK FIRE DEPT, San Diego, CA06, -117.248, 33.384, 698, 62.5, 1.09
DEL MAR FIRE DEPT, San Diego, CA06, -117.262, 32.972, 12, 68.0, 0.95
IMPERIAL BEACH FIRE DEPT, San Diego, CA06, -117.114, 32.576, 22, 63.5, 1.04
LEMON GROVE FIRE DEPARTMENT, San Diego, CA06, -117.030, 32.738, 427, 63.7, 1.09
NATIONAL CITY FIRE DEPT, San Diego, CA06, -117.100, 32.671, 30, 63.2, 0.71
SPRING VALLEY FIRE DEPT, San Diego, CA06, -117.006, 32.710, 270, 63.9, 0.77
MT LAGUNA # 2, San Diego, CA07, -116.422, 32.876, 5760, 49.5, 1.13
SANTEE FIRE DEPT, San Diego, CA06, -116.973, 32.841, 340, 66.7, 1.19
LEE VINING, Mono, CA07, -119.119, 37.957, 6797, 49.3, 0.65
ANAHEIM, Orange, CA06, -117.842, 33.865, 235, 65.8, 1.71
RED BLUFF TREATMENT PLANT, Tehama, CA02, -122.220, 40.162, 265, M, 3.57
NEW MELONES DAM HQ, Tuolumne, CA05, -120.486, 38.005, 960, 62.2, 5.49
MAMMOTH LAKES RS, Mono, CA07, -118.962, 37.648, 7804, 42.1, 1.86
CAMPTONVILLE 1SW, Yuba, CA02, -121.071, 39.440, 2500, M, 14.68
MONTEREY WFO, Monterey, CA04, -121.855, 36.593, 122, 59.0, 3.89
SKYLINE RIDGE PRESERVE, San Mateo, CA04, -122.185, 37.313, 2270, 57.3, 4.97
FREMONT, Alameda, CA04, -122.016, 37.542, 38, 62.2, 1.95
MAD RIVER 12 SE, Trinity, CA01, -123.374, 40.319, 2763, M, 11.30
BISHOP FS, Inyo, CA07, -118.365, 37.368, 4108, M, 0.25
NEWHALL 5NW, Los Angeles, CA06, -118.594, 34.393, 1765, 61.8, 0.65
TEHACHAPI 4 SE, Kern, CA05, -118.422, 35.101, 4220, 55.1, 0.81
REDWOOD CITY #2, San Mateo, CA04, -122.214, 37.488, 10, 62.2, 2.41
WRIGHTWOOD, San Bernardino, CA07, -117.639, 34.362, 6000, 48.9, 0.74
REDDING CDF, Shasta, CA02, -122.299, 40.519, 502, M, 4.42
STOCKTON 5 SSE, San Joaquin, CA05, -121.251, 37.899, 22, M, 0.52
VALLEJO, Solano, CA01, -122.187, 38.100, 341, 61.7, 2.25
NORTHRIDGE CAL STATE, Los Angeles, CA06, -118.525, 34.245, 904, 65.8, 1.69
OXNARD WFO, Ventura, CA06, -119.137, 34.207, 52, 62.3, 0.74
LAKEHEAD, Shasta, CA02, -122.391, 40.899, 1398, M, 3.90
HANFORD MUNICIPAL AP, Kings, CA05, -119.623, 36.311, 249, 63.5, 1.35
RAMONA AIRPORT, San Diego, CA06, -116.916, 33.038, 1385, 60.6, 0.66
VACAVILLE/NUT TREE AP ASOS, Solano, CA02, -121.959, 38.378, 104, 62.2, 3.02
ALTURAS MUNICIPAL AP, Modoc, CA02, -120.561, 41.484, 4383, 45.9, 1.74
MADERA MUNICIPAL AP, Madera, CA05, -120.111, 36.985, 251, 62.3, 0.25
BAKERSFIELD 5 NW, Kern, CA05, -119.051, 35.419, 470, 64.4, 0.36
FRESNO 5 NE, Fresno, CA05, -119.709, 36.767, 338, 64.5, 2.12
OCEANSIDE MUNICIPAL AP, San Diego, CA06, -117.350, 33.219, 30, 62.2, 1.27
SAN DIEGO SEAWORLD, San Diego, CA06, -117.231, 32.765, 14, 63.7, 1.28
BOULEVARD 2, San Diego, CA07, -116.300, 32.667, 3600, M, 5.00
ARCATA EUREKA AP, Humboldt, CA01, -124.105, 40.978, 211, 54.1, 3.37
CHICO ARMY FLYING SCH, Butte, CA02, -121.850, 39.800, 272, 70.8, 0.08
NEWPORT BEACH HARBOR, Orange, CA06, -117.884, 33.603, 10, 62.9, 1.57
ESCONDIDO NO. 2, San Diego, CA06, -117.090, 33.121, 600, 65.7, 0.90
REDDING AP, Shasta, CA02, -122.298, 40.515, 501, 61.3, 3.74
AVALON CATALINA AP, Los Angeles, CA06, -118.415, 33.404, 1565, 59.5, 1.09
SANTA MARIA PUBLIC AP, Santa Barbara, CA06, -120.452, 34.894, 243, 59.0, 0.80
MOUNT SHASTA, Siskiyou, CA02, -122.333, 41.333, 3535, 50.0, 2.09
RED BLUFF MUNI AP, Tehama, CA02, -122.255, 40.152, 354, 62.2, 3.70
NEEDLES AIRPORT, San Bernardino, CA07, -114.618, 34.768, 888, 74.5, 0.64
CECILVILLE, Siskiyou, CA01, -123.139, 41.142, 2310, 51.7, 1.73
CHINA LAKE NAF, Kern, CA07, -117.693, 35.688, 2230, 64.8, T
HEARST CASTLE, San Luis Obispo, CA04, -121.168, 35.684, 1526, 59.1, 3.85
HESPERIA 2E, San Bernardino, CA07, -117.266, 34.421, 3055, 70.1, 0.04
EMIGRANT GAP, Placer, CA02, -120.651, 39.303, 5250, 49.8, 5.12
RANCHO BERNARDO, San Diego, CA06, -117.081, 33.022, 690, 62.9, 0.82
TORRANCE AP, Los Angeles, CA06, -118.342, 33.802, 90, 63.3, 2.29
LOS ANGELES DOWNTOWN/USC, Los Angeles, CA06, -118.291, 34.024, 179, 65.1, 0.98
FRESNO YOSEMITE INT'L, Fresno, CA05, -119.720, 36.780, 334, 63.9, 2.45
MONTEREY PENINSUL AP, Monterey, CA04, -121.849, 36.590, 160, 57.6, 2.91
PASO ROBLES MUNICIPAL AP, San Luis Obispo, CA04, -120.629, 35.669, 820, 60.9, 0.96
MONTAGUE SISKIYOU AIRPORT, Siskiyou, CA01, -122.468, 41.774, 2645, 50.8, 1.51
SAN JOSE, Santa Clara, CA04, -121.903, 37.350, 67, 63.2, 2.16
SAN JOSE, Santa Clara, CA04, -121.924, 37.359, 49, 62.0, 2.14
PALM SPRINGS ASOS, Riverside, CA07, -116.504, 33.822, 409, 72.8, 0.12
SAN DIEGO BROWN FIELD, San Diego, CA06, -116.994, 32.576, 521, 62.4, 1.01
Bakersfield Area, -, -, -, -, -, 65.1, 0.39
Bishop Area, -, -, -, -, -, 55.1, 0.25
Los Angeles Downtown Area, -, -, -, -, -, 65.1, 0.98
Eureka Area, -, -, -, -, -, 54.2, 2.99
Fresno Area, -, -, -, -, -, 63.9, 2.45
Los Angeles Airport Area, -, -, -, -, -, 63.6, 1.12
Long Beach Area, -, -, -, -, -, 64.7, 2.30
Redding Area, -, -, -, -, -, 61.3, 3.74
Sacramento Area, -, -, -, -, -, 61.8, 1.62
San Diego Area, -, -, -, -, -, 65.1, 1.24
Stockton Area, -, -, -, -, -, 60.7, 2.68
San Francisco Airport Area, -, -, -, -, -, 60.0, 2.14
Santa Maria Area, -, -, -, -, -, 59.0, 0.80
LEMOORE REEVES NAS, Fresno, CA05, -119.950, 36.333, 232, 62.2, 1.43
ARVIN, Kern, CA05, -118.834, 35.211, 450, 64.1, 0.38
FRAZIER PARK, Kern, CA06, -118.965, 34.827, 4972, 50.5, 0.24
REDONDO BEACH, Los Angeles, CA06, -118.376, 33.834, 142, 64.3, 0.74
TEJON RANCHO, Kern, CA05, -118.750, 35.023, 1425, 64.1, 0.82
SAN SIMEON POINT PIEDRAS BLANCAS, San Luis Obispo, CA04, -121.285, 35.666, 59, 57.1, 1.20
BURBANK GLENDALE PASADENA AP, Los Angeles, CA06, -118.365, 34.200, 731, 63.6, 1.13
MOUNT SHASTA, Siskiyou, CA02, -122.317, 41.322, 3613, 49.5, 2.54
WATSONVILLE MUNICIPAL AIRPORT, Santa Cruz, CA04, -121.790, 36.939, 162, 58.7, 3.24
SANTA ROSA SONOMA CO AP, Sonoma, CA04, -122.811, 38.504, 119, 59.0, 2.35
OAKHURST, Madera, CA05, -119.653, 37.331, 2230, 56.0, 2.09
ARBUCKLE BASIN CALIFORNIA, Shasta, CA02, -122.833, 40.398, 1900, 61.0, M
ACTON CALIFORNIA, Los Angeles, CA06, -118.200, 34.446, 2600, 60.1, M
ARROYO GRANDE CALIFORNIA, San Luis Obispo, CA04, -120.392, 35.179, 1048, 60.2, M
ALDER SPRINGS CALIFORNIA, Glenn, CA02, -122.724, 39.651, 4300, 52.3, M
LOS ALTOS CALIFORNIA, Santa Clara, CA04, -122.147, 37.358, 645, 61.5, M
ANZA CALIFORNIA, Riverside, CA06, -116.673, 33.555, 3920, 56.2, M
ALDER POINT CALIFORNIA, Humboldt, CA01, -123.590, 40.187, 923, 58.6, M
ARROYO SECO (MT. DIABLO) CALIF, Monterey, CA04, -121.492, 36.230, 980, 60.6, M
ASH CREEK CALIFORNIA, Siskiyou, CA02, -121.979, 41.277, 3200, 47.5, M
ASH VALLEY CALIFORNIA, Lassen, CA02, -120.686, 41.052, 5100, 44.8, M
BACKBONE CALIFORNIA, Trinity, CA01, -123.142, 40.889, 4700, 53.8, M
BALD MTN LOC CALIFORNIA, El Dorado, CA02, -120.697, 38.906, 4680, 55.0, M
BARNABY CALIFORNIA, Marin, CA01, -122.702, 38.028, 1240, 58.2, M
BATTERSON CALIFORNIA, Madera, CA05, -119.508, 37.232, 3160, 59.8, M
BIG BAR CALIFORNIA, Trinity, CA01, -123.233, 40.733, 1500, 59.0, M
BELL CANYON CALIFORNIA, Orange, CA06, -117.592, 33.542, 700, 64.8, M
BEAR PEAK CALIFORNIA, Tulare, CA05, -118.052, 35.884, 8228, 45.4, M
BENTON CALIFORNIA, Mono, CA07, -118.478, 37.843, 5450, 50.7, M
BEVERLY HILLS CALIFORNIA, Los Angeles, CA06, -118.412, 34.125, 1260, 64.8, M
BANGOR CALIFORNIA, Butte, CA02, -121.386, 39.398, 803, 61.0, M
BIG HILL CALIFORNIA, Humboldt, CA01, -123.636, 41.098, 3570, 53.0, M
BLACK DIAMOND CALIFORNIA, Contra Costa, CA04, -121.884, 37.950, 1600, 60.3, M
BLUE DOOR CALIFORNIA, Lassen, CA02, -120.337, 41.055, 5615, 44.8, M
BEN BOLT CALIFORNIA, El Dorado, CA05, -120.934, 38.591, 905, 60.6, M
BEN LOMOND CALIFORNIA, Santa Cruz, CA04, -122.170, 37.132, 2630, 56.1, M
BOGARD R.S. CALIFORNIA, Lassen, CA02, -121.083, 40.598, 5650, 43.0, M
BOONVILLE CALIFORNIA, Mendocino, CA01, -123.349, 38.988, 644, 59.8, M
BRANCH MOUNTAIN CALIFORNIA, San Luis Obispo, CA04, -120.083, 35.189, 3770, 56.4, M
BRIONES CALIFORNIA, Contra Costa, CA04, -122.118, 37.944, 1450, 59.8, M
BLACKROCK CALIFORNIA, Tulare, CA05, -118.260, 36.093, 8200, 44.9, M
BROOKS CALIFORNIA, Yolo, CA02, -122.145, 38.738, 354, 62.8, M
BUCK MEADOWS CALIFORNIA, Tuolumne, CA05, -120.097, 37.823, 3200, 55.6, M
BULL FLAT CALIFORNIA, Lassen, CA03, -120.114, 40.481, 4395, 47.7, M
BURNS CANYON CALIFORNIA, San Bernardino, CA07, -116.634, 34.210, 6000, 53.5, M
BEAVER CAMP LOC CALIFORNIA, Amador, CA05, -120.325, 38.488, 5000, 55.9, M
BRAZIE RANCH CALIFORNIA, Siskiyou, CA01, -122.594, 41.685, 3000, 53.6, M
CALLAHAN CALIFORNIA, Siskiyou, CA01, -122.796, 41.308, 3136, 50.5, M
CAMERON FIRE STATION CALIFORNI, San Diego, CA06, -116.463, 32.721, 3443, 55.5, M
CANBY CALIFORNIA, Modoc, CA02, -120.868, 41.434, 4312, 46.8, M
CARRIZO CALIFORNIA, San Luis Obispo, CA05, -119.773, 35.096, 2490, 61.9, M
CASE SPRINGS CALIFORNIA, San Diego, CA06, -117.418, 33.445, 2320, 59.9, M
CATHEYS VALLEY CALIFORNIA, Mariposa, CA05, -120.111, 37.468, 1200, 62.9, M
CEDAR GROVE CALIFORNIA, Fresno, CA05, -118.656, 36.788, 4720, 52.1, M
CHEESEBORO CALIFORNIA, Ventura, CA06, -118.717, 34.185, 1650, 63.5, M
CHICO CALIFORNIA, Butte, CA02, -121.779, 39.712, 230, 61.8, M
CHILAO CALIFORNIA, Los Angeles, CA06, -118.030, 34.332, 5450, 55.7, M
CHUCHUPATE CALIFORNIA, Ventura, CA05, -119.012, 34.808, 4900, 48.7, M
CLAREMONT CALIFORNIA, Los Angeles, CA06, -117.707, 34.137, 1645, 61.2, M
CLARK CALIFORNIA, Riverside, CA06, -117.309, 33.877, 1720, 61.8, M
CALAVERAS ROAD CALIFORNIA, Alameda, CA04, -121.844, 37.553, 1230, 59.5, M
COHASSET CALIFORNIA, Butte, CA02, -121.769, 39.872, 1733, 63.5, M
COLLINS BALDY CALIFORNIA, Siskiyou, CA01, -122.950, 41.775, 5493, 48.3, M
LIVERMORE CALIFORNIA, Alameda, CA04, -121.814, 37.712, 800, 61.4, M
LYONS VALLEY CALIFORNIA, Lake, CA01, -123.074, 39.126, 3200, 57.4, M
MAD RIVER CALIFORNIA, Trinity, CA01, -123.524, 40.463, 2775, 54.1, M
MALIBU HILLS CALIFORNIA, Los Angeles, CA06, -118.633, 34.058, 1575, 63.7, M
MANZANITA LAKE CALIFORNIA, Shasta, CA02, -121.580, 40.540, 5660, 45.5, M
MAPLE CREEK CALIFORNIA, Humboldt, CA01, -123.937, 40.796, 1680, 57.6, M
MARIPOSA GROVE CALIFORNIA, Mariposa, CA05, -119.605, 37.513, 6400, 51.5, M
MILL CREEK (BDF) CALIFORNIA, San Bernardino, CA06, -117.035, 34.084, 2950, 61.7, M
MCGUIRES CALIFORNIA, Mendocino, CA01, -123.601, 39.353, 593, 57.7, M
MEANS LAKE CALIFORNIA, San Bernardino, CA07, -116.517, 34.391, 2900, 64.1, M
MENDOCINO PASS CALIFORNIA, Mendocino, CA01, -122.945, 39.808, 5420, 51.8, M
METCALF GAP CALIFORNIA, Madera, CA05, -119.768, 37.409, 3077, 61.7, M
MEYERS CALIFORNIA, El Dorado, CA03, -120.018, 38.849, 6310, 44.4, M
MID HILLS CALIFORNIA, San Bernardino, CA07, -115.411, 35.123, 5413, 53.3, M
MILL CREEK (ANF) CALIFORNIA, Los Angeles, CA06, -118.082, 34.390, 5021, 54.8, M
MALLORY RIDGE CALIFORNIA, Contra Costa, CA05, -121.779, 37.817, 2040, 59.2, M
MONTECITO CALIFORNIA, Santa Barbara, CA06, -119.648, 34.461, 1500, 62.1, M
MOJAVE RIVER SINK CALIFORNIA, San Bernardino, CA07, -116.079, 35.053, 950, 70.2, M
MORMON ROCK CALIFORNIA, San Bernardino, CA06, -117.502, 34.318, 3300, 58.3, M
MOUNTAIN REST CALIFORNIA, Fresno, CA05, -119.371, 37.054, 4100, 56.1, M
MARKLEEVILLE CALIFORNIA, Alpine, CA03, -119.767, 38.683, 5501, 48.4, M
MT. SHASTA CALIFORNIA, Siskiyou, CA02, -122.316, 41.316, -, 51.5, M
MARIPOSA CALIFORNIA, Mariposa, CA05, -119.987, 37.504, 2231, 59.7, M
MT. DIABLO CALIFORNIA, Contra Costa, CA05, -121.914, 37.882, 3849, 54.7, M
MOUNT ZION CALIFORNIA, Amador, CA05, -120.651, 38.389, 2960, 59.5, M
NORTH FORK CALIFORNIA, Madera, CA05, -119.505, 37.233, 2720, 76.1, M
OAK KNOLL CALIFORNIA, Siskiyou, CA01, -122.850, 41.839, 1940, 54.0, M
OAK MOUNTAIN CALIFORNIA, Shasta, CA02, -121.983, 41.006, 1700, 58.8, M
OAK CREEK CALIFORNIA, Inyo, CA07, -118.259, 36.843, 4855, 59.5, M
OJAI CALIFORNIA, Ventura, CA06, -119.230, 34.448, 765, 59.4, M
OAK GROVE CALIFORNIA, San Diego, CA06, -116.795, 33.393, 2752, 60.4, M
OAKLAND NORTH CALIFORNIA, Contra Costa, CA04, -122.221, 37.865, 1403, 58.0, M
OAK OPENING CALIFORNIA, Tulare, CA05, -118.702, 36.175, 3240, 59.2, M
OAKLAND SOUTH CALIFORNIA, Alameda, CA04, -122.145, 37.786, 1095, 58.9, M
OPAL MOUNTAIN CALIFORNIA, San Bernardino, CA07, -117.176, 35.154, 3240, 63.5, M
OWENS CAMP LOC CALIFORNIA, El Dorado, CA02, -120.245, 38.733, 5240, 50.6, M
OWENS VALLEY CALIFORNIA, Inyo, CA07, -118.551, 37.390, 4640, 58.3, M
PANAMINT CALIFORNIA, Inyo, CA07, -117.088, 36.120, 6880, 52.3, M
PARKFIELD CALIFORNIA, Monterey, CA04, -120.432, 35.899, 1535, 59.3, M
PATTY MOCUS CALIFORNIA, Tehama, CA02, -122.867, 40.295, 3500, 56.1, M
PIERCE CALIFORNIA, Plumas, CA02, -120.642, 40.246, 5700, 48.4, M
PIKE COUNTY LOOKOUT CALIFORNIA, Yuba, CA02, -121.202, 39.475, 3714, 57.0, M
PILOT HILL CALIFORNIA, El Dorado, CA02, -121.009, 38.833, 1200, 59.2, M
PARK RIDGE CALIFORNIA, Tulare, CA05, -118.942, 36.724, 7540, 47.5, M
POPPY PARK CALIFORNIA, Los Angeles, CA07, -118.383, 34.733, 2760, 62.3, M
POTRERO CALIFORNIA, San Diego, CA06, -116.609, 32.606, 2345, 57.6, M
PANOCHE ROAD CALIFORNIA, Fresno, CA05, -120.766, 36.727, 2032, 63.7, M
PULGAS CALIFORNIA, San Mateo, CA04, -122.298, 37.475, 644, 61.1, M
QUARTZ HILL CALIFORNIA, Siskiyou, CA01, -122.934, 41.599, 4225, 52.2, M
QUINCY RD CALIFORNIA, Plumas, CA02, -120.942, 39.973, 3500, 53.7, M
RAVENDALE CALIFORNIA, Lassen, CA03, -120.316, 40.731, 5298, 46.2, M
RANCHITA CALIFORNIA, San Diego, CA07, -116.497, 33.222, 4415, 56.8, M
RICE VALLEY CALIFORNIA, Riverside, CA07, -114.732, 34.061, 820, 72.1, M
ROCK CREEK, Mono, CA07, -118.667, 37.551, 7040, 45.9, M
RODEO VALLEY, Mendocino, CA01, -123.321, 39.668, 2428, 57.3, M
ROSE VALLEY CALIFORNIA, Ventura, CA06, -119.184, 34.543, 3331, 52.9, M
ROUND MOUNTAIN, Siskiyou, CA02, -121.464, 41.427, 5258, 48.6, M
ROSE PEAK CALIFORNIA, Alameda, CA04, -121.735, 37.502, 3060, 56.9, M
RATTLESNAKE CALIFORNIA, Tulare, CA05, -118.422, 36.407, 8600, 48.3, M
RUSH CREEK CALIFORNIA, Modoc, CA02, -120.864, 41.294, 4800, 48.5, M
SADDLEBACK BUTTE CALIFORNIA, Los Angeles, CA07, -117.821, 34.685, 2590, 62.2, M
SAUGUS CALIFORNIA, Los Angeles, CA06, -118.525, 34.425, 1450, 63.8, M
SAWYERS BAR CALIFORNIA, Siskiyou, CA01, -123.132, 41.300, 2192, 57.5, M
SANTA BARBARA ISLAND CALIFORNI, Santa Barbara, CA06, -119.033, 33.483, 176, 57.4, M
SANTA CRUZ ISLAND CALIFORNIA, Santa Barbara, CA06, -119.722, 33.996, 250, 58.1, M
SCORPION CALIFORNIA, Trinity, CA01, -122.697, 41.112, 4400, 55.2, M
SODA CREEK CALIFORNIA, Lake, CA01, -122.977, 39.425, 1773, 56.9, M
SECRET TOWN CALIFORNIA, Nevada, CA02, -120.885, 39.184, 2826, 56.9, M
SHAVER CALIFORNIA, Fresno, CA05, -119.256, 37.135, 5746, 47.9, M
SHADEQUARTER CALIFORNIA, Tulare, CA05, -118.956, 36.567, 4069, 56.2, M
SIMS CALIFORNIA, Shasta, CA02, -122.373, 41.075, 2400, 58.9, M
SLATER BUTTE CALIFORNIA, Siskiyou, CA01, -123.352, 41.859, 4670, 51.5, M
SANTA RITA CALIFORNIA, San Benito, CA05, -120.598, 36.348, 5000, 54.0, M
SOLDIER MOUNTAIN CALIFORNIA, Shasta, CA02, -121.586, 40.926, 3710, 52.6, M
SOMES BAR CALIFORNIA, Siskiyou, CA01, -123.496, 41.390, 920, 59.5, M
SQUAW SPRINGS CALIFORNIA, San Bernardino, CA07, -117.568, 35.370, 3620, 63.5, M
SQUAW LAKE CALIFORNIA, Imperial, CA07, -114.494, 32.908, 300, 74.4, M
SANTA ROSA ISLAND CALIFORNIA, Santa Barbara, CA06, -120.078, 33.978, 1298, 53.7, M
SANTA ROSA PLATEAU CALIFORNIA, Riverside, CA06, -117.231, 33.529, 1980, 62.4, M
SANTA ROSA CALIFORNIA, Sonoma, CA01, -122.712, 38.479, 576, 60.5, M
STAMPEDE CALIFORNIA, Sierra, CA03, -120.075, 39.483, 6867, 47.4, M
STONYFORD CALIFORNIA, Colusa, CA02, -122.575, 39.367, 1200, 59.7, M
SUGARLOAF (SHF) CALIFORNIA, Shasta, CA02, -122.438, 40.917, 4200, 57.7, M
SUGARLOAF CALIFORNIA, Tulare, CA05, -118.675, 36.727, 8120, 51.0, M
SPRING VALLEY CALIFORNIA, San Mateo, CA04, -122.436, 37.563, 1075, 57.3, M
TANBARK CALIFORNIA, Los Angeles, CA06, -117.761, 34.207, 2600, 60.8, M
TARGET RANGE CALIFORNIA, San Diego, CA06, -117.359, 33.372, 918, 63.8, M
THOMES CREEK CALIFORNIA, Tehama, CA02, -122.610, 39.864, 1040, 64.7, M
TEMESCAL (CNF) CALIFORNIA, Riverside, CA06, -117.483, 33.763, 1125, 64.6, M
MOUNT TOM CALIFORNIA, Fresno, CA05, -119.178, 37.376, 9018, 41.5, M
LAS TRAMPAS CALIFORNIA, Contra Costa, CA04, -122.067, 37.834, 1760, 58.6, M
TRINITY CAMP CALIFORNIA, Trinity, CA01, -122.804, 40.786, 3308, 54.1, M
TRIMMER CALIFORNIA, Fresno, CA05, -119.305, 36.911, 1540, 61.7, M
GAYLOR MEADOW CALIFORNIA, Tuolumne, CA05, -119.318, 37.868, 9270, 38.9, M
UHL / HOT SPRINGS, Tulare, CA05, -118.633, 35.889, 3720, 56.8, M
VALLEY CENTER CALIFORNIA, San Diego, CA06, -117.009, 33.237, 1483, 62.5, M
VAN BREMMER CALIFORNIA, Siskiyou, CA01, -121.794, 41.643, 4928, 47.8, M
WALKER PASS CALIFORNIA, Kern, CA05, -118.057, 35.665, 5572, 56.5, M
WARM SPRINGS CALIFORNIA, Los Angeles, CA06, -118.579, 34.596, 4930, 58.9, M
WEAVERVILLE CALIFORNIA, Trinity, CA01, -122.943, 40.735, 2100, 55.1, M
WEED AIRPORT CALIFORNIA, Siskiyou, CA01, -122.454, 41.479, 2930, 52.7, M
WESTWOOD CALIFORNIA, Lassen, CA02, -120.900, 40.307, 5800, 47.2, M
WHITE CLOUD CALIFORNIA, Nevada, CA02, -120.837, 39.317, 4320, 54.9, M
WHITTIER HILLS CALIFORNIA, Los Angeles, CA06, -118.010, 33.984, 950, 64.8, M
WHITMORE CALIFORNIA, Shasta, CA02, -121.899, 40.619, 2417, 58.6, M
WOFFORD HEIGHTS CALIFORNIA, Kern, CA05, -118.499, 35.722, 3150, 60.5, M
WOLVERTON CALIFORNIA, Tulare, CA05, -118.703, 36.445, 5240, 56.4, M
WHITAKER PEAK CALIFORNIA, Los Angeles, CA06, -118.740, 34.569, 4120, 58.9, M
WHITE WOLF CALIFORNIA, Tuolumne, CA05, -119.650, 37.851, 8025, 41.8, M
YOLLA BOLLA CALIFORNIA, Trinity, CA01, -123.066, 40.338, 4524, 52.3, M
YUCCA VALLEY CALIFORNIA, San Bernardino, CA07, -116.408, 34.123, 3260, 60.5, M
HAGAN'S MEADOW, El Dorado, CA03, -119.940, 38.850, 7776, 41.8, 1.30
BLUE LAKES, Alpine, CA05, -119.920, 38.610, 8057, 39.0, 3.30
POISON FLAT, Alpine, CA03, -119.630, 38.510, 7736, 38.1, 2.10
SONORA PASS, Mono, CA03, -119.600, 38.310, 8827, 37.5, 2.60
LEAVITT MEADOWS, Mono, CA03, -119.550, 38.300, 7198, 42.6, 2.40
VIRGINIA LAKES RIDGE, Mono, CA03, -119.230, 38.070, 9445, 38.4, 1.60
LOBDELL LAKE, Mono, CA03, -119.370, 38.440, 9233, 37.2, 1.60
EBBETTS PASS, Alpine, CA03, -119.800, 38.550, 8765, 41.1, 4.20
HEAVENLY VALLEY, El Dorado, CA03, -119.920, 38.920, 8582, 38.5, 1.70
LEAVITT LAKE, Mono, CA03, -119.610, 38.280, 9617, 35.5, 4.80
SPRATT CREEK, Alpine, CA03, -119.820, 38.670, 6115, 46.1, 2.60
MONITOR PASS, Alpine, CA03, -119.610, 38.670, 8310, 39.8, 1.60
CROWDER FLAT, Modoc, CA01, -120.750, 41.890, 5170, 44.5, 1.50
CEDAR PASS, Modoc, CA02, -120.300, 41.580, 7030, 41.5, 4.20
DISMAL SWAMP, Modoc, CA03, -120.180, 41.990, 7360, 38.1, 4.30
ADIN MTN, Modoc, CA02, -120.790, 41.240, 6190, 39.9, 2.90
INDEPENDENCE CREEK, Sierra, CA03, -120.280, 39.490, 6456, 41.9, 1.90
INDEPENDENCE CAMP, Sierra, CA03, -120.290, 39.450, 7003, 43.0, 1.90
INDEPENDENCE LAKE, Nevada, CA03, -120.310, 39.430, 8352, 39.5, 3.50
TRUCKEE #2, Placer, CA03, -120.180, 39.300, 6509, 45.0, 2.30
WARD CREEK #3, Placer, CA03, -120.220, 39.140, 6655, 43.0, 5.30
TAHOE CITY CROSS, Placer, CA03, -120.150, 39.170, 6797, 44.7, 2.40
SQUAW VALLEY G.C., Placer, CA03, -120.260, 39.190, 8029, 40.2, 5.50
CSS LAB, Nevada, CA02, -120.370, 39.330, 6855, 43.3, 6.00
RUBICON #2, El Dorado, CA03, -120.130, 39.000, 7689, 43.4, 2.90
ECHO PEAK, El Dorado, CA03, -120.080, 38.850, 7670, 43.5, 4.20
FALLEN LEAF, El Dorado, CA03, -120.050, 38.930, 6236, 42.2, 2.20
BEAR VALLEY F.D., Kern, CA01, -118.644, 35.166, 4100, 46.4, 1.27
CAMPO ASOS, San Diego, CA07, -116.468, 32.626, 2641, 55.7, 0.41
Burbank Glendale Pasadena Area, -, -, -, -, -, 63.6, 1.13
Camarillo Area, -, -, -, -, -, 61.6, 0.76
Needles Area, -, -, -, -, -, 74.5, 0.64
Oxnard Area, -, -, -, -, -, 62.3, 0.74
Palm Springs Area, -, -, -, -, -, 72.8, 0.12
Riverside Area, -, -, -, -, -, 66.0, 0.47
Ramona Area, -, -, -, -, -, 60.6, 0.66
Northern CA 8 Station Index, -, -, -, -, -, M, 4.59
Crescent City Area, -, -, -, -, -, 52.5, 6.08
Escondido Area, -, -, -, -, -, 65.7, 0.90
Sacramento Downtown Area, -, -, -, -, -, 63.0, 2.57
Tahoe City Area, -, -, -, -, -, 45.2, 2.40
Ukiah Area, -, -, -, -, -, 59.6, 3.39
Alturas Area, -, -, -, -, -, 45.9, 1.74
Mount Shasta Area, -, -, -, -, -, 50.0, 2.09
Palmdale Area, -, -, -, -, -, 60.1, 0.21
Lancaster Area, -, -, -, -, -, 61.4, 0.32
El Cajon Area, -, -, -, -, -, 65.7, 1.28
Hanford Area, -, -, -, -, -, 63.5, 1.35
El Centro Area, -, -, -, -, -, 72.0, 0.38
Madera Area, -, -, -, -, -, 62.3, 0.25
Merced Area, -, -, -, -, -, 61.3, 3.53
San Jose Area, -, -, -, -, -, 62.0, 2.14
CONVERSE CALIFORNIA, San Bernardino, CA06, -116.913, 34.194, 5618, 54.6, M
COOSKIE MOUNTAIN CALIFORNIA, Humboldt, CA01, -124.266, 40.257, 2950, 54.4, M
CORRALITOS CALIFORNIA, Santa Cruz, CA04, -121.798, 36.991, 450, 61.4, M
COUNTY LINE CALIFORNIA, Lake, CA02, -122.412, 39.019, 2085, 61.9, M
CAMP 9 CALIFORNIA, Los Angeles, CA06, -118.422, 34.362, 4000, 57.9, M
CRANE FLAT LOOKOUT CALIFORNIA, Mariposa, CA05, -119.825, 37.762, 6644, 51.5, M
CRESTVIEW CALIFORNIA, Mono, CA07, -118.983, 37.745, 7600, 41.8, M
CORNING CALIFORNIA, Tehama, CA02, -122.170, 39.939, 294, 62.2, M
CARPENTER RIDGE CALIFORNIA, Butte, CA02, -121.582, 40.069, 4812, 52.0, M
CRAZY PEAK CALIFORNIA, Del Norte, CA01, -123.604, 41.992, 3970, 52.0, M
DESCANSO CALIFORNIA, San Diego, CA06, -116.622, 32.857, 3480, 56.5, M
DEVILS GARDEN CALIFORNIA, Modoc, CA02, -120.671, 41.530, 5022, 47.3, M
DIABLO GRANDE CALIFORNIA, Stanislaus, CA05, -121.294, 37.329, 1850, 60.3, M
DINKEY CALIFORNIA, Fresno, CA05, -119.039, 37.066, 5668, 45.3, M
DELNORTE CALIFORNIA, Santa Barbara, CA06, -119.654, 34.009, 800, 60.4, M
DORRIS RANCH CALIFORNIA, Nevada, CA02, -121.117, 39.304, 2025, 61.3, M
DOYLE CALIFORNIA, Lassen, CA03, -120.106, 40.022, 4240, 50.6, M
DEVILS POST PILE CALIFORNIA, Madera, CA05, -119.093, 37.630, 7560, 41.1, M
DEL VALLE CALIFORNIA, Los Angeles, CA06, -118.683, 34.431, 1278, 64.5, M
DEVORE CALIFORNIA, San Bernardino, CA06, -117.404, 34.221, 2057, 63.6, M
EAGLE PEAK CALIFORNIA, Tehama, CA02, -122.657, 39.928, 3713, 56.5, M
EEL RIVER CALIFORNIA, Mendocino, CA01, -123.083, 39.833, 1500, 59.8, M
EL CARISO CALIFORNIA, Riverside, CA06, -117.411, 33.647, 3038, 61.7, M
MOUNT ELIZABETH CALIFORNIA, Tuolumne, CA05, -120.247, 38.063, 4933, 53.5, M
EL MIRAGE CALIFORNIA, San Bernardino, CA07, -117.550, 34.634, 2880, 61.0, M
ESPERANZA CALIFORNIA, Calaveras, CA05, -120.515, 38.243, 2559, 60.1, M
FANCHER CREEK CALIFORNIA, Fresno, CA05, -119.466, 36.884, 920, 69.7, M
FAWNSKIN CALIFORNIA, San Bernardino, CA06, -116.899, 34.266, 6900, 45.7, M
FENCE MEADOW CALIFORNIA, Fresno, CA05, -119.175, 36.961, 5048, 53.9, M
FISH CREEK MTN CALIFORNIA, Imperial, CA07, -116.067, 32.990, 760, 75.5, M
FIVE MILE CALIFORNIA, Inyo, CA07, -117.918, 35.872, 4150, 64.3, M
FOUNTAIN SPRINGS CALIFORNIA, Tulare, CA05, -118.915, 35.892, 210, 63.1, M
FREMONT CANYON CALIFORNIA, Orange, CA06, -117.711, 33.808, 1781, 63.8, M
FRIEND MOUNTAIN CALIFORNIA, Trinity, CA01, -123.342, 40.505, 4000, 52.5, M
FISH SLOUGH CALIFORNIA, Mono, CA07, -118.408, 37.478, 4500, 53.1, M
GASQUET CALIFORNIA, Del Norte, CA01, -123.979, 41.846, 500, 54.1, M
GRASSHOPPER CALIFORNIA, Lassen, CA03, -120.784, 40.782, 6158, 44.0, M
GOOSE VALLEY CALIFORNIA, San Diego, CA06, -116.846, 33.074, 1530, 61.1, M
GRANITE MOUNTAIN CALIFORNIA, San Bernardino, CA07, -117.026, 34.536, 4720, 58.3, M
GREEN SPRING CALIFORNIA, Tuolumne, CA05, -120.500, 37.833, 1020, 61.2, M
HASTINGS CALIFORNIA, Monterey, CA04, -121.552, 36.389, 1885, 57.5, M
HAWKEYE CALIFORNIA, Sonoma, CA01, -122.917, 38.782, 2000, 59.0, M
HAYFORK CALIFORNIA, Trinity, CA01, -123.165, 40.550, 2323, 53.5, M
HELL HOLE CALIFORNIA, Placer, CA02, -120.422, 39.072, 5240, 51.7, M
HERNANDEZ CALIFORNIA, San Benito, CA04, -120.856, 36.383, 3733, 58.5, M
HIGH GLADE LOOKOUT CALIFORNIA, Lake, CA02, -122.808, 39.208, 4840, 59.6, M
HUNTER MOUNTAIN CALIFORNIA, Inyo, CA07, -117.474, 36.563, 6880, 48.9, M
HORSE LAKE CALIFORNIA, Lassen, CA03, -120.503, 40.631, 5100, 46.6, M
HOOPA CALIFORNIA, Humboldt, CA01, -123.671, 41.048, 375, 59.0, M
HORSE THIEF SPRINGS CALIFORNIA, San Bernardino, CA07, -115.909, 35.771, 5000, 58.6, M
HURLEY CALIFORNIA, Fresno, CA05, -119.568, 37.015, 1201, 59.1, M
INDIAN WELL CALIFORNIA, Siskiyou, CA01, -121.538, 41.742, 4770, 48.9, M
JOHNSONDALE CALIFORNIA, Tulare, CA05, -118.545, 35.972, 4700, 50.4, M
JORDAN CREEK CALIFORNIA, Butte, CA02, -121.367, 39.783, 4400, 55.4, M
JUANITA LAKE CALIFORNIA, Siskiyou, CA01, -122.006, 41.786, 5400, 49.1, M
JULIAN CALIFORNIA, San Diego, CA07, -116.591, 33.076, 4240, 55.2, M
JUNIPER CREEK CALIFORNIA, Modoc, CA02, -120.472, 41.332, 4372, 47.7, M
KEENWILD CALIFORNIA, Riverside, CA06, -116.767, 33.667, 4920, 56.6, M
KERNVILLE CALIFORNIA, Kern, CA05, -118.417, 35.755, 2720, 61.7, M
KETTLEMAN HILLS CALIFORNIA, Kings, CA05, -120.057, 36.033, 810, 65.9, M
KNOXVILLE CREEK CALIFORNIA, Lake, CA02, -122.417, 38.862, 2200, 58.9, M
KONOCTI CALIFORNIA, Lake, CA02, -122.706, 38.912, 2163, 60.7, M
LOS BANOS CALIFORNIA, Merced, CA05, -121.053, 37.055, 350, 64.2, M
MT. LAGUNA CALIFORNIA, San Diego, CA07, -116.420, 32.880, 5760, 50.1, M
LA HONDA CALIFORNIA, San Mateo, CA04, -122.255, 37.305, 872, 58.1, M
LA PANZA CALIFORNIA, San Luis Obispo, CA04, -120.187, 35.381, 1630, 57.2, M
LAURAL MOUNTAIN CALIFORNIA, Kern, CA07, -117.699, 35.478, 4390, 60.4, M
LASSEN LODGE CALIFORNIA, Tehama, CA02, -121.714, 40.344, 4159, 54.7, M
