WHISKEYTOWN RESERVOIR, Shasta, CA02, -122.528, 40.612, 1295, 46.0, 27.28
HYAMPOM, Trinity, CA01, -123.457, 40.616, 1278, M, 9.80
SHASTA DAM, Shasta, CA02, -122.416, 40.714, 1075, 48.0, 26.06
TRINITY RIVER HATCHERY, Trinity, CA01, -122.795, 40.726, 1861, 43.9, 8.88
BIG BAR 4 E, Trinity, CA01, -123.208, 40.741, 1253, 47.1, 8.10
ROUND MOUNTAIN, Shasta, CA02, -121.935, 40.796, 2100, M, 17.88
BUCKHORN, Shasta, CA02, -121.932, 40.880, 3700, M, 17.40
HAT CREEK, Shasta, CA02, -121.543, 40.932, 3015, 39.9, 2.92
REDWOOD CREEK O'KANE, Humboldt, CA01, -123.815, 40.907, 883, M, 26.20
PIT RIVER PH 5, Shasta, CA02, -121.977, 40.987, 1458, M, 23.17
WILLOW CREEK 1 NW, Humboldt, CA01, -123.636, 40.947, 464, 47.9, 10.40
FALL RIVER MILLS, Shasta, CA02, -121.435, 41.008, 3300, M, 3.81
COFFEE CREEK RS, Trinity, CA01, -122.709, 41.089, 2503, M, 13.52
ADIN RANGER STATION, Modoc, CA02, -120.945, 41.193, 4202, 39.6, 2.07
DUNSMUIR TREATMENT PL, Siskiyou, CA02, -122.282, 41.183, 2169, 42.3, 22.89
JESS VALLEY, Modoc, CA02, -120.295, 41.268, 5400, 34.7, 1.62
MCCLOUD, Siskiyou, CA02, -122.138, 41.252, 3233, 38.9, 16.46
ORICK, Humboldt, CA01, -124.067, 41.283, 5, 40.0, 9.00
CALLAHAN, Siskiyou, CA01, -122.825, 41.338, 3085, 42.0, 4.25
SAWYERS BAR RS, Siskiyou, CA01, -123.133, 41.301, 2255, 44.3, M
ORLEANS RS, Humboldt, CA01, -123.534, 41.303, 433, M, 10.28
ORICK PRAIRIE CREEK PARK, Humboldt, CA01, -124.019, 41.362, 160, 46.9, 10.40
CANBY 3 SW, Modoc, CA02, -120.902, 41.422, 4310, 38.4, 3.38
ALTURAS, Modoc, CA02, -120.544, 41.490, 4378, 37.5, 0.89
KLAMATH, Del Norte, CA01, -124.075, 41.579, 28, 50.4, 12.83
GREENVIEW, Siskiyou, CA01, -122.924, 41.552, 2820, M, 11.80
FORT JONES RS, Siskiyou, CA01, -122.848, 41.601, 2729, 40.1, 4.38
LAVA BEDS NAT MON, Siskiyou, CA01, -121.501, 41.702, 4770, 36.7, 1.82
MOUNT HEBRON RS, Siskiyou, CA01, -122.045, 41.783, 4265, 38.9, 0.96
CRESCENT CITY 3 NNW, Del Norte, CA01, -124.215, 41.796, 43, 50.1, 13.54
OAK KNOLL W. C., Siskiyou, CA01, -122.850, 41.839, 1980, M, 4.42
CRESCENT CITY 7 ENE, Del Norte, CA01, -124.085, 41.794, 120, M, 14.02
FORT BIDWELL, Modoc, CA03, -120.157, 41.872, 4739, 37.6, 2.80
GASQUET RS, Del Norte, CA01, -123.965, 41.845, 387, M, 16.62
FORT DICK RIVER, Del Norte, CA01, -124.135, 41.881, -, M, 14.04
TULELAKE, Siskiyou, CA01, -121.474, 41.960, 4038, 36.7, 1.05
COPCO NO 1 DAM, Siskiyou, CA01, -122.338, 41.980, 2665, M, 3.36
ELK VALLEY, Del Norte, CA01, -123.718, 41.988, 1708, M, 14.52
PACIFICA 4 SSE, San Mateo, CA04, -122.472, 37.592, 475, 51.3, 12.79
BARSTOW, San Bernardino, CA07, -117.022, 34.893, 2220, 52.5, 0.84
INYOKERN, Kern, CA07, -117.821, 35.651, 2430, 52.1, 0.95
PEARBLOSSOM, Los Angeles, CA07, -117.897, 34.503, 3101, 50.0, 1.90
EL CAJON, San Diego, CA06, -116.928, 32.801, 495, 58.9, 3.65
MARKLEY COVE, Napa, CA02, -122.124, 38.492, 480, 49.4, 11.10
TEJON RANCHO, Kern, CA05, -118.750, 35.023, 1425, 54.9, 3.49
SAN SIMEON POINT PIEDRAS BLANCAS, San Luis Obispo, CA04, -121.285, 35.666, 59, 53.1, 7.94
BURBANK GLENDALE PASADENA AP, Los Angeles, CA06, -118.365, 34.200, 731, 55.2, 6.48
MOUNT SHASTA, Siskiyou, CA02, -122.317, 41.322, 3613, 38.5, 16.69
WATSONVILLE MUNICIPAL AIRPORT, Santa Cruz, CA04, -121.790, 36.939, 162, 52.7, 11.07
SANTA ROSA SONOMA CO AP, Sonoma, CA04, -122.811, 38.504, 119, 50.7, 11.60
OAKHURST, Madera, CA05, -119.653, 37.331, 2230, 45.4, 11.69
CORONADO FIRE DEPT, San Diego, CA06, -117.177, 32.692, 18, 58.6, 3.86
CUYAMACA RANCHO ST PARK, San Diego, CA06, -116.559, 32.927, 4870, 45.6, 6.77
FALLBROOK FIRE DEPT, San Diego, CA06, -117.248, 33.384, 698, 56.6, 3.30
DEL MAR FIRE DEPT, San Diego, CA06, -117.262, 32.972, 12, 57.2, 3.13
IMPERIAL BEACH FIRE DEPT, San Diego, CA06, -117.114, 32.576, 22, 58.4, 2.64
LEMON GROVE FIRE DEPARTMENT, San Diego, CA06, -117.030, 32.738, 427, 58.3, 3.69
NATIONAL CITY FIRE DEPT, San Diego, CA06, -117.100, 32.671, 30, 57.2, 3.28
SPRING VALLEY FIRE DEPT, San Diego, CA06, -117.006, 32.710, 270, 58.0, 3.37
MT LAGUNA # 2, San Diego, CA07, -116.422, 32.876, 5760, 40.3, 5.26
SANTEE FIRE DEPT, San Diego, CA06, -116.973, 32.841, 340, 58.9, 4.17
LEE VINING, Mono, CA07, -119.119, 37.957, 6797, 35.5, 3.00
ANAHEIM, Orange, CA06, -117.842, 33.865, 235, 58.9, 4.50
NEW MELONES DAM HQ, Tuolumne, CA05, -120.486, 38.005, 960, 49.7, 11.27
POINT REYES ALERT, Marin, CA01, -122.930, 38.101, 175, M, 7.50
MAMMOTH LAKES RS, Mono, CA07, -118.962, 37.648, 7804, 29.0, 5.30
CAMPTONVILLE 1SW, Yuba, CA02, -121.071, 39.440, 2500, M, 20.48
MONTEREY WFO, Monterey, CA04, -121.855, 36.593, 122, 54.3, 5.77
SKYLINE RIDGE PRESERVE, San Mateo, CA04, -122.185, 37.313, 2270, 46.1, 16.16
FREMONT, Alameda, CA04, -122.016, 37.542, 38, 54.8, 6.74
MAD RIVER 12 SE, Trinity, CA01, -123.374, 40.319, 2763, M, 16.10
BISHOP FS, Inyo, CA07, -118.365, 37.368, 4108, M, 0.88
NEWHALL 5NW, Los Angeles, CA06, -118.594, 34.393, 1765, 50.8, 6.66
TEHACHAPI 4 SE, Kern, CA05, -118.422, 35.101, 4220, 44.0, 4.10
REDWOOD CITY #2, San Mateo, CA04, -122.214, 37.488, 10, 54.8, 6.28
WRIGHTWOOD, San Bernardino, CA07, -117.639, 34.362, 6000, 38.1, 7.85
REDDING CDF, Shasta, CA02, -122.299, 40.519, 502, M, 10.31
STOCKTON 5 SSE, San Joaquin, CA05, -121.251, 37.899, 22, M, 4.96
VALLEJO, Solano, CA01, -122.187, 38.100, 341, 52.8, 9.73
NORTHRIDGE CAL STATE, Los Angeles, CA06, -118.525, 34.245, 904, 55.1, 5.71
OXNARD WFO, Ventura, CA06, -119.137, 34.207, 52, 56.2, 6.18
LAKEHEAD, Shasta, CA02, -122.391, 40.899, 1398, M, 28.42
HANFORD MUNICIPAL AP, Kings, CA05, -119.623, 36.311, 249, 53.5, 1.75
RAMONA AIRPORT, San Diego, CA06, -116.916, 33.038, 1385, 52.5, 4.79
VACAVILLE/NUT TREE AP ASOS, Solano, CA02, -121.959, 38.378, 104, 50.8, 10.76
ALTURAS MUNICIPAL AP, Modoc, CA02, -120.561, 41.484, 4383, 37.5, 1.26
MADERA MUNICIPAL AP, Madera, CA05, -120.111, 36.985, 251, 53.2, 4.48
BAKERSFIELD 5 NW, Kern, CA05, -119.051, 35.419, 470, 54.3, 1.57
FRESNO 5 NE, Fresno, CA05, -119.709, 36.767, 338, 54.4, 5.88
OCEANSIDE MUNICIPAL AP, San Diego, CA06, -117.350, 33.219, 30, 55.6, 2.07
SAN DIEGO SEAWORLD, San Diego, CA06, -117.231, 32.765, 14, 57.7, 3.16
BOULEVARD 2, San Diego, CA07, -116.300, 32.667, 3600, M, 17.20
ARCATA EUREKA AP, Humboldt, CA01, -124.105, 40.978, 211, 52.1, 8.67
CHICO ARMY FLYING SCH, Butte, CA02, -121.850, 39.800, 272, 54.2, 0.41
NEWPORT BEACH HARBOR, Orange, CA06, -117.884, 33.603, 10, 58.6, 2.18
ESCONDIDO NO. 2, San Diego, CA06, -117.090, 33.121, 600, 58.0, 3.75
REDDING AP, Shasta, CA02, -122.298, 40.515, 501, 48.7, 9.28
SANTA MARIA PUBLIC AP, Santa Barbara, CA06, -120.452, 34.894, 243, 53.2, 7.34
MOUNT SHASTA, Siskiyou, CA02, -122.333, 41.333, 3535, 38.5, 14.27
RED BLUFF MUNI AP, Tehama, CA02, -122.255, 40.152, 354, 50.2, 6.93
NEEDLES AIRPORT, San Bernardino, CA07, -114.618, 34.768, 888, 61.3, 0.32
CECILVILLE, Siskiyou, CA01, -123.139, 41.142, 2310, 41.6, 8.59
CHINA LAKE NAF, Kern, CA07, -117.693, 35.688, 2230, 51.2, 0.47
HEARST CASTLE, San Luis Obispo, CA04, -121.168, 35.684, 1526, 50.5, 16.22
GETTY CENTER, Los Angeles, CA06, -118.479, 34.087, 1117, 55.0, 8.42
HESPERIA 2E, San Bernardino, CA07, -117.266, 34.421, 3055, 48.5, 1.97
RANCHO BERNARDO, San Diego, CA06, -117.081, 33.022, 690, 57.2, 5.00
TORRANCE AP, Los Angeles, CA06, -118.342, 33.802, 90, 56.4, 4.53
LOS ANGELES DOWNTOWN/USC, Los Angeles, CA06, -118.291, 34.024, 179, 57.5, 5.54
FRESNO YOSEMITE INT'L, Fresno, CA05, -119.720, 36.780, 334, 53.8, 6.12
MONTEREY PENINSUL AP, Monterey, CA04, -121.849, 36.590, 160, 53.5, 5.28
PASO ROBLES MUNICIPAL AP, San Luis Obispo, CA04, -120.629, 35.669, 820, 52.3, 4.86
SAN JOSE, Santa Clara, CA04, -121.903, 37.350, 67, 54.2, 4.56
SAN JOSE, Santa Clara, CA04, -121.924, 37.359, 49, 53.6, 4.56
PALM SPRINGS ASOS, Riverside, CA07, -116.504, 33.822, 409, 60.6, 0.89
SAN DIEGO BROWN FIELD, San Diego, CA06, -116.994, 32.576, 521, 57.0, 3.19
Bakersfield Area, -, -, -, -, -, 54.3, 1.62
Bishop Area, -, -, -, -, -, 42.5, 0.98
Los Angeles Downtown Area, -, -, -, -, -, 57.5, 5.54
Eureka Area, -, -, -, -, -, 51.6, 7.00
Fresno Area, -, -, -, -, -, 53.8, 6.12
Los Angeles Airport Area, -, -, -, -, -, 57.7, 4.71
Long Beach Area, -, -, -, -, -, 57.9, 2.86
Redding Area, -, -, -, -, -, 48.7, 9.28
Sacramento Area, -, -, -, -, -, 51.4, 8.49
San Diego Area, -, -, -, -, -, 59.0, 3.67
Stockton Area, -, -, -, -, -, 52.1, 5.07
San Francisco Airport Area, -, -, -, -, -, 53.5, 8.46
Santa Maria Area, -, -, -, -, -, 53.2, 7.34
LEMOORE REEVES NAS, Fresno, CA05, -119.950, 36.333, 232, 53.3, 1.40
ARVIN, Kern, CA05, -118.834, 35.211, 450, 52.6, 0.57
FRAZIER PARK, Kern, CA06, -118.965, 34.827, 4972, 40.8, 2.64
REDONDO BEACH, Los Angeles, CA06, -118.376, 33.834, 142, 57.2, 4.62
BURBANK VALLEY PUMP PLANT, Los Angeles, CA06, -118.348, 34.187, 655, 55.1, 7.35
ARBUCKLE BASIN CALIFORNIA, Shasta, CA02, -122.833, 40.398, 1900, 44.6, M
ACTON CALIFORNIA, Los Angeles, CA06, -118.200, 34.446, 2600, 49.9, M
ALDER SPRINGS CALIFORNIA, Glenn, CA02, -122.724, 39.651, 4300, 37.7, M
LOS ALTOS CALIFORNIA, Santa Clara, CA04, -122.147, 37.358, 645, 53.0, M
ANZA CALIFORNIA, Riverside, CA06, -116.673, 33.555, 3920, 46.3, M
ALDER POINT CALIFORNIA, Humboldt, CA01, -123.590, 40.187, 923, 48.7, M
ARROYO SECO (MT. DIABLO) CALIF, Monterey, CA04, -121.492, 36.230, 980, 52.5, M
ASH CREEK CALIFORNIA, Siskiyou, CA02, -121.979, 41.277, 3200, 39.0, M
ASH VALLEY CALIFORNIA, Lassen, CA02, -120.686, 41.052, 5100, 36.2, M
BALD MTN LOC CALIFORNIA, El Dorado, CA02, -120.697, 38.906, 4680, 45.4, M
BARNABY CALIFORNIA, Marin, CA01, -122.702, 38.028, 1240, 50.5, M
BATTERSON CALIFORNIA, Madera, CA05, -119.508, 37.232, 3160, 47.1, M
BIG BAR CALIFORNIA, Trinity, CA01, -123.233, 40.733, 1500, 46.3, M
BELL CANYON CALIFORNIA, Orange, CA06, -117.592, 33.542, 700, 58.0, M
BEAR PEAK CALIFORNIA, Tulare, CA05, -118.052, 35.884, 8228, 32.4, M
BENTON CALIFORNIA, Mono, CA07, -118.478, 37.843, 5450, 38.3, M
BEVERLY HILLS CALIFORNIA, Los Angeles, CA06, -118.412, 34.125, 1260, 55.7, M
BANGOR CALIFORNIA, Butte, CA02, -121.386, 39.398, 803, 50.2, M
BIG HILL CALIFORNIA, Humboldt, CA01, -123.636, 41.098, 3570, 39.0, M
BLACK DIAMOND CALIFORNIA, Contra Costa, CA04, -121.884, 37.950, 1600, 48.9, M
BLUE DOOR CALIFORNIA, Lassen, CA02, -120.337, 41.055, 5615, 34.1, M
BEN BOLT CALIFORNIA, El Dorado, CA05, -120.934, 38.591, 905, 50.7, M
BEN LOMOND CALIFORNIA, Santa Cruz, CA04, -122.170, 37.132, 2630, 46.0, M
BOGARD R.S. CALIFORNIA, Lassen, CA02, -121.083, 40.598, 5650, 32.3, M
BOONVILLE CALIFORNIA, Mendocino, CA01, -123.349, 38.988, 644, 50.6, M
BRANCH MOUNTAIN CALIFORNIA, San Luis Obispo, CA04, -120.083, 35.189, 3770, 44.6, M
BRIONES CALIFORNIA, Contra Costa, CA04, -122.118, 37.944, 1450, 49.2, M
BLACKROCK CALIFORNIA, Tulare, CA05, -118.260, 36.093, 8200, 33.3, M
BROOKS CALIFORNIA, Yolo, CA02, -122.145, 38.738, 354, 50.8, M
BUCK MEADOWS CALIFORNIA, Tuolumne, CA05, -120.097, 37.823, 3200, 43.8, M
BULL FLAT CALIFORNIA, Lassen, CA03, -120.114, 40.481, 4395, 37.7, M
BURNS CANYON CALIFORNIA, San Bernardino, CA07, -116.634, 34.210, 6000, 43.0, M
BUTTE MEADOWS CALIFORNIA, Butte, CA02, -121.504, 40.079, 4960, 37.1, M
BEAVER CAMP LOC CALIFORNIA, Amador, CA05, -120.325, 38.488, 5000, 42.2, M
BRAZIE RANCH CALIFORNIA, Siskiyou, CA01, -122.594, 41.685, 3000, 42.4, M
CALLAHAN CALIFORNIA, Siskiyou, CA01, -122.796, 41.308, 3136, 42.3, M
CAMERON FIRE STATION CALIFORNI, San Diego, CA06, -116.463, 32.721, 3443, 47.4, M
CANBY CALIFORNIA, Modoc, CA02, -120.868, 41.434, 4312, 39.0, M
CARRIZO CALIFORNIA, San Luis Obispo, CA05, -119.773, 35.096, 2490, 50.6, M
CASE SPRINGS CALIFORNIA, San Diego, CA06, -117.418, 33.445, 2320, 52.4, M
CEDAR GROVE CALIFORNIA, Fresno, CA05, -118.656, 36.788, 4720, 42.7, M
CHEESEBORO CALIFORNIA, Ventura, CA06, -118.717, 34.185, 1650, 53.9, M
CHICO CALIFORNIA, Butte, CA02, -121.779, 39.712, 230, 51.0, M
CHILAO CALIFORNIA, Los Angeles, CA06, -118.030, 34.332, 5450, 43.3, M
CHUCHUPATE CALIFORNIA, Ventura, CA05, -119.012, 34.808, 4900, 40.5, M
CLAREMONT CALIFORNIA, Los Angeles, CA06, -117.707, 34.137, 1645, 52.7, M
CALAVERAS ROAD CALIFORNIA, Alameda, CA04, -121.844, 37.553, 1230, 50.7, M
COHASSET CALIFORNIA, Butte, CA02, -121.769, 39.872, 1733, 51.3, M
COLLINS BALDY CALIFORNIA, Siskiyou, CA01, -122.950, 41.775, 5493, 35.1, M
CONVERSE CALIFORNIA, San Bernardino, CA06, -116.913, 34.194, 5618, 44.4, M
COOSKIE MOUNTAIN CALIFORNIA, Humboldt, CA01, -124.266, 40.257, 2950, 42.8, M
CORRALITOS CALIFORNIA, Santa Cruz, CA04, -121.798, 36.991, 450, 57.2, M
COUNTY LINE CALIFORNIA, Lake, CA02, -122.412, 39.019, 2085, 46.4, M
CAMP 9 CALIFORNIA, Los Angeles, CA06, -118.422, 34.362, 4000, 45.7, M
CRESTVIEW CALIFORNIA, Mono, CA07, -118.983, 37.745, 7600, 30.8, M
CORNING CALIFORNIA, Tehama, CA02, -122.170, 39.939, 294, 50.4, M
CRAZY PEAK CALIFORNIA, Del Norte, CA01, -123.604, 41.992, 3970, 41.1, M
DESCANSO CALIFORNIA, San Diego, CA06, -116.622, 32.857, 3480, 48.8, M
DEVILS GARDEN CALIFORNIA, Modoc, CA02, -120.671, 41.530, 5022, 37.1, M
DIABLO GRANDE CALIFORNIA, Stanislaus, CA05, -121.294, 37.329, 1850, 48.8, M
DELNORTE CALIFORNIA, Santa Barbara, CA06, -119.654, 34.009, 800, 54.3, M
DORRIS RANCH CALIFORNIA, Nevada, CA02, -121.117, 39.304, 2025, 48.2, M
DOYLE CALIFORNIA, Lassen, CA03, -120.106, 40.022, 4240, 40.6, M
DEVILS POST PILE CALIFORNIA, Madera, CA05, -119.093, 37.630, 7560, 28.3, M
DEL VALLE CALIFORNIA, Los Angeles, CA06, -118.683, 34.431, 1278, 53.5, M
DEVORE CALIFORNIA, San Bernardino, CA06, -117.404, 34.221, 2057, 53.4, M
EAGLE PEAK CALIFORNIA, Tehama, CA02, -122.657, 39.928, 3713, 41.0, M
EEL RIVER CALIFORNIA, Mendocino, CA01, -123.083, 39.833, 1500, 48.2, M
EL CARISO CALIFORNIA, Riverside, CA06, -117.411, 33.647, 3038, 51.5, M
MOUNT ELIZABETH CALIFORNIA, Tuolumne, CA05, -120.247, 38.063, 4933, 35.1, M
EL MIRAGE CALIFORNIA, San Bernardino, CA07, -117.550, 34.634, 2880, 48.7, M
ESPERANZA CALIFORNIA, Calaveras, CA05, -120.515, 38.243, 2559, 48.4, M
FANCHER CREEK CALIFORNIA, Fresno, CA05, -119.466, 36.884, 920, 55.9, M
FAWNSKIN CALIFORNIA, San Bernardino, CA06, -116.899, 34.266, 6900, 36.2, M
FENCE MEADOW CALIFORNIA, Fresno, CA05, -119.175, 36.961, 5048, 41.1, M
FISH CREEK MTN CALIFORNIA, Imperial, CA07, -116.067, 32.990, 760, 64.6, M
FIVE MILE CALIFORNIA, Inyo, CA07, -117.918, 35.872, 4150, 49.4, M
FOUNTAIN SPRINGS CALIFORNIA, Tulare, CA05, -118.915, 35.892, 210, 55.1, M
FREMONT CANYON CALIFORNIA, Orange, CA06, -117.711, 33.808, 1781, 55.5, M
FRIEND MOUNTAIN CALIFORNIA, Trinity, CA01, -123.342, 40.505, 4000, 38.0, M
FISH SLOUGH CALIFORNIA, Mono, CA07, -118.408, 37.478, 4500, 41.9, M
GASQUET CALIFORNIA, Del Norte, CA01, -123.979, 41.846, 500, 48.9, M
GRASSHOPPER CALIFORNIA, Lassen, CA03, -120.784, 40.782, 6158, 31.4, M
GRANITE MOUNTAIN CALIFORNIA, San Bernardino, CA07, -117.026, 34.536, 4720, 45.6, M
GREEN SPRING CALIFORNIA, Tuolumne, CA05, -120.500, 37.833, 1020, 50.6, M
HASTINGS CALIFORNIA, Monterey, CA04, -121.552, 36.389, 1885, 49.3, M
HAWKEYE CALIFORNIA, Sonoma, CA01, -122.917, 38.782, 2000, 50.7, M
HAYFORK CALIFORNIA, Trinity, CA01, -123.165, 40.550, 2323, 43.3, M
HELL HOLE CALIFORNIA, Placer, CA02, -120.422, 39.072, 5240, 38.6, M
HERNANDEZ CALIFORNIA, San Benito, CA04, -120.856, 36.383, 3733, 44.3, M
HIGH GLADE LOOKOUT CALIFORNIA, Lake, CA02, -122.808, 39.208, 4840, 38.9, M
HUNTER MOUNTAIN CALIFORNIA, Inyo, CA07, -117.474, 36.563, 6880, 35.9, M
HORSE LAKE CALIFORNIA, Lassen, CA03, -120.503, 40.631, 5100, 35.4, M
HOOPA CALIFORNIA, Humboldt, CA01, -123.671, 41.048, 375, 50.0, M
HORSE THIEF SPRINGS CALIFORNIA, San Bernardino, CA07, -115.909, 35.771, 5000, 45.1, M
HURLEY CALIFORNIA, Fresno, CA05, -119.568, 37.015, 1201, 49.2, M
INDIAN WELL CALIFORNIA, Siskiyou, CA01, -121.538, 41.742, 4770, 42.1, M
JUNIPER FLAT CALIFORNIA, Riverside, CA06, -117.085, 33.778, 2120, 53.1, M
JOHNSONDALE CALIFORNIA, Tulare, CA05, -118.545, 35.972, 4700, 40.0, M
JUANITA LAKE CALIFORNIA, Siskiyou, CA01, -122.006, 41.786, 5400, 37.7, M
JULIAN CALIFORNIA, San Diego, CA07, -116.591, 33.076, 4240, 48.5, M
JUNIPER CREEK CALIFORNIA, Modoc, CA02, -120.472, 41.332, 4372, 39.3, M
KEENWILD CALIFORNIA, Riverside, CA06, -116.767, 33.667, 4920, 45.7, M
KERNVILLE CALIFORNIA, Kern, CA05, -118.417, 35.755, 2720, 50.0, M
KETTLEMAN HILLS CALIFORNIA, Kings, CA05, -120.057, 36.033, 810, 54.2, M
KNOXVILLE CREEK CALIFORNIA, Lake, CA02, -122.417, 38.862, 2200, 45.3, M
KONOCTI CALIFORNIA, Lake, CA02, -122.706, 38.912, 2163, 45.9, M
LOS BANOS CALIFORNIA, Merced, CA05, -121.053, 37.055, 350, 54.1, M
MT. LAGUNA CALIFORNIA, San Diego, CA07, -116.420, 32.880, 5760, 40.4, M
LA HONDA CALIFORNIA, San Mateo, CA04, -122.255, 37.305, 872, 51.3, M
LA PANZA CALIFORNIA, San Luis Obispo, CA04, -120.187, 35.381, 1630, 49.9, M
LAURAL MOUNTAIN CALIFORNIA, Kern, CA07, -117.699, 35.478, 4390, 45.6, M
LASSEN LODGE CALIFORNIA, Tehama, CA02, -121.714, 40.344, 4159, 40.7, M
LAUFMAN CALIFORNIA, Lassen, CA03, -120.353, 40.142, 5800, 38.8, M
LADDER BUTTE CALIFORNIA, Lassen, CA02, -121.297, 40.807, 5750, 36.6, M
LEO CARRILLO CALIFORNIA, Los Angeles, CA06, -118.936, 34.046, 50, 57.6, M
LOS GATOS CALIFORNIA, Santa Clara, CA04, -121.943, 37.203, 2000, 50.0, M
LOST HORSE CALIFORNIA, Riverside, CA07, -116.188, 34.018, 4200, 47.3, M
LINCOLN CALIFORNIA, Placer, CA02, -121.268, 38.883, 200, 51.7, M
LOS PRIETOS CALIFORNIA, Santa Barbara, CA06, -119.783, 34.536, 1020, 54.2, M
LAS FLORES CALIFORNIA, San Diego, CA06, -117.439, 33.289, 100, 58.6, M
LAS TABLAS CALIFORNIA, San Luis Obispo, CA04, -120.924, 35.656, 994, 50.2, M
LIVERMORE CALIFORNIA, Alameda, CA04, -121.814, 37.712, 800, 51.8, M
LYONS VALLEY CALIFORNIA, Lake, CA01, -123.074, 39.126, 3200, 45.5, M
MAD RIVER CALIFORNIA, Trinity, CA01, -123.524, 40.463, 2775, 42.0, M
MALIBU HILLS CALIFORNIA, Los Angeles, CA06, -118.633, 34.058, 1575, 55.0, M
MANZANITA LAKE CALIFORNIA, Shasta, CA02, -121.580, 40.540, 5660, 35.6, M
MAPLE CREEK CALIFORNIA, Humboldt, CA01, -123.937, 40.796, 1680, 48.9, M
MARIPOSA GROVE CALIFORNIA, Mariposa, CA05, -119.605, 37.513, 6400, 38.0, M
MILL CREEK (BDF) CALIFORNIA, San Bernardino, CA06, -117.035, 34.084, 2950, 51.9, M
MCGUIRES CALIFORNIA, Mendocino, CA01, -123.601, 39.353, 593, 51.1, M
MEANS LAKE CALIFORNIA, San Bernardino, CA07, -116.517, 34.391, 2900, 52.1, M
METCALF GAP CALIFORNIA, Madera, CA05, -119.768, 37.409, 3077, 48.3, M
MEYERS CALIFORNIA, El Dorado, CA03, -120.018, 38.849, 6310, 34.5, M
MID HILLS CALIFORNIA, San Bernardino, CA07, -115.411, 35.123, 5413, 41.9, M
MILL CREEK (ANF) CALIFORNIA, Los Angeles, CA06, -118.082, 34.390, 5021, 43.3, M
MALLORY RIDGE CALIFORNIA, Contra Costa, CA05, -121.779, 37.817, 2040, 49.1, M
MONTECITO CALIFORNIA, Santa Barbara, CA06, -119.648, 34.461, 1500, 53.6, M
MOJAVE RIVER SINK CALIFORNIA, San Bernardino, CA07, -116.079, 35.053, 950, 57.1, M
MORMON ROCK CALIFORNIA, San Bernardino, CA06, -117.502, 34.318, 3300, 47.2, M
MOUNTAIN REST CALIFORNIA, Fresno, CA05, -119.371, 37.054, 4100, 43.4, M
MARKLEEVILLE CALIFORNIA, Alpine, CA03, -119.767, 38.683, 5501, 38.2, M
MT. SHASTA CALIFORNIA, Siskiyou, CA02, -122.316, 41.316, -, 39.7, M
MARIPOSA CALIFORNIA, Mariposa, CA05, -119.987, 37.504, 2231, 48.0, M
MOUNT ZION CALIFORNIA, Amador, CA05, -120.651, 38.389, 2960, 46.7, M
NORTH FORK CALIFORNIA, Madera, CA05, -119.505, 37.233, 2720, 47.3, M
OAK KNOLL CALIFORNIA, Siskiyou, CA01, -122.850, 41.839, 1940, 46.0, M
OAK CREEK CALIFORNIA, Inyo, CA07, -118.259, 36.843, 4855, 44.9, M
OAK GROVE CALIFORNIA, San Diego, CA06, -116.795, 33.393, 2752, 50.6, M
OAKLAND NORTH CALIFORNIA, Contra Costa, CA04, -122.221, 37.865, 1403, 45.4, M
OAK OPENING CALIFORNIA, Tulare, CA05, -118.702, 36.175, 3240, 47.9, M
OAKLAND SOUTH CALIFORNIA, Alameda, CA04, -122.145, 37.786, 1095, 51.0, M
OPAL MOUNTAIN CALIFORNIA, San Bernardino, CA07, -117.176, 35.154, 3240, 49.9, M
OWENS CAMP LOC CALIFORNIA, El Dorado, CA02, -120.245, 38.733, 5240, 39.0, M
OWENS VALLEY CALIFORNIA, Inyo, CA07, -118.551, 37.390, 4640, 44.5, M
PANAMINT CALIFORNIA, Inyo, CA07, -117.088, 36.120, 6880, 39.9, M
PARKFIELD CALIFORNIA, Monterey, CA04, -120.432, 35.899, 1535, 49.2, M
PATTY MOCUS CALIFORNIA, Tehama, CA02, -122.867, 40.295, 3500, 41.8, M
PIERCE CALIFORNIA, Plumas, CA02, -120.642, 40.246, 5700, 37.2, M
PIKE COUNTY LOOKOUT CALIFORNIA, Yuba, CA02, -121.202, 39.475, 3714, 42.4, M
PILOT HILL CALIFORNIA, El Dorado, CA02, -121.009, 38.833, 1200, 48.9, M
POPPY PARK CALIFORNIA, Los Angeles, CA07, -118.383, 34.733, 2760, 48.5, M
POTRERO CALIFORNIA, San Diego, CA06, -116.609, 32.606, 2345, 49.9, M
PANOCHE ROAD CALIFORNIA, Fresno, CA05, -120.766, 36.727, 2032, 53.2, M
PULGAS CALIFORNIA, San Mateo, CA04, -122.298, 37.475, 644, 52.8, M
QUARTZ HILL CALIFORNIA, Siskiyou, CA01, -122.934, 41.599, 4225, 39.2, M
QUINCY RD CALIFORNIA, Plumas, CA02, -120.942, 39.973, 3500, 41.5, M
RAVENDALE CALIFORNIA, Lassen, CA03, -120.316, 40.731, 5298, 35.1, M
RANCHITA CALIFORNIA, San Diego, CA07, -116.497, 33.222, 4415, 46.3, M
RICE VALLEY CALIFORNIA, Riverside, CA07, -114.732, 34.061, 820, 58.9, M
ROCK CREEK, Mono, CA07, -118.667, 37.551, 7040, 33.4, M
RODEO VALLEY, Mendocino, CA01, -123.321, 39.668, 2428, 44.5, M
ROSE VALLEY CALIFORNIA, Ventura, CA06, -119.184, 34.543, 3331, 44.6, M
ROUND MOUNTAIN, Siskiyou, CA02, -121.464, 41.427, 5258, 35.0, M
ROSE PEAK CALIFORNIA, Alameda, CA04, -121.735, 37.502, 3060, 44.2, M
SADDLEBACK BUTTE CALIFORNIA, Los Angeles, CA07, -117.821, 34.685, 2590, 49.4, M
SAUGUS CALIFORNIA, Los Angeles, CA06, -118.525, 34.425, 1450, 53.2, M
SAWYERS BAR CALIFORNIA, Siskiyou, CA01, -123.132, 41.300, 2192, 45.2, M
SANTA BARBARA ISLAND CALIFORNI, Santa Barbara, CA06, -119.033, 33.483, 176, 54.3, M
SANTA CRUZ ISLAND CALIFORNIA, Santa Barbara, CA06, -119.722, 33.996, 250, 52.3, M
SCORPION CALIFORNIA, Trinity, CA01, -122.697, 41.112, 4400, M, M
SODA CREEK CALIFORNIA, Lake, CA01, -122.977, 39.425, 1773, 46.2, M
SECRET TOWN CALIFORNIA, Nevada, CA02, -120.885, 39.184, 2826, 44.7, M
SHAVER CALIFORNIA, Fresno, CA05, -119.256, 37.135, 5746, 38.1, M
SHADEQUARTER CALIFORNIA, Tulare, CA05, -118.956, 36.567, 4069, 44.1, M
SIMS CALIFORNIA, Shasta, CA02, -122.373, 41.075, 2400, 45.4, M
SLATER BUTTE CALIFORNIA, Siskiyou, CA01, -123.352, 41.859, 4670, 37.8, M
SANTA RITA CALIFORNIA, San Benito, CA05, -120.598, 36.348, 5000, 39.7, M
SOLDIER MOUNTAIN CALIFORNIA, Shasta, CA02, -121.586, 40.926, 3710, 39.6, M
SOMES BAR CALIFORNIA, Siskiyou, CA01, -123.496, 41.390, 920, 47.9, M
SQUAW SPRINGS CALIFORNIA, San Bernardino, CA07, -117.568, 35.370, 3620, 49.0, M
SQUAW LAKE CALIFORNIA, Imperial, CA07, -114.494, 32.908, 300, 63.2, M
SANTA ROSA ISLAND CALIFORNIA, Santa Barbara, CA06, -120.078, 33.978, 1298, 47.7, M
SANTA ROSA PLATEAU CALIFORNIA, Riverside, CA06, -117.231, 33.529, 1980, 55.0, M
SANTA ROSA CALIFORNIA, Sonoma, CA01, -122.712, 38.479, 576, 51.2, M
STAMPEDE CALIFORNIA, Sierra, CA03, -120.075, 39.483, 6867, 35.6, M
STONYFORD CALIFORNIA, Colusa, CA02, -122.575, 39.367, 1200, 47.6, M
SUGARLOAF (SHF) CALIFORNIA, Shasta, CA02, -122.438, 40.917, 4200, 41.0, M
SPRING VALLEY CALIFORNIA, San Mateo, CA04, -122.436, 37.563, 1075, 50.3, M
TANBARK CALIFORNIA, Los Angeles, CA06, -117.761, 34.207, 2600, 50.4, M
TARGET RANGE CALIFORNIA, San Diego, CA06, -117.359, 33.372, 918, 57.4, M
THOMES CREEK CALIFORNIA, Tehama, CA02, -122.610, 39.864, 1040, 48.9, M
TEMESCAL (CNF) CALIFORNIA, Riverside, CA06, -117.483, 33.763, 1125, 56.3, M
MOUNT TOM CALIFORNIA, Fresno, CA05, -119.178, 37.376, 9018, 29.9, M
TRINITY CAMP CALIFORNIA, Trinity, CA01, -122.804, 40.786, 3308, 45.0, M
TRIMMER CALIFORNIA, Fresno, CA05, -119.305, 36.911, 1540, 50.0, M
UHL / HOT SPRINGS, Tulare, CA05, -118.633, 35.889, 3720, 46.0, M
VALLEY CENTER CALIFORNIA, San Diego, CA06, -117.009, 33.237, 1483, 54.5, M
VAN BREMMER CALIFORNIA, Siskiyou, CA01, -121.794, 41.643, 4928, 35.7, M
WALKER PASS CALIFORNIA, Kern, CA05, -118.057, 35.665, 5572, 42.2, M
WARM SPRINGS CALIFORNIA, Los Angeles, CA06, -118.579, 34.596, 4930, 44.9, M
WEAVERVILLE CALIFORNIA, Trinity, CA01, -122.943, 40.735, 2100, 43.6, M
WEED AIRPORT CALIFORNIA, Siskiyou, CA01, -122.454, 41.479, 2930, 42.4, M
WESTWOOD CALIFORNIA, Lassen, CA02, -120.900, 40.307, 5800, 31.7, M
WHITE CLOUD CALIFORNIA, Nevada, CA02, -120.837, 39.317, 4320, 40.9, M
WHITTIER HILLS CALIFORNIA, Los Angeles, CA06, -118.010, 33.984, 950, 56.7, M
WHITMORE CALIFORNIA, Shasta, CA02, -121.899, 40.619, 2417, 45.2, M
WOFFORD HEIGHTS CALIFORNIA, Kern, CA05, -118.499, 35.722, 3150, 46.9, M
WOLVERTON CALIFORNIA, Tulare, CA05, -118.703, 36.445, 5240, 43.4, M
WHITAKER PEAK CALIFORNIA, Los Angeles, CA06, -118.740, 34.569, 4120, 44.9, M
WHITE WOLF CALIFORNIA, Tuolumne, CA05, -119.650, 37.851, 8025, 30.1, M
YOLLA BOLLA CALIFORNIA, Trinity, CA01, -123.066, 40.338, 4524, 40.3, M
YUCCA VALLEY CALIFORNIA, San Bernardino, CA07, -116.408, 34.123, 3260, 48.4, M
HAGAN'S MEADOW, El Dorado, CA03, -119.940, 38.850, 7776, 31.8, 7.40
BLUE LAKES, Alpine, CA05, -119.920, 38.610, 8057, 27.1, 13.30
POISON FLAT, Alpine, CA03, -119.630, 38.510, 7736, 29.2, 7.10
SONORA PASS, Mono, CA03, -119.600, 38.310, 8827, 26.5, 10.10
LEAVITT MEADOWS, Mono, CA03, -119.550, 38.300, 7198, 32.0, 8.80
VIRGINIA LAKES RIDGE, Mono, CA03, -119.230, 38.070, 9445, 26.4, 7.00
LOBDELL LAKE, Mono, CA03, -119.370, 38.440, 9233, 26.1, 5.90
EBBETTS PASS, Alpine, CA03, -119.800, 38.550, 8765, 27.2, 14.50
HEAVENLY VALLEY, El Dorado, CA03, -119.920, 38.920, 8582, 28.8, 7.70
LEAVITT LAKE, Mono, CA03, -119.610, 38.280, 9617, 26.1, 16.40
SPRATT CREEK, Alpine, CA03, -119.820, 38.670, 6115, 36.1, 7.50
MONITOR PASS, Alpine, CA03, -119.610, 38.670, 8310, 30.1, 5.10
CROWDER FLAT, Modoc, CA01, -120.750, 41.890, 5170, 35.3, 3.30
CEDAR PASS, Modoc, CA02, -120.300, 41.580, 7030, 29.7, 3.70
DISMAL SWAMP, Modoc, CA03, -120.180, 41.990, 7360, 27.5, 8.50
ADIN MTN, Modoc, CA02, -120.790, 41.240, 6190, 31.9, 4.20
INDEPENDENCE CREEK, Sierra, CA03, -120.280, 39.490, 6456, 32.1, 9.20
INDEPENDENCE CAMP, Sierra, CA03, -120.290, 39.450, 7003, 31.2, 7.30
INDEPENDENCE LAKE, Nevada, CA03, -120.310, 39.430, 8352, 27.6, 14.10
TRUCKEE #2, Placer, CA03, -120.180, 39.300, 6509, 34.3, 9.80
WARD CREEK #3, Placer, CA03, -120.220, 39.140, 6655, 33.4, 17.80
TAHOE CITY CROSS, Placer, CA03, -120.150, 39.170, 6797, 33.2, 8.30
