Name, County, ClimateDivision, Longitude, Latitude, Elevation, MeanAvgTemperature, TotalPrecipitation
IMPERIAL, Imperial, CA07, -115.567, 32.849, -64, 61.4, 0.19
EL CAPITAN DAM, San Diego, CA06, -116.815, 32.886, 600, 59.3, 5.02
LAKESIDE 2 E, San Diego, CA06, -116.895, 32.854, 690, M, 4.58
POWAY VALLEY, San Diego, CA06, -117.031, 33.020, 648, 56.3, 4.89
JULIAN CDF, San Diego, CA06, -116.592, 33.076, 4215, 44.6, 8.70
RAMONA FIRE DEPT, San Diego, CA06, -116.908, 33.011, 1470, 54.0, 5.64
SAN PASQUAL ANIMAL PK, San Diego, CA06, -116.997, 33.096, 420, 57.7, 3.95
CARLSBAD MCCLELLAN PALOMAR AP, San Diego, CA06, -117.277, 33.130, 313, 57.0, 2.74
HENSHAW DAM, San Diego, CA06, -116.761, 33.237, 2700, 47.7, 8.67
VISTA, San Diego, CA06, -117.232, 33.235, 430, 58.8, 3.44
OCEANSIDE MARINA, San Diego, CA06, -117.395, 33.210, 10, 56.3, 3.14
NILAND, Imperial, CA07, -115.524, 33.278, -60, M, 0.30
BORREGO DESERT PARK, San Diego, CA07, -116.404, 33.256, 810, 60.1, 0.75
PALOMAR MTN OBSERVATORY, San Diego, CA06, -116.840, 33.378, 5550, 41.8, 10.95
TEMECULA, Riverside, CA06, -117.151, 33.497, 1020, 52.4, 4.83
MECCA FIRE STATION, Riverside, CA07, -116.073, 33.570, -183, 58.6, 0.00
ANZA, Riverside, CA06, -116.674, 33.556, 3915, M, 2.59
LAGUNA BEACH, Orange, CA06, -117.781, 33.545, 44, 57.7, 4.23
BLYTHE ASOS, Riverside, CA07, -114.715, 33.619, 395, 60.4, 0.08
DESERT RESORTS REGIONAL AP, Riverside, CA07, -116.164, 33.632, -118, 59.5, 0.48
BARSTOW-DAGGETT AIRPORT, San Bernardino, CA07, -116.787, 34.854, 1919, 54.3, 0.59
MERCED, Merced, CA05, -120.516, 37.289, 154, 52.6, 4.80
SAN DIEGO MONTGOMERY FIELD, San Diego, CA06, -117.137, 32.815, 418, 57.0, 3.61
SAN DIEGO INTERNATIONAL AP, San Diego, CA06, -117.183, 32.734, 15, 59.0, 3.67
SAN DIEGO MIRAMAR NAS, San Diego, CA06, -117.133, 32.867, 477, 56.1, 0.76
SAN FRANCISCO INTERNATIONAL AP, San Mateo, CA04, -122.366, 37.620, 10, 53.5, 8.46
SAN LUIS OBISPO MCCHESNEY FIELD, San Luis Obispo, CA04, -120.644, 35.238, 183, 53.2, 10.12
BRAWLEY 2 SW, Imperial, CA07, -115.558, 32.954, -100, 60.2, 0.00
CEDARVILLE, Modoc, CA03, -120.179, 41.530, 4688, 37.2, 1.13
CHICO UNIVERSITY FARM, Butte, CA02, -121.821, 39.691, 185, 50.0, 8.42
CHULA VISTA, San Diego, CA06, -117.086, 32.640, 56, 59.1, 2.92
COLFAX, Placer, CA02, -120.947, 39.090, 2373, 45.1, 21.40
CUYAMACA, San Diego, CA06, -116.587, 32.990, 4640, 41.4, 9.84
DAVIS 2 WSW EXP FARM, Yolo, CA02, -121.776, 38.535, 60, 50.7, 7.46
DEATH VALLEY NATIONAL PARK, Inyo, CA07, -116.867, 36.463, -194, 61.4, 0.43
FAIRMONT, Los Angeles, CA07, -118.430, 34.705, 3060, 47.9, 6.44
FORT BRAGG 5 N, Mendocino, CA01, -123.756, 39.510, 123, 50.2, 11.10
HANFORD 1 S, Kings, CA05, -119.637, 36.316, 237, 52.6, 3.28
HAPPY CAMP RANGER STATION, Siskiyou, CA01, -123.375, 41.796, 1142, 44.5, 10.33
HEALDSBURG, Sonoma, CA01, -122.866, 38.629, 177, 53.2, 14.58
INDIO FIRE STATION, Riverside, CA07, -116.215, 33.709, -21, 62.5, 0.32
LAKE SPAULDING, Nevada, CA02, -120.639, 39.318, 5156, 35.8, 25.41
LEMON COVE, Tulare, CA05, -119.026, 36.382, 513, 53.8, 5.99
LIVERMORE, Alameda, CA04, -121.751, 37.682, 529, 52.5, 4.87
LODI, San Joaquin, CA05, -121.288, 38.106, 40, 53.0, 8.56
MARYSVILLE, Yuba, CA02, -121.585, 39.146, 57, 53.4, 9.38
MERCED MUNICIPAL AP, Merced, CA05, -120.518, 37.286, 152, 51.7, 4.95
NAPA STATE HOSPITAL, Napa, CA01, -122.265, 38.278, 35, 52.7, 9.88
OJAI, Ventura, CA06, -119.227, 34.448, 745, 53.8, 10.06
ORLAND, Glenn, CA02, -122.200, 39.746, 254, 51.2, 5.95
ORLEANS, Humboldt, CA01, -123.532, 41.309, 403, 48.6, 8.94
PASADENA, Los Angeles, CA06, -118.145, 34.148, 864, 57.6, 9.70
PASO ROBLES, San Luis Obispo, CA04, -120.685, 35.628, 730, 50.4, 5.89
PETALUMA AIRPORT, Sonoma, CA01, -122.608, 38.258, 20, 52.7, 10.25
QUINCY, Plumas, CA02, -120.947, 39.937, 3420, 40.6, 15.13
REDLANDS, San Bernardino, CA06, -117.195, 34.037, 1410, 54.0, 3.64
SANTA BARBARA, Santa Barbara, CA06, -119.684, 34.417, 16, 56.1, 9.79
SANTA CRUZ, Santa Cruz, CA04, -122.000, 36.988, 70, 53.1, 14.06
SANTA ROSA, Sonoma, CA01, -122.713, 38.456, 166, 52.4, 11.65
TAHOE CITY, Placer, CA03, -120.143, 39.168, 6230, 33.7, 8.80
TUSTIN IRVINE RANCH, Orange, CA06, -117.754, 33.703, 235, 56.2, 3.97
UKIAH, Mendocino, CA01, -123.210, 39.147, 636, 50.2, 12.03
VACAVILLE, Solano, CA02, -121.961, 38.396, 110, 51.6, 10.51
WASCO, Kern, CA05, -119.352, 35.589, 291, 54.7, 1.82
WEAVERVILLE, Trinity, CA01, -122.940, 40.737, 2058, 43.0, 11.79
WILLOWS 6 W, Glenn, CA02, -122.305, 39.523, 234, 49.8, 5.79
YOSEMITE PARK HEADQUARTERS, Mariposa, CA05, -119.590, 37.750, 4018, 41.0, 11.34
YREKA, Siskiyou, CA01, -122.641, 41.703, 2709, 41.1, 3.21
BERKELEY, Alameda, CA04, -122.260, 37.874, 310, 52.7, 11.56
BLYTHE, Riverside, CA07, -114.597, 33.613, 268, 59.2, 0.00
EUREKA WFO WOODLEY ISLAND, Humboldt, CA01, -124.160, 40.810, 20, 51.6, 7.00
INDEPENDENCE, Inyo, CA07, -118.204, 36.798, 3950, 45.8, 0.38
SAN LUIS OBISPO POLY, San Luis Obispo, CA04, -120.662, 35.306, 308, 54.1, 13.17
BURNEY, Shasta, CA02, -121.655, 40.880, 3198, 40.1, 6.26
CAMPO, San Diego, CA06, -116.470, 32.626, 2630, 49.9, 4.20
CALEXICO 2 NE, Imperial, CA07, -115.464, 32.688, 12, M, 0.04
EL CENTRO 2 SSW, Imperial, CA07, -115.562, 32.767, -30, 61.5, 0.06
OCOTILLO 2, Imperial, CA07, -116.001, 32.746, 410, M, 0.42
LA MESA, San Diego, CA06, -117.023, 32.768, 530, 58.9, 4.68
ALPINE, San Diego, CA06, -116.777, 32.836, 1695, 55.1, 5.08
CULVER CITY, Los Angeles, CA06, -118.414, 34.005, 92, 56.3, 6.02
SANTA MONICA PIER, Los Angeles, CA06, -118.500, 34.008, 14, 56.4, 5.48
ONTARIO INTL AP, San Bernardino, CA06, -117.577, 34.053, 924, 54.8, 5.69
COVINA CITY YARD FC387B, Los Angeles, CA06, -117.880, 34.092, 607, M, 6.73
U C L A, Los Angeles, CA06, -118.443, 34.070, 430, 57.6, 7.60
TOPANGA PATROL FC-6, Los Angeles, CA06, -118.599, 34.084, 745, M, 8.68
IRON MOUNTAIN, San Bernardino, CA07, -115.122, 34.147, 922, 60.3, 0.23
TWENTYNINE PALMS, San Bernardino, CA07, -116.037, 34.128, 1975, 55.1, 0.33
SAN BERNARDINO F S 226, San Bernardino, CA06, -117.254, 34.134, 1140, 56.7, 6.45
SAN DIMAS FIRE FC 95, Los Angeles, CA06, -117.802, 34.105, 958, M, 7.92
GLENDORA FC 287B, Los Angeles, CA06, -117.847, 34.147, 933, M, 8.78
SAN GABRIEL FIRE DEPT, Los Angeles, CA06, -118.100, 34.084, 363, 57.1, 7.87
POINT MUGU NF, Ventura, CA06, -119.123, 34.124, 12, 54.1, 6.73
ALTADENA, Los Angeles, CA06, -118.138, 34.182, 1127, M, 9.43
SAN GABRIEL CANYON PH, Los Angeles, CA06, -117.908, 34.155, 744, M, 8.83
WOODLAND HILLS PIERCE COLLEGE, Los Angeles, CA06, -118.574, 34.182, 790, 54.3, 6.36
BIG BEAR LAKE DAM, San Bernardino, CA06, -116.975, 34.241, 6815, M, 8.30
LYTLE CREEK R S, San Bernardino, CA06, -117.471, 34.238, 2730, M, 14.63
SAN GABRIEL DAM FC425B-E, Los Angeles, CA06, -117.861, 34.205, 1481, M, 10.20
MT WILSON CBS, Los Angeles, CA06, -118.071, 34.231, 5710, 43.1, 16.32
LA CRESCENTA FC251 C, Los Angeles, CA06, -118.238, 34.222, 1545, M, 9.90
VAN NUYS AP, Los Angeles, CA06, -118.491, 34.212, 785, 54.6, 4.75
CAMARILLO AP, Ventura, CA06, -119.088, 34.211, 71, 55.4, 4.67
OXNARD, Ventura, CA06, -119.175, 34.198, 49, 55.4, 6.15
OXNARD VENTURA COUNTY AP, Ventura, CA06, -119.204, 34.200, 39, 55.3, 6.61
PARKER RESRVOIR, San Bernardino, CA07, -114.171, 34.290, 738, 60.9, 0.74
TWENTYNINE PALMS MC, San Bernardino, CA07, -116.147, 34.294, 2003, 54.6, T
BIG BEAR LAKE, San Bernardino, CA06, -116.917, 34.243, 6753, 35.9, 8.45
LAKE ARROWHEAD, San Bernardino, CA07, -117.188, 34.247, 5205, 41.1, 13.78
CHATSWORTH FC 24 F, Los Angeles, CA06, -118.600, 34.250, 950, M, 7.22
VENTURA, Ventura, CA06, -119.292, 34.283, 105, M, 7.17
CRYSTAL LAKE FC238C, Los Angeles, CA06, -117.842, 34.318, 5345, M, 12.76
BIG TUJUNGA DAM FC46, Los Angeles, CA06, -118.188, 34.295, 2326, M, 12.27
PACOIMA DAM FC33A-E, Los Angeles, CA06, -118.400, 34.329, 1550, M, 10.31
NEWHALL S FC32CE, Los Angeles, CA06, -118.534, 34.387, 1233, M, 3.54
SANTA PAULA, Ventura, CA06, -119.133, 34.312, 237, 54.9, 8.57
PIRU TELEMETERING, Ventura, CA06, -118.705, 34.400, 800, M, 2.30
PIRU 2 ESE, Ventura, CA06, -118.757, 34.406, 712, M, 7.21
CARPINTERIA RESERVOIR, Santa Barbara, CA06, -119.485, 34.406, 385, M, 2.80
SANTA BARBARA MUNI AP, Santa Barbara, CA06, -119.842, 34.424, 8, 56.8, 10.57
MATILIJA DAM, Ventura, CA06, -119.306, 34.484, 1060, M, 4.00
JUNCAL DAM, Santa Barbara, CA06, -119.507, 34.491, 2260, M, 15.18
VICTORVILLE, San Bernardino, CA07, -117.293, 34.529, 2880, 50.4, 1.23
ACTON ESCONDIDO FC261, Los Angeles, CA06, -118.271, 34.494, 2833, M, 3.54
GIBRALTAR DAM NO. 2, Santa Barbara, CA06, -119.682, 34.523, 1558, M, 16.68
SAN MARCOS PASS, Santa Barbara, CA06, -119.823, 34.512, 2258, M, 6.90
PALMDALE, Los Angeles, CA07, -118.094, 34.588, 2612, 51.6, 1.85
SAUGUS POWER PLANT 1, Los Angeles, CA06, -118.454, 34.590, 2161, M, 8.49
LOS PRIETOS RS, Santa Barbara, CA06, -119.791, 34.544, 1024, 53.5, 12.65
CACHUMA LAKE, Santa Barbara, CA06, -119.982, 34.582, 789, 54.4, 10.37
SALSIPUEDES GAGING STATION, Santa Barbara, CA06, -120.408, 34.585, 254, M, 9.76
EL MIRAGE, San Bernardino, CA07, -117.630, 34.589, 2950, 47.2, 0.91
PALMDALE AP, Los Angeles, CA07, -118.083, 34.629, 2509, 49.7, 1.23
SANTA YNEZ, Santa Barbara, CA06, -120.069, 34.608, 600, M, 2.50
LOMPOC, Santa Barbara, CA06, -120.451, 34.654, 75, 56.2, 7.92
FIGUEROA MOUNTAIN, Santa Barbara, CA06, -120.007, 34.734, 3152, M, 4.10
LANCASTER, Los Angeles, CA06, -118.213, 34.741, 2338, 48.4, 1.76
SANDBERG, Los Angeles, CA06, -118.724, 34.744, 4510, 41.6, 5.00
LOS ALAMOS, Santa Barbara, CA06, -120.280, 34.746, 565, 52.9, 8.78
LEBEC, Kern, CA05, -118.865, 34.833, 3575, 45.8, 3.99
CHUCHUPATE RANGER STN, Ventura, CA05, -119.011, 34.808, 5260, 40.6, M
DAGGETT POWER PLANT, San Bernardino, CA07, -116.856, 34.861, 1970, 52.5, 0.52
GAREY SISQUOC RIVER, Santa Barbara, CA06, -120.305, 34.894, 355, M, 2.65
MITCHELL CAVERNS, San Bernardino, CA07, -115.547, 34.944, 4350, 48.4, 2.42
NEW CUYAMA FIRE STATION, Santa Barbara, CA06, -119.683, 34.946, 2160, 50.0, 2.32
MOJAVE, Kern, CA07, -118.162, 35.049, 2735, 49.5, 1.67
PISMO BEACH, San Luis Obispo, CA04, -120.683, 35.160, 39, 56.9, 9.29
TAFT, Kern, CA05, -119.430, 35.150, 773, 56.2, 1.63
BAKER, San Bernardino, CA07, -116.063, 35.276, 962, 56.6, 0.88
GOLDSTONE ECHO NO 2, San Bernardino, CA07, -116.784, 35.281, 2950, M, 2.01
SALINAS DAM, San Luis Obispo, CA04, -120.504, 35.337, 1392, M, 11.37
RANDSBURG, Kern, CA07, -117.652, 35.369, 3570, 48.9, 2.33
SANTA MARGARITA BOOST, San Luis Obispo, CA04, -120.637, 35.374, 1148, M, 18.33
MORRO BAY FIRE DEPT, San Luis Obispo, CA04, -120.845, 35.367, 118, 53.3, 9.92
BAKERSFIELD AP, Kern, CA05, -119.055, 35.434, 490, 54.3, 1.62
BUTTONWILLOW, Kern, CA05, -119.470, 35.403, 225, 60.5, 1.52
MOUNTAIN PASS, San Bernardino, CA07, -115.544, 35.470, 4730, 43.7, 3.81
LOST HILLS, Kern, CA05, -119.689, 35.618, 288, M, 1.44
GLENNVILLE, Kern, CA05, -118.701, 35.727, 3140, 46.5, 7.93
TRONA, San Bernardino, CA07, -117.391, 35.764, 1695, 54.0, 0.38
KERN RIVER PH 3, Kern, CA05, -118.439, 35.783, 2703, 49.0, 3.68
DELANO, Kern, CA05, -119.260, 35.768, 302, 53.4, 3.11
UHL RS, Tulare, CA05, -118.646, 35.886, 3732, M, 0.00
BRADLEY TELEMETERING, Monterey, CA04, -120.868, 35.930, 443, M, 3.36
SHOSHONE, Inyo, CA07, -116.271, 35.972, 1546, M, 1.87
PORTERVILLE MUNICIPAL AIRPORT, Tulare, CA05, -119.062, 36.029, 442, 54.0, 2.15
PORTERVILLE, Tulare, CA05, -119.020, 36.068, 393, 55.6, 4.40
KETTLEMAN STATION, Kings, CA05, -120.088, 36.073, 508, M, 1.19
HAIWEE, Inyo, CA07, -117.953, 36.139, 3825, 46.2, 2.35
CORCORAN IRRIGATION DIST., Kings, CA05, -119.582, 36.098, 200, 54.0, 2.38
COALINGA, Fresno, CA05, -120.361, 36.136, 670, 54.5, 1.32
PRIEST VALLEY, Monterey, CA04, -120.695, 36.188, 2300, 47.0, 8.67
KING CITY, Monterey, CA04, -121.138, 36.207, 320, 54.4, 4.63
SPRINGVILLE TULE HD, Tulare, CA05, -118.657, 36.193, 4070, 47.8, 0.24
LINDSAY, Tulare, CA05, -119.054, 36.203, 435, 54.5, 5.27
ARROYO SECO RIVER, Monterey, CA04, -121.481, 36.238, 805, M, 0.00
BIG SUR STATION, Monterey, CA04, -121.780, 36.247, 200, 53.0, 20.18
VISALIA, Tulare, CA05, -119.300, 36.328, 303, 54.2, 4.44
FIVE POINTS 5 SSW, Fresno, CA05, -120.156, 36.364, 285, 55.7, 2.31
SAN CLEMENTE DAM, Monterey, CA04, -121.709, 36.438, 600, M, 7.75
ASH MOUNTAIN, Tulare, CA05, -118.825, 36.491, 1708, 50.3, 11.34
THREE RIVERS EDISON PH 1, Tulare, CA05, -118.862, 36.465, 1140, 52.6, 9.89
PINNACLES NATIONAL PARK, San Benito, CA04, -121.182, 36.482, 1307, 48.8, 6.28
LODGEPOLE, Tulare, CA05, -118.732, 36.604, 6735, 29.3, 16.16
PANOCHE 2 W, San Benito, CA05, -120.884, 36.607, 1400, M, 3.41
SPRECKELS HWY BRIDGE, Monterey, CA04, -121.671, 36.631, 21, M, 0.00
MONTEREY, Monterey, CA04, -121.855, 36.593, 122, 53.6, 7.97
SALINAS NO. 2, Monterey, CA04, -121.666, 36.659, 45, 55.1, 5.58
SALINAS AP, Monterey, CA04, -121.609, 36.664, 73, 53.9, 4.24
GRANT GROVE, Tulare, CA05, -118.962, 36.738, 6580, 33.8, 14.93
PINE FLAT DAM, Fresno, CA05, -119.337, 36.821, 615, M, 8.35
LOS BANOS ARBURUA RANCH, Merced, CA05, -120.939, 36.875, 843, M, 2.73
HOLLISTER 2, San Benito, CA04, -121.421, 36.848, 275, 52.8, 4.96
CHITTENDEN PASS, Santa Cruz, CA04, -121.597, 36.900, 82, M, 7.36
BALCH POWER HOUSE, Fresno, CA05, -119.088, 36.909, 1735, 51.2, 12.46
WATSONVILLE WATERWORKS, Santa Cruz, CA04, -121.769, 36.931, 95, 53.5, 10.14
FRIANT GOVERNMENT CAMP, Fresno, CA05, -119.707, 36.997, 410, 53.5, 8.11
MADERA, Madera, CA05, -120.038, 36.954, 270, 52.8, 6.13
WISHON DAM, Fresno, CA05, -118.984, 37.007, 6550, 37.4, 12.13
LOS BANOS DET RESV, Merced, CA05, -120.930, 36.990, 407, 53.6, 2.32
GILROY, Santa Clara, CA04, -121.561, 37.003, 194, 54.4, 8.80
AUBERRY 2 NW, Fresno, CA05, -119.513, 37.092, 2090, 50.0, 11.78
LOS BANOS, Merced, CA05, -120.867, 37.056, 120, 53.2, 2.65
SAN LUIS DAM, Merced, CA05, -121.058, 37.053, 277, 53.7, 3.49
BEN LOMOND NO. 4, Santa Cruz, CA04, -122.080, 37.086, 420, 51.5, 20.77
MORGAN HILL, Santa Clara, CA04, -121.602, 37.136, 375, 54.0, 7.86
SOUTH LAKE, Inyo, CA07, -118.570, 37.168, 9580, 8.3, 4.18
LAKE SABRINA, Inyo, CA07, -118.614, 37.213, 9065, M, 3.39
HUNTINGTON LAKE, Fresno, CA05, -119.221, 37.228, 7020, 33.9, 15.79
BIG CREEK PH 1, Fresno, CA05, -119.242, 37.206, 4878, 43.6, 12.17
NORTH FORK RS, Madera, CA05, -119.510, 37.233, 2645, 46.6, 15.52
LOS GATOS, Santa Clara, CA04, -121.959, 37.232, 365, 52.3, 6.63
BISHOP CREEK INTAKE 2, Inyo, CA07, -118.581, 37.248, 8154, M, 2.91
COARSEGOLD 1 SW, Madera, CA05, -119.705, 37.250, 2230, M, 14.49
NEWMAN, Stanislaus, CA05, -121.018, 37.281, 90, 52.6, 4.63
MOUNT HAMILTON, Santa Clara, CA04, -121.635, 37.343, 4220, 41.3, 8.79
SAN GREGORIO 2 SE, San Mateo, CA04, -122.362, 37.312, 275, 51.2, 13.25
DEEP SPRINGS COLLEGE, Inyo, CA07, -117.980, 37.374, 5225, 48.8, 2.13
BISHOP AIRPORT, Inyo, CA07, -118.359, 37.371, 4110, 42.5, 0.98
MOFFETT FEDERAL AIRFIELD, Santa Clara, CA04, -122.048, 37.406, 39, 53.4, 4.95
WOODSIDE FIRE STATION 1, San Mateo, CA04, -122.256, 37.429, 380, 52.8, 12.53
TURLOCK #2, Stanislaus, CA05, -120.846, 37.502, 103, 53.6, 4.88
PALO ALTO, Santa Clara, CA04, -122.140, 37.444, 25, 53.3, 6.47
HALF MOON BAY, San Mateo, CA04, -122.443, 37.473, 27, 52.7, 11.27
SO ENTRANCE YOSEMITE N.P., Mariposa, CA05, -119.633, 37.512, 5047, 37.8, 15.21
MARIPOSA R S, Mariposa, CA05, -119.986, 37.495, 2100, 47.5, 13.30
NEWARK, Alameda, CA04, -122.032, 37.515, 10, 54.4, 6.26
EXCHEQUER DAM, Mariposa, CA05, -120.267, 37.585, 442, M, 9.64
MODESTO AP, Stanislaus, CA05, -120.955, 37.625, 87, 52.7, 5.04
HAYWARD AIR TERMINAL, Alameda, CA04, -122.121, 37.659, 31, 53.8, 7.08
TRACY CARBONA, San Joaquin, CA05, -121.347, 37.682, 135, 51.2, 4.38
LIVERMORE MUNICIPAL AP, Alameda, CA04, -121.815, 37.693, 393, 51.4, 5.68
OAKLAND INTERNATIONAL AIRPORT, Alameda, CA04, -122.233, 37.718, 5, 52.9, 7.63
GEM LAKE, Mono, CA03, -119.140, 37.752, 8970, M, 4.26
UPPER SAN LEANDRO FILTERS, Alameda, CA04, -122.167, 37.772, 394, M, 8.48
SAN FRANCISCO DOWNTOWN, San Francisco, CA04, -122.427, 37.771, 150, 53.8, 8.96
SAN FRANCISCO OCEANSIDE, San Francisco, CA04, -122.505, 37.728, 8, 53.8, 8.24
GROVELAND RS, Tuolumne, CA05, -120.098, 37.823, 3145, M, 14.40
GROVELAND 2, Tuolumne, CA05, -120.226, 37.844, 2800, 44.6, 15.32
TRACY PUMPING PLANT, Alameda, CA05, -121.583, 37.796, 61, 53.3, 4.42
OAKLAND MUSEUM, Alameda, CA04, -122.264, 37.798, 30, 54.3, 9.94
BENTON INSPECTION STN, Mono, CA07, -118.478, 37.843, 5460, M, 0.43
MATHER, Tuolumne, CA05, -119.856, 37.885, 4510, M, 13.91
MOUNT DIABLO JUNCTION, Contra Costa, CA04, -121.930, 37.879, 2170, 46.3, 9.30
ELLERY LAKE, Mono, CA03, -119.230, 37.936, 9645, M, 7.03
STOCKTON AP, San Joaquin, CA05, -121.226, 37.890, 27, 52.1, 5.07
RICHMOND, Contra Costa, CA04, -122.377, 37.919, 20, 54.1, 10.96
MUIR WOODS, Marin, CA01, -122.569, 37.898, 220, M, 12.94
HETCH HETCHY, Tuolumne, CA05, -119.783, 37.961, 3870, 43.0, 12.00
CHERRY VALLEY DAM, Tuolumne, CA05, -119.916, 37.975, 4765, 40.3, 16.41
SONORA, Tuolumne, CA05, -120.387, 37.967, 1675, 47.5, 13.25
STOCKTON FIRE STA 4, San Joaquin, CA05, -121.318, 37.999, 12, 53.1, 8.34
ANTIOCH PUMPING PLANT #3, Contra Costa, CA05, -121.752, 37.983, 60, 52.3, 4.46
CONCORD BUCHANAN FIELD, Contra Costa, CA04, -122.053, 37.992, 23, 53.4, 6.86
CONCORD WASTEWATER PLANT, Contra Costa, CA04, -122.069, 37.983, 40, 53.7, 7.64
SAN RAFAEL-CIVIC CENTER, Marin, CA01, -122.537, 37.998, 120, 51.7, 12.79
KENTFIELD, Marin, CA01, -122.545, 37.957, 145, 52.8, 16.70
MARTINEZ WATER PLANT, Contra Costa, CA04, -122.114, 38.013, 40, 52.3, 7.75
SAN ANDREAS 2, Calaveras, CA05, -120.671, 38.191, 1100, 49.3, 9.54
BODIE CALIFORNIA STATE HISTORIC PARK, Mono, CA03, -119.014, 38.212, 8370, 25.6, 1.35
ACAMPO 5NE, San Joaquin, CA05, -121.201, 38.218, 87, M, 8.01
NAPA COUNTY AIRPORT, Napa, CA04, -122.280, 38.208, 16, 50.7, 8.10
BRIDGEPORT, Mono, CA03, -119.229, 38.258, 6470, 32.6, 1.33
CALAVERAS BIG TREES, Calaveras, CA05, -120.311, 38.277, 4695, 36.4, 19.44
CAMP PARDEE, Calaveras, CA05, -120.843, 38.249, 658, 52.5, 8.58
TRAVIS FIELD AFB, Solano, CA02, -121.933, 38.267, 62, 53.5, 7.34
FAIRFIELD, Solano, CA02, -122.068, 38.274, 40, 51.1, 11.25
DEEP CANYON LAB, Riverside, CA07, -116.376, 33.651, 1200, M, 0.76
ELSINORE, Riverside, CA06, -117.346, 33.686, 1268, 54.9, 3.91
SANTA ANA JOHN WAYNE AP, Orange, CA06, -117.867, 33.680, 43, 57.6, 3.04
HAYFIELD PUMPING PLANT, Riverside, CA07, -115.629, 33.704, 1370, 56.7, 0.79
SUN CITY, Riverside, CA06, -117.190, 33.716, 1420, 53.4, 3.71
IDYLLWILD FIRE DEPT, Riverside, CA06, -116.707, 33.757, 5380, 42.4, 4.47
SAN JACINTO, Riverside, CA06, -116.975, 33.797, 1525, 53.8, 4.03
HEMET, Riverside, CA06, -116.894, 33.738, 1811, 53.0, 3.57
SANTA ANA FIRE STATION, Orange, CA06, -117.867, 33.744, 135, 58.2, 4.65
EAGLE MOUNTAIN, Riverside, CA07, -115.451, 33.809, 973, 59.5, 0.31
PALM SPRINGS, Riverside, CA07, -116.510, 33.828, 425, 60.4, 0.90
LONG BEACH DAUGHERTY AP, Los Angeles, CA06, -118.147, 33.812, 34, 57.9, 2.86
PALOS VERDES ES FC43D, Los Angeles, CA06, -118.391, 33.800, 220, M, 4.18
SNOW CREEK UPPER, Riverside, CA07, -116.680, 33.873, 1940, M, 4.58
FULLERTON MUNICIPAL AP, Orange, CA06, -117.986, 33.872, 86, 57.6, 4.79
BEAUMONT #2, Riverside, CA07, -116.990, 33.926, 2591, 52.7, 5.38
DOWNEY FIRE DEPT. FC107C, Los Angeles, CA06, -118.145, 33.930, 110, M, 4.01
HAWTHORNE MUNICIPAL AP, Los Angeles, CA06, -118.333, 33.924, 55, 61.6, 4.29
LOS ANGELES INTL AP, Los Angeles, CA06, -118.387, 33.938, 97, 57.7, 4.71
RIVERSIDE FIRE STATION 3, Riverside, CA06, -117.388, 33.951, 840, 57.3, 2.95
RIVERSIDE MUNICIPAL AP, Riverside, CA06, -117.435, 33.953, 845, 55.8, 3.11
CHINO AP, San Bernardino, CA06, -117.625, 33.976, 636, 54.3, 2.05
WHITTIER CITY YARD FC106C, Los Angeles, CA06, -118.022, 33.976, 446, M, 4.93
RIVERSIDE CITRUS EXP, Riverside, CA06, -117.361, 33.967, 986, 56.2, 2.85
WALNUT NI FC102C, Los Angeles, CA06, -117.866, 34.002, 488, M, 6.27
MONTEBELLO, Los Angeles, CA06, -118.105, 34.019, 246, 59.6, 6.03
SONOMA, Sonoma, CA01, -122.462, 38.299, 97, 51.9, 10.80
SUTTER HILL CDF, Amador, CA05, -120.801, 38.377, 1586, 49.6, 12.14
NAPA RIVER TELEMETER, Napa, CA02, -122.300, 38.367, -, M, 0.00
WEST POINT, Calaveras, CA05, -120.545, 38.378, 2775, M, 15.03
ATLAS ROAD BROWN, Napa, CA01, -122.248, 38.427, 1680, M, 15.64
GRATON, Sonoma, CA01, -122.865, 38.431, 200, 50.2, 14.99
OCCIDENTAL, Sonoma, CA01, -122.966, 38.386, 865, 49.6, 18.23
FIDDLETOWN DEXTER RCH, Amador, CA05, -120.698, 38.525, 2170, M, 14.09
SACRAMENTO AP ASOS, Sacramento, CA02, -121.496, 38.507, 19, 51.4, 8.49
WINTERS, Yolo, CA02, -121.978, 38.525, 135, 51.6, 8.66
LAKE SOLANO, Solano, CA02, -122.004, 38.492, 187, 50.6, 9.52
SAINT HELENA, Napa, CA01, -122.471, 38.507, 225, 52.1, 13.34
SAINT HELENA 4 WSW, Napa, CA01, -122.538, 38.493, 1780, M, 16.20
HACIENDA BRIDGE, Sonoma, CA01, -122.927, 38.509, 20, M, 0.00
CAZADERO 5NW, Sonoma, CA01, -123.162, 38.564, 1420, M, 28.08
FORT ROSS, Sonoma, CA01, -123.245, 38.515, 112, 52.9, 11.14
SACRAMENTO 5 ESE, Sacramento, CA02, -121.418, 38.555, 38, 52.9, 8.93
ANGWIN PACIFIC UNION COLLEGE, Napa, CA01, -122.440, 38.573, 1715, 48.2, 11.98
CALISTOGA, Napa, CA01, -122.578, 38.577, 350, 51.1, 14.60
VENADO, Sonoma, CA01, -123.018, 38.609, 1260, M, 19.24
WOODLAND 1 WNW, Yolo, CA02, -121.794, 38.683, 67, 51.8, 7.50
MARKLEEVILLE, Alpine, CA03, -119.780, 38.692, 5530, 36.6, 5.22
TWIN LAKES, Alpine, CA02, -120.040, 38.709, 8000, 26.4, 11.18
PLACERVILLE, El Dorado, CA02, -120.824, 38.696, 1850, 49.4, 14.95
REPRESA, Sacramento, CA02, -121.161, 38.694, 295, M, 8.99
SACRAMENTO METROPOLITAN AP, Sacramento, CA02, -121.595, 38.701, 24, 51.1, 7.91
CAPAY 5 WNW, Yolo, CA02, -122.133, 38.733, 360, 56.1, M
PACIFIC HOUSE, El Dorado, CA02, -120.503, 38.758, 3450, M, 16.53
CLOVERDALE, Sonoma, CA01, -123.026, 38.793, 400, 51.3, 14.45
KELSEY 1 N, El Dorado, CA02, -120.821, 38.809, 2000, M, 15.13
SOUTH LAKE TAHOE AP, El Dorado, CA03, -119.996, 38.898, 6257, 32.7, M
GEORGETOWN RS, El Dorado, CA02, -120.801, 38.933, 3001, 44.7, 21.25
AUBURN, Placer, CA02, -121.084, 38.907, 1292, 49.2, 15.16
NICOLAUS #2, Sutter, CA02, -121.545, 38.926, 43, M, 7.12
YORKVILLE, Mendocino, CA01, -123.231, 38.905, 1100, M, 18.36
CLEARLAKE 4 SE, Lake, CA02, -122.567, 38.924, 1349, 45.6, 10.33
FORESTHILL RANGER STATION, Placer, CA02, -120.845, 39.010, 3015, M, 19.79
LAKEPORT, Lake, CA02, -122.917, 39.033, 1315, 47.2, 10.85
IOWA HILL, Placer, CA02, -120.840, 39.118, 3100, M, 24.92
MARYSVILLE AIRPORT (ASOS), Yuba, CA02, -121.569, 39.102, 62, 53.0, 6.51
UKIAH 4 WSW, Mendocino, CA01, -123.272, 39.127, 1328, M, 14.80
GOLD RUN 4 SW, Placer, CA02, -120.900, 39.150, 3220, M, 16.77
WILLIAMS, Colusa, CA02, -122.150, 39.150, 85, M, 16.76
GRASS VALLEY NO. 2, Nevada, CA02, -121.068, 39.204, 2400, 44.5, 21.26
HARRY L. ENGLEBRIGHT DAM, Nevada, CA02, -121.267, 39.237, 800, M, 15.76
COLUSA 2 SSW, Colusa, CA02, -122.027, 39.188, 50, 51.2, 4.49
LAKE MENDOCINO DAM, Mendocino, CA01, -123.185, 39.203, 764, M, 0.48
BLUE CANYON NYACK AP, Placer, CA02, -120.709, 39.276, 5286, 36.4, 24.90
NEVADA CITY, Nevada, CA02, -121.001, 39.247, 2781, 42.5, 24.77
TRUCKEE AIRPORT, Nevada, CA03, -120.139, 39.320, 5900, 31.0, 4.36
TRUCKEE RS, Nevada, CA03, -120.173, 39.333, 5823, 33.0, 8.80
DONNER MEMORIAL ST PARK, Nevada, CA03, -120.233, 39.324, 5937, 32.6, 12.43
DEER CREEK FOREBAY, Nevada, CA02, -120.833, 39.300, 4455, M, 12.77
COLGATE POWERHOUSE, Yuba, CA02, -121.192, 39.331, 595, M, 15.77
BOCA, Nevada, CA03, -120.094, 39.389, 5575, 32.2, 5.66
DOBBINS 1 S, Yuba, CA02, -121.201, 39.358, 1640, 48.3, 14.82
EAST PARK RESERVOIR, Colusa, CA02, -122.518, 39.359, 1205, 45.7, 5.65
STONYFORD, Colusa, CA02, -122.546, 39.375, 1170, M, 6.43
POTTER VALLEY POWERHOUSE, Mendocino, CA01, -123.129, 39.362, 1018, 48.1, 13.33
SAGEHEN CREEK, Nevada, CA03, -120.241, 39.432, 6337, 33.5, 2.35
WILLITS 1 NE, Mendocino, CA01, -123.342, 39.419, 1353, 46.3, 12.88
BOWMAN DAM, Nevada, CA02, -120.656, 39.454, 5385, 35.1, 21.59
OROVILLE, Butte, CA02, -121.553, 39.518, 171, 50.7, 8.67
OROVILLE MUNICIPAL AP, Butte, CA02, -121.622, 39.494, 187, 50.7, 10.29
SIERRAVILLE RS, Sierra, CA02, -120.370, 39.583, 4975, 35.6, 7.00
DOWNIEVILLE, Sierra, CA02, -120.824, 39.563, 2915, 41.0, 22.93
STRAWBERRY VALLEY, Yuba, CA02, -121.108, 39.563, 3808, 39.7, 31.12
STONY GORGE RESERVOIR, Glenn, CA02, -122.534, 39.586, 800, 47.7, 5.55
BRUSH CREEK RANGER STATION, Butte, CA02, -121.345, 39.695, 3560, M, 30.99
PARADISE, Butte, CA02, -121.624, 39.754, 1750, 47.6, 23.14
COVELO, Mendocino, CA01, -123.244, 39.816, 1413, 47.4, 11.97
VINTON, Plumas, CA02, -120.186, 39.806, 4950, M, 3.26
PORTOLA, Plumas, CA02, -120.472, 39.805, 4850, 35.4, 6.60
COVELO EEL RIVER RS, Mendocino, CA01, -123.085, 39.826, 1517, M, 10.52
DE SABLA, Butte, CA02, -121.611, 39.872, 2710, 44.2, 27.67
PASKENTA RANGER STATION, Tehama, CA02, -122.554, 39.888, 755, M, 7.63
LEGGETT, Mendocino, CA01, -123.720, 39.874, 703, M, 16.24
STANDISH HICKEY ST PK, Mendocino, CA01, -123.727, 39.878, 853, 47.7, 17.18
DOYLE 4 SSE, Lassen, CA03, -120.083, 39.972, 4390, 40.9, 3.62
DOYLE, Lassen, CA03, -120.105, 40.027, 4293, M, 2.12
RICHARDSON GR ST PK, Humboldt, CA01, -123.793, 40.026, 503, 47.6, 17.05
SHELTER COVE AVIATION, Humboldt, CA01, -124.073, 40.033, 246, 52.7, 12.98
GREENVILLE, Plumas, CA02, -120.950, 40.141, 3590, M, 14.20
CANYON DAM, Plumas, CA02, -121.089, 40.171, 4560, 35.7, 10.69
MIRANDA 4 SE, Humboldt, CA01, -123.776, 40.182, 266, M, 11.92
FORT SEWARD, Humboldt, CA01, -123.632, 40.218, 220, M, 18.16
HONEYDEW 1 SW, Humboldt, CA01, -124.132, 40.238, 373, M, 24.56
CHESTER, Plumas, CA02, -121.242, 40.303, 4530, 34.5, 10.94
MINERAL, Tehama, CA02, -121.609, 40.346, 4875, 34.7, 16.41
HARRISON GULCH RS, Shasta, CA02, -122.965, 40.364, 2750, 38.6, 10.79
COLEMAN FISHERIES STATION, Shasta, CA02, -122.143, 40.400, 420, M, 8.04
VOLTA PH, Shasta, CA02, -121.866, 40.458, 2220, M, 7.84
GRIZZLY CREEK STATE PARK, Humboldt, CA01, -123.909, 40.486, 413, 47.3, 11.69
SCOTIA, Humboldt, CA01, -124.104, 40.483, 136, 52.1, 11.79
MANZANITA LAKE, Shasta, CA02, -121.577, 40.541, 5750, 32.6, 8.12
BRIDGEVILLE 4 NNW, Humboldt, CA01, -123.822, 40.519, 2100, M, 15.56
HAYFORK 2 W, Trinity, CA01, -123.212, 40.552, 2300, 42.6, 9.52
