LAUFMAN CALIFORNIA, Lassen, CA03, -120.353, 40.142, 5800, 50.7, M
LADDER BUTTE CALIFORNIA, Lassen, CA02, -121.297, 40.807, 5750, 48.3, M
LEO CARRILLO CALIFORNIA, Los Angeles, CA06, -118.936, 34.046, 50, 63.7, M
LOS GATOS CALIFORNIA, Santa Clara, CA04, -121.943, 37.203, 2000, 60.6, M
LOST HORSE CALIFORNIA, Riverside, CA07, -116.188, 34.018, 4200, 57.9, M
LINCOLN CALIFORNIA, Placer, CA02, -121.268, 38.883, 200, 63.6, M
LOS PRIETOS CALIFORNIA, Santa Barbara, CA06, -119.783, 34.536, 1020, 63.8, M
LAS FLORES CALIFORNIA, San Diego, CA06, -117.439, 33.289, 100, 64.5, M
LAS TABLAS CALIFORNIA, San Luis Obispo, CA04, -120.924, 35.656, 994, 58.4, M