HEARST CASTLE, San Luis Obispo, CA04, -121.168, 35.684, 1526, 74.2, T
GETTY CENTER, Los Angeles, CA06, -118.479, 34.087, 1117, 73.6, 0.14
HESPERIA 2E, San Bernardino, CA07, -117.266, 34.421, 3055, 91.8, 0.09
RANCHO BERNARDO, San Diego, CA06, -117.081, 33.022, 690, 72.9, 0.11
FELTON, Santa Cruz, CA04, -122.075, 37.051, 400, 67.8, 0.00
PACIFICA 2S, San Mateo, CA04, -122.484, 37.610, 125, 58.4, 0.18
WEST COVINA, Los Angeles, CA06, -117.896, 34.052, 575, 77.2, 0.05
PIONEER 6E, Amador, CA05, -120.512, 38.445, 3000, 76.1, 0.00
SAN JUAN CANYON, Orange, CA06, -117.552, 33.532, 375, 74.3, 0.25
BEAR VALLEY, Calaveras, CA05, -120.076, 38.441, 6900, M, 1.34
YOUNTVILLE, Napa, CA01, -122.357, 38.395, 95, 70.9, 0.00
APPLE VALLEY #2, San Bernardino, CA07, -117.279, 34.536, 2780, 81.6, 0.08
OCOTILLO WELLS 2W, San Diego, CA07, -116.169, 33.155, 390, 97.7, 0.19
TORRANCE AP, Los Angeles, CA06, -118.342, 33.802, 90, 72.0, 0.26
REDDING 12 WNW, Shasta, CA02, -122.607, 40.651, 1418, 82.8, 0.02
LOS ANGELES DOWNTOWN/USC, Los Angeles, CA06, -118.291, 34.024, 179, 75.4, T
FRESNO YOSEMITE INT'L, Fresno, CA05, -119.720, 36.780, 334, 86.5, T
MONTEREY PENINSUL AP, Monterey, CA04, -121.849, 36.590, 160, 60.7, T
PASO ROBLES MUNICIPAL AP, San Luis Obispo, CA04, -120.629, 35.669, 820, 76.8, 0.02
MONTAGUE SISKIYOU AIRPORT, Siskiyou, CA01, -122.468, 41.774, 2645, 75.3, 0.04
SAN JOSE, Santa Clara, CA04, -121.903, 37.350, 67, 71.3, 0.00
SAN JOSE, Santa Clara, CA04, -121.924, 37.359, 49, 70.4, T
PALM SPRINGS ASOS, Riverside, CA07, -116.504, 33.822, 409, 94.7, 0.17
SAN DIEGO BROWN FIELD, San Diego, CA06, -116.994, 32.576, 521, 69.9, 0.03
Bakersfield Area, -, -, -, -, -, 87.4, T
Bishop Area, -, -, -, -, -, 80.1, T
Los Angeles Downtown Area, -, -, -, -, -, 75.4, T
Eureka Area, -, -, -, -, -, 58.8, 0.02
Fresno Area, -, -, -, -, -, 86.5, T
Los Angeles Airport Area, -, -, -, -, -, 71.5, 0.02
Long Beach Area, -, -, -, -, -, 73.9, 0.34
Redding Area, -, -, -, -, -, 84.9, 0.05
Sacramento Area, -, -, -, -, -, 79.2, T
San Diego Area, -, -, -, -, -, 70.0, T
Stockton Area, -, -, -, -, -, 80.0, T
San Francisco Airport Area, -, -, -, -, -, 63.0, T
Santa Maria Area, -, -, -, -, -, 63.5, 0.01
CAMP PENDLETON MCAS, San Diego, CA06, -117.355, 33.304, 70, 70.6, 0.08
LEMOORE REEVES NAS, Fresno, CA05, -119.950, 36.333, 232, 83.0, T
ARVIN, Kern, CA05, -118.834, 35.211, 450, 88.0, 0.20
FRAZIER PARK, Kern, CA06, -118.965, 34.827, 4972, 70.1, 0.03
REDONDO BEACH, Los Angeles, CA06, -118.376, 33.834, 142, 71.2, 0.24
MT WILSON, Los Angeles, -, -118.067, 34.233, 5712, 78.2, 0.01
BURBANK VALLEY PUMP PLANT, Los Angeles, CA06, -118.348, 34.187, 655, 76.8, 0.00
CORONADO FIRE DEPT, San Diego, CA06, -117.177, 32.692, 18, 69.7, T
CUYAMACA RANCHO ST PARK, San Diego, CA06, -116.559, 32.927, 4870, 75.7, 0.65
FALLBROOK FIRE DEPT, San Diego, CA06, -117.248, 33.384, 698, 72.1, 0.05
DEL MAR FIRE DEPT, San Diego, CA06, -117.262, 32.972, 12, 69.3, 0.81
IMPERIAL BEACH FIRE DEPT, San Diego, CA06, -117.114, 32.576, 22, 69.3, 0.01
LEMON GROVE FIRE DEPARTMENT, San Diego, CA06, -117.030, 32.738, 427, 73.1, 0.02
NATIONAL CITY FIRE DEPT, San Diego, CA06, -117.100, 32.671, 30, 70.9, 0.04
SPRING VALLEY FIRE DEPT, San Diego, CA06, -117.006, 32.710, 270, 73.5, 0.00
SANTEE FIRE DEPT, San Diego, CA06, -116.973, 32.841, 340, 70.1, 0.00
LEE VINING, Mono, CA07, -119.119, 37.957, 6797, 70.9, 0.41
ANAHEIM, Orange, CA06, -117.842, 33.865, 235, 77.6, 0.15
RED BLUFF TREATMENT PLANT, Tehama, CA02, -122.220, 40.162, 265, M, 0.04
NEW MELONES DAM HQ, Tuolumne, CA05, -120.486, 38.005, 960, 84.9, T
MAMMOTH LAKES RS, Mono, CA07, -118.962, 37.648, 7804, 64.0, 1.48
CAMPTONVILLE 1SW, Yuba, CA02, -121.071, 39.440, 2500, M, 0.00
MONTEREY WFO, Monterey, CA04, -121.855, 36.593, 122, 61.9, 0.01
SKYLINE RIDGE PRESERVE, San Mateo, CA04, -122.185, 37.313, 2270, 72.7, 0.00
FREMONT, Alameda, CA04, -122.016, 37.542, 38, 68.8, T
MAD RIVER 12 SE, Trinity, CA01, -123.374, 40.319, 2763, M, 0.00
BISHOP FS, Inyo, CA07, -118.365, 37.368, 4108, M, 0.00
NEWHALL 5NW, Los Angeles, CA06, -118.594, 34.393, 1765, 80.8, 0.02
TEHACHAPI 4 SE, Kern, CA05, -118.422, 35.101, 4220, 75.8, 0.09
REDWOOD CITY #2, San Mateo, CA04, -122.214, 37.488, 10, 69.1, 0.00
WRIGHTWOOD, San Bernardino, CA07, -117.639, 34.362, 6000, 70.4, 0.11
REDDING CDF, Shasta, CA02, -122.299, 40.519, 502, M, 0.10
VALLEJO, Solano, CA01, -122.187, 38.100, 341, 69.5, 0.00
NORTHRIDGE CAL STATE, Los Angeles, CA06, -118.525, 34.245, 904, 79.4, T
OXNARD WFO, Ventura, CA06, -119.137, 34.207, 52, 69.6, 0.01
LAKEHEAD, Shasta, CA02, -122.391, 40.899, 1398, M, 0.04
HANFORD MUNICIPAL AP, Kings, CA05, -119.623, 36.311, 249, 83.2, T
RAMONA AIRPORT, San Diego, CA06, -116.916, 33.038, 1385, 74.2, T
VACAVILLE/NUT TREE AP ASOS, Solano, CA02, -121.959, 38.378, 104, 79.8, T
ALTURAS MUNICIPAL AP, Modoc, CA02, -120.561, 41.484, 4383, 70.3, 0.26
MADERA MUNICIPAL AP, Madera, CA05, -120.111, 36.985, 251, 82.0, T
BAKERSFIELD 5 NW, Kern, CA05, -119.051, 35.419, 470, 85.0, 0.02
FRESNO 5 NE, Fresno, CA05, -119.709, 36.767, 338, 84.7, T
OCEANSIDE MUNICIPAL AP, San Diego, CA06, -117.350, 33.219, 30, 69.8, 0.06
SAN DIEGO SEAWORLD, San Diego, CA06, -117.231, 32.765, 14, 68.7, 0.01
RIALTO, San Bernardino, CA07, -117.393, 34.130, 1420, 81.5, 0.04
BOULEVARD 2, San Diego, CA07, -116.300, 32.667, 3600, M, 0.00
ARCATA EUREKA AP, Humboldt, CA01, -124.105, 40.978, 211, 56.5, 0.04
NEWPORT BEACH HARBOR, Orange, CA06, -117.884, 33.603, 10, 72.2, 0.07
ESCONDIDO NO. 2, San Diego, CA06, -117.090, 33.121, 600, 76.9, 0.05
REDDING AP, Shasta, CA02, -122.298, 40.515, 501, 84.9, 0.05
AVALON CATALINA AP, Los Angeles, CA06, -118.415, 33.404, 1565, 71.8, 0.03
SANTA MARIA PUBLIC AP, Santa Barbara, CA06, -120.452, 34.894, 243, 63.5, 0.01
MOUNT SHASTA, Siskiyou, CA02, -122.333, 41.333, 3535, 71.0, 0.60
RED BLUFF MUNI AP, Tehama, CA02, -122.255, 40.152, 354, 84.3, 0.07
NEEDLES AIRPORT, San Bernardino, CA07, -114.618, 34.768, 888, 99.0, 0.02
CHINA LAKE NAF, Kern, CA07, -117.693, 35.688, 2230, 90.5, 0.01
ARBUCKLE BASIN CALIFORNIA, Shasta, CA02, -122.833, 40.398, 1900, 83.7, M
ACTON CALIFORNIA, Los Angeles, CA06, -118.200, 34.446, 2600, 80.8, M
ARROYO GRANDE CALIFORNIA, San Luis Obispo, CA04, -120.392, 35.179, 1048, 76.0, M
ALDER SPRINGS CALIFORNIA, Glenn, CA02, -122.724, 39.651, 4300, 76.7, M
ALPINE CALIFORNIA, San Diego, CA06, -116.739, 32.834, 2041, 78.3, M
LOS ALTOS CALIFORNIA, Santa Clara, CA04, -122.147, 37.358, 645, 71.1, M
AMMO DUMP CALIFORNIA, San Diego, CA06, -117.286, 33.381, 1068, 73.1, M
ANZA CALIFORNIA, Riverside, CA06, -116.673, 33.555, 3920, 77.0, M
ALDER POINT CALIFORNIA, Humboldt, CA01, -123.590, 40.187, 923, 73.2, M
ARROYO SECO (MT. DIABLO) CALIF, Monterey, CA04, -121.492, 36.230, 980, 77.1, M
ASH CREEK CALIFORNIA, Siskiyou, CA02, -121.979, 41.277, 3200, 73.6, M
ASH VALLEY CALIFORNIA, Lassen, CA02, -120.686, 41.052, 5100, 68.3, M
BACKBONE CALIFORNIA, Trinity, CA01, -123.142, 40.889, 4700, 76.4, M
BALD MTN LOC CALIFORNIA, El Dorado, CA02, -120.697, 38.906, 4680, 79.8, M
BARNABY CALIFORNIA, Marin, CA01, -122.702, 38.028, 1240, 66.3, M
BATTERSON CALIFORNIA, Madera, CA05, -119.508, 37.232, 3160, 82.8, M
BIG BAR CALIFORNIA, Trinity, CA01, -123.233, 40.733, 1500, 80.1, M
BELL CANYON CALIFORNIA, Orange, CA06, -117.592, 33.542, 700, 73.7, M
BRADLEY CALIFORNIA, Monterey, CA04, -120.803, 35.864, 537, 77.8, M
BEAR PEAK CALIFORNIA, Tulare, CA05, -118.052, 35.884, 8228, 69.4, M
BENTON CALIFORNIA, Mono, CA07, -118.478, 37.843, 5450, 76.0, M
BEVERLY HILLS CALIFORNIA, Los Angeles, CA06, -118.412, 34.125, 1260, 77.9, M
BEAR VALLEY CALIFORNIA, Kern, CA05, -118.625, 35.140, 4000, 77.5, M
BANGOR CALIFORNIA, Butte, CA02, -121.386, 39.398, 803, 81.8, M
BIG HILL CALIFORNIA, Humboldt, CA01, -123.636, 41.098, 3570, 71.2, M
BIG PINES CALIFORNIA, Los Angeles, CA07, -117.692, 34.379, 6917, 72.0, M
BLACK DIAMOND CALIFORNIA, Contra Costa, CA04, -121.884, 37.950, 1600, 77.4, M
BLUE DOOR CALIFORNIA, Lassen, CA02, -120.337, 41.055, 5615, 70.3, M
BLUE RIDGE (KNF) CALIFORNIA, Siskiyou, CA01, -123.187, 41.269, 5956, 70.6, M
BEN BOLT CALIFORNIA, El Dorado, CA05, -120.934, 38.591, 905, 80.7, M
BEN LOMOND CALIFORNIA, Santa Cruz, CA04, -122.170, 37.132, 2630, 74.9, M
BOGARD R.S. CALIFORNIA, Lassen, CA02, -121.083, 40.598, 5650, 64.1, M
BOONVILLE CALIFORNIA, Mendocino, CA01, -123.349, 38.988, 644, 70.5, M
BIG PINE FLAT CALIFORNIA, San Bernardino, CA07, -117.013, 34.319, 6861, 69.6, M
BRIDGEPORT 4NW CALIFORNIA, Mono, CA03, -119.289, 38.272, 6650, 69.5, M
BRANCH MOUNTAIN CALIFORNIA, San Luis Obispo, CA04, -120.083, 35.189, 3770, 81.1, M
BEAR FLAT CALIFORNIA, Modoc, CA02, -120.313, 41.295, 6200, 74.0, M
BRIONES CALIFORNIA, Contra Costa, CA04, -122.118, 37.944, 1450, 73.4, M
BLACKROCK CALIFORNIA, Tulare, CA05, -118.260, 36.093, 8200, 65.3, M
BROOKS CALIFORNIA, Yolo, CA02, -122.145, 38.738, 354, 83.3, M
BIG SUR CALIFORNIA, Monterey, CA04, -121.785, 36.236, 450, 66.5, M
BUCK MEADOWS CALIFORNIA, Tuolumne, CA05, -120.097, 37.823, 3200, 76.1, M
BULL FLAT CALIFORNIA, Lassen, CA03, -120.114, 40.481, 4395, 72.0, M
BURNS CANYON CALIFORNIA, San Bernardino, CA07, -116.634, 34.210, 6000, 78.0, M
BUTTERCUP CALIFORNIA, Imperial, CA07, -114.884, 32.740, 217, 96.3, M
BEAVER CAMP LOC CALIFORNIA, Amador, CA05, -120.325, 38.488, 5000, 77.4, M
BRAZIE RANCH CALIFORNIA, Siskiyou, CA01, -122.594, 41.685, 3000, 77.8, M
CAHUILLA CALIFORNIA, Imperial, CA07, -115.174, 32.974, 278, 96.3, M
CALLAHAN CALIFORNIA, Siskiyou, CA01, -122.796, 41.308, 3136, 74.9, M
CAMERON FIRE STATION CALIFORNI, San Diego, CA06, -116.463, 32.721, 3443, 76.1, M
CANBY CALIFORNIA, Modoc, CA02, -120.868, 41.434, 4312, 72.3, M
CARRIZO CALIFORNIA, San Luis Obispo, CA05, -119.773, 35.096, 2490, 83.6, M
CASE SPRINGS CALIFORNIA, San Diego, CA06, -117.418, 33.445, 2320, 77.5, M
CATHEYS VALLEY CALIFORNIA, Mariposa, CA05, -120.111, 37.468, 1200, 85.5, M
CEDAR GROVE CALIFORNIA, Fresno, CA05, -118.656, 36.788, 4720, 72.5, M
CHEESEBORO CALIFORNIA, Ventura, CA06, -118.717, 34.185, 1650, 80.0, M
CHICO CALIFORNIA, Butte, CA02, -121.779, 39.712, 230, 81.3, M
CHILAO CALIFORNIA, Los Angeles, CA06, -118.030, 34.332, 5450, 77.9, M
CHUCHUPATE CALIFORNIA, Ventura, CA05, -119.012, 34.808, 4900, 70.5, M
CLAREMONT CALIFORNIA, Los Angeles, CA06, -117.707, 34.137, 1645, 78.1, M
CLEAR CREEK CALIFORNIA, Los Angeles, CA06, -118.152, 34.271, 3000, 80.1, M
CLARK CALIFORNIA, Riverside, CA06, -117.309, 33.877, 1720, 77.3, M
CALAVERAS ROAD CALIFORNIA, Alameda, CA04, -121.844, 37.553, 1230, 72.9, M
CASE MOUNTAIN CALIFORNIA, Tulare, CA05, -118.809, 36.411, 6450, 71.3, M
CORONA CALIFORNIA, Riverside, CA06, -117.549, 33.874, 640, 80.2, M
COHASSET CALIFORNIA, Butte, CA02, -121.769, 39.872, 1733, 85.2, M
COLLINS BALDY CALIFORNIA, Siskiyou, CA01, -122.950, 41.775, 5493, 71.0, M
CONVERSE CALIFORNIA, San Bernardino, CA06, -116.913, 34.194, 5618, 72.0, M
COOSKIE MOUNTAIN CALIFORNIA, Humboldt, CA01, -124.266, 40.257, 2950, 68.7, M
CORRALITOS CALIFORNIA, Santa Cruz, CA04, -121.798, 36.991, 450, 67.9, M
COUNTY LINE CALIFORNIA, Lake, CA02, -122.412, 39.019, 2085, 83.6, M
CAMP 9 CALIFORNIA, Los Angeles, CA06, -118.422, 34.362, 4000, 80.0, M
CRANE FLAT LOOKOUT CALIFORNIA, Mariposa, CA05, -119.825, 37.762, 6644, 70.4, M
CRESTVIEW CALIFORNIA, Mono, CA07, -118.983, 37.745, 7600, 62.6, M
CORNING CALIFORNIA, Tehama, CA02, -122.170, 39.939, 294, 84.0, M
CARPENTER RIDGE CALIFORNIA, Butte, CA02, -121.582, 40.069, 4812, 75.0, M
CRANSTON CALIFORNIA, Riverside, CA06, -116.841, 33.740, 1950, 83.2, M
CRAZY PEAK CALIFORNIA, Del Norte, CA01, -123.604, 41.992, 3970, 87.8, M
CASHMAN CALIFORNIA, Plumas, CA02, -120.915, 40.002, 4520, 75.0, M
DESCANSO CALIFORNIA, San Diego, CA06, -116.622, 32.857, 3480, 80.0, M
DEVILS GARDEN CALIFORNIA, Modoc, CA02, -120.671, 41.530, 5022, 72.8, M
DIABLO GRANDE CALIFORNIA, Stanislaus, CA05, -121.294, 37.329, 1850, 82.4, M
DEMOCRAT CALIFORNIA, Kern, CA05, -118.630, 35.532, 2356, 83.1, M
DINKEY CALIFORNIA, Fresno, CA05, -119.039, 37.066, 5668, 65.2, M
DELNORTE CALIFORNIA, Santa Barbara, CA06, -119.654, 34.009, 800, 68.0, M
DOG VALLEY CALIFORNIA, Sierra, CA03, -120.048, 39.562, 5976, 69.4, M
DOYLE CALIFORNIA, Lassen, CA03, -120.106, 40.022, 4240, 76.2, M
DEVILS POST PILE CALIFORNIA, Madera, CA05, -119.093, 37.630, 7560, 61.0, M
DEL VALLE CALIFORNIA, Los Angeles, CA06, -118.683, 34.431, 1278, 81.3, M
DEVORE CALIFORNIA, San Bernardino, CA06, -117.404, 34.221, 2057, 81.4, M
EAGLE PEAK CALIFORNIA, Tehama, CA02, -122.657, 39.928, 3713, 80.0, M
EEL RIVER CAMP CALIFORNIA, Humboldt, CA01, -123.824, 40.138, 446, 71.6, M
EEL RIVER CALIFORNIA, Mendocino, CA01, -123.083, 39.833, 1500, 78.2, M
EL CARISO CALIFORNIA, Riverside, CA06, -117.411, 33.647, 3038, 81.2, M
MOUNT ELIZABETH CALIFORNIA, Tuolumne, CA05, -120.247, 38.063, 4933, 77.4, M
EL MIRAGE CALIFORNIA, San Bernardino, CA07, -117.550, 34.634, 2880, 85.0, M
ESPERANZA CALIFORNIA, Calaveras, CA05, -120.515, 38.243, 2559, 80.5, M
FANCHER CREEK CALIFORNIA, Fresno, CA05, -119.466, 36.884, 920, 88.4, M
FAWNSKIN CALIFORNIA, San Bernardino, CA06, -116.899, 34.266, 6900, 66.2, M
FENCE MEADOW CALIFORNIA, Fresno, CA05, -119.175, 36.961, 5048, 76.8, M
FORT HUNTER LIGGET CALIFORNIA, Monterey, CA04, -121.242, 36.012, 1100, 79.3, M
FIGUEROA CALIFORNIA, Santa Barbara, CA06, -120.007, 34.733, 3200, 81.5, M
FISH CREEK MTN CALIFORNIA, Imperial, CA07, -116.067, 32.990, 760, 97.6, M
FIVE MILE CALIFORNIA, Inyo, CA07, -117.918, 35.872, 4150, 89.2, M
FORT ORD #2 CALIFORNIA, Monterey, CA04, -121.786, 36.627, 490, 59.4, M
FORESTHILL CALIFORNIA, Placer, CA02, -120.732, 39.091, 4355, 77.8, M
FOUNTAIN SPRINGS CALIFORNIA, Tulare, CA05, -118.915, 35.892, 210, 88.1, M
FREMONT CANYON CALIFORNIA, Orange, CA06, -117.711, 33.808, 1781, 78.2, M
FRIEND MOUNTAIN CALIFORNIA, Trinity, CA01, -123.342, 40.505, 4000, 74.1, M
FISH SLOUGH CALIFORNIA, Mono, CA07, -118.408, 37.478, 4500, 77.1, M
GASQUET CALIFORNIA, Del Norte, CA01, -123.979, 41.846, 500, 69.7, M
GRASSHOPPER CALIFORNIA, Lassen, CA03, -120.784, 40.782, 6158, 68.2, M
GOOSE VALLEY CALIFORNIA, San Diego, CA06, -116.846, 33.074, 1530, 75.1, M
GORDON CALIFORNIA, Lassen, CA03, -120.896, 40.759, 6200, 68.4, M
GRANITE MOUNTAIN CALIFORNIA, San Bernardino, CA07, -117.026, 34.536, 4720, 82.3, M
GREEN SPRING CALIFORNIA, Tuolumne, CA05, -120.500, 37.833, 1020, 82.8, M
GRIZZLY FLAT CALIFORNIA, El Dorado, CA05, -120.561, 38.620, 3740, 77.4, M
HASTINGS CALIFORNIA, Monterey, CA04, -121.552, 36.389, 1885, 77.6, M
HAWKEYE CALIFORNIA, Sonoma, CA01, -122.917, 38.782, 2000, 76.2, M
HAYFORK CALIFORNIA, Trinity, CA01, -123.165, 40.550, 2323, 75.1, M
HELL HOLE CALIFORNIA, Placer, CA02, -120.422, 39.072, 5240, 73.8, M
HERNANDEZ CALIFORNIA, San Benito, CA04, -120.856, 36.383, 3733, 81.2, M
HIGH GLADE LOOKOUT CALIFORNIA, Lake, CA02, -122.808, 39.208, 4840, 76.0, M
HIGH SIERRA CALIFORNIA, Fresno, CA05, -119.038, 37.315, 7403, 67.0, M
HOPLAND CALIFORNIA, Mendocino, CA01, -123.081, 39.031, 2682, 77.2, M
HOLLISTER CALIFORNIA, San Benito, CA04, -121.362, 36.842, 404, 70.7, M
HORSE LAKE CALIFORNIA, Lassen, CA03, -120.503, 40.631, 5100, 71.5, M
HOOPA CALIFORNIA, Humboldt, CA01, -123.671, 41.048, 375, 74.5, M
HORSE THIEF SPRINGS CALIFORNIA, San Bernardino, CA07, -115.909, 35.771, 5000, 85.0, M
HURLEY CALIFORNIA, Fresno, CA05, -119.568, 37.015, 1201, 81.2, M
INDIAN WELL CALIFORNIA, Siskiyou, CA01, -121.538, 41.742, 4770, 74.2, M
JARBO GAP CALIFORNIA, Butte, CA02, -121.489, 39.736, 2490, 83.0, M
JERSEYDALE CALIFORNIA, Mariposa, CA05, -119.839, 37.544, 3900, 80.2, M
JOHNSONDALE CALIFORNIA, Tulare, CA05, -118.545, 35.972, 4700, 71.5, M
JUANITA LAKE CALIFORNIA, Siskiyou, CA01, -122.006, 41.786, 5400, 73.1, M
JULIAN CALIFORNIA, San Diego, CA07, -116.591, 33.076, 4240, 77.6, M
JUNIPER CREEK CALIFORNIA, Modoc, CA02, -120.472, 41.332, 4372, 74.3, M
KEENWILD CALIFORNIA, Riverside, CA06, -116.767, 33.667, 4920, 76.8, M
KERNVILLE CALIFORNIA, Kern, CA05, -118.417, 35.755, 2720, 83.8, M
KETTLEMAN HILLS CALIFORNIA, Kings, CA05, -120.057, 36.033, 810, 86.9, M
KNOXVILLE CREEK CALIFORNIA, Lake, CA02, -122.417, 38.862, 2200, 79.2, M
KONOCTI CALIFORNIA, Lake, CA02, -122.706, 38.912, 2163, 80.9, M
LOS BANOS CALIFORNIA, Merced, CA05, -121.053, 37.055, 350, 83.5, M
MT. LAGUNA CALIFORNIA, San Diego, CA07, -116.420, 32.880, 5760, 70.4, M
LA HONDA CALIFORNIA, San Mateo, CA04, -122.255, 37.305, 872, 64.2, M
LA PANZA CALIFORNIA, San Luis Obispo, CA04, -120.187, 35.381, 1630, 78.2, M
LAURAL MOUNTAIN CALIFORNIA, Kern, CA07, -117.699, 35.478, 4390, 86.4, M
LASSEN LODGE CALIFORNIA, Tehama, CA02, -121.714, 40.344, 4159, 79.0, M
LAUFMAN CALIFORNIA, Lassen, CA03, -120.353, 40.142, 5800, 76.3, M
LAYTONVILLE CALIFORNIA, Mendocino, CA01, -123.485, 39.702, 1820, 75.2, M
LADDER BUTTE CALIFORNIA, Lassen, CA02, -121.297, 40.807, 5750, 72.5, M
LEO CARRILLO CALIFORNIA, Los Angeles, CA06, -118.936, 34.046, 50, 69.5, M
LOS GATOS CALIFORNIA, Santa Clara, CA04, -121.943, 37.203, 2000, 76.8, M
LOST HORSE CALIFORNIA, Riverside, CA07, -116.188, 34.018, 4200, 82.2, M
LINCOLN CALIFORNIA, Placer, CA02, -121.268, 38.883, 200, 84.3, M
LOWER KLAMATH CALIFORNIA, Siskiyou, CA01, -121.700, 41.999, 4098, 69.0, M
LOS PRIETOS CALIFORNIA, Santa Barbara, CA06, -119.783, 34.536, 1020, 77.8, M
LAS FLORES CALIFORNIA, San Diego, CA06, -117.439, 33.289, 100, 70.7, M
LAS TABLAS CALIFORNIA, San Luis Obispo, CA04, -120.924, 35.656, 994, 76.3, M
LITTLE TUJUNGA CALIFORNIA, Los Angeles, CA06, -118.361, 34.294, 1390, 76.6, M
LIVERMORE CALIFORNIA, Alameda, CA04, -121.814, 37.712, 800, 75.4, M
LYONS VALLEY CALIFORNIA, Lake, CA01, -123.074, 39.126, 3200, 77.6, M
LYTLE CREEK CALIFORNIA, San Bernardino, CA06, -117.480, 34.234, 2792, 79.6, M
MAD RIVER CALIFORNIA, Trinity, CA01, -123.524, 40.463, 2775, 70.9, M
MALIBU HILLS CALIFORNIA, Los Angeles, CA06, -118.633, 34.058, 1575, 75.8, M
MANZANITA LAKE CALIFORNIA, Shasta, CA02, -121.580, 40.540, 5660, 63.5, M
MAPLE CREEK CALIFORNIA, Humboldt, CA01, -123.937, 40.796, 1680, 66.6, M
MILL CREEK (BDF) CALIFORNIA, San Bernardino, CA06, -117.035, 34.084, 2950, 81.0, M
MCGUIRES CALIFORNIA, Mendocino, CA01, -123.601, 39.353, 593, 66.6, M
MEANS LAKE CALIFORNIA, San Bernardino, CA07, -116.517, 34.391, 2900, 83.3, M
MENDOCINO PASS CALIFORNIA, Mendocino, CA01, -122.945, 39.808, 5420, 74.4, M
METCALF GAP CALIFORNIA, Madera, CA05, -119.768, 37.409, 3077, 86.2, M
MEYERS CALIFORNIA, El Dorado, CA03, -120.018, 38.849, 6310, 65.1, M
MID HILLS CALIFORNIA, San Bernardino, CA07, -115.411, 35.123, 5413, 79.8, M
MILL CREEK (ANF) CALIFORNIA, Los Angeles, CA06, -118.082, 34.390, 5021, 77.2, M
MILO CALIFORNIA, Tulare, CA05, -118.869, 36.231, 1923, 87.5, M
MALLORY RIDGE CALIFORNIA, Contra Costa, CA05, -121.779, 37.817, 2040, 80.6, M
MONTECITO CALIFORNIA, Santa Barbara, CA06, -119.648, 34.461, 1500, 76.3, M
MODOC NWR CALIFORNIA, Modoc, CA02, -120.354, 41.459, 4380, 70.9, M
MOJAVE RIVER SINK CALIFORNIA, San Bernardino, CA07, -116.079, 35.053, 950, 97.8, M
MORMON ROCK CALIFORNIA, San Bernardino, CA06, -117.502, 34.318, 3300, 79.5, M
MOUNTAIN REST CALIFORNIA, Fresno, CA05, -119.371, 37.054, 4100, 79.9, M
MARKLEEVILLE CALIFORNIA, Alpine, CA03, -119.767, 38.683, 5501, 71.9, M
MT. SHASTA CALIFORNIA, Siskiyou, CA02, -122.316, 41.316, -, 74.7, M
MARIPOSA CALIFORNIA, Mariposa, CA05, -119.987, 37.504, 2231, 81.7, M
MT. DIABLO CALIFORNIA, Contra Costa, CA05, -121.914, 37.882, 3849, 75.7, M
MOUNT ZION CALIFORNIA, Amador, CA05, -120.651, 38.389, 2960, 85.1, M
NORTH FORK CALIFORNIA, Madera, CA05, -119.505, 37.233, 2720, 82.4, M
OAK BOTTOM CALIFORNIA, Shasta, CA02, -122.606, 40.651, 1326, 84.6, M
OAK KNOLL CALIFORNIA, Siskiyou, CA01, -122.850, 41.839, 1940, 76.7, M
OAK MOUNTAIN CALIFORNIA, Shasta, CA02, -121.983, 41.006, 1700, 80.6, M
OAK CREEK CALIFORNIA, Inyo, CA07, -118.259, 36.843, 4855, 83.5, M
OJAI CALIFORNIA, Ventura, CA06, -119.230, 34.448, 765, 74.1, M
OAK GROVE CALIFORNIA, San Diego, CA06, -116.795, 33.393, 2752, 80.6, M
OAKLAND NORTH CALIFORNIA, Contra Costa, CA04, -122.221, 37.865, 1403, 67.7, M
OAK OPENING CALIFORNIA, Tulare, CA05, -118.702, 36.175, 3240, 83.2, M
OAKLAND SOUTH CALIFORNIA, Alameda, CA04, -122.145, 37.786, 1095, 67.2, M
OPAL MOUNTAIN CALIFORNIA, San Bernardino, CA07, -117.176, 35.154, 3240, 86.8, M
OWENS CAMP LOC CALIFORNIA, El Dorado, CA02, -120.245, 38.733, 5240, 72.0, M
OWENS VALLEY CALIFORNIA, Inyo, CA07, -118.551, 37.390, 4640, 82.3, M
OZENA CALIFORNIA, Ventura, CA06, -119.354, 34.682, 3670, 77.9, M
PANAMINT CALIFORNIA, Inyo, CA07, -117.088, 36.120, 6880, 77.9, M
PARKFIELD CALIFORNIA, Monterey, CA04, -120.432, 35.899, 1535, 89.3, M
PATTY MOCUS CALIFORNIA, Tehama, CA02, -122.867, 40.295, 3500, 78.5, M
PINE HILLS CALIFORNIA, San Diego, CA06, -116.634, 33.016, -, 74.8, M
PIERCE CALIFORNIA, Plumas, CA02, -120.642, 40.246, 5700, 71.2, M
PINEHURST CALIFORNIA, Fresno, CA05, -119.000, 36.685, 4060, 79.8, M
PIKE COUNTY LOOKOUT CALIFORNIA, Yuba, CA02, -121.202, 39.475, 3714, 79.8, M
PILOT HILL CALIFORNIA, El Dorado, CA02, -121.009, 38.833, 1200, 79.4, M
PIRU CALIFORNIA, Ventura, CA06, -118.810, 34.404, 614, 74.7, M
PARK RIDGE CALIFORNIA, Tulare, CA05, -118.942, 36.724, 7540, 69.0, M
PINNACLES CALIFORNIA, San Benito, CA04, -121.147, 36.471, 1322, 78.7, M
POPPY PARK CALIFORNIA, Los Angeles, CA07, -118.383, 34.733, 2760, 86.1, M
POTRERO CALIFORNIA, San Diego, CA06, -116.609, 32.606, 2345, 77.2, M
POVERTY CALIFORNIA, Santa Clara, CA04, -121.771, 37.443, 2066, 76.7, M
PULGAS CALIFORNIA, San Mateo, CA04, -122.298, 37.475, 644, 70.1, M
QUARTZ HILL CALIFORNIA, Siskiyou, CA01, -122.934, 41.599, 4225, 77.9, M
QUINCY RD CALIFORNIA, Plumas, CA02, -120.942, 39.973, 3500, 74.0, M
RAVENDALE CALIFORNIA, Lassen, CA03, -120.316, 40.731, 5298, 72.6, M
RANCHITA CALIFORNIA, San Diego, CA07, -116.497, 33.222, 4415, 80.6, M
READER RANCH CALIFORNIA, Nevada, CA02, -121.117, 39.304, 1968, 81.8, M
SANTA ROSA ISLAND CALIFORNIA, Santa Barbara, CA06, -120.078, 33.978, 1298, 62.4, M
SANTA ROSA PLATEAU CALIFORNIA, Riverside, CA06, -117.231, 33.529, 1980, 72.7, M
SANTA ROSA CALIFORNIA, Sonoma, CA01, -122.712, 38.479, 576, 70.0, M
STAMPEDE CALIFORNIA, Sierra, CA03, -120.075, 39.483, 6867, 66.9, M
STONYFORD CALIFORNIA, Colusa, CA02, -122.575, 39.367, 1200, 81.2, M
SUGARLOAF (SHF) CALIFORNIA, Shasta, CA02, -122.438, 40.917, 4200, 83.2, M
SUGARLOAF CALIFORNIA, Tulare, CA05, -118.675, 36.727, 8120, 67.8, M
SPRING VALLEY CALIFORNIA, San Mateo, CA04, -122.436, 37.563, 1075, 63.6, M
TALEGA CALIFORNIA, San Diego, CA06, -117.486, 33.478, 1203, 74.6, M
TANBARK CALIFORNIA, Los Angeles, CA06, -117.761, 34.207, 2600, 79.6, M
TARGET RANGE CALIFORNIA, San Diego, CA06, -117.359, 33.372, 918, 72.2, M
TEMESCAL (LPF) CALIFORNIA, Ventura, CA06, -118.756, 34.481, 1140, 78.6, M
THOMES CREEK CALIFORNIA, Tehama, CA02, -122.610, 39.864, 1040, 88.5, M
THOUSAND OAKS CALIFORNIA, Ventura, CA06, -118.870, 34.210, 795, 71.8, M
TIMBER MOUNTAIN CALIFORNIA, Modoc, CA01, -121.298, 41.629, 4960, 74.2, M
TEMESCAL (CNF) CALIFORNIA, Riverside, CA06, -117.483, 33.763, 1125, 80.6, M
MOUNT TOM CALIFORNIA, Fresno, CA05, -119.178, 37.376, 9018, 63.1, M
LAS TRAMPAS CALIFORNIA, Contra Costa, CA04, -122.067, 37.834, 1760, 74.6, M
TRINITY CAMP CALIFORNIA, Trinity, CA01, -122.804, 40.786, 3308, 76.8, M
TRIMMER CALIFORNIA, Fresno, CA05, -119.305, 36.911, 1540, 85.0, M
GAYLOR MEADOW CALIFORNIA, Tuolumne, CA05, -119.318, 37.868, 9270, 55.9, M
UHL / HOT SPRINGS, Tulare, CA05, -118.633, 35.889, 3720, 78.9, M
UNDERWOOD CALIFORNIA, Trinity, CA01, -123.495, 40.722, 2600, 75.5, M
VALLEY CENTER CALIFORNIA, San Diego, CA06, -117.009, 33.237, 1483, 78.0, M
VAN BREMMER CALIFORNIA, Siskiyou, CA01, -121.794, 41.643, 4928, 72.5, M
VALYERMO CALIFORNIA, Los Angeles, CA07, -117.851, 34.446, 3780, 80.7, M
VANDENBERG CALIFORNIA, Santa Barbara, CA06, -120.486, 34.759, 1050, 64.9, M
WALKER CALIFORNIA, Mono, CA03, -119.459, 38.565, 5440, 77.5, M
WALKER PASS CALIFORNIA, Kern, CA05, -118.057, 35.665, 5572, 80.9, M
WARM SPRINGS CALIFORNIA, Los Angeles, CA06, -118.579, 34.596, 4930, 81.1, M
WEAVERVILLE CALIFORNIA, Trinity, CA01, -122.943, 40.735, 2100, 78.0, M
WEED AIRPORT CALIFORNIA, Siskiyou, CA01, -122.454, 41.479, 2930, 75.9, M
WESTWOOD CALIFORNIA, Lassen, CA02, -120.900, 40.307, 5800, 70.9, M
WHITE CLOUD CALIFORNIA, Nevada, CA02, -120.837, 39.317, 4320, 79.6, M
WHITTIER HILLS CALIFORNIA, Los Angeles, CA06, -118.010, 33.984, 950, 76.4, M
WHITMORE CALIFORNIA, Shasta, CA02, -121.899, 40.619, 2417, 82.6, M
WOFFORD HEIGHTS CALIFORNIA, Kern, CA05, -118.499, 35.722, 3150, 81.9, M
WOLVERTON CALIFORNIA, Tulare, CA05, -118.703, 36.445, 5240, 77.6, M
WOODACRE CALIFORNIA, Marin, CA01, -122.645, 37.991, 1400, 72.0, M
WHITAKER PEAK CALIFORNIA, Los Angeles, CA06, -118.740, 34.569, 4120, 80.5, M
WHITE WOLF CALIFORNIA, Tuolumne, CA05, -119.650, 37.851, 8025, 58.9, M
YOLLA BOLLA CALIFORNIA, Trinity, CA01, -123.066, 40.338, 4524, 74.0, M
YUCCA VALLEY CALIFORNIA, San Bernardino, CA07, -116.408, 34.123, 3260, 84.4, M
YUROK CALIFORNIA, Humboldt, CA01, -123.857, 41.290, 495, 69.8, M
HAGAN'S MEADOW, El Dorado, CA03, -119.940, 38.850, 7776, 60.5, 1.60
BLUE LAKES, Alpine, CA05, -119.920, 38.610, 8057, 60.9, 1.20
POISON FLAT, Alpine, CA03, -119.630, 38.510, 7736, 60.1, 0.80
SONORA PASS, Mono, CA03, -119.600, 38.310, 8827, 61.0, 0.80
LEAVITT MEADOWS, Mono, CA03, -119.550, 38.300, 7198, 63.0, 2.20
VIRGINIA LAKES RIDGE, Mono, CA03, -119.230, 38.070, 9445, 62.5, 0.40
LOBDELL LAKE, Mono, CA03, -119.370, 38.440, 9233, 59.8, 1.20
EBBETTS PASS, Alpine, CA03, -119.800, 38.550, 8765, 61.0, 1.40
HEAVENLY VALLEY, El Dorado, CA03, -119.920, 38.920, 8582, 59.4, 0.20
LEAVITT LAKE, Mono, CA03, -119.610, 38.280, 9617, 56.2, 1.60
SPRATT CREEK, Alpine, CA03, -119.820, 38.670, 6115, 68.5, 1.20
MONITOR PASS, Alpine, CA03, -119.610, 38.670, 8310, 63.4, 0.00
CROWDER FLAT, Modoc, CA01, -120.750, 41.890, 5170, 66.9, 1.20
CEDAR PASS, Modoc, CA02, -120.300, 41.580, 7030, 66.3, 0.10
DISMAL SWAMP, Modoc, CA03, -120.180, 41.990, 7360, 62.9, 0.80
ADIN MTN, Modoc, CA02, -120.790, 41.240, 6190, 62.7, 0.00
INDEPENDENCE CREEK, Sierra, CA03, -120.280, 39.490, 6456, 62.7, 1.20
INDEPENDENCE CAMP, Sierra, CA03, -120.290, 39.450, 7003, 63.1, 0.20
