CAMPO ASOS, San Diego, CA07, -116.468, 32.626, 2641, 75.2, 1.62
Burbank Glendale Pasadena Area, -, -, -, -, -, 78.3, T
Camarillo Area, -, -, -, -, -, 70.1, 0.01
Needles Area, -, -, -, -, -, 99.0, 0.02
Oxnard Area, -, -, -, -, -, 69.6, 0.01
Palm Springs Area, -, -, -, -, -, 94.7, 0.17
Riverside Area, -, -, -, -, -, 81.5, 0.00
Ramona Area, -, -, -, -, -, 74.2, T
Northern CA 8 Station Index, -, -, -, -, -, M, 0.16
INDEPENDENCE LAKE, Nevada, CA03, -120.310, 39.430, 8352, 65.0, 1.30
TRUCKEE #2, Placer, CA03, -120.180, 39.300, 6509, 67.4, 0.70
WARD CREEK #3, Placer, CA03, -120.220, 39.140, 6655, 62.1, 0.20
TAHOE CITY CROSS, Placer, CA03, -120.150, 39.170, 6797, 65.1, 0.00
SQUAW VALLEY G.C., Placer, CA03, -120.260, 39.190, 8029, 62.6, 0.20
CSS LAB, Nevada, CA02, -120.370, 39.330, 6855, 63.1, 0.60
RUBICON #2, El Dorado, CA03, -120.130, 39.000, 7689, 65.3, 0.00
ECHO PEAK, El Dorado, CA03, -120.080, 38.850, 7670, 63.7, 1.70
FALLEN LEAF, El Dorado, CA03, -120.050, 38.930, 6236, 57.0, 1.00
BEAR VALLEY F.D., Kern, CA01, -118.644, 35.166, 4100, 68.3, 0.05
REDDING AIRPORT CALIFORNIA, Shasta, CA02, -122.291, 40.516, 500, 85.6, M
RICE VALLEY CALIFORNIA, Riverside, CA07, -114.732, 34.061, 820, 96.5, M
ROCK CREEK, Mono, CA07, -118.667, 37.551, 7040, 69.9, M
RODEO VALLEY, Mendocino, CA01, -123.321, 39.668, 2428, 74.5, M
ROSE VALLEY CALIFORNIA, Ventura, CA06, -119.184, 34.543, 3331, 72.8, M
ROUND MOUNTAIN, Siskiyou, CA02, -121.464, 41.427, 5258, 73.6, M
ROSE PEAK CALIFORNIA, Alameda, CA04, -121.735, 37.502, 3060, 76.7, M
RATTLESNAKE CALIFORNIA, Tulare, CA05, -118.422, 36.407, 8600, 66.6, M
RUSH CREEK CALIFORNIA, Modoc, CA02, -120.864, 41.294, 4800, 74.2, M
RUTH CALIFORNIA, Trinity, CA01, -123.316, 40.251, 2732, 76.0, M
SACRAMENTO NWR CALIFORNIA, Glenn, CA02, -122.182, 39.417, 120, 82.1, M
SADDLEBACK BUTTE CALIFORNIA, Los Angeles, CA07, -117.821, 34.685, 2590, 85.4, M
SAUGUS CALIFORNIA, Los Angeles, CA06, -118.525, 34.425, 1450, 80.8, M
SAWYERS BAR CALIFORNIA, Siskiyou, CA01, -123.132, 41.300, 2192, 77.0, M
SANTA CRUZ ISLAND CALIFORNIA, Santa Barbara, CA06, -119.722, 33.996, 250, 70.0, M
SCORPION CALIFORNIA, Trinity, CA01, -122.697, 41.112, 4400, 77.4, M
SODA CREEK CALIFORNIA, Lake, CA01, -122.977, 39.425, 1773, 75.1, M
SADDLEBACK CALIFORNIA, Sierra, CA02, -120.865, 39.638, 6670, 71.0, M
SECRET TOWN CALIFORNIA, Nevada, CA02, -120.885, 39.184, 2826, 78.7, M
SANTA FE DAM CALIFORNIA, Los Angeles, CA06, -117.946, 34.121, 500, 79.2, M
SHAVER CALIFORNIA, Fresno, CA05, -119.256, 37.135, 5746, 67.3, M
SCHOOL HOUSE CALIFORNIA, Humboldt, CA01, -123.906, 41.138, 2640, 67.6, M
SHIP MTN. CALIFORNIA, Del Norte, CA01, -123.792, 41.736, 5300, 68.5, M
SHADEQUARTER CALIFORNIA, Tulare, CA05, -118.956, 36.567, 4069, 79.3, M
SIMS CALIFORNIA, Shasta, CA02, -122.373, 41.075, 2400, 81.9, M
SIMI VALLEY CALIFORNIA, Ventura, CA06, -118.814, 34.291, 914, 73.2, M
SLATER BUTTE CALIFORNIA, Siskiyou, CA01, -123.352, 41.859, 4670, 75.5, M
SAN MIGUEL CALIFORNIA, San Diego, CA06, -116.974, 32.685, 425, 70.5, M
SAN LUIS NWR CALIFORNIA, Merced, CA05, -120.794, 37.182, 65, 80.0, M
SANTA RITA CALIFORNIA, San Benito, CA05, -120.598, 36.348, 5000, 77.1, M
SOLDIER MOUNTAIN CALIFORNIA, Shasta, CA02, -121.586, 40.926, 3710, 77.4, M
SQUAW SPRINGS CALIFORNIA, San Bernardino, CA07, -117.568, 35.370, 3620, 87.2, M
SQUAW LAKE CALIFORNIA, Imperial, CA07, -114.494, 32.908, 300, 96.1, M
Crescent City Area, -, -, -, -, -, 57.0, 0.03
Escondido Area, -, -, -, -, -, 76.9, 0.05
Sacramento Downtown Area, -, -, -, -, -, 81.6, 0.00
Tahoe City Area, -, -, -, -, -, 65.1, 0.11
Ukiah Area, -, -, -, -, -, 76.0, 0.01
Alturas Area, -, -, -, -, -, 70.3, 0.26
Mount Shasta Area, -, -, -, -, -, 71.0, 0.60
Palmdale Area, -, -, -, -, -, 85.3, T
Lancaster Area, -, -, -, -, -, 86.2, 0.11
El Cajon Area, -, -, -, -, -, 75.8, 0.78
Hanford Area, -, -, -, -, -, 83.2, T
El Centro Area, -, -, -, -, -, 93.6, T
Madera Area, -, -, -, -, -, 82.0, T
Merced Area, -, -, -, -, -, 81.5, T
San Jose Area, -, -, -, -, -, 70.4, T