MARIPOSA CALIFORNIA, Mariposa, CA05, -119.987, 37.504, 2231, 52.4, M
MT. DIABLO CALIFORNIA, Contra Costa, CA05, -121.914, 37.882, 3849, 40.8, M
MOUNT ZION CALIFORNIA, Amador, CA05, -120.651, 38.389, 2960, 53.8, M
NORTH FORK CALIFORNIA, Madera, CA05, -119.505, 37.233, 2720, 52.4, M
OAK BOTTOM CALIFORNIA, Shasta, CA02, -122.606, 40.651, 1326, 55.3, M
OAK KNOLL CALIFORNIA, Siskiyou, CA01, -122.850, 41.839, 1940, 51.6, M
OAK MOUNTAIN CALIFORNIA, Shasta, CA02, -121.983, 41.006, 1700, 50.0, M
OAK CREEK CALIFORNIA, Inyo, CA07, -118.259, 36.843, 4855, 55.1, M
OJAI CALIFORNIA, Ventura, CA06, -119.230, 34.448, 765, 53.9, M
OAK GROVE CALIFORNIA, San Diego, CA06, -116.795, 33.393, 2752, 55.0, M
OAK OPENING CALIFORNIA, Tulare, CA05, -118.702, 36.175, 3240, 51.5, M
OAKLAND SOUTH CALIFORNIA, Alameda, CA04, -122.145, 37.786, 1095, 53.4, M
OPAL MOUNTAIN CALIFORNIA, San Bernardino, CA07, -117.176, 35.154, 3240, 57.0, M
OWENS CAMP LOC CALIFORNIA, El Dorado, CA02, -120.245, 38.733, 5240, 45.8, M
OWENS VALLEY CALIFORNIA, Inyo, CA07, -118.551, 37.390, 4640, 54.6, M
OZENA CALIFORNIA, Ventura, CA06, -119.354, 34.682, 3670, 50.8, M
PANAMINT CALIFORNIA, Inyo, CA07, -117.088, 36.120, 6880, 47.3, M
PARKFIELD CALIFORNIA, Monterey, CA04, -120.432, 35.899, 1535, 53.4, M
PATTY MOCUS CALIFORNIA, Tehama, CA02, -122.867, 40.295, 3500, 47.8, M
PINE HILLS CALIFORNIA, San Diego, CA06, -116.634, 33.016, -, 49.4, M
PIERCE CALIFORNIA, Plumas, CA02, -120.642, 40.246, 5700, 43.1, M
PINEHURST CALIFORNIA, Fresno, CA05, -119.000, 36.685, 4060, 48.0, M
PIKE COUNTY LOOKOUT CALIFORNIA, Yuba, CA02, -121.202, 39.475, 3714, 49.1, M
PILOT HILL CALIFORNIA, El Dorado, CA02, -121.009, 38.833, 1200, 54.8, M
PIRU CALIFORNIA, Ventura, CA06, -118.810, 34.404, 614, 56.4, M
PARK RIDGE CALIFORNIA, Tulare, CA05, -118.942, 36.724, 7540, 37.9, M
PINNACLES CALIFORNIA, San Benito, CA04, -121.147, 36.471, 1322, 54.7, M
POPPY PARK CALIFORNIA, Los Angeles, CA07, -118.383, 34.733, 2760, 54.2, M
POTRERO CALIFORNIA, San Diego, CA06, -116.609, 32.606, 2345, 53.7, M
POVERTY CALIFORNIA, Santa Clara, CA04, -121.771, 37.443, 2066, 51.0, M
PANOCHE ROAD CALIFORNIA, Fresno, CA05, -120.766, 36.727, 2032, 54.2, M
PULGAS CALIFORNIA, San Mateo, CA04, -122.298, 37.475, 644, 56.8, M
QUARTZ HILL CALIFORNIA, Siskiyou, CA01, -122.934, 41.599, 4225, 46.9, M
QUINCY RD CALIFORNIA, Plumas, CA02, -120.942, 39.973, 3500, 48.8, M
RAVENDALE CALIFORNIA, Lassen, CA03, -120.316, 40.731, 5298, 43.2, M
RANCHITA CALIFORNIA, San Diego, CA07, -116.497, 33.222, 4415, 50.8, M
READER RANCH CALIFORNIA, Nevada, CA02, -121.117, 39.304, 1968, 53.7, M
REDDING AIRPORT CALIFORNIA, Shasta, CA02, -122.291, 40.516, 500, 57.5, M
RICE VALLEY CALIFORNIA, Riverside, CA07, -114.732, 34.061, 820, 69.0, M
ROCK CREEK, Mono, CA07, -118.667, 37.551, 7040, 42.5, M
RODEO VALLEY, Mendocino, CA01, -123.321, 39.668, 2428, 48.7, M
ROSE VALLEY CALIFORNIA, Ventura, CA06, -119.184, 34.543, 3331, 47.8, M
ROUND MOUNTAIN, Siskiyou, CA02, -121.464, 41.427, 5258, 41.7, M
ROSE PEAK CALIFORNIA, Alameda, CA04, -121.735, 37.502, 3060, 47.3, M
RUSH CREEK CALIFORNIA, Modoc, CA02, -120.864, 41.294, 4800, 41.7, M
RUTH CALIFORNIA, Trinity, CA01, -123.316, 40.251, 2732, 48.8, M
SACRAMENTO NWR CALIFORNIA, Glenn, CA02, -122.182, 39.417, 120, 58.6, M
SADDLEBACK BUTTE CALIFORNIA, Los Angeles, CA07, -117.821, 34.685, 2590, 56.2, M
SAUGUS CALIFORNIA, Los Angeles, CA06, -118.525, 34.425, 1450, 55.7, M
SAWYERS BAR CALIFORNIA, Siskiyou, CA01, -123.132, 41.300, 2192, 51.3, M
SANTA BARBARA ISLAND CALIFORNI, Santa Barbara, CA06, -119.033, 33.483, 176, 56.1, M
SANTA CRUZ ISLAND CALIFORNIA, Santa Barbara, CA06, -119.722, 33.996, 250, 54.7, M
SCORPION CALIFORNIA, Trinity, CA01, -122.697, 41.112, 4400, 48.5, M
SODA CREEK CALIFORNIA, Lake, CA01, -122.977, 39.425, 1773, 51.5, M
SADDLEBACK CALIFORNIA, Sierra, CA02, -120.865, 39.638, 6670, 38.1, M
SECRET TOWN CALIFORNIA, Nevada, CA02, -120.885, 39.184, 2826, 51.2, M
SANTA FE DAM CALIFORNIA, Los Angeles, CA06, -117.946, 34.121, 500, 61.1, M
SHAVER CALIFORNIA, Fresno, CA05, -119.256, 37.135, 5746, 41.7, M
SCHOOL HOUSE CALIFORNIA, Humboldt, CA01, -123.906, 41.138, 2640, 45.1, M
SHIP MTN. CALIFORNIA, Del Norte, CA01, -123.792, 41.736, 5300, 39.3, M
SHADEQUARTER CALIFORNIA, Tulare, CA05, -118.956, 36.567, 4069, 48.1, M
SIMS CALIFORNIA, Shasta, CA02, -122.373, 41.075, 2400, 50.2, M
SIMI VALLEY CALIFORNIA, Ventura, CA06, -118.814, 34.291, 914, 55.1, M
SAN MIGUEL CALIFORNIA, San Diego, CA06, -116.974, 32.685, 425, 59.5, M
SAN LUIS NWR CALIFORNIA, Merced, CA05, -120.794, 37.182, 65, 58.3, M
SANTA RITA CALIFORNIA, San Benito, CA05, -120.598, 36.348, 5000, 44.0, M
SOLDIER MOUNTAIN CALIFORNIA, Shasta, CA02, -121.586, 40.926, 3710, 47.4, M
SOMES BAR CALIFORNIA, Siskiyou, CA01, -123.496, 41.390, 920, 69.7, M
SQUAW SPRINGS CALIFORNIA, San Bernardino, CA07, -117.568, 35.370, 3620, 56.6, M
SQUAW LAKE CALIFORNIA, Imperial, CA07, -114.494, 32.908, 300, 72.8, M