MARKLEY COVE, Napa, CA02, -122.124, 38.492, 480, 55.5, 6.66
SUSANVILLE 2SW, Lassen, CA03, -120.663, 40.417, 4212, 47.2, 1.75
TEJON RANCHO, Kern, CA05, -118.750, 35.023, 1425, 53.3, 0.94
BURBANK GLENDALE PASADENA AP, Los Angeles, CA06, -118.365, 34.200, 731, 58.9, 1.83
MOUNT SHASTA, Siskiyou, CA02, -122.317, 41.322, 3613, 45.2, 6.83
WATSONVILLE MUNICIPAL AIRPORT, Santa Cruz, CA04, -121.790, 36.939, 162, 54.7, 4.13
SANTA ROSA SONOMA CO AP, Sonoma, CA04, -122.811, 38.504, 119, 54.7, 5.83
OAKHURST, Madera, CA05, -119.653, 37.331, 2230, 49.1, 5.79
CORONADO FIRE DEPT, San Diego, CA06, -117.177, 32.692, 18, 59.5, 0.74
FALLBROOK FIRE DEPT, San Diego, CA06, -117.248, 33.384, 698, 58.0, 1.94
DEL MAR FIRE DEPT, San Diego, CA06, -117.262, 32.972, 12, 60.1, 0.59
LEMON GROVE FIRE DEPARTMENT, San Diego, CA06, -117.030, 32.738, 427, 60.4, 1.57
SPRING VALLEY FIRE DEPT, San Diego, CA06, -117.006, 32.710, 270, 60.8, 0.34
SANTEE FIRE DEPT, San Diego, CA06, -116.973, 32.841, 340, 60.9, 0.00
LEE VINING, Mono, CA07, -119.119, 37.957, 6797, 43.2, 2.29
ANAHEIM, Orange, CA06, -117.842, 33.865, 235, 62.7, 2.00
RED BLUFF TREATMENT PLANT, Tehama, CA02, -122.220, 40.162, 265, M, 5.30
NEW MELONES DAM HQ, Tuolumne, CA05, -120.486, 38.005, 960, 55.9, 8.21
POINT REYES ALERT, Marin, CA01, -122.930, 38.101, 175, M, 4.82
MAMMOTH LAKES RS, Mono, CA07, -118.962, 37.648, 7804, 34.6, 5.04
BIG SUR 3 SE, Monterey, CA04, -121.772, 36.246, 240, M, 1.89
FRAZIER PARK 9 SW, Ventura, CA05, -119.104, 34.733, 5169, M, 3.95
CAMPTONVILLE 1SW, Yuba, CA02, -121.071, 39.440, 2500, M, 13.68
MONTEREY WFO, Monterey, CA04, -121.855, 36.593, 122, 55.1, 2.77
SKYLINE RIDGE PRESERVE, San Mateo, CA04, -122.185, 37.313, 2270, 47.4, 8.71
FREMONT, Alameda, CA04, -122.016, 37.542, 38, 57.0, 2.49
MAD RIVER 12 SE, Trinity, CA01, -123.374, 40.319, 2763, M, 9.00
NEWHALL 5NW, Los Angeles, CA06, -118.594, 34.393, 1765, 55.2, 2.92
TEHACHAPI 4 SE, Kern, CA05, -118.422, 35.101, 4220, 49.1, 1.84
REDWOOD CITY #2, San Mateo, CA04, -122.214, 37.488, 10, 56.3, 2.77
WRIGHTWOOD, San Bernardino, CA07, -117.639, 34.362, 6000, 44.5, 4.24
REDDING CDF, Shasta, CA02, -122.299, 40.519, 502, M, 6.53
VALLEJO, Solano, CA01, -122.187, 38.100, 341, 57.7, 1.31
NORTHRIDGE CAL STATE, Los Angeles, CA06, -118.525, 34.245, 904, 58.4, 2.17
OXNARD WFO, Ventura, CA06, -119.137, 34.207, 52, 57.9, 3.22
LAKEHEAD, Shasta, CA02, -122.391, 40.899, 1398, M, 15.35
HANFORD MUNICIPAL AP, Kings, CA05, -119.623, 36.311, 249, 59.3, 3.00
RAMONA AIRPORT, San Diego, CA06, -116.916, 33.038, 1385, 54.4, 1.73
VACAVILLE/NUT TREE AP ASOS, Solano, CA02, -121.959, 38.378, 104, 57.7, 4.07
ALTURAS MUNICIPAL AP, Modoc, CA02, -120.561, 41.484, 4383, 43.8, 1.85
MADERA MUNICIPAL AP, Madera, CA05, -120.111, 36.985, 251, 58.3, 1.73
BAKERSFIELD 5 NW, Kern, CA05, -119.051, 35.419, 470, 59.0, 2.05
FRESNO 5 NE, Fresno, CA05, -119.709, 36.767, 338, 58.7, 3.82
OCEANSIDE MUNICIPAL AP, San Diego, CA06, -117.350, 33.219, 30, 57.0, 1.36
SAN DIEGO SEAWORLD, San Diego, CA06, -117.231, 32.765, 14, 60.7, 0.18
RIALTO, San Bernardino, CA07, -117.393, 34.130, 1420, 57.6, 2.87
BOULEVARD 2, San Diego, CA07, -116.300, 32.667, 3600, M, 9.75
ARCATA EUREKA AP, Humboldt, CA01, -124.105, 40.978, 211, 49.4, 4.50
CHICO ARMY FLYING SCH, Butte, CA02, -121.850, 39.800, 272, 57.6, 4.54
NEWPORT BEACH HARBOR, Orange, CA06, -117.884, 33.603, 10, 58.7, 1.51
ESCONDIDO NO. 2, San Diego, CA06, -117.090, 33.121, 600, 60.0, 2.06
REDDING AP, Shasta, CA02, -122.298, 40.515, 501, 57.3, 6.09
AVALON CATALINA AP, Los Angeles, CA06, -118.415, 33.404, 1565, 53.3, 1.49
SANTA MARIA PUBLIC AP, Santa Barbara, CA06, -120.452, 34.894, 243, 56.5, 3.89
MOUNT SHASTA, Siskiyou, CA02, -122.333, 41.333, 3535, 46.0, 6.18
RED BLUFF MUNI AP, Tehama, CA02, -122.255, 40.152, 354, 57.5, 4.40
NEEDLES AIRPORT, San Bernardino, CA07, -114.618, 34.768, 888, 73.6, 0.02
CHINA LAKE NAF, Kern, CA07, -117.693, 35.688, 2230, 59.9, 0.08
REDONDO BEACH, Los Angeles, CA06, -118.376, 33.834, 142, 58.2, 0.95
BURBANK VALLEY PUMP PLANT, Los Angeles, CA06, -118.348, 34.187, 655, 57.8, 2.39
HEARST CASTLE, San Luis Obispo, CA04, -121.168, 35.684, 1526, 51.9, 5.93
GETTY CENTER, Los Angeles, CA06, -118.479, 34.087, 1117, 57.3, 2.87
HESPERIA 2E, San Bernardino, CA07, -117.266, 34.421, 3055, 53.4, 1.22
RANCHO BERNARDO, San Diego, CA06, -117.081, 33.022, 690, 58.9, 1.22
FELTON, Santa Cruz, CA04, -122.075, 37.051, 400, 53.8, 12.01
PACIFICA 2S, San Mateo, CA04, -122.484, 37.610, 125, 53.7, 3.61
SAN JUAN CANYON, Orange, CA06, -117.552, 33.532, 375, 58.3, 2.09
YOUNTVILLE, Napa, CA01, -122.357, 38.395, 95, 54.7, 7.09
APPLE VALLEY #2, San Bernardino, CA07, -117.279, 34.536, 2780, 55.0, 0.41
OCOTILLO WELLS 2W, San Diego, CA07, -116.169, 33.155, 390, 68.5, T
IRVINE RANCH, Orange, CA06, -117.723, 33.720, 540, 58.9, 3.18
MT. LAGUNA #3, San Diego, CA07, -116.419, 32.867, 5920, 43.6, 0.65
AVALON INLAND, Los Angeles, CA06, -118.330, 33.338, 90, 52.5, 0.00
DESERT CENTER 2 NNE, Riverside, CA07, -115.392, 33.738, 747, 69.8, 0.00
TORRANCE AP, Los Angeles, CA06, -118.342, 33.802, 90, 58.2, 1.19
MERCED 23 WSW, Merced, CA05, -120.882, 37.238, 78, 56.3, 1.60
REDDING 12 WNW, Shasta, CA02, -122.607, 40.651, 1418, 53.8, 10.96
STOVEPIPE WELLS 1 SW, Inyo, CA07, -117.145, 36.602, 84, 73.5, 0.12
LOS ANGELES DOWNTOWN/USC, Los Angeles, CA06, -118.291, 34.024, 179, 60.9, 2.15
FRESNO YOSEMITE INT'L, Fresno, CA05, -119.720, 36.780, 334, 59.7, 3.27
MONTEREY PENINSUL AP, Monterey, CA04, -121.849, 36.590, 160, 54.3, 1.76
PASO ROBLES MUNICIPAL AP, San Luis Obispo, CA04, -120.629, 35.669, 820, 55.0, 2.15
MONTAGUE SISKIYOU AIRPORT, Siskiyou, CA01, -122.468, 41.774, 2645, 48.3, 0.75
SAN JOSE, Santa Clara, CA04, -121.903, 37.350, 67, 57.5, 4.55
SAN JOSE, Santa Clara, CA04, -121.924, 37.359, 49, 56.8, 2.14
PALM SPRINGS ASOS, Riverside, CA07, -116.504, 33.822, 409, 68.8, 0.08
THOUSAND OAKS 1 SW, Ventura, CA06, -118.899, 34.182, 783, 56.8, 2.03
FILLMORE 2 W, Ventura, CA06, -118.945, 34.409, 495, 58.1, 2.65
SAN DIEGO BROWN FIELD, San Diego, CA06, -116.994, 32.576, 521, 60.5, 1.05
LAKE BERRYESSA, Napa, CA02, -122.250, 38.579, 455, 57.3, 4.06
PACIFIC HOUSE #2, El Dorado, CA02, -120.503, 38.758, 3440, M, 15.00
Bakersfield Area, -, -, -, -, -, 60.3, 1.99
Bishop Area, -, -, -, -, -, 54.1, 0.39
Los Angeles Downtown Area, -, -, -, -, -, 60.9, 2.15
Eureka Area, -, -, -, -, -, 50.9, 4.08
Fresno Area, -, -, -, -, -, 59.7, 3.27
Los Angeles Airport Area, -, -, -, -, -, 59.4, 1.63
Long Beach Area, -, -, -, -, -, 59.4, 1.32
Redding Area, -, -, -, -, -, 57.3, 6.09
Sacramento Area, -, -, -, -, -, 57.4, 3.27
San Diego Area, -, -, -, -, -, 61.9, 0.88
Stockton Area, -, -, -, -, -, 58.4, 2.65
San Francisco Airport Area, -, -, -, -, -, 55.6, 4.01
Santa Maria Area, -, -, -, -, -, 56.5, 3.89
CAMP PENDLETON MCAS, San Diego, CA06, -117.355, 33.304, 70, 56.4, 1.46
LEMOORE REEVES NAS, Fresno, CA05, -119.950, 36.333, 232, 58.4, 1.73
ARVIN, Kern, CA05, -118.834, 35.211, 450, 60.4, T
FRAZIER PARK, Kern, CA06, -118.965, 34.827, 4972, 44.6, 1.97
ARBUCKLE BASIN CALIFORNIA, Shasta, CA02, -122.833, 40.398, 1900, 52.5, M
ACTON CALIFORNIA, Los Angeles, CA06, -118.200, 34.446, 2600, 53.8, M
ARROYO GRANDE CALIFORNIA, San Luis Obispo, CA04, -120.392, 35.179, 1048, 54.4, M
ALDER SPRINGS CALIFORNIA, Glenn, CA02, -122.724, 39.651, 4300, 45.6, M
ALPINE CALIFORNIA, San Diego, CA06, -116.739, 32.834, 2041, 56.6, M
LOS ALTOS CALIFORNIA, Santa Clara, CA04, -122.147, 37.358, 645, 56.4, M
AMMO DUMP CALIFORNIA, San Diego, CA06, -117.286, 33.381, 1068, 58.3, M
ANZA CALIFORNIA, Riverside, CA06, -116.673, 33.555, 3920, 50.2, M
ALDER POINT CALIFORNIA, Humboldt, CA01, -123.590, 40.187, 923, 52.8, M
ARROYO SECO (MT. DIABLO) CALIF, Monterey, CA04, -121.492, 36.230, 980, 54.9, M
ASH CREEK CALIFORNIA, Siskiyou, CA02, -121.979, 41.277, 3200, 44.0, M
ASH VALLEY CALIFORNIA, Lassen, CA02, -120.686, 41.052, 5100, 42.3, M
BACKBONE CALIFORNIA, Trinity, CA01, -123.142, 40.889, 4700, 45.8, M
BALD MTN LOC CALIFORNIA, El Dorado, CA02, -120.697, 38.906, 4680, 47.1, M
BARNABY CALIFORNIA, Marin, CA01, -122.702, 38.028, 1240, 53.2, M
BATTERSON CALIFORNIA, Madera, CA05, -119.508, 37.232, 3160, 50.8, M
BIG BAR CALIFORNIA, Trinity, CA01, -123.233, 40.733, 1500, 54.2, M
BELL CANYON CALIFORNIA, Orange, CA06, -117.592, 33.542, 700, 55.2, M
BRADLEY CALIFORNIA, Monterey, CA04, -120.803, 35.864, 537, 55.5, M
BEAR PEAK CALIFORNIA, Tulare, CA05, -118.052, 35.884, 8228, 38.4, M
BENTON CALIFORNIA, Mono, CA07, -118.478, 37.843, 5450, 49.2, M
BEAUMONT CALIFORNIA, Riverside, CA06, -116.950, 33.931, 2604, 55.3, M
BEVERLY HILLS CALIFORNIA, Los Angeles, CA06, -118.412, 34.125, 1260, 59.4, M
BANGOR CALIFORNIA, Butte, CA02, -121.386, 39.398, 803, 56.2, M
BIG HILL CALIFORNIA, Humboldt, CA01, -123.636, 41.098, 3570, 45.4, M
BIG PINES CALIFORNIA, Los Angeles, CA07, -117.692, 34.379, 6917, 44.2, M
BIG ROCK CALIFORNIA, Marin, CA01, -122.570, 38.039, 1500, 53.9, M
BLACK DIAMOND CALIFORNIA, Contra Costa, CA04, -121.884, 37.950, 1600, 52.2, M
BLUE DOOR CALIFORNIA, Lassen, CA02, -120.337, 41.055, 5615, 40.3, M
BLUE RIDGE (KNF) CALIFORNIA, Siskiyou, CA01, -123.187, 41.269, 5956, 39.6, M
BEN BOLT CALIFORNIA, El Dorado, CA05, -120.934, 38.591, 905, 55.0, M
BEN LOMOND CALIFORNIA, Santa Cruz, CA04, -122.170, 37.132, 2630, 48.2, M
BOGARD R.S. CALIFORNIA, Lassen, CA02, -121.083, 40.598, 5650, 38.0, M
BOONVILLE CALIFORNIA, Mendocino, CA01, -123.349, 38.988, 644, 52.8, M
BIG PINE FLAT CALIFORNIA, San Bernardino, CA07, -117.013, 34.319, 6861, 44.9, M
BRIDGEPORT 4NW CALIFORNIA, Mono, CA03, -119.289, 38.272, 6650, 43.4, M
BRANCH MOUNTAIN CALIFORNIA, San Luis Obispo, CA04, -120.083, 35.189, 3770, 47.9, M
BEAR FLAT CALIFORNIA, Modoc, CA02, -120.313, 41.295, 6200, 39.2, M
BRIONES CALIFORNIA, Contra Costa, CA04, -122.118, 37.944, 1450, 53.3, M
BLACKROCK CALIFORNIA, Tulare, CA05, -118.260, 36.093, 8200, 39.1, M
BROOKS CALIFORNIA, Yolo, CA02, -122.145, 38.738, 354, 57.5, M
BIG SUR CALIFORNIA, Monterey, CA04, -121.785, 36.236, 450, 54.4, M
BUCK MEADOWS CALIFORNIA, Tuolumne, CA05, -120.097, 37.823, 3200, 49.1, M
BULL FLAT CALIFORNIA, Lassen, CA03, -120.114, 40.481, 4395, 45.1, M
BURNS CANYON CALIFORNIA, San Bernardino, CA07, -116.634, 34.210, 6000, 49.5, M
BUTTERCUP CALIFORNIA, Imperial, CA07, -114.884, 32.740, 217, 70.1, M
BEAVER CAMP LOC CALIFORNIA, Amador, CA05, -120.325, 38.488, 5000, 48.4, M
BRAZIE RANCH CALIFORNIA, Siskiyou, CA01, -122.594, 41.685, 3000, 48.3, M
CAHUILLA CALIFORNIA, Imperial, CA07, -115.174, 32.974, 278, 70.7, M
CALLAHAN CALIFORNIA, Siskiyou, CA01, -122.796, 41.308, 3136, 47.1, M
CAMERON FIRE STATION CALIFORNI, San Diego, CA06, -116.463, 32.721, 3443, 50.7, M
CANBY CALIFORNIA, Modoc, CA02, -120.868, 41.434, 4312, 45.2, M
CARRIZO CALIFORNIA, San Luis Obispo, CA05, -119.773, 35.096, 2490, 53.2, M
CASE SPRINGS CALIFORNIA, San Diego, CA06, -117.418, 33.445, 2320, 53.0, M
CATHEYS VALLEY CALIFORNIA, Mariposa, CA05, -120.111, 37.468, 1200, 56.1, M
CEDAR GROVE CALIFORNIA, Fresno, CA05, -118.656, 36.788, 4720, 47.3, M
CHEESEBORO CALIFORNIA, Ventura, CA06, -118.717, 34.185, 1650, 57.0, M
CHICO CALIFORNIA, Butte, CA02, -121.779, 39.712, 230, 58.2, M
CHILAO CALIFORNIA, Los Angeles, CA06, -118.030, 34.332, 5450, 46.9, M
CHUCHUPATE CALIFORNIA, Ventura, CA05, -119.012, 34.808, 4900, 44.8, M
CLAREMONT CALIFORNIA, Los Angeles, CA06, -117.707, 34.137, 1645, 56.1, M
CLEAR CREEK CALIFORNIA, Los Angeles, CA06, -118.152, 34.271, 3000, 49.3, M
CLARK CALIFORNIA, Riverside, CA06, -117.309, 33.877, 1720, 57.4, M
CALAVERAS ROAD CALIFORNIA, Alameda, CA04, -121.844, 37.553, 1230, 53.2, M
CASE MOUNTAIN CALIFORNIA, Tulare, CA05, -118.809, 36.411, 6450, 42.7, M
CORONA CALIFORNIA, Riverside, CA06, -117.549, 33.874, 640, 60.6, M
COHASSET CALIFORNIA, Butte, CA02, -121.769, 39.872, 1733, 54.9, M
COLLINS BALDY CALIFORNIA, Siskiyou, CA01, -122.950, 41.775, 5493, 40.6, M
CONVERSE CALIFORNIA, San Bernardino, CA06, -116.913, 34.194, 5618, 46.1, M
COOSKIE MOUNTAIN CALIFORNIA, Humboldt, CA01, -124.266, 40.257, 2950, 53.1, M
COUNTY LINE CALIFORNIA, Lake, CA02, -122.412, 39.019, 2085, 53.9, M
CAMP 9 CALIFORNIA, Los Angeles, CA06, -118.422, 34.362, 4000, 47.8, M
CRANE FLAT LOOKOUT CALIFORNIA, Mariposa, CA05, -119.825, 37.762, 6644, 41.7, M
CRESTVIEW CALIFORNIA, Mono, CA07, -118.983, 37.745, 7600, 39.6, M
CORNING CALIFORNIA, Tehama, CA02, -122.170, 39.939, 294, 58.5, M
CARPENTER RIDGE CALIFORNIA, Butte, CA02, -121.582, 40.069, 4812, 43.3, M
CRANSTON CALIFORNIA, Riverside, CA06, -116.841, 33.740, 1950, 57.3, M
CRAZY PEAK CALIFORNIA, Del Norte, CA01, -123.604, 41.992, 3970, 44.5, M
CASHMAN CALIFORNIA, Plumas, CA02, -120.915, 40.002, 4520, 44.8, M
DESCANSO CALIFORNIA, San Diego, CA06, -116.622, 32.857, 3480, 51.3, M
DEVILS GARDEN CALIFORNIA, Modoc, CA02, -120.671, 41.530, 5022, 42.7, M
DIABLO GRANDE CALIFORNIA, Stanislaus, CA05, -121.294, 37.329, 1850, 53.3, M
DEMOCRAT CALIFORNIA, Kern, CA05, -118.630, 35.532, 2356, 54.2, M
DINKEY CALIFORNIA, Fresno, CA05, -119.039, 37.066, 5668, 40.8, M
DELNORTE CALIFORNIA, Santa Barbara, CA06, -119.654, 34.009, 800, 55.3, M
DOG VALLEY CALIFORNIA, Sierra, CA03, -120.048, 39.562, 5976, 42.6, M
DOYLE CALIFORNIA, Lassen, CA03, -120.106, 40.022, 4240, 48.6, M
DUNCAN CALIFORNIA, Placer, CA02, -120.509, 39.144, 7100, 38.1, M
DEL VALLE CALIFORNIA, Los Angeles, CA06, -118.683, 34.431, 1278, 56.4, M
DEVORE CALIFORNIA, San Bernardino, CA06, -117.404, 34.221, 2057, 55.4, M
EAGLE PEAK CALIFORNIA, Tehama, CA02, -122.657, 39.928, 3713, 48.3, M
EEL RIVER CAMP CALIFORNIA, Humboldt, CA01, -123.824, 40.138, 446, 54.3, M
EEL RIVER CALIFORNIA, Mendocino, CA01, -123.083, 39.833, 1500, 53.6, M
EL CARISO CALIFORNIA, Riverside, CA06, -117.411, 33.647, 3038, 55.0, M
MOUNT ELIZABETH CALIFORNIA, Tuolumne, CA05, -120.247, 38.063, 4933, 45.3, M
EL MIRAGE CALIFORNIA, San Bernardino, CA07, -117.550, 34.634, 2880, 55.6, M
FANCHER CREEK CALIFORNIA, Fresno, CA05, -119.466, 36.884, 920, 58.9, M
FAWNSKIN CALIFORNIA, San Bernardino, CA06, -116.899, 34.266, 6900, 41.9, M
FENCE MEADOW CALIFORNIA, Fresno, CA05, -119.175, 36.961, 5048, 44.9, M
FORT HUNTER LIGGET CALIFORNIA, Monterey, CA04, -121.242, 36.012, 1100, 54.0, M
FIGUEROA CALIFORNIA, Santa Barbara, CA06, -120.007, 34.733, 3200, 49.7, M
FISH CREEK MTN CALIFORNIA, Imperial, CA07, -116.067, 32.990, 760, 70.9, M
FIVE MILE CALIFORNIA, Inyo, CA07, -117.918, 35.872, 4150, 57.6, M
FORT ORD #1 CALIFORNIA, Monterey, CA04, -121.798, 36.627, 460, 54.0, M
FORT ORD #2 CALIFORNIA, Monterey, CA04, -121.786, 36.627, 490, 53.2, M
FORESTHILL CALIFORNIA, Placer, CA02, -120.732, 39.091, 4355, 47.5, M
FOUNTAIN SPRINGS CALIFORNIA, Tulare, CA05, -118.915, 35.892, 210, 56.7, M
FREMONT CANYON CALIFORNIA, Orange, CA06, -117.711, 33.808, 1781, 56.6, M
FRIEND MOUNTAIN CALIFORNIA, Trinity, CA01, -123.342, 40.505, 4000, 44.6, M
GASQUET CALIFORNIA, Del Norte, CA01, -123.979, 41.846, 500, 53.8, M
GRASSHOPPER CALIFORNIA, Lassen, CA03, -120.784, 40.782, 6158, 38.4, M
GOOSE VALLEY CALIFORNIA, San Diego, CA06, -116.846, 33.074, 1530, 56.0, M
GORDON CALIFORNIA, Lassen, CA03, -120.896, 40.759, 6200, 39.1, M
GREEN SPRING CALIFORNIA, Tuolumne, CA05, -120.500, 37.833, 1020, 56.4, M
GRIZZLY FLAT CALIFORNIA, El Dorado, CA05, -120.561, 38.620, 3740, 48.1, M
HASTINGS CALIFORNIA, Monterey, CA04, -121.552, 36.389, 1885, 51.1, M
HAWKEYE CALIFORNIA, Sonoma, CA01, -122.917, 38.782, 2000, 51.1, M
HAYFORK CALIFORNIA, Trinity, CA01, -123.165, 40.550, 2323, 50.4, M
HELL HOLE CALIFORNIA, Placer, CA02, -120.422, 39.072, 5240, 44.5, M
HERNANDEZ CALIFORNIA, San Benito, CA04, -120.856, 36.383, 3733, 48.1, M
HIGH SIERRA CALIFORNIA, Fresno, CA05, -119.038, 37.315, 7403, 39.2, M
HOPLAND CALIFORNIA, Mendocino, CA01, -123.081, 39.031, 2682, 49.8, M
HOLLISTER CALIFORNIA, San Benito, CA04, -121.362, 36.842, 404, 56.1, M
HUNTER MOUNTAIN CALIFORNIA, Inyo, CA07, -117.474, 36.563, 6880, 44.3, M
HORSE LAKE CALIFORNIA, Lassen, CA03, -120.503, 40.631, 5100, 43.0, M
HOOPA CALIFORNIA, Humboldt, CA01, -123.671, 41.048, 375, 55.1, M
HORSE THIEF SPRINGS CALIFORNIA, San Bernardino, CA07, -115.909, 35.771, 5000, 54.2, M
HURLEY CALIFORNIA, Fresno, CA05, -119.568, 37.015, 1201, 55.0, M
INDIAN WELL CALIFORNIA, Siskiyou, CA01, -121.538, 41.742, 4770, 44.3, M
JARBO GAP CALIFORNIA, Butte, CA02, -121.489, 39.736, 2490, 52.7, M
JERSEYDALE CALIFORNIA, Mariposa, CA05, -119.839, 37.544, 3900, 48.9, M
JOHNSONDALE CALIFORNIA, Tulare, CA05, -118.545, 35.972, 4700, 46.8, M
JULIAN CALIFORNIA, San Diego, CA07, -116.591, 33.076, 4240, 49.7, M
JUNIPER CREEK CALIFORNIA, Modoc, CA02, -120.472, 41.332, 4372, 44.3, M
KEENWILD CALIFORNIA, Riverside, CA06, -116.767, 33.667, 4920, 49.1, M
KETTLEMAN HILLS CALIFORNIA, Kings, CA05, -120.057, 36.033, 810, 59.5, M
KNOXVILLE CREEK CALIFORNIA, Lake, CA02, -122.417, 38.862, 2200, 52.2, M
KONOCTI CALIFORNIA, Lake, CA02, -122.706, 38.912, 2163, 53.3, M
LOS BANOS CALIFORNIA, Merced, CA05, -121.053, 37.055, 350, 58.0, M
MT. LAGUNA CALIFORNIA, San Diego, CA07, -116.420, 32.880, 5760, 46.4, M
LA HONDA CALIFORNIA, San Mateo, CA04, -122.255, 37.305, 872, 51.4, M
LA PANZA CALIFORNIA, San Luis Obispo, CA04, -120.187, 35.381, 1630, 51.9, M
LAURAL MOUNTAIN CALIFORNIA, Kern, CA07, -117.699, 35.478, 4390, 53.5, M
LASSEN LODGE CALIFORNIA, Tehama, CA02, -121.714, 40.344, 4159, 46.6, M
LAUFMAN CALIFORNIA, Lassen, CA03, -120.353, 40.142, 5800, 45.8, M
LAYTONVILLE CALIFORNIA, Mendocino, CA01, -123.485, 39.702, 1820, 52.2, M
LADDER BUTTE CALIFORNIA, Lassen, CA02, -121.297, 40.807, 5750, 41.2, M
LEO CARRILLO CALIFORNIA, Los Angeles, CA06, -118.936, 34.046, 50, 57.6, M
LOS GATOS CALIFORNIA, Santa Clara, CA04, -121.943, 37.203, 2000, 53.1, M
LOST HORSE CALIFORNIA, Riverside, CA07, -116.188, 34.018, 4200, 53.9, M
LINCOLN CALIFORNIA, Placer, CA02, -121.268, 38.883, 200, 58.3, M
LOWER KLAMATH CALIFORNIA, Siskiyou, CA01, -121.700, 41.999, 4098, 44.8, M
LOS PRIETOS CALIFORNIA, Santa Barbara, CA06, -119.783, 34.536, 1020, 56.6, M
LAS FLORES CALIFORNIA, San Diego, CA06, -117.439, 33.289, 100, 59.0, M
LAS TABLAS CALIFORNIA, San Luis Obispo, CA04, -120.924, 35.656, 994, 52.7, M
LITTLE TUJUNGA CALIFORNIA, Los Angeles, CA06, -118.361, 34.294, 1390, 55.2, M
CAMPO ASOS, San Diego, CA07, -116.468, 32.626, 2641, 51.5, 0.07
Burbank Glendale Pasadena Area, -, -, -, -, -, 58.9, 1.83
Camarillo Area, -, -, -, -, -, 56.8, 2.79
Needles Area, -, -, -, -, -, 73.6, 0.02
Oxnard Area, -, -, -, -, -, 57.9, 3.22
Palm Springs Area, -, -, -, -, -, 68.8, 0.08
Riverside Area, -, -, -, -, -, 60.1, 0.71
Ramona Area, -, -, -, -, -, 54.4, 1.73
Northern CA 8 Station Index, -, -, -, -, -, M, 12.04
San Joaquin 5 Station Index, -, -, -, -, -, M, 10.78
SANTA ROSA ISLAND CALIFORNIA, Santa Barbara, CA06, -120.078, 33.978, 1298, 52.1, M
SANTA ROSA PLATEAU CALIFORNIA, Riverside, CA06, -117.231, 33.529, 1980, 55.9, M
SANTA ROSA CALIFORNIA, Sonoma, CA01, -122.712, 38.479, 576, 54.8, M
STAMPEDE CALIFORNIA, Sierra, CA03, -120.075, 39.483, 6867, 41.2, M
STONYFORD CALIFORNIA, Colusa, CA02, -122.575, 39.367, 1200, 54.0, M
SUGARLOAF (SHF) CALIFORNIA, Shasta, CA02, -122.438, 40.917, 4200, 48.4, M
SPRING VALLEY CALIFORNIA, San Mateo, CA04, -122.436, 37.563, 1075, 51.0, M
TALEGA CALIFORNIA, San Diego, CA06, -117.486, 33.478, 1203, 58.1, M
TANBARK CALIFORNIA, Los Angeles, CA06, -117.761, 34.207, 2600, 53.1, M
TARGET RANGE CALIFORNIA, San Diego, CA06, -117.359, 33.372, 918, 57.8, M
TEMESCAL (LPF) CALIFORNIA, Ventura, CA06, -118.756, 34.481, 1140, 56.0, M
THOMES CREEK CALIFORNIA, Tehama, CA02, -122.610, 39.864, 1040, 57.0, M
THOUSAND OAKS CALIFORNIA, Ventura, CA06, -118.870, 34.210, 795, 55.6, M
TIMBER MOUNTAIN CALIFORNIA, Modoc, CA01, -121.298, 41.629, 4960, 43.0, M
TEMESCAL (CNF) CALIFORNIA, Riverside, CA06, -117.483, 33.763, 1125, 59.1, M
LAS TRAMPAS CALIFORNIA, Contra Costa, CA04, -122.067, 37.834, 1760, 51.6, M
TRINITY CAMP CALIFORNIA, Trinity, CA01, -122.804, 40.786, 3308, 63.0, M
TRIMMER CALIFORNIA, Fresno, CA05, -119.305, 36.911, 1540, 55.5, M
GAYLOR MEADOW CALIFORNIA, Tuolumne, CA05, -119.318, 37.868, 9270, 32.7, M
UHL / HOT SPRINGS, Tulare, CA05, -118.633, 35.889, 3720, 48.6, M
UNDERWOOD CALIFORNIA, Trinity, CA01, -123.495, 40.722, 2600, 51.0, M
VALLEY CENTER CALIFORNIA, San Diego, CA06, -117.009, 33.237, 1483, 61.8, M
VAN BREMMER CALIFORNIA, Siskiyou, CA01, -121.794, 41.643, 4928, 42.3, M
VALYERMO CALIFORNIA, Los Angeles, CA07, -117.851, 34.446, 3780, 52.8, M
VANDENBERG CALIFORNIA, Santa Barbara, CA06, -120.486, 34.759, 1050, 53.6, M
WALKER CALIFORNIA, Mono, CA03, -119.459, 38.565, 5440, 48.5, M
WALKER PASS CALIFORNIA, Kern, CA05, -118.057, 35.665, 5572, 50.3, M
WARM SPRINGS CALIFORNIA, Los Angeles, CA06, -118.579, 34.596, 4930, 49.2, M
WEED AIRPORT CALIFORNIA, Siskiyou, CA01, -122.454, 41.479, 2930, 48.5, M
WESTWOOD CALIFORNIA, Lassen, CA02, -120.900, 40.307, 5800, 38.7, M
WHITE CLOUD CALIFORNIA, Nevada, CA02, -120.837, 39.317, 4320, 47.7, M
WHITTIER HILLS CALIFORNIA, Los Angeles, CA06, -118.010, 33.984, 950, 58.8, M
WHITMORE CALIFORNIA, Shasta, CA02, -121.899, 40.619, 2417, 51.6, M
WILEY RIDGE CALIFORNIA, Ventura, CA06, -118.841, 34.372, 1645, 55.0, M
WOFFORD HEIGHTS CALIFORNIA, Kern, CA05, -118.499, 35.722, 3150, 53.5, M
WOLVERTON CALIFORNIA, Tulare, CA05, -118.703, 36.445, 5240, 48.2, M
WOODACRE CALIFORNIA, Marin, CA01, -122.645, 37.991, 1400, 53.2, M
WHITAKER PEAK CALIFORNIA, Los Angeles, CA06, -118.740, 34.569, 4120, 49.8, M
WHITE WOLF CALIFORNIA, Tuolumne, CA05, -119.650, 37.851, 8025, 36.8, M
YOLLA BOLLA CALIFORNIA, Trinity, CA01, -123.066, 40.338, 4524, 44.8, M
YUCCA VALLEY CALIFORNIA, San Bernardino, CA07, -116.408, 34.123, 3260, 56.0, M
YUROK CALIFORNIA, Humboldt, CA01, -123.857, 41.290, 495, 53.4, M
HAGAN'S MEADOW, El Dorado, CA03, -119.940, 38.850, 7776, 37.1, 4.40
BLUE LAKES, Alpine, CA05, -119.920, 38.610, 8057, 34.9, 11.50
POISON FLAT, Alpine, CA03, -119.630, 38.510, 7736, 36.4, 4.80
SONORA PASS, Mono, CA03, -119.600, 38.310, 8827, 35.2, 5.50
LEAVITT MEADOWS, Mono, CA03, -119.550, 38.300, 7198, 40.4, 5.20
VIRGINIA LAKES RIDGE, Mono, CA03, -119.230, 38.070, 9445, 34.6, 1.60
LOBDELL LAKE, Mono, CA03, -119.370, 38.440, 9233, 33.7, 3.80
EBBETTS PASS, Alpine, CA03, -119.800, 38.550, 8765, 35.0, 11.40
HEAVENLY VALLEY, El Dorado, CA03, -119.920, 38.920, 8582, 35.1, 5.50
LEAVITT LAKE, Mono, CA03, -119.610, 38.280, 9617, 32.8, 9.30
SPRATT CREEK, Alpine, CA03, -119.820, 38.670, 6115, 42.6, 4.70
MONITOR PASS, Alpine, CA03, -119.610, 38.670, 8310, 37.3, 3.20
BURNSIDE LAKE, Alpine, CA03, -119.890, 38.720, 8129, 33.9, 7.40
SUMMIT MEADOW, Mono, CA03, -119.540, 38.400, 9313, 33.1, 3.30
FORESTDALE CREEK, Alpine, CA03, -119.960, 38.680, 8017, 37.2, 13.40
HORSE MEADOW, Alpine, CA03, -119.890, 38.840, 8557, 35.0, 3.90
CARSON PASS, Alpine, CA02, -119.990, 38.690, 8353, 35.8, 9.10
CROWDER FLAT, Modoc, CA01, -120.750, 41.890, 5170, 41.4, 2.80
CEDAR PASS, Modoc, CA02, -120.300, 41.580, 7030, 36.5, 4.80
DISMAL SWAMP, Modoc, CA03, -120.180, 41.990, 7360, 33.9, 8.50
Crescent City Area, -, -, -, -, -, 50.2, 5.48
Escondido Area, -, -, -, -, -, 60.0, 2.06
Sacramento Downtown Area, -, -, -, -, -, 59.6, 3.42
Tahoe City Area, -, -, -, -, -, 38.2, 6.23
Ukiah Area, -, -, -, -, -, 54.7, 7.63
ADIN MTN, Modoc, CA02, -120.790, 41.240, 6190, 39.2, 6.00
INDEPENDENCE CREEK, Sierra, CA03, -120.280, 39.490, 6456, 39.9, 6.20
INDEPENDENCE CAMP, Sierra, CA03, -120.290, 39.450, 7003, 37.3, 6.50
INDEPENDENCE LAKE, Nevada, CA03, -120.310, 39.430, 8352, 34.9, 12.40
TRUCKEE #2, Placer, CA03, -120.180, 39.300, 6509, 41.2, 7.40
WARD CREEK #3, Placer, CA03, -120.220, 39.140, 6655, 39.6, 8.20
TAHOE CITY CROSS, Placer, CA03, -120.150, 39.170, 6797, 39.8, 6.50
SQUAW VALLEY G.C., Placer, CA03, -120.260, 39.190, 8029, 35.7, 12.40
CSS LAB, Nevada, CA02, -120.370, 39.330, 6855, 37.8, 17.00
RUBICON #2, El Dorado, CA03, -120.130, 39.000, 7689, 37.7, 8.20
ECHO PEAK, El Dorado, CA03, -120.080, 38.850, 7670, 36.8, 9.10
FALLEN LEAF, El Dorado, CA03, -120.050, 38.930, 6236, 40.1, 4.00
BEAR VALLEY F.D., Kern, CA01, -118.644, 35.166, 4100, 45.6, 0.61
Alturas Area, -, -, -, -, -, 43.8, 1.85
Mount Shasta Area, -, -, -, -, -, 46.0, 6.18
Palmdale Area, -, -, -, -, -, 55.7, 0.74
Lancaster Area, -, -, -, -, -, 55.9, 0.68
El Cajon Area, -, -, -, -, -, 62.6, 1.90
Hanford Area, -, -, -, -, -, 59.3, 3.00
El Centro Area, -, -, -, -, -, 69.2, T
Madera Area, -, -, -, -, -, 58.3, 1.73
Merced Area, -, -, -, -, -, 58.2, 2.47
San Jose Area, -, -, -, -, -, 56.8, 2.14
LIVERMORE CALIFORNIA, Alameda, CA04, -121.814, 37.712, 800, 55.4, M
LYONS VALLEY CALIFORNIA, Lake, CA01, -123.074, 39.126, 3200, 47.7, M
LYTLE CREEK CALIFORNIA, San Bernardino, CA06, -117.480, 34.234, 2792, 53.8, M
MAD RIVER CALIFORNIA, Trinity, CA01, -123.524, 40.463, 2775, 47.8, M
MALIBU HILLS CALIFORNIA, Los Angeles, CA06, -118.633, 34.058, 1575, 55.8, M
MANZANITA LAKE CALIFORNIA, Shasta, CA02, -121.580, 40.540, 5660, 40.6, M
MARIPOSA GROVE CALIFORNIA, Mariposa, CA05, -119.605, 37.513, 6400, 42.3, M
MILL CREEK (BDF) CALIFORNIA, San Bernardino, CA06, -117.035, 34.084, 2950, 54.1, M
MCGUIRES CALIFORNIA, Mendocino, CA01, -123.601, 39.353, 593, 51.5, M
MEANS LAKE CALIFORNIA, San Bernardino, CA07, -116.517, 34.391, 2900, 60.6, M
METCALF GAP CALIFORNIA, Madera, CA05, -119.768, 37.409, 3077, 53.7, M
MEYERS CALIFORNIA, El Dorado, CA03, -120.018, 38.849, 6310, 39.9, M
MID HILLS CALIFORNIA, San Bernardino, CA07, -115.411, 35.123, 5413, 51.6, M
MILL CREEK (ANF) CALIFORNIA, Los Angeles, CA06, -118.082, 34.390, 5021, 47.2, M
MILO CALIFORNIA, Tulare, CA05, -118.869, 36.231, 1923, 56.1, M
MALLORY RIDGE CALIFORNIA, Contra Costa, CA05, -121.779, 37.817, 2040, 51.6, M
MONTECITO CALIFORNIA, Santa Barbara, CA06, -119.648, 34.461, 1500, 54.9, M
MODOC NWR CALIFORNIA, Modoc, CA02, -120.354, 41.459, 4380, 45.1, M
MOJAVE RIVER SINK CALIFORNIA, San Bernardino, CA07, -116.079, 35.053, 950, 67.4, M
MORMON ROCK CALIFORNIA, San Bernardino, CA06, -117.502, 34.318, 3300, 52.4, M
MOUNTAIN REST CALIFORNIA, Fresno, CA05, -119.371, 37.054, 4100, 48.1, M
MARKLEEVILLE CALIFORNIA, Alpine, CA03, -119.767, 38.683, 5501, 44.3, M
MT. SHASTA CALIFORNIA, Siskiyou, CA02, -122.316, 41.316, -, 46.4, M
