OAK GROVE CALIFORNIA, San Diego, CA06, -116.795, 33.393, 2752, 49.5, M
OAKLAND NORTH CALIFORNIA, Contra Costa, CA04, -122.221, 37.865, 1403, 46.5, M
OAK OPENING CALIFORNIA, Tulare, CA05, -118.702, 36.175, 3240, 44.1, M
OPAL MOUNTAIN CALIFORNIA, San Bernardino, CA07, -117.176, 35.154, 3240, 45.6, M
OWENS CAMP LOC CALIFORNIA, El Dorado, CA02, -120.245, 38.733, 5240, 37.7, M
OWENS VALLEY CALIFORNIA, Inyo, CA07, -118.551, 37.390, 4640, 38.7, M
OZENA CALIFORNIA, Ventura, CA06, -119.354, 34.682, 3670, 44.9, M
PANAMINT CALIFORNIA, Inyo, CA07, -117.088, 36.120, 6880, 37.6, M
PARKFIELD CALIFORNIA, Monterey, CA04, -120.432, 35.899, 1535, 44.2, M
PATTY MOCUS CALIFORNIA, Tehama, CA02, -122.867, 40.295, 3500, 40.6, M
PINE HILLS CALIFORNIA, San Diego, CA06, -116.634, 33.016, -, 46.7, M
PIERCE CALIFORNIA, Plumas, CA02, -120.642, 40.246, 5700, 33.2, M
PINEHURST CALIFORNIA, Fresno, CA05, -119.000, 36.685, 4060, 42.8, M
PIKE COUNTY LOOKOUT CALIFORNIA, Yuba, CA02, -121.202, 39.475, 3714, 42.1, M
PILOT HILL CALIFORNIA, El Dorado, CA02, -121.009, 38.833, 1200, 42.5, M
PIRU CALIFORNIA, Ventura, CA06, -118.810, 34.404, 614, 52.9, M
PARK RIDGE CALIFORNIA, Tulare, CA05, -118.942, 36.724, 7540, 39.3, M
PINNACLES CALIFORNIA, San Benito, CA04, -121.147, 36.471, 1322, 48.0, M
POPPY PARK CALIFORNIA, Los Angeles, CA07, -118.383, 34.733, 2760, 43.9, M
POTRERO CALIFORNIA, San Diego, CA06, -116.609, 32.606, 2345, 49.9, M
POVERTY CALIFORNIA, Santa Clara, CA04, -121.771, 37.443, 2066, 45.7, M
PANOCHE ROAD CALIFORNIA, Fresno, CA05, -120.766, 36.727, 2032, 45.0, M
PULGAS CALIFORNIA, San Mateo, CA04, -122.298, 37.475, 644, 49.6, M
QUARTZ HILL CALIFORNIA, Siskiyou, CA01, -122.934, 41.599, 4225, 35.2, M
QUINCY RD CALIFORNIA, Plumas, CA02, -120.942, 39.973, 3500, 35.0, M
RAVENDALE CALIFORNIA, Lassen, CA03, -120.316, 40.731, 5298, 28.3, M
RANCHITA CALIFORNIA, San Diego, CA07, -116.497, 33.222, 4415, 44.0, M
READER RANCH CALIFORNIA, Nevada, CA02, -121.117, 39.304, 1968, 44.7, M
REDDING AIRPORT CALIFORNIA, Shasta, CA02, -122.291, 40.516, 500, 43.0, M
RICE VALLEY CALIFORNIA, Riverside, CA07, -114.732, 34.061, 820, 51.5, M
ROCK CREEK, Mono, CA07, -118.667, 37.551, 7040, 31.4, M
JUANITA LAKE CALIFORNIA, Siskiyou, CA01, -122.006, 41.786, 5400, 32.5, M
JULIAN CALIFORNIA, San Diego, CA07, -116.591, 33.076, 4240, 43.0, M
JUNIPER CREEK CALIFORNIA, Modoc, CA02, -120.472, 41.332, 4372, 30.6, M
KEENWILD CALIFORNIA, Riverside, CA06, -116.767, 33.667, 4920, 44.6, M
KETTLEMAN HILLS CALIFORNIA, Kings, CA05, -120.057, 36.033, 810, 45.5, M
KNOXVILLE CREEK CALIFORNIA, Lake, CA02, -122.417, 38.862, 2200, 43.9, M
KONOCTI CALIFORNIA, Lake, CA02, -122.706, 38.912, 2163, 44.8, M
LOS BANOS CALIFORNIA, Merced, CA05, -121.053, 37.055, 350, 46.0, M
MT. LAGUNA CALIFORNIA, San Diego, CA07, -116.420, 32.880, 5760, 39.7, M
LA HONDA CALIFORNIA, San Mateo, CA04, -122.255, 37.305, 872, 46.9, M
LA PANZA CALIFORNIA, San Luis Obispo, CA04, -120.187, 35.381, 1630, 42.7, M
LAURAL MOUNTAIN CALIFORNIA, Kern, CA07, -117.699, 35.478, 4390, 42.7, M
LASSEN LODGE CALIFORNIA, Tehama, CA02, -121.714, 40.344, 4159, 40.6, M
LAUFMAN CALIFORNIA, Lassen, CA03, -120.353, 40.142, 5800, 32.9, M
LAYTONVILLE CALIFORNIA, Mendocino, CA01, -123.485, 39.702, 1820, 41.5, M
LADDER BUTTE CALIFORNIA, Lassen, CA02, -121.297, 40.807, 5750, 33.4, M
LEO CARRILLO CALIFORNIA, Los Angeles, CA06, -118.936, 34.046, 50, 55.9, M
LOS GATOS CALIFORNIA, Santa Clara, CA04, -121.943, 37.203, 2000, 48.4, M
LOST HORSE CALIFORNIA, Riverside, CA07, -116.188, 34.018, 4200, 42.4, M
LINCOLN CALIFORNIA, Placer, CA02, -121.268, 38.883, 200, 43.6, M
LOWER KLAMATH CALIFORNIA, Siskiyou, CA01, -121.700, 41.999, 4098, 28.0, M
LOS PRIETOS CALIFORNIA, Santa Barbara, CA06, -119.783, 34.536, 1020, 49.5, M
LAS FLORES CALIFORNIA, San Diego, CA06, -117.439, 33.289, 100, 56.0, M
LAS TABLAS CALIFORNIA, San Luis Obispo, CA04, -120.924, 35.656, 994, 44.5, M
LITTLE TUJUNGA CALIFORNIA, Los Angeles, CA06, -118.361, 34.294, 1390, 54.3, M
Alturas Area, -, -, -, -, -, 26.2, 1.45
Mount Shasta Area, -, -, -, -, -, 32.1, 1.61
Palmdale Area, -, -, -, -, -, 43.2, 1.43
Lancaster Area, -, -, -, -, -, 43.2, 0.92
SANTA ROSA ISLAND CALIFORNIA, Santa Barbara, CA06, -120.078, 33.978, 1298, 51.3, M
SANTA ROSA PLATEAU CALIFORNIA, Riverside, CA06, -117.231, 33.529, 1980, 51.7, M
SANTA ROSA CALIFORNIA, Sonoma, CA01, -122.712, 38.479, 576, 46.0, M
STAMPEDE CALIFORNIA, Sierra, CA03, -120.075, 39.483, 6867, 31.2, M
STONYFORD CALIFORNIA, Colusa, CA02, -122.575, 39.367, 1200, 43.0, M
SUGARLOAF (SHF) CALIFORNIA, Shasta, CA02, -122.438, 40.917, 4200, 40.9, M
TALEGA CALIFORNIA, San Diego, CA06, -117.486, 33.478, 1203, 55.9, M
TANBARK CALIFORNIA, Los Angeles, CA06, -117.761, 34.207, 2600, 50.6, M
TARGET RANGE CALIFORNIA, San Diego, CA06, -117.359, 33.372, 918, 55.8, M
TEMESCAL (LPF) CALIFORNIA, Ventura, CA06, -118.756, 34.481, 1140, 52.6, M
THOMES CREEK CALIFORNIA, Tehama, CA02, -122.610, 39.864, 1040, 45.3, M
THOUSAND OAKS CALIFORNIA, Ventura, CA06, -118.870, 34.210, 795, 51.6, M
TIMBER MOUNTAIN CALIFORNIA, Modoc, CA01, -121.298, 41.629, 4960, 31.0, M
TEMESCAL (CNF) CALIFORNIA, Riverside, CA06, -117.483, 33.763, 1125, 53.6, M
MOUNT TOM CALIFORNIA, Fresno, CA05, -119.178, 37.376, 9018, 33.8, M
LAS TRAMPAS CALIFORNIA, Contra Costa, CA04, -122.067, 37.834, 1760, 44.2, M
TRINITY CAMP CALIFORNIA, Trinity, CA01, -122.804, 40.786, 3308, 36.1, M
TRIMMER CALIFORNIA, Fresno, CA05, -119.305, 36.911, 1540, 44.8, M
GAYLOR MEADOW CALIFORNIA, Tuolumne, CA05, -119.318, 37.868, 9270, 24.6, M
UHL / HOT SPRINGS, Tulare, CA05, -118.633, 35.889, 3720, 43.2, M
UNDERWOOD CALIFORNIA, Trinity, CA01, -123.495, 40.722, 2600, 38.3, M
VALLEY CENTER CALIFORNIA, San Diego, CA06, -117.009, 33.237, 1483, 52.6, M
VAN BREMMER CALIFORNIA, Siskiyou, CA01, -121.794, 41.643, 4928, 32.7, M
VALYERMO CALIFORNIA, Los Angeles, CA07, -117.851, 34.446, 3780, 42.7, M
VANDENBERG CALIFORNIA, Santa Barbara, CA06, -120.486, 34.759, 1050, 52.0, M
WALKER CALIFORNIA, Mono, CA03, -119.459, 38.565, 5440, 36.0, M
WALKER PASS CALIFORNIA, Kern, CA05, -118.057, 35.665, 5572, 41.0, M
WARM SPRINGS CALIFORNIA, Los Angeles, CA06, -118.579, 34.596, 4930, 44.4, M
WEED AIRPORT CALIFORNIA, Siskiyou, CA01, -122.454, 41.479, 2930, 33.6, M
WESTWOOD CALIFORNIA, Lassen, CA02, -120.900, 40.307, 5800, 31.8, M
WHITE CLOUD CALIFORNIA, Nevada, CA02, -120.837, 39.317, 4320, 42.3, M
WHITTIER HILLS CALIFORNIA, Los Angeles, CA06, -118.010, 33.984, 950, 55.9, M
WHITMORE CALIFORNIA, Shasta, CA02, -121.899, 40.619, 2417, 42.0, M
WILEY RIDGE CALIFORNIA, Ventura, CA06, -118.841, 34.372, 1645, 52.4, M
WOFFORD HEIGHTS CALIFORNIA, Kern, CA05, -118.499, 35.722, 3150, 43.7, M
WOLVERTON CALIFORNIA, Tulare, CA05, -118.703, 36.445, 5240, 43.5, M
WOODACRE CALIFORNIA, Marin, CA01, -122.645, 37.991, 1400, 46.3, M
WHITAKER PEAK CALIFORNIA, Los Angeles, CA06, -118.740, 34.569, 4120, 46.0, M
WHITE WOLF CALIFORNIA, Tuolumne, CA05, -119.650, 37.851, 8025, 32.0, M
YOLLA BOLLA CALIFORNIA, Trinity, CA01, -123.066, 40.338, 4524, 37.5, M
YUCCA VALLEY CALIFORNIA, San Bernardino, CA07, -116.408, 34.123, 3260, 43.8, M
YUROK CALIFORNIA, Humboldt, CA01, -123.857, 41.290, 495, 42.7, M
HAGAN'S MEADOW, El Dorado, CA03, -119.940, 38.850, 7776, 28.9, 4.90
BLUE LAKES, Alpine, CA05, -119.920, 38.610, 8057, 27.0, 6.40
POISON FLAT, Alpine, CA03, -119.630, 38.510, 7736, 28.4, 5.00
SONORA PASS, Mono, CA03, -119.600, 38.310, 8827, 28.6, 4.90
LEAVITT MEADOWS, Mono, CA03, -119.550, 38.300, 7198, 31.1, 3.70
VIRGINIA LAKES RIDGE, Mono, CA03, -119.230, 38.070, 9445, 29.0, 3.00
LOBDELL LAKE, Mono, CA03, -119.370, 38.440, 9233, 26.6, 3.00
EBBETTS PASS, Alpine, CA03, -119.800, 38.550, 8765, 29.3, 9.00
HEAVENLY VALLEY, El Dorado, CA03, -119.920, 38.920, 8582, 28.0, 6.10
LEAVITT LAKE, Mono, CA03, -119.610, 38.280, 9617, 28.0, 8.20
SPRATT CREEK, Alpine, CA03, -119.820, 38.670, 6115, 33.1, 4.00
MONITOR PASS, Alpine, CA03, -119.610, 38.670, 8310, 30.3, 3.80
BURNSIDE LAKE, Alpine, CA03, -119.890, 38.720, 8129, 26.2, 7.00
SUMMIT MEADOW, Mono, CA03, -119.540, 38.400, 9313, 29.0, 3.60
FORESTDALE CREEK, Alpine, CA03, -119.960, 38.680, 8017, 31.0, 7.90
HORSE MEADOW, Alpine, CA03, -119.890, 38.840, 8557, 30.3, 4.60
CARSON PASS, Alpine, CA02, -119.990, 38.690, 8353, 28.4, 5.40
CROWDER FLAT, Modoc, CA01, -120.750, 41.890, 5170, 28.7, 2.50
CEDAR PASS, Modoc, CA02, -120.300, 41.580, 7030, 27.8, 5.10
DISMAL SWAMP, Modoc, CA03, -120.180, 41.990, 7360, 25.4, 7.80
El Cajon Area, -, -, -, -, -, 56.0, 5.38
Hanford Area, -, -, -, -, -, 43.2, 1.39
El Centro Area, -, -, -, -, -, 55.2, 0.98
Madera Area, -, -, -, -, -, 43.7, 1.17
Merced Area, -, -, -, -, -, 44.2, 1.31
Crescent City Area, -, -, -, -, -, 44.3, 13.44
Escondido Area, -, -, -, -, -, M, M
Sacramento Downtown Area, -, -, -, -, -, 45.3, 1.75
Tahoe City Area, -, -, -, -, -, 28.5, 4.58
Ukiah Area, -, -, -, -, -, 43.4, 3.37
San Jose Area, -, -, -, -, -, 48.1, 1.53
RODEO VALLEY, Mendocino, CA01, -123.321, 39.668, 2428, 41.0, M
ROSE VALLEY CALIFORNIA, Ventura, CA06, -119.184, 34.543, 3331, 42.5, M
ROUND MOUNTAIN, Siskiyou, CA02, -121.464, 41.427, 5258, 29.6, M
ROSE PEAK CALIFORNIA, Alameda, CA04, -121.735, 37.502, 3060, 43.8, M
RUSH CREEK CALIFORNIA, Modoc, CA02, -120.864, 41.294, 4800, 32.2, M
RUTH CALIFORNIA, Trinity, CA01, -123.316, 40.251, 2732, 38.1, M
SACRAMENTO NWR CALIFORNIA, Glenn, CA02, -122.182, 39.417, 120, 44.2, M
SADDLEBACK BUTTE CALIFORNIA, Los Angeles, CA07, -117.821, 34.685, 2590, 43.2, M
SAUGUS CALIFORNIA, Los Angeles, CA06, -118.525, 34.425, 1450, 52.8, M
SAWYERS BAR CALIFORNIA, Siskiyou, CA01, -123.132, 41.300, 2192, 37.9, M
SANTA BARBARA ISLAND CALIFORNI, Santa Barbara, CA06, -119.033, 33.483, 176, 55.5, M
SANTA CRUZ ISLAND CALIFORNIA, Santa Barbara, CA06, -119.722, 33.996, 250, 53.5, M
SCORPION CALIFORNIA, Trinity, CA01, -122.697, 41.112, 4400, 37.5, M
SADDLEBACK CALIFORNIA, Sierra, CA02, -120.865, 39.638, 6670, 35.6, M
SECRET TOWN CALIFORNIA, Nevada, CA02, -120.885, 39.184, 2826, 44.2, M
SANTA FE DAM CALIFORNIA, Los Angeles, CA06, -117.946, 34.121, 500, 56.0, M
SHAVER CALIFORNIA, Fresno, CA05, -119.256, 37.135, 5746, 34.3, M
SCHOOL HOUSE CALIFORNIA, Humboldt, CA01, -123.906, 41.138, 2640, 40.0, M
SHIP MTN. CALIFORNIA, Del Norte, CA01, -123.792, 41.736, 5300, 35.5, M
SHADEQUARTER CALIFORNIA, Tulare, CA05, -118.956, 36.567, 4069, 42.1, M
SIMS CALIFORNIA, Shasta, CA02, -122.373, 41.075, 2400, 39.1, M
SIMI VALLEY CALIFORNIA, Ventura, CA06, -118.814, 34.291, 914, 53.6, M
SLATER BUTTE CALIFORNIA, Siskiyou, CA01, -123.352, 41.859, 4670, 37.7, M
SAN MIGUEL CALIFORNIA, San Diego, CA06, -116.974, 32.685, 425, 56.5, M
SAN LUIS NWR CALIFORNIA, Merced, CA05, -120.794, 37.182, 65, 44.4, M
SANTA RITA CALIFORNIA, San Benito, CA05, -120.598, 36.348, 5000, 42.5, M
SOLDIER MOUNTAIN CALIFORNIA, Shasta, CA02, -121.586, 40.926, 3710, 36.5, M
SOMES BAR CALIFORNIA, Siskiyou, CA01, -123.496, 41.390, 920, 40.7, M
SQUAW SPRINGS CALIFORNIA, San Bernardino, CA07, -117.568, 35.370, 3620, 45.2, M
SQUAW LAKE CALIFORNIA, Imperial, CA07, -114.494, 32.908, 300, 56.7, M
ADIN MTN, Modoc, CA02, -120.790, 41.240, 6190, 27.9, 4.80
INDEPENDENCE CREEK, Sierra, CA03, -120.280, 39.490, 6456, 29.1, 4.50
INDEPENDENCE CAMP, Sierra, CA03, -120.290, 39.450, 7003, 31.1, 3.80
INDEPENDENCE LAKE, Nevada, CA03, -120.310, 39.430, 8352, 28.9, 6.60
TRUCKEE #2, Placer, CA03, -120.180, 39.300, 6509, 31.9, 5.70
WARD CREEK #3, Placer, CA03, -120.220, 39.140, 6655, 31.3, 11.60
TAHOE CITY CROSS, Placer, CA03, -120.150, 39.170, 6797, 33.1, 7.00
SQUAW VALLEY G.C., Placer, CA03, -120.260, 39.190, 8029, 30.4, 11.00
CSS LAB, Nevada, CA02, -120.370, 39.330, 6855, 31.8, 10.40
RUBICON #2, El Dorado, CA03, -120.130, 39.000, 7689, 31.4, 6.90
ECHO PEAK, El Dorado, CA03, -120.080, 38.850, 7670, 32.2, 10.60
FALLEN LEAF, El Dorado, CA03, -120.050, 38.930, 6236, 31.0, 4.90
CAMPO ASOS, San Diego, CA07, -116.468, 32.626, 2641, 46.0, 4.63
Burbank Glendale Pasadena Area, -, -, -, -, -, 53.1, 2.18
Camarillo Area, -, -, -, -, -, 51.8, 1.45
Needles Area, -, -, -, -, -, 51.7, 1.12
Oxnard Area, -, -, -, -, -, 53.3, 2.14
Palm Springs Area, -, -, -, -, -, 55.0, 2.53
Riverside Area, -, -, -, -, -, 54.0, 0.00
Ramona Area, -, -, -, -, -, 49.5, 4.99
Northern CA 8 Station Index, -, -, -, -, -, M, 6.08
San Joaquin 5 Station Index, -, -, -, -, -, M, 6.60
LEE VINING 5.9 NW, Mono, CA03, -119.170, 38.034, 7094, M, 1.27
MARIPOSA 3.7 NNW, Mariposa, CA05, -119.988, 37.540, 2942, M, 3.79
WOODACRE 0.6 SW, Marin, CA01, -122.635, 38.005, 439, M, 4.22
SAN ANSELMO 1.2 NNW, Marin, CA01, -122.580, 37.997, 370, M, 3.86
NOVATO 4.8 WNW, Marin, CA01, -122.644, 38.106, 246, M, 2.89
SAN ANSELMO 0.4 NE, Marin, CA01, -122.564, 37.987, 107, M, 4.20
IGNACIO 0.6 SW, Marin, CA01, -122.546, 38.065, 57, M, 2.75
MONTEREY 1.0 W, Monterey, CA04, -121.899, 36.603, 123, M, 3.12
CARMEL VALLEY VILLAGE 0.8 SSW, Monterey, CA04, -121.728, 36.476, 359, M, 2.25
LOCKWOOD 3.6 NW, Monterey, CA04, -121.117, 35.981, 1181, M, 1.20
PACIFIC GROVE 0.7 ESE, Monterey, CA04, -121.913, 36.619, 119, M, 2.51
KING CITY 13.2 S, Monterey, CA04, -121.174, 36.025, 1104, M, 1.33
CASTROVILLE 1.6 ENE, Monterey, CA04, -121.728, 36.776, 18, M, 2.82
MONTEREY 1.5 ESE, Monterey, CA04, -121.856, 36.594, 108, M, 2.67
KING CITY 2.0 SSW, Monterey, CA04, -121.146, 36.187, 371, M, 0.67
PACIFIC GROVE 1.5 SSW, Monterey, CA04, -121.932, 36.602, 280, M, 2.73
BIG SUR 4.0 SE, Monterey, CA04, -121.763, 36.224, 824, M, 1.70
NEVADA CITY 3.4 NNW, Nevada, CA02, -121.040, 39.307, 2390, M, 8.79
KINGVALE 1.3 WSW, Nevada, CA02, -120.452, 39.317, 6035, M, 10.80
GRASS VALLEY 5.5 ESE, Nevada, CA02, -120.963, 39.190, 2763, M, 5.74
GRASS VALLEY 5.0 S, Nevada, CA02, -121.042, 39.149, 2312, M, 7.16
ALTA SIERRA 1.3 S, Nevada, CA02, -121.057, 39.104, 2154, M, 1.18
ROUGH AND READY 0.5 NW, Nevada, CA02, -121.143, 39.234, 2010, M, 4.06
ALTA SIERRA 0.4 WSW, Nevada, CA02, -121.060, 39.120, 2303, M, 3.65
NEVADA CITY 5.4 W, Nevada, CA02, -121.121, 39.268, 1982, M, 3.46
GRASS VALLEY 0.6 NNW, Nevada, CA02, -121.062, 39.229, 2661, M, 0.00
GRASS VALLEY 0.5 NNW, Nevada, CA02, -121.059, 39.229, 2669, M, 0.00
ORANGE 3.5 ENE, Orange, CA06, -117.770, 33.829, 811, M, 2.77
YORBA LINDA 1.9 SSW, Orange, CA06, -117.781, 33.865, 361, M, 3.51
LAGUNA NIGUEL 0.9 W, Orange, CA06, -117.720, 33.528, 477, M, 3.85
SILVERADO 1.0 ESE, Orange, CA06, -117.620, 33.746, 1394, M, 6.60
SODA SPRINGS 1.5 SSW, Placer, CA02, -120.384, 39.302, 6887, M, 10.79
LINCOLN 0.9 SSW, Placer, CA02, -121.322, 38.888, 131, M, 2.23
ROSEVILLE 4.7 WNW, Placer, CA02, -121.377, 38.780, 96, M, 1.79
ROSEVILLE 0.8 ENE, Placer, CA02, -121.279, 38.763, 170, M, 0.10
COLFAX 1.0 WNW, Placer, CA02, -120.970, 39.101, 2260, M, 5.71
IDYLLWILD 1.8 NW, Riverside, CA06, -116.735, 33.763, 6325, M, 7.25
DESERT HOT SPRINGS 3.0 NW, Riverside, CA07, -116.541, 33.985, 1339, M, 2.76
HEMET 4.1 ENE, Riverside, CA06, -116.920, 33.753, 1698, M, 3.32
CORONA 12.8 SE, Riverside, CA06, -117.428, 33.731, 1404, M, 5.83
HOMELAND 1.7 NNE, Riverside, CA06, -117.092, 33.769, 2248, M, 5.48
LAKE ELSINORE 3.5 WSW, Riverside, CA06, -117.381, 33.657, 1356, M, 5.31
CARMICHAEL 1.6 SW, Sacramento, CA02, -121.340, 38.617, 102, M, 2.15
SACRAMENTO 8.0 NE, Sacramento, CA02, -121.361, 38.635, 95, M, 2.42
FOLSOM 3.4 ESE, Sacramento, CA05, -121.091, 38.655, 594, M, 2.67
CARMICHAEL 0.9 NE, Sacramento, CA02, -121.306, 38.643, 130, M, 2.14
CARMICHAEL 1.4 W, Sacramento, CA02, -121.345, 38.638, 109, M, 2.20
FOLSOM 1.2 SSE, Sacramento, CA02, -121.140, 38.660, 362, M, 2.64