WRIGHTWOOD, San Bernardino, CA07, -117.639, 34.362, 6000, 70.2, 0.00
REDDING CDF, Shasta, CA02, -122.299, 40.519, 502, M, 0.00
NORTHRIDGE CAL STATE, Los Angeles, CA06, -118.525, 34.245, 904, 79.1, 0.00
OXNARD WFO, Ventura, CA06, -119.137, 34.207, 52, 69.6, 0.01
HANFORD MUNICIPAL AP, Kings, CA05, -119.623, 36.311, 249, 81.5, 0.00
RAMONA AIRPORT, San Diego, CA06, -116.916, 33.038, 1385, 74.4, 0.02
VACAVILLE/NUT TREE AP ASOS, Solano, CA02, -121.959, 38.378, 104, 78.4, 0.00
ALTURAS MUNICIPAL AP, Modoc, CA02, -120.561, 41.484, 4383, 66.6, 0.09
MADERA MUNICIPAL AP, Madera, CA05, -120.111, 36.985, 251, 79.3, 0.00
BAKERSFIELD 5 NW, Kern, CA05, -119.051, 35.419, 470, 85.3, 0.00
FRESNO 5 NE, Fresno, CA05, -119.709, 36.767, 338, 83.8, 0.00
OCEANSIDE MUNICIPAL AP, San Diego, CA06, -117.350, 33.219, 30, 71.7, 0.09
SAN DIEGO SEAWORLD, San Diego, CA06, -117.231, 32.765, 14, 69.6, 0.00
ARCATA EUREKA AP, Humboldt, CA01, -124.105, 40.978, 211, 57.4, 0.82
CHICO ARMY FLYING SCH, Butte, CA02, -121.850, 39.800, 272, 78.8, 0.20
NEWPORT BEACH HARBOR, Orange, CA06, -117.884, 33.603, 10, 69.7, 0.00
ESCONDIDO NO. 2, San Diego, CA06, -117.090, 33.121, 600, 74.8, 0.00
REDDING AP, Shasta, CA02, -122.298, 40.515, 501, 83.1, 0.01
AVALON CATALINA AP, Los Angeles, CA06, -118.415, 33.404, 1565, 69.8, T
SANTA MARIA PUBLIC AP, Santa Barbara, CA06, -120.452, 34.894, 243, 64.0, 0.00
MOUNT SHASTA, Siskiyou, CA02, -122.333, 41.333, 3535, 68.5, 0.17
RED BLUFF MUNI AP, Tehama, CA02, -122.255, 40.152, 354, 82.6, T
NEEDLES AIRPORT, San Bernardino, CA07, -114.618, 34.768, 888, 95.6, 1.70
CHINA LAKE NAF, Kern, CA07, -117.693, 35.688, 2230, 87.6, 0.00
SUSANVILLE 2SW, Lassen, CA03, -120.663, 40.417, 4212, 70.2, 0.00
TEJON RANCHO, Kern, CA05, -118.750, 35.023, 1425, 75.6, 0.00
SAN NICOLAS IS, Ventura, CA06, -119.458, 33.240, 568, 67.7, T
BURBANK GLENDALE PASADENA AP, Los Angeles, CA06, -118.365, 34.200, 731, 76.8, 0.00
MOUNT SHASTA, Siskiyou, CA02, -122.317, 41.322, 3613, 68.8, 0.22
WATSONVILLE MUNICIPAL AIRPORT, Santa Cruz, CA04, -121.790, 36.939, 162, 63.1, 0.01
SANTA ROSA SONOMA CO AP, Sonoma, CA04, -122.811, 38.504, 119, 69.1, 0.00
HEARST CASTLE, San Luis Obispo, CA04, -121.168, 35.684, 1526, 69.9, T
GETTY CENTER, Los Angeles, CA06, -118.479, 34.087, 1117, 71.7, 0.00
HESPERIA 2E, San Bernardino, CA07, -117.266, 34.421, 3055, 84.7, 1.54
RANCHO BERNARDO, San Diego, CA06, -117.081, 33.022, 690, 73.7, 0.00
FELTON, Santa Cruz, CA04, -122.075, 37.051, 400, 67.1, 0.00
PACIFICA 2S, San Mateo, CA04, -122.484, 37.610, 125, 58.8, 0.11
SAN JUAN CANYON, Orange, CA06, -117.552, 33.532, 375, 74.5, 0.00
YOUNTVILLE, Napa, CA01, -122.357, 38.395, 95, 70.9, 0.00
APPLE VALLEY #2, San Bernardino, CA07, -117.279, 34.536, 2780, 82.0, 0.00
OCOTILLO WELLS 2W, San Diego, CA07, -116.169, 33.155, 390, 95.9, 0.00
IRVINE RANCH, Orange, CA06, -117.723, 33.720, 540, 75.1, 0.00
MT. LAGUNA #3, San Diego, CA07, -116.419, 32.867, 5920, 71.0, 0.05
AVALON INLAND, Los Angeles, CA06, -118.330, 33.338, 90, 67.0, 0.00
DESERT CENTER 2 NNE, Riverside, CA07, -115.392, 33.738, 747, 94.5, 0.50
TORRANCE AP, Los Angeles, CA06, -118.342, 33.802, 90, 70.9, 0.00
MERCED 23 WSW, Merced, CA05, -120.882, 37.238, 78, 74.2, 0.00
REDDING 12 WNW, Shasta, CA02, -122.607, 40.651, 1418, 80.1, 0.00
STOVEPIPE WELLS 1 SW, Inyo, CA07, -117.145, 36.602, 84, 102.4, 0.00
LOS ANGELES DOWNTOWN/USC, Los Angeles, CA06, -118.291, 34.024, 179, 75.2, 0.00
FRESNO YOSEMITE INT'L, Fresno, CA05, -119.720, 36.780, 334, 84.1, 0.00
MONTEREY PENINSUL AP, Monterey, CA04, -121.849, 36.590, 160, 61.2, 0.00
PASO ROBLES MUNICIPAL AP, San Luis Obispo, CA04, -120.629, 35.669, 820, 75.1, 0.00
MONTAGUE SISKIYOU AIRPORT, Siskiyou, CA01, -122.468, 41.774, 2645, 71.2, 0.27
SAN JOSE, Santa Clara, CA04, -121.924, 37.359, 49, 70.5, T
PALM SPRINGS ASOS, Riverside, CA07, -116.504, 33.822, 409, 92.5, 0.08
THOUSAND OAKS 1 SW, Ventura, CA06, -118.899, 34.182, 783, 72.6, 0.00
FILLMORE 2 W, Ventura, CA06, -118.945, 34.409, 495, 74.2, 0.00
SAN DIEGO BROWN FIELD, San Diego, CA06, -116.994, 32.576, 521, 72.6, T
Bakersfield Area, -, -, -, -, -, 85.0, 0.00
Bishop Area, -, -, -, -, -, 76.7, 0.00
Los Angeles Downtown Area, -, -, -, -, -, 75.2, 0.00
Eureka Area, -, -, -, -, -, 58.7, 0.47
Fresno Area, -, -, -, -, -, 84.1, 0.00
Los Angeles Airport Area, -, -, -, -, -, 70.0, T
Long Beach Area, -, -, -, -, -, 74.4, 0.00
Redding Area, -, -, -, -, -, 83.1, 0.01
Sacramento Area, -, -, -, -, -, 76.0, 0.00
San Diego Area, -, -, -, -, -, 72.1, T
Stockton Area, -, -, -, -, -, 78.2, 0.00
San Francisco Airport Area, -, -, -, -, -, 64.4, 0.01
Santa Maria Area, -, -, -, -, -, 64.0, 0.00
CAMP PENDLETON MCAS, San Diego, CA06, -117.355, 33.304, 70, 71.5, 0.00
LEMOORE REEVES NAS, Fresno, CA05, -119.950, 36.333, 232, 81.2, T
MOUNTAIN PASS 1SE, San Bernardino, CA07, -115.531, 35.459, 4777, 79.3, 2.51
ARVIN, Kern, CA05, -118.834, 35.211, 450, 85.8, 0.00
FRAZIER PARK, Kern, CA06, -118.965, 34.827, 4972, 71.8, 0.00
CHIRIACO SUMMIT, Riverside, CA07, -115.721, 33.662, 1706, 88.0, 0.42
EDWARDS AFB NORTH AUXILIARY AIRFIELD, Kern, CA07, -117.865, 34.988, 2283, 84.4, T
FALLBROOK 5 NE, San Diego, CA06, -117.190, 33.439, 1140, 75.1, 0.08
SANTA BARBARA 11 W, Santa Barbara, CA06, -119.880, 34.414, 18, 65.7, 0.00
BODEGA 6 WSW, Sonoma, CA01, -123.075, 38.321, 63, 57.1, 0.07
YOSEMITE VILLAGE 12 W, Mariposa, CA05, -119.821, 37.759, 6620, 69.2, 0.00
REDONDO BEACH, Los Angeles, CA06, -118.376, 33.834, 142, 70.0, 0.01
BURBANK VALLEY PUMP PLANT, Los Angeles, CA06, -118.348, 34.187, 655, 75.3, 0.00
PLEASANTON 1.8 SSE, Alameda, CA04, -121.875, 37.648, 351, M, 0.00
PLACERVILLE 2.9 WNW, El Dorado, CA02, -120.840, 38.753, 1800, M, 0.00
PLACERVILLE 3.7 SW, El Dorado, CA02, -120.849, 38.695, 1755, M, 0.00
TOLLHOUSE 2.0 SSE, Fresno, CA05, -119.397, 36.990, 1673, M, 0.00
YORBA LINDA 1.9 SSW, Orange, CA06, -117.781, 33.865, 361, M, 0.00
CORONA 12.8 SE, Riverside, CA06, -117.428, 33.731, 1404, M, 0.00
PACIFICA 0.3 W, San Mateo, CA04, -122.483, 37.612, 227, M, 0.03
DAVIS 0.8 NE, Yolo, CA02, -121.724, 38.562, 41, M, 0.00
ARBUCKLE BASIN CALIFORNIA, Shasta, CA02, -122.833, 40.398, 1900, 78.8, M
ACTON CALIFORNIA, Los Angeles, CA06, -118.200, 34.446, 2600, 77.6, M
ARROYO GRANDE CALIFORNIA, San Luis Obispo, CA04, -120.392, 35.179, 1048, 71.8, M
ALDER SPRINGS CALIFORNIA, Glenn, CA02, -122.724, 39.651, 4300, 74.6, M
ALPINE CALIFORNIA, San Diego, CA06, -116.739, 32.834, 2041, 78.2, M
LOS ALTOS CALIFORNIA, Santa Clara, CA04, -122.147, 37.358, 645, 73.6, M
AMMO DUMP CALIFORNIA, San Diego, CA06, -117.286, 33.381, 1068, 73.8, M
ANZA CALIFORNIA, Riverside, CA06, -116.673, 33.555, 3920, 74.0, M
ALDER POINT CALIFORNIA, Humboldt, CA01, -123.590, 40.187, 923, 70.2, M
ARROYO SECO (MT. DIABLO) CALIF, Monterey, CA04, -121.492, 36.230, 980, 74.2, M
ASH CREEK CALIFORNIA, Siskiyou, CA02, -121.979, 41.277, 3200, 64.9, M
ASH VALLEY CALIFORNIA, Lassen, CA02, -120.686, 41.052, 5100, 64.5, M
BACKBONE CALIFORNIA, Trinity, CA01, -123.142, 40.889, 4700, 72.6, M
BALD MTN LOC CALIFORNIA, El Dorado, CA02, -120.697, 38.906, 4680, 78.0, M
BARNABY CALIFORNIA, Marin, CA01, -122.702, 38.028, 1240, 65.8, M
BATTERSON CALIFORNIA, Madera, CA05, -119.508, 37.232, 3160, 81.8, M
BIG BAR CALIFORNIA, Trinity, CA01, -123.233, 40.733, 1500, 74.9, M
BELL CANYON CALIFORNIA, Orange, CA06, -117.592, 33.542, 700, 73.9, M
BRADLEY CALIFORNIA, Monterey, CA04, -120.803, 35.864, 537, 77.7, M
BEAR PEAK CALIFORNIA, Tulare, CA05, -118.052, 35.884, 8228, 67.5, M
BENTON CALIFORNIA, Mono, CA07, -118.478, 37.843, 5450, 73.6, M
BEAUMONT CALIFORNIA, Riverside, CA06, -116.950, 33.931, 2604, 81.1, M
BEVERLY HILLS CALIFORNIA, Los Angeles, CA06, -118.412, 34.125, 1260, 77.4, M
BEAR VALLEY CALIFORNIA, Kern, CA05, -118.625, 35.140, 4000, 74.0, M
BANGOR CALIFORNIA, Butte, CA02, -121.386, 39.398, 803, 79.3, M
BIG HILL CALIFORNIA, Humboldt, CA01, -123.636, 41.098, 3570, 67.6, M
BIG PINES CALIFORNIA, Los Angeles, CA07, -117.692, 34.379, 6917, 71.7, M
BIG ROCK CALIFORNIA, Marin, CA01, -122.570, 38.039, 1500, 71.6, M
BLACK DIAMOND CALIFORNIA, Contra Costa, CA04, -121.884, 37.950, 1600, 74.4, M
BLUE DOOR CALIFORNIA, Lassen, CA02, -120.337, 41.055, 5615, 65.5, M
BLUE RIDGE (KNF) CALIFORNIA, Siskiyou, CA01, -123.187, 41.269, 5956, 66.7, M
BEN BOLT CALIFORNIA, El Dorado, CA05, -120.934, 38.591, 905, 77.3, M
BEN LOMOND CALIFORNIA, Santa Cruz, CA04, -122.170, 37.132, 2630, 73.8, M
BOGARD R.S. CALIFORNIA, Lassen, CA02, -121.083, 40.598, 5650, 61.1, M
BOONVILLE CALIFORNIA, Mendocino, CA01, -123.349, 38.988, 644, 68.7, M
BIG PINE FLAT CALIFORNIA, San Bernardino, CA07, -117.013, 34.319, 6861, 68.9, M
BRIDGEPORT 4NW CALIFORNIA, Mono, CA03, -119.289, 38.272, 6650, 68.3, M
BRANCH MOUNTAIN CALIFORNIA, San Luis Obispo, CA04, -120.083, 35.189, 3770, 78.3, M
BEAR FLAT CALIFORNIA, Modoc, CA02, -120.313, 41.295, 6200, 65.1, M
BRIONES CALIFORNIA, Contra Costa, CA04, -122.118, 37.944, 1450, 71.5, M
BLACKROCK CALIFORNIA, Tulare, CA05, -118.260, 36.093, 8200, 63.8, M
BROOKS CALIFORNIA, Yolo, CA02, -122.145, 38.738, 354, 80.5, M
BIG SUR CALIFORNIA, Monterey, CA04, -121.785, 36.236, 450, 64.1, M
BUCK MEADOWS CALIFORNIA, Tuolumne, CA05, -120.097, 37.823, 3200, 74.2, M
BULL FLAT CALIFORNIA, Lassen, CA03, -120.114, 40.481, 4395, 69.7, M
BURNS CANYON CALIFORNIA, San Bernardino, CA07, -116.634, 34.210, 6000, 76.0, M
BUTTERCUP CALIFORNIA, Imperial, CA07, -114.884, 32.740, 217, 93.6, M
BEAVER CAMP LOC CALIFORNIA, Amador, CA05, -120.325, 38.488, 5000, 85.2, M
BRAZIE RANCH CALIFORNIA, Siskiyou, CA01, -122.594, 41.685, 3000, 74.5, M
CAHUILLA CALIFORNIA, Imperial, CA07, -115.174, 32.974, 278, 94.5, M
CALLAHAN CALIFORNIA, Siskiyou, CA01, -122.796, 41.308, 3136, 73.0, M
CAMERON FIRE STATION CALIFORNI, San Diego, CA06, -116.463, 32.721, 3443, 74.3, M
CANBY CALIFORNIA, Modoc, CA02, -120.868, 41.434, 4312, 68.3, M
CARRIZO CALIFORNIA, San Luis Obispo, CA05, -119.773, 35.096, 2490, 82.1, M
CASE SPRINGS CALIFORNIA, San Diego, CA06, -117.418, 33.445, 2320, 76.2, M
CATHEYS VALLEY CALIFORNIA, Mariposa, CA05, -120.111, 37.468, 1200, 82.8, M
CEDAR GROVE CALIFORNIA, Fresno, CA05, -118.656, 36.788, 4720, 71.9, M
CHEESEBORO CALIFORNIA, Ventura, CA06, -118.717, 34.185, 1650, 77.4, M
CHICO CALIFORNIA, Butte, CA02, -121.779, 39.712, 230, 79.4, M
CHILAO CALIFORNIA, Los Angeles, CA06, -118.030, 34.332, 5450, 75.7, M
CHUCHUPATE CALIFORNIA, Ventura, CA05, -119.012, 34.808, 4900, 67.8, M
CLAREMONT CALIFORNIA, Los Angeles, CA06, -117.707, 34.137, 1645, 76.6, M
CLEAR CREEK CALIFORNIA, Los Angeles, CA06, -118.152, 34.271, 3000, 77.6, M
CLARK CALIFORNIA, Riverside, CA06, -117.309, 33.877, 1720, 77.4, M
CALAVERAS ROAD CALIFORNIA, Alameda, CA04, -121.844, 37.553, 1230, 69.1, M
CASE MOUNTAIN CALIFORNIA, Tulare, CA05, -118.809, 36.411, 6450, 70.5, M
CORONA CALIFORNIA, Riverside, CA06, -117.549, 33.874, 640, 78.8, M
COHASSET CALIFORNIA, Butte, CA02, -121.769, 39.872, 1733, 81.6, M
COLLINS BALDY CALIFORNIA, Siskiyou, CA01, -122.950, 41.775, 5493, 65.8, M
CONVERSE CALIFORNIA, San Bernardino, CA06, -116.913, 34.194, 5618, 69.8, M
COOSKIE MOUNTAIN CALIFORNIA, Humboldt, CA01, -124.266, 40.257, 2950, 64.5, M
CORRALITOS CALIFORNIA, Santa Cruz, CA04, -121.798, 36.991, 450, 67.6, M
COUNTY LINE CALIFORNIA, Lake, CA02, -122.412, 39.019, 2085, 81.6, M
CAMP 9 CALIFORNIA, Los Angeles, CA06, -118.422, 34.362, 4000, 76.9, M
CRANE FLAT LOOKOUT CALIFORNIA, Mariposa, CA05, -119.825, 37.762, 6644, 69.6, M
CRESTVIEW CALIFORNIA, Mono, CA07, -118.983, 37.745, 7600, 61.8, M
CORNING CALIFORNIA, Tehama, CA02, -122.170, 39.939, 294, 81.7, M
CARPENTER RIDGE CALIFORNIA, Butte, CA02, -121.582, 40.069, 4812, 73.1, M
CRANSTON CALIFORNIA, Riverside, CA06, -116.841, 33.740, 1950, 84.1, M
CRAZY PEAK CALIFORNIA, Del Norte, CA01, -123.604, 41.992, 3970, 63.4, M
CASHMAN CALIFORNIA, Plumas, CA02, -120.915, 40.002, 4520, 76.1, M
DESCANSO CALIFORNIA, San Diego, CA06, -116.622, 32.857, 3480, 75.7, M
DEVILS GARDEN CALIFORNIA, Modoc, CA02, -120.671, 41.530, 5022, 69.1, M
DIABLO GRANDE CALIFORNIA, Stanislaus, CA05, -121.294, 37.329, 1850, 79.6, M
DEMOCRAT CALIFORNIA, Kern, CA05, -118.630, 35.532, 2356, 81.0, M
DINKEY CALIFORNIA, Fresno, CA05, -119.039, 37.066, 5668, 63.6, M
DOG VALLEY CALIFORNIA, Sierra, CA03, -120.048, 39.562, 5976, 67.6, M
DOYLE CALIFORNIA, Lassen, CA03, -120.106, 40.022, 4240, 74.5, M
DUNCAN CALIFORNIA, Placer, CA02, -120.509, 39.144, 7100, 67.7, M
DEL VALLE CALIFORNIA, Los Angeles, CA06, -118.683, 34.431, 1278, 78.4, M
DEVORE CALIFORNIA, San Bernardino, CA06, -117.404, 34.221, 2057, 79.3, M
EAGLE PEAK CALIFORNIA, Tehama, CA02, -122.657, 39.928, 3713, 77.5, M
EEL RIVER CAMP CALIFORNIA, Humboldt, CA01, -123.824, 40.138, 446, 69.8, M
EEL RIVER CALIFORNIA, Mendocino, CA01, -123.083, 39.833, 1500, 76.3, M
EL CARISO CALIFORNIA, Riverside, CA06, -117.411, 33.647, 3038, 80.9, M
MOUNT ELIZABETH CALIFORNIA, Tuolumne, CA05, -120.247, 38.063, 4933, 75.9, M
EL MIRAGE CALIFORNIA, San Bernardino, CA07, -117.550, 34.634, 2880, 82.7, M
ESPERANZA CALIFORNIA, Calaveras, CA05, -120.515, 38.243, 2559, 77.9, M
FANCHER CREEK CALIFORNIA, Fresno, CA05, -119.466, 36.884, 920, 86.3, M
FAWNSKIN CALIFORNIA, San Bernardino, CA06, -116.899, 34.266, 6900, 64.3, M
FENCE MEADOW CALIFORNIA, Fresno, CA05, -119.175, 36.961, 5048, 76.5, M
FORT HUNTER LIGGET CALIFORNIA, Monterey, CA04, -121.242, 36.012, 1100, 77.0, M
FIGUEROA CALIFORNIA, Santa Barbara, CA06, -120.007, 34.733, 3200, 77.8, M
FISH CREEK MTN CALIFORNIA, Imperial, CA07, -116.067, 32.990, 760, 94.3, M
FIVE MILE CALIFORNIA, Inyo, CA07, -117.918, 35.872, 4150, 86.5, M
FORT ORD #2 CALIFORNIA, Monterey, CA04, -121.786, 36.627, 490, 59.0, M
FORESTHILL CALIFORNIA, Placer, CA02, -120.732, 39.091, 4355, 75.2, M
FOUNTAIN SPRINGS CALIFORNIA, Tulare, CA05, -118.915, 35.892, 210, 81.6, M
FREMONT CANYON CALIFORNIA, Orange, CA06, -117.711, 33.808, 1781, 75.4, M
FRIEND MOUNTAIN CALIFORNIA, Trinity, CA01, -123.342, 40.505, 4000, 70.0, M
GASQUET CALIFORNIA, Del Norte, CA01, -123.979, 41.846, 500, 67.5, M
GRASSHOPPER CALIFORNIA, Lassen, CA03, -120.784, 40.782, 6158, 65.1, M
GOOSE VALLEY CALIFORNIA, San Diego, CA06, -116.846, 33.074, 1530, 75.5, M
GORDON CALIFORNIA, Lassen, CA03, -120.896, 40.759, 6200, 65.4, M
GREEN SPRING CALIFORNIA, Tuolumne, CA05, -120.500, 37.833, 1020, 80.0, M
HASTINGS CALIFORNIA, Monterey, CA04, -121.552, 36.389, 1885, 71.8, M
HAWKEYE CALIFORNIA, Sonoma, CA01, -122.917, 38.782, 2000, 73.5, M
HAYFORK CALIFORNIA, Trinity, CA01, -123.165, 40.550, 2323, 70.8, M
HELL HOLE CALIFORNIA, Placer, CA02, -120.422, 39.072, 5240, 72.5, M
HERNANDEZ CALIFORNIA, San Benito, CA04, -120.856, 36.383, 3733, 77.6, M
HIGH GLADE LOOKOUT CALIFORNIA, Lake, CA02, -122.808, 39.208, 4840, 71.5, M
HIGH SIERRA CALIFORNIA, Fresno, CA05, -119.038, 37.315, 7403, 66.7, M
HOPLAND CALIFORNIA, Mendocino, CA01, -123.081, 39.031, 2682, 75.7, M
HOLLISTER CALIFORNIA, San Benito, CA04, -121.362, 36.842, 404, 69.5, M
HUNTER MOUNTAIN CALIFORNIA, Inyo, CA07, -117.474, 36.563, 6880, 72.7, M
HORSE LAKE CALIFORNIA, Lassen, CA03, -120.503, 40.631, 5100, 68.1, M
HOOPA CALIFORNIA, Humboldt, CA01, -123.671, 41.048, 375, 71.9, M
HORSE THIEF SPRINGS CALIFORNIA, San Bernardino, CA07, -115.909, 35.771, 5000, 82.4, M
HURLEY CALIFORNIA, Fresno, CA05, -119.568, 37.015, 1201, 79.3, M
INDIAN WELL CALIFORNIA, Siskiyou, CA01, -121.538, 41.742, 4770, 69.0, M
LYONS VALLEY CALIFORNIA, Lake, CA01, -123.074, 39.126, 3200, 68.5, M
LYTLE CREEK CALIFORNIA, San Bernardino, CA06, -117.480, 34.234, 2792, 77.4, M
MAD RIVER CALIFORNIA, Trinity, CA01, -123.524, 40.463, 2775, 69.2, M
MALIBU HILLS CALIFORNIA, Los Angeles, CA06, -118.633, 34.058, 1575, 75.0, M
MANZANITA LAKE CALIFORNIA, Shasta, CA02, -121.580, 40.540, 5660, 63.2, M
MILL CREEK (BDF) CALIFORNIA, San Bernardino, CA06, -117.035, 34.084, 2950, 79.5, M
MCGUIRES CALIFORNIA, Mendocino, CA01, -123.601, 39.353, 593, 65.4, M
MEANS LAKE CALIFORNIA, San Bernardino, CA07, -116.517, 34.391, 2900, 86.3, M
MENDOCINO PASS CALIFORNIA, Mendocino, CA01, -122.945, 39.808, 5420, 78.0, M
METCALF GAP CALIFORNIA, Madera, CA05, -119.768, 37.409, 3077, 82.5, M
MEYERS CALIFORNIA, El Dorado, CA03, -120.018, 38.849, 6310, 64.3, M
MID HILLS CALIFORNIA, San Bernardino, CA07, -115.411, 35.123, 5413, 77.1, M
MILL CREEK (ANF) CALIFORNIA, Los Angeles, CA06, -118.082, 34.390, 5021, 74.1, M
MILO CALIFORNIA, Tulare, CA05, -118.869, 36.231, 1923, 85.3, M
MALLORY RIDGE CALIFORNIA, Contra Costa, CA05, -121.779, 37.817, 2040, 76.8, M
MONTECITO CALIFORNIA, Santa Barbara, CA06, -119.648, 34.461, 1500, 73.0, M
MODOC NWR CALIFORNIA, Modoc, CA02, -120.354, 41.459, 4380, 66.8, M
MOJAVE RIVER SINK CALIFORNIA, San Bernardino, CA07, -116.079, 35.053, 950, 94.3, M
MORMON ROCK CALIFORNIA, San Bernardino, CA06, -117.502, 34.318, 3300, 78.5, M
MOUNTAIN REST CALIFORNIA, Fresno, CA05, -119.371, 37.054, 4100, 78.8, M
MARKLEEVILLE CALIFORNIA, Alpine, CA03, -119.767, 38.683, 5501, 69.9, M
MT. SHASTA CALIFORNIA, Siskiyou, CA02, -122.316, 41.316, -, 70.4, M
MARIPOSA CALIFORNIA, Mariposa, CA05, -119.987, 37.504, 2231, 78.5, M
MT. DIABLO CALIFORNIA, Contra Costa, CA05, -121.914, 37.882, 3849, 72.5, M
MOUNT ZION CALIFORNIA, Amador, CA05, -120.651, 38.389, 2960, 79.6, M
NORTH FORK CALIFORNIA, Madera, CA05, -119.505, 37.233, 2720, 79.6, M
OAK BOTTOM CALIFORNIA, Shasta, CA02, -122.606, 40.651, 1326, 82.0, M
OAK KNOLL CALIFORNIA, Siskiyou, CA01, -122.850, 41.839, 1940, 71.9, M
OAK MOUNTAIN CALIFORNIA, Shasta, CA02, -121.983, 41.006, 1700, 78.5, M
OJAI CALIFORNIA, Ventura, CA06, -119.230, 34.448, 765, 72.9, M
OAK GROVE CALIFORNIA, San Diego, CA06, -116.795, 33.393, 2752, 78.4, M
OAKLAND NORTH CALIFORNIA, Contra Costa, CA04, -122.221, 37.865, 1403, 65.3, M
OAK OPENING CALIFORNIA, Tulare, CA05, -118.702, 36.175, 3240, 81.9, M
OPAL MOUNTAIN CALIFORNIA, San Bernardino, CA07, -117.176, 35.154, 3240, 84.5, M
OWENS CAMP LOC CALIFORNIA, El Dorado, CA02, -120.245, 38.733, 5240, 70.2, M
OWENS VALLEY CALIFORNIA, Inyo, CA07, -118.551, 37.390, 4640, 81.0, M
OZENA CALIFORNIA, Ventura, CA06, -119.354, 34.682, 3670, 76.8, M
PANAMINT CALIFORNIA, Inyo, CA07, -117.088, 36.120, 6880, 75.1, M
PARKFIELD CALIFORNIA, Monterey, CA04, -120.432, 35.899, 1535, 77.3, M
PATTY MOCUS CALIFORNIA, Tehama, CA02, -122.867, 40.295, 3500, 75.0, M
PINE HILLS CALIFORNIA, San Diego, CA06, -116.634, 33.016, -, 75.2, M
PIERCE CALIFORNIA, Plumas, CA02, -120.642, 40.246, 5700, 69.0, M
PINEHURST CALIFORNIA, Fresno, CA05, -119.000, 36.685, 4060, 77.4, M
PIKE COUNTY LOOKOUT CALIFORNIA, Yuba, CA02, -121.202, 39.475, 3714, 75.9, M
PILOT HILL CALIFORNIA, El Dorado, CA02, -121.009, 38.833, 1200, 77.0, M
PIRU CALIFORNIA, Ventura, CA06, -118.810, 34.404, 614, 72.3, M
PARK RIDGE CALIFORNIA, Tulare, CA05, -118.942, 36.724, 7540, 68.1, M
PINNACLES CALIFORNIA, San Benito, CA04, -121.147, 36.471, 1322, 77.5, M
POPPY PARK CALIFORNIA, Los Angeles, CA07, -118.383, 34.733, 2760, 84.0, M
POTRERO CALIFORNIA, San Diego, CA06, -116.609, 32.606, 2345, 76.1, M
POVERTY CALIFORNIA, Santa Clara, CA04, -121.771, 37.443, 2066, 72.8, M
PANOCHE ROAD CALIFORNIA, Fresno, CA05, -120.766, 36.727, 2032, 81.6, M
PULGAS CALIFORNIA, San Mateo, CA04, -122.298, 37.475, 644, 69.8, M
QUARTZ HILL CALIFORNIA, Siskiyou, CA01, -122.934, 41.599, 4225, 72.8, M
QUINCY RD CALIFORNIA, Plumas, CA02, -120.942, 39.973, 3500, 72.1, M
RAVENDALE CALIFORNIA, Lassen, CA03, -120.316, 40.731, 5298, 68.4, M
RANCHITA CALIFORNIA, San Diego, CA07, -116.497, 33.222, 4415, 77.3, M
READER RANCH CALIFORNIA, Nevada, CA02, -121.117, 39.304, 1968, 79.9, M
REDDING AIRPORT CALIFORNIA, Shasta, CA02, -122.291, 40.516, 500, 82.9, M
RICE VALLEY CALIFORNIA, Riverside, CA07, -114.732, 34.061, 820, 94.5, M
ROCK CREEK, Mono, CA07, -118.667, 37.551, 7040, 68.3, M
SANTA ROSA ISLAND CALIFORNIA, Santa Barbara, CA06, -120.078, 33.978, 1298, 61.4, M
SANTA ROSA PLATEAU CALIFORNIA, Riverside, CA06, -117.231, 33.529, 1980, 74.5, M
SANTA ROSA CALIFORNIA, Sonoma, CA01, -122.712, 38.479, 576, 69.0, M
STAMPEDE CALIFORNIA, Sierra, CA03, -120.075, 39.483, 6867, 66.1, M
STONYFORD CALIFORNIA, Colusa, CA02, -122.575, 39.367, 1200, 79.0, M
SUGARLOAF (SHF) CALIFORNIA, Shasta, CA02, -122.438, 40.917, 4200, 78.3, M
SUGARLOAF CALIFORNIA, Tulare, CA05, -118.675, 36.727, 8120, 66.3, M
TALEGA CALIFORNIA, San Diego, CA06, -117.486, 33.478, 1203, 74.2, M
TANBARK CALIFORNIA, Los Angeles, CA06, -117.761, 34.207, 2600, 77.7, M
TARGET RANGE CALIFORNIA, San Diego, CA06, -117.359, 33.372, 918, 72.4, M
TEMESCAL (LPF) CALIFORNIA, Ventura, CA06, -118.756, 34.481, 1140, 77.5, M
THOMES CREEK CALIFORNIA, Tehama, CA02, -122.610, 39.864, 1040, 84.9, M
THOUSAND OAKS CALIFORNIA, Ventura, CA06, -118.870, 34.210, 795, 67.5, M
TIMBER MOUNTAIN CALIFORNIA, Modoc, CA01, -121.298, 41.629, 4960, 69.1, M
TEMESCAL (CNF) CALIFORNIA, Riverside, CA06, -117.483, 33.763, 1125, 79.8, M
MOUNT TOM CALIFORNIA, Fresno, CA05, -119.178, 37.376, 9018, 61.4, M
LAS TRAMPAS CALIFORNIA, Contra Costa, CA04, -122.067, 37.834, 1760, 72.0, M
TRINITY CAMP CALIFORNIA, Trinity, CA01, -122.804, 40.786, 3308, 73.1, M
TRIMMER CALIFORNIA, Fresno, CA05, -119.305, 36.911, 1540, 89.2, M
GAYLOR MEADOW CALIFORNIA, Tuolumne, CA05, -119.318, 37.868, 9270, 54.9, M
UHL / HOT SPRINGS, Tulare, CA05, -118.633, 35.889, 3720, 77.2, M
UNDERWOOD CALIFORNIA, Trinity, CA01, -123.495, 40.722, 2600, 72.2, M
VALLEY CENTER CALIFORNIA, San Diego, CA06, -117.009, 33.237, 1483, 75.9, M
VAN BREMMER CALIFORNIA, Siskiyou, CA01, -121.794, 41.643, 4928, 68.0, M
VALYERMO CALIFORNIA, Los Angeles, CA07, -117.851, 34.446, 3780, 79.1, M
VANDENBERG CALIFORNIA, Santa Barbara, CA06, -120.486, 34.759, 1050, 63.7, M
WALKER CALIFORNIA, Mono, CA03, -119.459, 38.565, 5440, 76.7, M
WALKER PASS CALIFORNIA, Kern, CA05, -118.057, 35.665, 5572, 78.5, M
WARM SPRINGS CALIFORNIA, Los Angeles, CA06, -118.579, 34.596, 4930, 78.3, M
WEED AIRPORT CALIFORNIA, Siskiyou, CA01, -122.454, 41.479, 2930, 72.2, M
WESTWOOD CALIFORNIA, Lassen, CA02, -120.900, 40.307, 5800, 69.3, M
WHITE CLOUD CALIFORNIA, Nevada, CA02, -120.837, 39.317, 4320, 76.8, M
WHITTIER HILLS CALIFORNIA, Los Angeles, CA06, -118.010, 33.984, 950, 75.7, M
WHITMORE CALIFORNIA, Shasta, CA02, -121.899, 40.619, 2417, 79.7, M
WILEY RIDGE CALIFORNIA, Ventura, CA06, -118.841, 34.372, 1645, 76.5, M
WOFFORD HEIGHTS CALIFORNIA, Kern, CA05, -118.499, 35.722, 3150, 79.6, M
WOLVERTON CALIFORNIA, Tulare, CA05, -118.703, 36.445, 5240, 76.9, M
WOODACRE CALIFORNIA, Marin, CA01, -122.645, 37.991, 1400, 71.3, M
WHITAKER PEAK CALIFORNIA, Los Angeles, CA06, -118.740, 34.569, 4120, 77.2, M
WHITE WOLF CALIFORNIA, Tuolumne, CA05, -119.650, 37.851, 8025, 62.2, M
YOLLA BOLLA CALIFORNIA, Trinity, CA01, -123.066, 40.338, 4524, 71.4, M
YUCCA VALLEY CALIFORNIA, San Bernardino, CA07, -116.408, 34.123, 3260, 82.3, M
YUROK CALIFORNIA, Humboldt, CA01, -123.857, 41.290, 495, 69.8, M
HAGAN'S MEADOW, El Dorado, CA03, -119.940, 38.850, 7776, 58.2, 0.00
BLUE LAKES, Alpine, CA05, -119.920, 38.610, 8057, 60.3, 0.00
POISON FLAT, Alpine, CA03, -119.630, 38.510, 7736, 59.0, 0.50
SONORA PASS, Mono, CA03, -119.600, 38.310, 8827, 60.1, 0.20
LEAVITT MEADOWS, Mono, CA03, -119.550, 38.300, 7198, 62.6, 0.20
VIRGINIA LAKES RIDGE, Mono, CA03, -119.230, 38.070, 9445, 60.9, 0.00
LOBDELL LAKE, Mono, CA03, -119.370, 38.440, 9233, 58.4, 0.00
EBBETTS PASS, Alpine, CA03, -119.800, 38.550, 8765, 60.4, 0.00
HEAVENLY VALLEY, El Dorado, CA03, -119.920, 38.920, 8582, 57.9, 0.00
LEAVITT LAKE, Mono, CA03, -119.610, 38.280, 9617, 58.4, 0.40
SPRATT CREEK, Alpine, CA03, -119.820, 38.670, 6115, 66.8, 0.20
MONITOR PASS, Alpine, CA03, -119.610, 38.670, 8310, 61.3, 0.20
BURNSIDE LAKE, Alpine, CA03, -119.890, 38.720, 8129, 56.5, 0.00
SUMMIT MEADOW, Mono, CA03, -119.540, 38.400, 9313, 59.2, 0.00
FORESTDALE CREEK, Alpine, CA03, -119.960, 38.680, 8017, 63.0, 0.00
HORSE MEADOW, Alpine, CA03, -119.890, 38.840, 8557, 60.6, 0.20
CARSON PASS, Alpine, CA02, -119.990, 38.690, 8353, 59.9, 0.00
CROWDER FLAT, Modoc, CA01, -120.750, 41.890, 5170, 63.6, 0.30
CEDAR PASS, Modoc, CA02, -120.300, 41.580, 7030, 63.0, 0.00
JARBO GAP CALIFORNIA, Butte, CA02, -121.489, 39.736, 2490, 81.6, M
JERSEYDALE CALIFORNIA, Mariposa, CA05, -119.839, 37.544, 3900, 80.0, M
JOHNSONDALE CALIFORNIA, Tulare, CA05, -118.545, 35.972, 4700, 68.9, M
JUANITA LAKE CALIFORNIA, Siskiyou, CA01, -122.006, 41.786, 5400, 68.0, M
JULIAN CALIFORNIA, San Diego, CA07, -116.591, 33.076, 4240, 74.8, M
JUNIPER CREEK CALIFORNIA, Modoc, CA02, -120.472, 41.332, 4372, 69.0, M
KEENWILD CALIFORNIA, Riverside, CA06, -116.767, 33.667, 4920, 75.2, M
KETTLEMAN HILLS CALIFORNIA, Kings, CA05, -120.057, 36.033, 810, 85.8, M
KNOXVILLE CREEK CALIFORNIA, Lake, CA02, -122.417, 38.862, 2200, 77.5, M
KONOCTI CALIFORNIA, Lake, CA02, -122.706, 38.912, 2163, 78.3, M
LOS BANOS CALIFORNIA, Merced, CA05, -121.053, 37.055, 350, 80.7, M
MT. LAGUNA CALIFORNIA, San Diego, CA07, -116.420, 32.880, 5760, 68.6, M
LA HONDA CALIFORNIA, San Mateo, CA04, -122.255, 37.305, 872, 63.5, M
LA PANZA CALIFORNIA, San Luis Obispo, CA04, -120.187, 35.381, 1630, 75.4, M
LAURAL MOUNTAIN CALIFORNIA, Kern, CA07, -117.699, 35.478, 4390, 82.7, M
LASSEN LODGE CALIFORNIA, Tehama, CA02, -121.714, 40.344, 4159, 77.0, M
LAUFMAN CALIFORNIA, Lassen, CA03, -120.353, 40.142, 5800, 73.3, M
LAYTONVILLE CALIFORNIA, Mendocino, CA01, -123.485, 39.702, 1820, 72.9, M
LADDER BUTTE CALIFORNIA, Lassen, CA02, -121.297, 40.807, 5750, 68.7, M
LEO CARRILLO CALIFORNIA, Los Angeles, CA06, -118.936, 34.046, 50, 68.7, M
LOS GATOS CALIFORNIA, Santa Clara, CA04, -121.943, 37.203, 2000, 73.9, M
LOST HORSE CALIFORNIA, Riverside, CA07, -116.188, 34.018, 4200, 79.9, M
LINCOLN CALIFORNIA, Placer, CA02, -121.268, 38.883, 200, 80.5, M
LOWER KLAMATH CALIFORNIA, Siskiyou, CA01, -121.700, 41.999, 4098, 64.3, M
LOS PRIETOS CALIFORNIA, Santa Barbara, CA06, -119.783, 34.536, 1020, 76.3, M
LAS FLORES CALIFORNIA, San Diego, CA06, -117.439, 33.289, 100, 71.8, M
LAS TABLAS CALIFORNIA, San Luis Obispo, CA04, -120.924, 35.656, 994, 73.5, M
LITTLE TUJUNGA CALIFORNIA, Los Angeles, CA06, -118.361, 34.294, 1390, 75.5, M
DISMAL SWAMP, Modoc, CA03, -120.180, 41.990, 7360, 57.6, 0.30
ADIN MTN, Modoc, CA02, -120.790, 41.240, 6190, 60.5, 0.50
