INDEPENDENCE CREEK, Sierra, CA03, -120.280, 39.490, 6456, 61.1, 0.00
INDEPENDENCE CAMP, Sierra, CA03, -120.290, 39.450, 7003, 60.9, 0.00
INDEPENDENCE LAKE, Nevada, CA03, -120.310, 39.430, 8352, 62.5, 0.10
TRUCKEE #2, Placer, CA03, -120.180, 39.300, 6509, 66.2, 0.00
WARD CREEK #3, Placer, CA03, -120.220, 39.140, 6655, 61.1, 0.00
TAHOE CITY CROSS, Placer, CA03, -120.150, 39.170, 6797, 64.2, 0.00
SQUAW VALLEY G.C., Placer, CA03, -120.260, 39.190, 8029, 61.4, 0.30
CSS LAB, Nevada, CA02, -120.370, 39.330, 6855, 62.1, 0.00
RUBICON #2, El Dorado, CA03, -120.130, 39.000, 7689, 64.0, 0.40
ECHO PEAK, El Dorado, CA03, -120.080, 38.850, 7670, 63.6, 0.00
FALLEN LEAF, El Dorado, CA03, -120.050, 38.930, 6236, 61.1, 0.00
CAMPO ASOS, San Diego, CA07, -116.468, 32.626, 2641, 74.2, 1.14
Burbank Glendale Pasadena Area, -, -, -, -, -, 76.8, 0.00
Camarillo Area, -, -, -, -, -, 69.7, 0.02
Needles Area, -, -, -, -, -, 95.6, 1.70
Oxnard Area, -, -, -, -, -, 69.6, 0.01
Palm Springs Area, -, -, -, -, -, 92.5, 0.08
Riverside Area, -, -, -, -, -, 81.4, 0.00
Ramona Area, -, -, -, -, -, 74.4, 0.02
Northern CA 8 Station Index, -, -, -, -, -, M, 0.03
San Joaquin 5 Station Index, -, -, -, -, -, M, 0.00
RODEO VALLEY, Mendocino, CA01, -123.321, 39.668, 2428, 72.1, M
ROSE VALLEY CALIFORNIA, Ventura, CA06, -119.184, 34.543, 3331, 69.4, M
ROUND MOUNTAIN, Siskiyou, CA02, -121.464, 41.427, 5258, 69.5, M
ROSE PEAK CALIFORNIA, Alameda, CA04, -121.735, 37.502, 3060, 73.4, M
RATTLESNAKE CALIFORNIA, Tulare, CA05, -118.422, 36.407, 8600, 65.0, M
RUSH CREEK CALIFORNIA, Modoc, CA02, -120.864, 41.294, 4800, 69.9, M
RUTH CALIFORNIA, Trinity, CA01, -123.316, 40.251, 2732, 69.3, M
SACRAMENTO NWR CALIFORNIA, Glenn, CA02, -122.182, 39.417, 120, 77.6, M
SADDLEBACK BUTTE CALIFORNIA, Los Angeles, CA07, -117.821, 34.685, 2590, 82.9, M
SAUGUS CALIFORNIA, Los Angeles, CA06, -118.525, 34.425, 1450, 79.2, M
SAWYERS BAR CALIFORNIA, Siskiyou, CA01, -123.132, 41.300, 2192, 74.3, M
SANTA BARBARA ISLAND CALIFORNI, Santa Barbara, CA06, -119.033, 33.483, 176, 66.5, M
SANTA CRUZ ISLAND CALIFORNIA, Santa Barbara, CA06, -119.722, 33.996, 250, 69.3, M
SCORPION CALIFORNIA, Trinity, CA01, -122.697, 41.112, 4400, 75.5, M
SODA CREEK CALIFORNIA, Lake, CA01, -122.977, 39.425, 1773, 73.2, M
SADDLEBACK CALIFORNIA, Sierra, CA02, -120.865, 39.638, 6670, 68.3, M
SECRET TOWN CALIFORNIA, Nevada, CA02, -120.885, 39.184, 2826, 77.4, M
SANTA FE DAM CALIFORNIA, Los Angeles, CA06, -117.946, 34.121, 500, 78.2, M
SHAVER CALIFORNIA, Fresno, CA05, -119.256, 37.135, 5746, 65.2, M
SCHOOL HOUSE CALIFORNIA, Humboldt, CA01, -123.906, 41.138, 2640, 63.4, M
SHIP MTN. CALIFORNIA, Del Norte, CA01, -123.792, 41.736, 5300, 62.8, M
SHADEQUARTER CALIFORNIA, Tulare, CA05, -118.956, 36.567, 4069, 78.7, M
SIMS CALIFORNIA, Shasta, CA02, -122.373, 41.075, 2400, 79.0, M
SIMI VALLEY CALIFORNIA, Ventura, CA06, -118.814, 34.291, 914, 71.2, M
SLATER BUTTE CALIFORNIA, Siskiyou, CA01, -123.352, 41.859, 4670, 69.9, M
SAN MIGUEL CALIFORNIA, San Diego, CA06, -116.974, 32.685, 425, 73.0, M
SAN LUIS NWR CALIFORNIA, Merced, CA05, -120.794, 37.182, 65, 76.8, M
SANTA RITA CALIFORNIA, San Benito, CA05, -120.598, 36.348, 5000, 74.5, M
SOLDIER MOUNTAIN CALIFORNIA, Shasta, CA02, -121.586, 40.926, 3710, 74.8, M
SOMES BAR CALIFORNIA, Siskiyou, CA01, -123.496, 41.390, 920, 74.9, M
SQUAW SPRINGS CALIFORNIA, San Bernardino, CA07, -117.568, 35.370, 3620, 84.0, M
SQUAW LAKE CALIFORNIA, Imperial, CA07, -114.494, 32.908, 300, 94.4, M
Crescent City Area, -, -, -, -, -, 56.9, 1.17
Escondido Area, -, -, -, -, -, 74.8, 0.00
Sacramento Downtown Area, -, -, -, -, -, 77.8, 0.00
Tahoe City Area, -, -, -, -, -, 63.7, 0.00
Ukiah Area, -, -, -, -, -, 74.5, 0.00
Alturas Area, -, -, -, -, -, 66.6, 0.09
Mount Shasta Area, -, -, -, -, -, 68.5, 0.17
Palmdale Area, -, -, -, -, -, 83.9, 0.00
Lancaster Area, -, -, -, -, -, 83.4, 0.00
El Cajon Area, -, -, -, -, -, 77.9, 0.00
Hanford Area, -, -, -, -, -, 81.5, 0.00
El Centro Area, -, -, -, -, -, 93.0, 0.17
Madera Area, -, -, -, -, -, 79.3, 0.00
Merced Area, -, -, -, -, -, 79.8, 0.00
San Jose Area, -, -, -, -, -, 70.5, T