Name, County, ClimateDivision, Longitude, Latitude, Elevation, MeanAvgTemperature, TotalPrecipitation
IMPERIAL, Imperial, CA07, -115.567, 32.849, -64, 85.7, 0.17
EL CAPITAN DAM, San Diego, CA06, -116.815, 32.886, 600, 75.2, 0.12
LAKESIDE 2 E, San Diego, CA06, -116.895, 32.854, 690, M, 0.15
POWAY VALLEY, San Diego, CA06, -117.031, 33.020, 648, 70.9, 0.32
JULIAN CDF, San Diego, CA06, -116.592, 33.076, 4215, 71.3, 0.41
CARLSBAD MCCLELLAN PALOMAR AP, San Diego, CA06, -117.277, 33.130, 313, 67.8, 0.03
HENSHAW DAM, San Diego, CA06, -116.761, 33.237, 2700, 67.8, 0.29
VISTA, San Diego, CA06, -117.232, 33.235, 430, 70.2, 0.02
OCEANSIDE MARINA, San Diego, CA06, -117.395, 33.210, 10, 65.2, 0.00
NILAND, Imperial, CA07, -115.524, 33.278, -60, M, 0.27
BORREGO DESERT PARK, San Diego, CA07, -116.404, 33.256, 810, 88.2, 0.50
PALOMAR MTN OBSERVATORY, San Diego, CA06, -116.840, 33.378, 5550, 70.1, 0.30
MECCA FIRE STATION, Riverside, CA07, -116.073, 33.570, -183, 87.6, 0.00
LAGUNA BEACH, Orange, CA06, -117.781, 33.545, 44, M, 0.03
BLYTHE ASOS, Riverside, CA07, -114.715, 33.619, 395, 88.9, 0.08
DESERT RESORTS REGIONAL AP, Riverside, CA07, -116.164, 33.632, -118, 85.9, 0.58
DEEP CANYON LAB, Riverside, CA07, -116.376, 33.651, 1200, M, 1.24
ELSINORE, Riverside, CA06, -117.346, 33.686, 1268, 77.9, 0.03
SANTA ANA JOHN WAYNE AP, Orange, CA06, -117.867, 33.680, 43, 70.3, 0.07
HAYFIELD PUMPING PLANT, Riverside, CA07, -115.629, 33.704, 1370, 84.3, 1.98
IDYLLWILD FIRE DEPT, Riverside, CA06, -116.707, 33.757, 5380, 66.9, 1.64
SAN JACINTO, Riverside, CA06, -116.975, 33.797, 1525, 77.4, 0.22
HEMET, Riverside, CA06, -116.894, 33.738, 1811, 78.3, 0.00
SANTA ANA FIRE STATION, Orange, CA06, -117.867, 33.744, 135, 72.5, 0.06
EAGLE MOUNTAIN, Riverside, CA07, -115.451, 33.809, 973, 88.0, 0.19
PALM SPRINGS, Riverside, CA07, -116.510, 33.828, 425, 88.4, 0.55
LONG BEACH DAUGHERTY AP, Los Angeles, CA06, -118.147, 33.812, 34, 70.8, 0.02
FULLERTON MUNICIPAL AP, Orange, CA06, -117.986, 33.872, 86, 73.7, 0.06
BEAUMONT #2, Riverside, CA07, -116.990, 33.926, 2591, M, 0.04
MARCH AFB, Riverside, CA06, -117.250, 33.900, 1536, 73.4, 0.03
YORBA LINDA, Orange, CA06, -117.819, 33.890, 350, M, 0.00
HAWTHORNE MUNICIPAL AP, Los Angeles, CA06, -118.333, 33.924, 55, 69.0, 0.03
LOS ANGELES INTL AP, Los Angeles, CA06, -118.387, 33.938, 97, 66.9, 0.01
RIVERSIDE FIRE STATION 3, Riverside, CA06, -117.388, 33.951, 840, 76.7, 0.00
RIVERSIDE MUNICIPAL AP, Riverside, CA06, -117.435, 33.953, 845, 76.4, 0.04
CHINO AP, San Bernardino, CA06, -117.625, 33.976, 636, 74.4, T
WHITTIER CITY YARD FC106C, Los Angeles, CA06, -118.022, 33.976, 446, M, 0.06
BARSTOW-DAGGETT AIRPORT, San Bernardino, CA07, -116.787, 34.854, 1919, 82.7, 0.31
MERCED, Merced, CA05, -120.516, 37.289, 154, 75.3, 0.02
SAN DIEGO MONTGOMERY FIELD, San Diego, CA06, -117.137, 32.815, 418, 69.7, 0.11
SAN DIEGO INTERNATIONAL AP, San Diego, CA06, -117.183, 32.734, 15, 68.8, 0.13
SAN DIEGO MIRAMAR NAS, San Diego, CA06, -117.133, 32.867, 477, 69.6, 0.11
NORTH ISLAND NAS, San Diego, CA06, -117.210, 32.692, 14, 71.4, 0.13
SAN FRANCISCO INTERNATIONAL AP, San Mateo, CA04, -122.366, 37.620, 10, 64.7, 0.01
SAN LUIS OBISPO MCCHESNEY FIELD, San Luis Obispo, CA04, -120.644, 35.238, 183, 66.4, 0.06
CEDARVILLE, Modoc, CA03, -120.179, 41.530, 4688, 66.9, 0.00
CHICO UNIVERSITY FARM, Butte, CA02, -121.821, 39.691, 185, 77.1, 0.00
CHULA VISTA, San Diego, CA06, -117.086, 32.640, 56, 68.3, 0.11
COLFAX, Placer, CA02, -120.947, 39.090, 2373, 75.9, 0.00
CUYAMACA, San Diego, CA06, -116.587, 32.990, 4640, 66.3, 0.31
DAVIS 2 WSW EXP FARM, Yolo, CA02, -121.776, 38.535, 60, 75.3, 0.01
DEATH VALLEY NATIONAL PARK, Inyo, CA07, -116.867, 36.463, -194, 94.5, 0.09
FORT BRAGG 5 N, Mendocino, CA01, -123.756, 39.510, 123, 57.2, 0.30
HANFORD 1 S, Kings, CA05, -119.637, 36.316, 237, 77.4, 0.01
HAPPY CAMP RANGER STATION, Siskiyou, CA01, -123.375, 41.796, 1142, 67.2, 0.28
HEALDSBURG, Sonoma, CA01, -122.866, 38.629, 177, 69.6, 0.00
INDIO FIRE STATION, Riverside, CA07, -116.215, 33.709, -21, 88.2, 0.29
LEMON COVE, Tulare, CA05, -119.026, 36.382, 513, 77.6, 0.01
LIVERMORE, Alameda, CA04, -121.751, 37.682, 529, 72.9, T
LODI, San Joaquin, CA05, -121.288, 38.106, 40, 74.3, 0.02
MERCED MUNICIPAL AP, Merced, CA05, -120.518, 37.286, 152, 77.2, T
NAPA STATE HOSPITAL, Napa, CA01, -122.265, 38.278, 35, 70.4, 0.00
OJAI, Ventura, CA06, -119.227, 34.448, 745, 70.8, 0.01
ORLAND, Glenn, CA02, -122.200, 39.746, 254, 78.2, 0.02
ORLEANS, Humboldt, CA01, -123.532, 41.309, 403, 70.0, 0.22
PASADENA, Los Angeles, CA06, -118.145, 34.148, 864, 75.9, 0.00
PASO ROBLES, San Luis Obispo, CA04, -120.685, 35.628, 730, 70.9, 0.03
PETALUMA AIRPORT, Sonoma, CA01, -122.608, 38.258, 20, 67.9, 0.00
QUINCY, Plumas, CA02, -120.947, 39.937, 3420, 65.1, 0.86
REDLANDS, San Bernardino, CA06, -117.195, 34.037, 1410, 77.4, 0.05
SANTA BARBARA, Santa Barbara, CA06, -119.684, 34.417, 16, 64.4, 0.00
SANTA CRUZ, Santa Cruz, CA04, -122.000, 36.988, 70, 63.2, 0.05
SANTA ROSA, Sonoma, CA01, -122.713, 38.456, 166, 68.1, 0.01
TAHOE CITY, Placer, CA03, -120.143, 39.168, 6230, 58.1, 0.46
UKIAH, Mendocino, CA01, -123.210, 39.147, 636, 71.5, M
WASCO, Kern, CA05, -119.352, 35.589, 291, 80.4, T
WEAVERVILLE, Trinity, CA01, -122.940, 40.737, 2058, 68.3, 0.09
WILLOWS 6 W, Glenn, CA02, -122.305, 39.523, 234, 77.2, 0.07
YOSEMITE PARK HEADQUARTERS, Mariposa, CA05, -119.590, 37.750, 4018, 69.3, 3.42
YREKA, Siskiyou, CA01, -122.641, 41.703, 2709, 67.1, 0.05
BERKELEY, Alameda, CA04, -122.260, 37.874, 310, 64.5, 0.05
BLYTHE, Riverside, CA07, -114.597, 33.613, 268, 92.1, 0.00
EUREKA WFO WOODLEY ISLAND, Humboldt, CA01, -124.160, 40.810, 20, 56.9, 0.37
INDEPENDENCE, Inyo, CA07, -118.204, 36.798, 3950, 76.9, 0.05
SAN LUIS OBISPO POLY, San Luis Obispo, CA04, -120.662, 35.306, 308, 65.5, 0.01
BURNEY, Shasta, CA02, -121.655, 40.880, 3198, 63.0, 0.30
IMPERIAL BEACH REAM FIELD NAS, San Diego, CA06, -117.117, 32.568, 24, 66.4, 0.04
CAMPO, San Diego, CA06, -116.470, 32.626, 2630, 71.2, 0.22
EL CENTRO 2 SSW, Imperial, CA07, -115.562, 32.767, -30, 89.4, 0.02
IMPERIAL COUNTY AP, Imperial, CA07, -115.577, 32.835, -55, 88.6, 0.09
EL CENTRO NAF, Imperial, CA07, -115.664, 32.832, -46, 88.0, 0.39
ALPINE, San Diego, CA06, -116.777, 32.836, 1695, 71.8, 0.20
CULVER CITY, Los Angeles, CA06, -118.414, 34.005, 92, 66.9, 0.04
SANTA MONICA MUNICIPAL AP, Los Angeles, CA06, -118.447, 34.021, 175, 66.7, 0.05
SANTA MONICA PIER, Los Angeles, CA06, -118.500, 34.008, 14, M, 0.00
ONTARIO INTL AP, San Bernardino, CA06, -117.577, 34.053, 924, 75.6, 0.02
POMONA/FAIRPLEX, Los Angeles, CA06, -117.766, 34.082, 999, 74.1, 0.03
COVINA CITY YARD FC387B, Los Angeles, CA06, -117.880, 34.092, 607, M, 0.02
U C L A, Los Angeles, CA06, -118.443, 34.070, 430, 68.5, 0.07
TOPANGA PATROL FC-6, Los Angeles, CA06, -118.599, 34.084, 745, M, 0.00
IRON MOUNTAIN, San Bernardino, CA07, -115.122, 34.147, 922, 88.8, 0.83
TWENTYNINE PALMS, San Bernardino, CA07, -116.037, 34.128, 1975, 83.3, 0.04
JOSHUA TREE, San Bernardino, CA07, -116.275, 34.147, 2563, 81.0, 0.27
SAN DIMAS FIRE FC 95, Los Angeles, CA06, -117.802, 34.105, 958, M, 0.04
SAN GABRIEL FIRE DEPT, Los Angeles, CA06, -118.100, 34.084, 363, M, 0.02
POINT MUGU NF, Ventura, CA06, -119.123, 34.124, 12, 62.8, 0.03
ALTADENA, Los Angeles, CA06, -118.138, 34.182, 1127, M, 0.00
SAN GABRIEL CANYON PH, Los Angeles, CA06, -117.908, 34.155, 744, 76.8, 0.02
WOODLAND HILLS PIERCE COLLEGE, Los Angeles, CA06, -118.574, 34.182, 790, 74.8, 0.07
LYTLE CREEK R S, San Bernardino, CA06, -117.471, 34.238, 2730, M, 0.00
SAN GABRIEL DAM FC425B-E, Los Angeles, CA06, -117.861, 34.205, 1481, M, 0.05
MT WILSON CBS, Los Angeles, CA06, -118.071, 34.231, 5710, 70.7, 0.00
VAN NUYS AP, Los Angeles, CA06, -118.491, 34.212, 785, 73.3, 0.11
CAMARILLO AP, Ventura, CA06, -119.088, 34.211, 71, 68.4, 0.04
OXNARD VENTURA COUNTY AP, Ventura, CA06, -119.204, 34.200, 39, 64.5, 0.03
PARKER RESRVOIR, San Bernardino, CA07, -114.171, 34.290, 738, 90.7, 0.75
TWENTYNINE PALMS MC, San Bernardino, CA07, -116.147, 34.294, 2003, M, 0.08
BIG BEAR LAKE, San Bernardino, CA06, -116.917, 34.243, 6753, 60.0, 1.34
LAKE ARROWHEAD, San Bernardino, CA07, -117.188, 34.247, 5205, M, 0.26
CHATSWORTH FC 24 F, Los Angeles, CA06, -118.600, 34.250, 950, M, 0.00
CRYSTAL LAKE FC238C, Los Angeles, CA06, -117.842, 34.318, 5345, M, 0.23
BIG TUJUNGA DAM FC46, Los Angeles, CA06, -118.188, 34.295, 2326, M, 0.00
PACOIMA DAM FC33A-E, Los Angeles, CA06, -118.400, 34.329, 1550, M, 0.00
PIRU 2 ESE, Ventura, CA06, -118.757, 34.406, 712, M, 0.00
SANTA BARBARA MUNI AP, Santa Barbara, CA06, -119.842, 34.424, 8, 62.9, 0.00
JUNCAL DAM, Santa Barbara, CA06, -119.507, 34.491, 2260, M, 0.00
VICTORVILLE, San Bernardino, CA07, -117.293, 34.529, 2880, 75.7, 0.06
ACTON ESCONDIDO FC261, Los Angeles, CA06, -118.271, 34.494, 2833, M, 0.00
AMBOY, San Bernardino, CA07, -115.744, 34.559, 648, 87.4, 0.53
PALMDALE, Los Angeles, CA07, -118.094, 34.588, 2612, 78.8, 1.45
SAUGUS POWER PLANT 1, Los Angeles, CA06, -118.454, 34.590, 2161, 76.0, 0.37
LOS PRIETOS RS, Santa Barbara, CA06, -119.791, 34.544, 1024, M, 0.05
CACHUMA LAKE, Santa Barbara, CA06, -119.982, 34.582, 789, 70.7, 0.00
SALSIPUEDES GAGING STATION, Santa Barbara, CA06, -120.408, 34.585, 254, M, 0.02
PALMDALE AP, Los Angeles, CA07, -118.083, 34.629, 2509, 77.5, 0.85
LOMPOC, Santa Barbara, CA06, -120.451, 34.654, 75, 63.4, 0.08
LANCASTER, Los Angeles, CA06, -118.213, 34.741, 2338, 76.3, 0.01
SANDBERG, Los Angeles, CA06, -118.724, 34.744, 4510, 73.2, 0.02
LEBEC, Kern, CA05, -118.865, 34.833, 3575, 70.4, T
NEW CUYAMA FIRE STATION, Santa Barbara, CA06, -119.683, 34.946, 2160, 72.7, 1.70
TWITCHELL DAM, Santa Barbara, CA06, -120.321, 34.988, 582, 67.7, 0.07
TEHACHAPI AP, Kern, CA05, -118.432, 35.131, 3960, 67.8, 0.00
PISMO BEACH, San Luis Obispo, CA04, -120.683, 35.160, 39, 59.7, 0.15
TAFT, Kern, CA05, -119.430, 35.150, 773, 83.3, 0.00
BAKER, San Bernardino, CA07, -116.063, 35.276, 962, 85.6, 1.11
SALINAS DAM, San Luis Obispo, CA04, -120.504, 35.337, 1392, 72.8, 0.15
RANDSBURG, Kern, CA07, -117.652, 35.369, 3570, 77.6, T
SANTA MARGARITA BOOST, San Luis Obispo, CA04, -120.637, 35.374, 1148, 70.9, 0.02
MORRO BAY FIRE DEPT, San Luis Obispo, CA04, -120.845, 35.367, 118, 65.7, 0.02
BAKERSFIELD AP, Kern, CA05, -119.055, 35.434, 490, 80.3, T
BUTTONWILLOW, Kern, CA05, -119.470, 35.403, 225, 79.0, 0.00
GLENNVILLE, Kern, CA05, -118.701, 35.727, 3140, 67.0, 0.10
TRONA, San Bernardino, CA07, -117.391, 35.764, 1695, 83.6, 0.00
DELANO, Kern, CA05, -119.260, 35.768, 302, 78.4, 0.02
BRADLEY TELEMETERING, Monterey, CA04, -120.868, 35.930, 443, M, 0.00
PORTERVILLE MUNICIPAL AIRPORT, Tulare, CA05, -119.062, 36.029, 442, 77.8, 0.01
KETTLEMAN CITY, Kings, CA05, -119.960, 36.007, 240, 78.4, 0.00
HAIWEE, Inyo, CA07, -117.953, 36.139, 3825, 77.6, 0.05
CORCORAN IRRIGATION DIST., Kings, CA05, -119.582, 36.098, 200, 77.1, 0.00
COALINGA, Fresno, CA05, -120.361, 36.136, 670, 80.7, 0.01
PRIEST VALLEY, Monterey, CA04, -120.695, 36.188, 2300, 72.4, 0.18
KING CITY, Monterey, CA04, -121.138, 36.207, 320, 69.1, 0.04
LINDSAY, Tulare, CA05, -119.054, 36.203, 435, 76.4, 0.02
BIG SUR STATION, Monterey, CA04, -121.780, 36.247, 200, 63.1, 0.00
VISALIA, Tulare, CA05, -119.300, 36.328, 303, 77.9, 0.00
FIVE POINTS 5 SSW, Fresno, CA05, -120.156, 36.364, 285, 78.0, 0.00
SAN CLEMENTE DAM, Monterey, CA04, -121.709, 36.438, 600, M, 0.00
ASH MOUNTAIN, Tulare, CA05, -118.825, 36.491, 1708, 78.5, 0.02
THREE RIVERS EDISON PH 1, Tulare, CA05, -118.862, 36.465, 1140, 75.8, 0.00
PINNACLES NATIONAL PARK, San Benito, CA04, -121.182, 36.482, 1307, 71.2, 0.01
CARMEL VALLEY, Monterey, CA04, -121.724, 36.481, 480, 66.6, 0.00
LODGEPOLE, Tulare, CA05, -118.732, 36.604, 6735, 56.1, 1.28
PANOCHE 2 W, San Benito, CA05, -120.884, 36.607, 1400, M, T
MONTEREY, Monterey, CA04, -121.855, 36.593, 122, 61.1, 0.03
SALINAS NO. 2, Monterey, CA04, -121.666, 36.659, 45, 63.4, 0.02
SALINAS AP, Monterey, CA04, -121.609, 36.664, 73, 64.2, 0.03
GRANT GROVE, Tulare, CA05, -118.962, 36.738, 6580, 61.4, 0.77
PINE FLAT DAM, Fresno, CA05, -119.337, 36.821, 615, 79.8, 0.00
LOS BANOS ARBURUA RANCH, Merced, CA05, -120.939, 36.875, 843, M, 0.01
HOLLISTER 2, San Benito, CA04, -121.421, 36.848, 275, 66.8, 0.00
BALCH POWER HOUSE, Fresno, CA05, -119.088, 36.909, 1735, 76.9, 0.25
WATSONVILLE WATERWORKS, Santa Cruz, CA04, -121.769, 36.931, 95, 63.0, 0.00
FRIANT GOVERNMENT CAMP, Fresno, CA05, -119.707, 36.997, 410, 77.4, 0.00
MADERA, Madera, CA05, -120.038, 36.954, 270, 76.5, 0.00
WISHON DAM, Fresno, CA05, -118.984, 37.007, 6550, 62.9, 0.75
GILROY, Santa Clara, CA04, -121.561, 37.003, 194, 70.4, 0.00
AUBERRY 2 NW, Fresno, CA05, -119.513, 37.092, 2090, 78.0, 0.03
LOS BANOS, Merced, CA05, -120.867, 37.056, 120, 77.6, 0.00
BEN LOMOND NO. 4, Santa Cruz, CA04, -122.080, 37.086, 420, 68.1, 0.00
MORGAN HILL, Santa Clara, CA04, -121.602, 37.136, 375, M, M
ASPENDELL, Inyo, CA01, -118.599, 37.232, 8470, 57.3, 0.01
HUNTINGTON LAKE, Fresno, CA05, -119.221, 37.228, 7020, M, 0.00
NORTH FORK RS, Madera, CA05, -119.510, 37.233, 2645, 72.1, 0.03
LOS GATOS, Santa Clara, CA04, -121.959, 37.232, 365, 70.2, 0.00
NEWMAN, Stanislaus, CA05, -121.018, 37.281, 90, 78.4, 0.00
MOUNT HAMILTON, Santa Clara, CA04, -121.635, 37.343, 4220, 72.8, T
BISHOP AIRPORT, Inyo, CA07, -118.359, 37.371, 4110, 69.1, 0.16
MOFFETT FEDERAL AIRFIELD, Santa Clara, CA04, -122.048, 37.406, 39, 69.7, T
TURLOCK #2, Stanislaus, CA05, -120.846, 37.502, 103, 75.9, 0.02
PALO ALTO, Santa Clara, CA04, -122.140, 37.444, 25, 66.8, 0.02
REDWOOD CITY, San Mateo, CA04, -122.239, 37.477, 31, 68.1, 0.00
HALF MOON BAY, San Mateo, CA04, -122.443, 37.473, 27, 58.1, 0.03
SO ENTRANCE YOSEMITE N.P., Mariposa, CA05, -119.633, 37.512, 5047, 62.4, 0.41
MARIPOSA R S, Mariposa, CA05, -119.986, 37.495, 2100, M, 0.05
NEWARK, Alameda, CA04, -122.032, 37.515, 10, 67.9, 0.00
EXCHEQUER DAM, Mariposa, CA05, -120.267, 37.585, 442, M, 0.01
MODESTO AP, Stanislaus, CA05, -120.955, 37.625, 87, 76.4, T
HAYWARD AIR TERMINAL, Alameda, CA04, -122.121, 37.659, 31, 67.8, T
TRACY CARBONA, San Joaquin, CA05, -121.347, 37.682, 135, 72.9, 0.00
LIVERMORE MUNICIPAL AP, Alameda, CA04, -121.815, 37.693, 393, 72.8, T
OAKLAND INTERNATIONAL AIRPORT, Alameda, CA04, -122.233, 37.718, 5, 64.3, T
UPPER SAN LEANDRO FILTERS, Alameda, CA04, -122.167, 37.772, 394, M, 0.00
SAN FRANCISCO DOWNTOWN, San Francisco, CA04, -122.427, 37.771, 150, 62.5, 0.00
SAN FRANCISCO OCEANSIDE, San Francisco, CA04, -122.505, 37.728, 8, 58.4, 0.00
GROVELAND 2, Tuolumne, CA05, -120.226, 37.844, 2800, 70.4, 0.10
TRACY PUMPING PLANT, Alameda, CA05, -121.583, 37.796, 61, 76.1, 0.00
OAKLAND MUSEUM, Alameda, CA04, -122.264, 37.798, 30, 65.6, 0.00
MOUNT DIABLO JUNCTION, Contra Costa, CA04, -121.930, 37.879, 2170, 73.4, 0.06
STOCKTON AP, San Joaquin, CA05, -121.226, 37.890, 27, 74.8, T
RICHMOND, Contra Costa, CA04, -122.377, 37.919, 20, M, M
MUIR WOODS, Marin, CA01, -122.569, 37.898, 220, M, 0.14
HETCH HETCHY, Tuolumne, CA05, -119.783, 37.961, 3870, 68.8, 1.99
CHERRY VALLEY DAM, Tuolumne, CA05, -119.916, 37.975, 4765, 69.1, 0.70
SONORA, Tuolumne, CA05, -120.387, 37.967, 1675, 71.5, 0.00
STOCKTON FIRE STA 4, San Joaquin, CA05, -121.318, 37.999, 12, 76.3, 0.00
ANTIOCH PUMPING PLANT #3, Contra Costa, CA05, -121.752, 37.983, 60, 75.9, 0.00
CONCORD BUCHANAN FIELD, Contra Costa, CA04, -122.053, 37.992, 23, 72.0, 0.02
CONCORD WASTEWATER PLANT, Contra Costa, CA04, -122.069, 37.983, 40, 73.4, 0.00
SAN RAFAEL-CIVIC CENTER, Marin, CA01, -122.537, 37.998, 120, M, 0.00
KENTFIELD, Marin, CA01, -122.545, 37.957, 145, 67.3, 0.00
MARTINEZ WATER PLANT, Contra Costa, CA04, -122.114, 38.013, 40, 67.5, 0.00
BODIE CALIFORNIA STATE HISTORIC PARK, Mono, CA03, -119.014, 38.212, 8370, 50.9, 0.48
ACAMPO 5NE, San Joaquin, CA05, -121.201, 38.218, 87, M, T
NAPA COUNTY AIRPORT, Napa, CA04, -122.280, 38.208, 16, 66.1, 0.01
BRIDGEPORT, Mono, CA03, -119.229, 38.258, 6470, 57.4, 0.36
CALAVERAS BIG TREES, Calaveras, CA05, -120.311, 38.277, 4695, 64.1, 0.13
CAMP PARDEE, Calaveras, CA05, -120.843, 38.249, 658, 76.9, 0.34
TRAVIS FIELD AFB, Solano, CA02, -121.933, 38.267, 62, M, 0.62
FAIRFIELD, Solano, CA02, -122.068, 38.274, 40, 72.1, 0.00
SONOMA, Sonoma, CA01, -122.462, 38.299, 97, 68.8, 0.00
WEST POINT, Calaveras, CA05, -120.545, 38.378, 2775, M, 0.11
ATLAS ROAD BROWN, Napa, CA01, -122.248, 38.427, 1680, M, 0.04
GRATON, Sonoma, CA01, -122.865, 38.431, 200, 67.0, 0.04
OCCIDENTAL, Sonoma, CA01, -122.966, 38.386, 865, 68.6, 0.26
FIDDLETOWN DEXTER RCH, Amador, CA05, -120.698, 38.525, 2170, M, 0.13
SACRAMENTO AP ASOS, Sacramento, CA02, -121.496, 38.507, 19, 74.5, 0.01
WINTERS, Yolo, CA02, -121.978, 38.525, 135, 77.3, 0.04
LAKE SOLANO, Solano, CA02, -122.004, 38.492, 187, 74.7, 0.04
SAINT HELENA, Napa, CA01, -122.471, 38.507, 225, 72.0, 0.03
SAINT HELENA 4 WSW, Napa, CA01, -122.538, 38.493, 1780, M, 0.00
FORT ROSS, Sonoma, CA01, -123.245, 38.515, 112, 55.9, 0.15
SACRAMENTO 5 ESE, Sacramento, CA02, -121.418, 38.555, 38, 76.2, 0.00
ANGWIN PACIFIC UNION COLLEGE, Napa, CA01, -122.440, 38.573, 1715, 69.9, 0.03
CALISTOGA, Napa, CA01, -122.578, 38.577, 350, 71.5, 0.00
VENADO, Sonoma, CA01, -123.018, 38.609, 1260, M, 0.00
WOODLAND 1 WNW, Yolo, CA02, -121.794, 38.683, 67, 76.9, 0.05
PLACERVILLE IFG, El Dorado, CA02, -120.733, 38.733, 2755, 74.9, 0.06
REPRESA, Sacramento, CA02, -121.161, 38.694, 295, M, 0.00
SACRAMENTO METROPOLITAN AP, Sacramento, CA02, -121.595, 38.701, 24, 74.3, T
PACIFIC HOUSE, El Dorado, CA02, -120.503, 38.758, 3450, 68.5, 0.77
MIDDLETOWN, Lake, CA02, -122.626, 38.748, 1121, M, 0.00
CLOVERDALE, Sonoma, CA01, -123.026, 38.793, 400, 73.8, 0.02
KELSEY 1 N, El Dorado, CA02, -120.821, 38.809, 2000, M, T
SOUTH LAKE TAHOE AP, El Dorado, CA03, -119.996, 38.898, 6257, 58.7, 0.35
GEORGETOWN RS, El Dorado, CA02, -120.801, 38.933, 3001, 75.3, 0.01
AUBURN, Placer, CA02, -121.084, 38.907, 1292, 77.4, 0.00
NICOLAUS #2, Sutter, CA02, -121.545, 38.926, 43, M, 0.00
YORKVILLE, Mendocino, CA01, -123.231, 38.905, 1100, M, 0.00
CLEARLAKE 4 SE, Lake, CA02, -122.567, 38.924, 1349, 72.7, 0.00
FORESTHILL RANGER STATION, Placer, CA02, -120.845, 39.010, 3015, M, 0.01
MARYSVILLE AIRPORT (ASOS), Yuba, CA02, -121.569, 39.102, 62, 75.9, 0.03
UKIAH MUNICIPAL AP, Mendocino, CA01, -123.200, 39.128, 603, 72.5, 0.01
UKIAH 4 WSW, Mendocino, CA01, -123.272, 39.127, 1328, M, 0.04
GOLD RUN 4 SW, Placer, CA02, -120.900, 39.150, 3220, M, 0.03
GRASS VALLEY NO. 2, Nevada, CA02, -121.068, 39.204, 2400, 70.7, 0.00
HARRY L. ENGLEBRIGHT DAM, Nevada, CA02, -121.267, 39.237, 800, M, 2.54
COLUSA 2 SSW, Colusa, CA02, -122.027, 39.188, 50, 74.4, 0.13
BLUE CANYON NYACK AP, Placer, CA02, -120.709, 39.276, 5286, 70.4, 0.11
NEVADA CITY, Nevada, CA02, -121.001, 39.247, 2781, 71.6, 0.03
TRUCKEE AIRPORT, Nevada, CA03, -120.139, 39.320, 5900, 56.0, 0.12
TRUCKEE RS, Nevada, CA03, -120.173, 39.333, 5823, M, 0.12
DONNER MEMORIAL ST PARK, Nevada, CA03, -120.233, 39.324, 5937, 59.0, 1.65
COLGATE POWERHOUSE, Yuba, CA02, -121.192, 39.331, 595, M, 0.02
MOULTON WEIR, Colusa, CA02, -122.017, 39.333, 76, M, 0.00
BOCA, Nevada, CA03, -120.094, 39.389, 5575, 58.0, 0.58
POTTER VALLEY POWERHOUSE, Mendocino, CA01, -123.129, 39.362, 1018, 72.3, 0.00
FARAD, Nevada, CA03, -120.033, 39.428, 5153, M, 0.07
WILLITS 1 NE, Mendocino, CA01, -123.342, 39.419, 1353, 64.1, 0.07
BOWMAN DAM, Nevada, CA02, -120.656, 39.454, 5385, 65.5, 1.35
OROVILLE, Butte, CA02, -121.553, 39.518, 171, 74.5, T
OROVILLE MUNICIPAL AP, Butte, CA02, -121.622, 39.494, 187, 76.0, 0.03
SIERRAVILLE RS, Sierra, CA02, -120.370, 39.583, 4975, 60.5, 0.91
DOWNIEVILLE, Sierra, CA02, -120.824, 39.563, 2915, 66.9, 0.39
STRAWBERRY VALLEY, Yuba, CA02, -121.108, 39.563, 3808, 66.4, 0.20
STONY GORGE RESERVOIR, Glenn, CA02, -122.534, 39.586, 800, 75.5, 0.03
BRUSH CREEK RANGER STATION, Butte, CA02, -121.345, 39.695, 3560, M, 0.63
PARADISE, Butte, CA02, -121.624, 39.754, 1750, 76.8, 0.07
COVELO, Mendocino, CA01, -123.244, 39.816, 1413, 68.0, 0.10
VINTON, Plumas, CA02, -120.186, 39.806, 4950, 65.3, 0.28
PORTOLA, Plumas, CA02, -120.472, 39.805, 4850, 61.4, 0.11
DE SABLA, Butte, CA02, -121.611, 39.872, 2710, 72.2, 0.09
LEGGETT, Mendocino, CA01, -123.720, 39.874, 703, M, 0.24
BUCKS CREEK, Plumas, CA02, -121.315, 39.937, 1891, M, 0.04
DOYLE 4 SSE, Lassen, CA03, -120.083, 39.972, 4390, 65.4, 0.47
DOYLE, Lassen, CA03, -120.105, 40.027, 4293, M, 0.19
RICHARDSON GR ST PK, Humboldt, CA01, -123.793, 40.026, 503, 68.4, 0.00
CANYON DAM, Plumas, CA02, -121.089, 40.171, 4560, 63.0, 0.24
MIRANDA 4 SE, Humboldt, CA01, -123.776, 40.182, 266, M, 0.16
FORT SEWARD, Humboldt, CA01, -123.632, 40.218, 220, M, 0.08
HONEYDEW 1 SW, Humboldt, CA01, -124.132, 40.238, 373, M, 0.44
CHESTER, Plumas, CA02, -121.242, 40.303, 4530, 62.7, 0.02
MINERAL, Tehama, CA02, -121.609, 40.346, 4875, 61.5, 0.00
COLEMAN FISHERIES STATION, Shasta, CA02, -122.143, 40.400, 420, M, 0.00
VOLTA PH, Shasta, CA02, -121.866, 40.458, 2220, M, 0.04
SCOTIA, Humboldt, CA01, -124.104, 40.483, 136, 63.9, 0.19
MANZANITA LAKE, Shasta, CA02, -121.577, 40.541, 5750, 59.2, 0.33
WHISKEYTOWN RESERVOIR, Shasta, CA02, -122.528, 40.612, 1295, 78.3, 0.03
SHASTA DAM, Shasta, CA02, -122.416, 40.714, 1075, 78.7, 0.17
TRINITY RIVER HATCHERY, Trinity, CA01, -122.795, 40.726, 1861, 69.0, 0.14
BIG BAR 4 E, Trinity, CA01, -123.208, 40.741, 1253, 70.0, 0.11
BUCKHORN, Shasta, CA02, -121.932, 40.880, 3700, M, 0.53
HAT CREEK, Shasta, CA02, -121.543, 40.932, 3015, 65.7, 0.09
PIT RIVER PH 5, Shasta, CA02, -121.977, 40.987, 1458, M, 0.41
WILLOW CREEK 1 NW, Humboldt, CA01, -123.636, 40.947, 464, 71.3, 0.17
FALL RIVER MILLS, Shasta, CA02, -121.435, 41.008, 3300, M, 0.10
ADIN RANGER STATION, Modoc, CA02, -120.945, 41.193, 4202, M, 0.07
DUNSMUIR TREATMENT PL, Siskiyou, CA02, -122.282, 41.183, 2169, 68.0, 0.13
JESS VALLEY, Modoc, CA02, -120.295, 41.268, 5400, 62.8, 0.77
MCCLOUD, Siskiyou, CA02, -122.138, 41.252, 3233, 63.1, 0.18
ORICK, Humboldt, CA01, -124.067, 41.283, 5, M, 0.24
CALLAHAN, Siskiyou, CA01, -122.825, 41.338, 3085, 63.4, 0.09
SAWYERS BAR RS, Siskiyou, CA01, -123.133, 41.301, 2255, 70.3, 0.22
ORLEANS RS, Humboldt, CA01, -123.534, 41.303, 433, M, 0.20
ALTURAS, Modoc, CA02, -120.544, 41.490, 4378, 62.3, 0.00
FORT JONES RS, Siskiyou, CA01, -122.848, 41.601, 2729, 63.2, 0.02
LAVA BEDS NAT MON, Siskiyou, CA01, -121.501, 41.702, 4770, 65.5, 0.14
MOUNT HEBRON RS, Siskiyou, CA01, -122.045, 41.783, 4265, 61.0, 0.05
CRESCENT CITY 3 NNW, Del Norte, CA01, -124.215, 41.796, 43, 57.4, 0.46
CRESCENT CITY MCNAMARA AP, Del Norte, CA01, -124.238, 41.784, 56, 57.7, 0.05
OAK KNOLL W. C., Siskiyou, CA01, -122.850, 41.839, 1980, M, 0.07
FORT BIDWELL, Modoc, CA03, -120.157, 41.872, 4739, 66.4, 0.00
GASQUET RS, Del Norte, CA01, -123.965, 41.845, 387, 64.1, 0.34
FORT DICK RIVER, Del Norte, CA01, -124.135, 41.881, -, M, 0.52
TULELAKE, Siskiyou, CA01, -121.474, 41.960, 4038, 60.9, 0.20
COPCO NO 1 DAM, Siskiyou, CA01, -122.338, 41.980, 2665, 69.0, 0.03
PACIFICA 4 SSE, San Mateo, CA04, -122.472, 37.592, 475, 60.3, 0.02
BARSTOW, San Bernardino, CA07, -117.022, 34.893, 2220, 79.4, 0.34
PEARBLOSSOM, Los Angeles, CA07, -117.897, 34.503, 3101, 76.6, 0.10
EL CAJON, San Diego, CA06, -116.928, 32.801, 495, 72.9, 0.10
MARKLEY COVE, Napa, CA02, -122.124, 38.492, 480, 74.3, 0.03
SUSANVILLE 2SW, Lassen, CA03, -120.663, 40.417, 4212, 65.8, 0.10
TEJON RANCHO, Kern, CA05, -118.750, 35.023, 1425, 80.7, 0.00
BURBANK GLENDALE PASADENA AP, Los Angeles, CA06, -118.365, 34.200, 731, 73.5, T
TOLLHOUSE 2.8 SSE, Fresno, CA05, -119.396, 36.978, 2111, M, 0.30
ENCINITAS 2.7N, San Diego, CA06, -117.292, 33.076, 188, M, 0.00
CARLSBAD 8.7SE, San Diego, CA06, -117.221, 33.095, 605, M, 0.05
MOUNT SHASTA, Siskiyou, CA02, -122.317, 41.322, 3613, 65.5, 0.31
WATSONVILLE MUNICIPAL AIRPORT, Santa Cruz, CA04, -121.790, 36.939, 162, 63.8, 0.06
SANTA ROSA SONOMA CO AP, Sonoma, CA04, -122.811, 38.504, 119, 67.9, 0.01
LORAINE 5 NNE, Kern, CA05, -118.412, 35.384, 4235, 68.7, 0.00
DEL MAR FIRE DEPT, San Diego, CA06, -117.262, 32.972, 12, M, 0.00
LEMON GROVE FIRE DEPARTMENT, San Diego, CA06, -117.030, 32.738, 427, 70.3, 0.00
LEE VINING, Mono, CA07, -119.119, 37.957, 6797, 63.5, 0.35
ANAHEIM, Orange, CA06, -117.842, 33.865, 235, 73.5, 0.54
RED BLUFF TREATMENT PLANT, Tehama, CA02, -122.220, 40.162, 265, M, 0.04
NEW MELONES DAM HQ, Tuolumne, CA05, -120.486, 38.005, 960, 80.0, 0.00
MAMMOTH LAKES RS, Mono, CA07, -118.962, 37.648, 7804, 55.8, 0.83
FRAZIER PARK 9 SW, Ventura, CA05, -119.104, 34.733, 5169, M, 1.38
MONTEREY WFO, Monterey, CA04, -121.855, 36.593, 122, 60.1, 0.01
SKYLINE RIDGE PRESERVE, San Mateo, CA04, -122.185, 37.313, 2270, 70.6, 0.00
FREMONT, Alameda, CA04, -122.016, 37.542, 38, 68.2, T
NEWHALL 5NW, Los Angeles, CA06, -118.594, 34.393, 1765, 76.7, T
TEHACHAPI 4 SE, Kern, CA05, -118.422, 35.101, 4220, 68.1, 0.20
WRIGHTWOOD, San Bernardino, CA07, -117.639, 34.362, 6000, 61.6, 1.30
REDDING CDF, Shasta, CA02, -122.299, 40.519, 502, M, 0.14
NORTHRIDGE CAL STATE, Los Angeles, CA06, -118.525, 34.245, 904, M, 0.04
OXNARD WFO, Ventura, CA06, -119.137, 34.207, 52, 65.2, 0.03
HANFORD MUNICIPAL AP, Kings, CA05, -119.623, 36.311, 249, 76.3, T
RAMONA AIRPORT, San Diego, CA06, -116.916, 33.038, 1385, 70.3, 0.20
VACAVILLE/NUT TREE AP ASOS, Solano, CA02, -121.959, 38.378, 104, 74.6, 0.01
ALTURAS MUNICIPAL AP, Modoc, CA02, -120.561, 41.484, 4383, 61.6, 0.18
MADERA MUNICIPAL AP, Madera, CA05, -120.111, 36.985, 251, 76.0, T
BAKERSFIELD 5 NW, Kern, CA05, -119.051, 35.419, 470, 79.3, 0.00
FRESNO 5 NE, Fresno, CA05, -119.709, 36.767, 338, 81.4, 0.00
OCEANSIDE MUNICIPAL AP, San Diego, CA06, -117.350, 33.219, 30, 66.6, T
SAN DIEGO SEAWORLD, San Diego, CA06, -117.231, 32.765, 14, 66.0, 0.08
ARCATA EUREKA AP, Humboldt, CA01, -124.105, 40.978, 211, 55.7, 0.37
NEWPORT BEACH HARBOR, Orange, CA06, -117.884, 33.603, 10, 66.0, 0.02
ESCONDIDO NO. 2, San Diego, CA06, -117.090, 33.121, 600, 72.4, 0.12
REDDING AP, Shasta, CA02, -122.298, 40.515, 501, 78.2, 0.13
AVALON CATALINA AP, Los Angeles, CA06, -118.415, 33.404, 1565, 67.9, 0.09
SANTA MARIA PUBLIC AP, Santa Barbara, CA06, -120.452, 34.894, 243, 64.0, 0.09
