SANTA ROSA ISLAND CALIFORNIA, Santa Barbara, CA06, -120.078, 33.978, 1298, 52.4, M
SANTA ROSA PLATEAU CALIFORNIA, Riverside, CA06, -117.231, 33.529, 1980, 59.8, M
SANTA ROSA CALIFORNIA, Sonoma, CA01, -122.712, 38.479, 576, 56.2, M
STAMPEDE CALIFORNIA, Sierra, CA03, -120.075, 39.483, 6867, 56.5, M
STONYFORD CALIFORNIA, Colusa, CA02, -122.575, 39.367, 1200, 55.2, M
SUGARLOAF (SHF) CALIFORNIA, Shasta, CA02, -122.438, 40.917, 4200, 50.4, M
SPRING VALLEY CALIFORNIA, San Mateo, CA04, -122.436, 37.563, 1075, 53.1, M
TANBARK CALIFORNIA, Los Angeles, CA06, -117.761, 34.207, 2600, 58.9, M
TEMESCAL (LPF) CALIFORNIA, Ventura, CA06, -118.756, 34.481, 1140, 60.7, M
THOMES CREEK CALIFORNIA, Tehama, CA02, -122.610, 39.864, 1040, 59.1, M
THOUSAND OAKS CALIFORNIA, Ventura, CA06, -118.870, 34.210, 795, 59.2, M
TIMBER MOUNTAIN CALIFORNIA, Modoc, CA01, -121.298, 41.629, 4960, 44.4, M
MOUNT TOM CALIFORNIA, Fresno, CA05, -119.178, 37.376, 9018, 39.9, M
LAS TRAMPAS CALIFORNIA, Contra Costa, CA04, -122.067, 37.834, 1760, 54.5, M
TRINITY CAMP CALIFORNIA, Trinity, CA01, -122.804, 40.786, 3308, 48.4, M
TRIMMER CALIFORNIA, Fresno, CA05, -119.305, 36.911, 1540, 58.3, M
UHL / HOT SPRINGS, Tulare, CA05, -118.633, 35.889, 3720, 52.7, M
UNDERWOOD CALIFORNIA, Trinity, CA01, -123.495, 40.722, 2600, 50.6, M
VALLEY CENTER CALIFORNIA, San Diego, CA06, -117.009, 33.237, 1483, 59.6, M
VAN BREMMER CALIFORNIA, Siskiyou, CA01, -121.794, 41.643, 4928, 44.5, M
VALYERMO CALIFORNIA, Los Angeles, CA07, -117.851, 34.446, 3780, 56.6, M
VANDENBERG CALIFORNIA, Santa Barbara, CA06, -120.486, 34.759, 1050, 56.3, M
WALKER CALIFORNIA, Mono, CA03, -119.459, 38.565, 5440, 52.1, M
WALKER PASS CALIFORNIA, Kern, CA05, -118.057, 35.665, 5572, 54.8, M
WARM SPRINGS CALIFORNIA, Los Angeles, CA06, -118.579, 34.596, 4930, 56.2, M
WEED AIRPORT CALIFORNIA, Siskiyou, CA01, -122.454, 41.479, 2930, 50.2, M
WESTWOOD CALIFORNIA, Lassen, CA02, -120.900, 40.307, 5800, 42.9, M
WHITE CLOUD CALIFORNIA, Nevada, CA02, -120.837, 39.317, 4320, 51.1, M
WHITTIER HILLS CALIFORNIA, Los Angeles, CA06, -118.010, 33.984, 950, 63.6, M
WHITMORE CALIFORNIA, Shasta, CA02, -121.899, 40.619, 2417, 57.1, M
WILEY RIDGE CALIFORNIA, Ventura, CA06, -118.841, 34.372, 1645, 59.8, M
WOFFORD HEIGHTS CALIFORNIA, Kern, CA05, -118.499, 35.722, 3150, 55.6, M
WOLVERTON CALIFORNIA, Tulare, CA05, -118.703, 36.445, 5240, 52.3, M
WOODACRE CALIFORNIA, Marin, CA01, -122.645, 37.991, 1400, 54.8, M
WHITAKER PEAK CALIFORNIA, Los Angeles, CA06, -118.740, 34.569, 4120, 55.5, M
WHITE WOLF CALIFORNIA, Tuolumne, CA05, -119.650, 37.851, 8025, 39.8, M
YOLLA BOLLA CALIFORNIA, Trinity, CA01, -123.066, 40.338, 4524, 46.4, M
YUCCA VALLEY CALIFORNIA, San Bernardino, CA07, -116.408, 34.123, 3260, 61.2, M
YUROK CALIFORNIA, Humboldt, CA01, -123.857, 41.290, 495, 53.7, M
HAGAN'S MEADOW, El Dorado, CA03, -119.940, 38.850, 7776, 37.9, 2.20
BLUE LAKES, Alpine, CA05, -119.920, 38.610, 8057, 35.8, 3.30
POISON FLAT, Alpine, CA03, -119.630, 38.510, 7736, 38.3, 1.70
SONORA PASS, Mono, CA03, -119.600, 38.310, 8827, 37.3, 2.90
LEAVITT MEADOWS, Mono, CA03, -119.550, 38.300, 7198, 41.6, 2.00
VIRGINIA LAKES RIDGE, Mono, CA03, -119.230, 38.070, 9445, 37.8, 1.20
LOBDELL LAKE, Mono, CA03, -119.370, 38.440, 9233, 35.8, 0.90
EBBETTS PASS, Alpine, CA03, -119.800, 38.550, 8765, 37.6, 4.60
HEAVENLY VALLEY, El Dorado, CA03, -119.920, 38.920, 8582, 36.8, 2.40
LEAVITT LAKE, Mono, CA03, -119.610, 38.280, 9617, 35.4, 5.10
SPRATT CREEK, Alpine, CA03, -119.820, 38.670, 6115, 44.9, 1.60
MONITOR PASS, Alpine, CA03, -119.610, 38.670, 8310, 40.1, 1.00
BURNSIDE LAKE, Alpine, CA03, -119.890, 38.720, 8129, 34.6, 3.00
SUMMIT MEADOW, Mono, CA03, -119.540, 38.400, 9313, 35.6, 2.20
FORESTDALE CREEK, Alpine, CA03, -119.960, 38.680, 8017, 39.4, 3.90
HORSE MEADOW, Alpine, CA03, -119.890, 38.840, 8557, 37.0, 1.20
CARSON PASS, Alpine, CA02, -119.990, 38.690, 8353, 37.4, 3.60
CROWDER FLAT, Modoc, CA01, -120.750, 41.890, 5170, 42.8, 2.30
CEDAR PASS, Modoc, CA02, -120.300, 41.580, 7030, 38.8, 4.60
DISMAL SWAMP, Modoc, CA03, -120.180, 41.990, 7360, 36.5, 5.80
ADIN MTN, Modoc, CA02, -120.790, 41.240, 6190, 38.9, 4.80
INDEPENDENCE CREEK, Sierra, CA03, -120.280, 39.490, 6456, 40.3, 2.70
INDEPENDENCE CAMP, Sierra, CA03, -120.290, 39.450, 7003, 38.6, 3.00
BENICIA 1.3 W, Solano, CA01, -122.178, 38.075, 304, M, 2.35
THOUSAND PALMS 0.7 W, Riverside, CA07, -116.398, 33.821, 254, M, 0.05
INDEPENDENCE LAKE, Nevada, CA03, -120.310, 39.430, 8352, 37.2, 4.30
TRUCKEE #2, Placer, CA03, -120.180, 39.300, 6509, 43.0, 2.70
WARD CREEK #3, Placer, CA03, -120.220, 39.140, 6655, 40.8, 4.80
TAHOE CITY CROSS, Placer, CA03, -120.150, 39.170, 6797, 41.2, 3.30
SQUAW VALLEY G.C., Placer, CA03, -120.260, 39.190, 8029, 38.0, 5.10
CSS LAB, Nevada, CA02, -120.370, 39.330, 6855, 39.2, 6.70
RUBICON #2, El Dorado, CA03, -120.130, 39.000, 7689, 40.2, 3.80
ECHO PEAK, El Dorado, CA03, -120.080, 38.850, 7670, 39.9, 4.90
FALLEN LEAF, El Dorado, CA03, -120.050, 38.930, 6236, 41.8, 1.90
BARSTOW 0.8 SSE, San Bernardino, CA07, -117.059, 34.867, 2609, M, 0.60
MCOLF CAMP PENDLETON RED BEACH AIRPORT, San Diego, -, -117.456, 33.286, 89, 58.3, 1.91
CAMPO ASOS, San Diego, CA07, -116.468, 32.626, 2641, 54.3, 2.26
Burbank Glendale Pasadena Area, -, -, -, -, -, 61.7, 2.14
Camarillo Area, -, -, -, -, -, 57.8, 1.69
Needles Area, -, -, -, -, -, 74.7, 0.42
Oxnard Area, -, -, -, -, -, 58.6, 2.02
Palm Springs Area, -, -, -, -, -, 73.8, 0.20
Riverside Area, -, -, -, -, -, 64.6, 0.87
Ramona Area, -, -, -, -, -, 56.2, 1.54
Northern CA 8 Station Index, -, -, -, -, -, M, 6.50
San Joaquin 5 Station Index, -, -, -, -, -, M, 4.86
SMARTSVILLE 2.4 S, Yuba, CA02, -121.291, 39.173, 859, M, 4.32
Crescent City Area, -, -, -, -, -, 49.5, 6.38
Escondido Area, -, -, -, -, -, 61.7, 1.74
Sacramento Downtown Area, -, -, -, -, -, 61.3, 2.65
Tahoe City Area, -, -, -, -, -, 40.4, 2.53
Ukiah Area, -, -, -, -, -, 55.5, 1.35
Alturas Area, -, -, -, -, -, 45.5, 1.64
Mount Shasta Area, -, -, -, -, -, 47.6, 4.44
Palmdale Area, -, -, -, -, -, 60.2, 0.62
Lancaster Area, -, -, -, -, -, 60.1, 0.82
El Cajon Area, -, -, -, -, -, 61.7, 1.54
Hanford Area, -, -, -, -, -, 61.7, 1.79
El Centro Area, -, -, -, -, -, 71.3, 0.06
Madera Area, -, -, -, -, -, 60.0, 1.59
Merced Area, -, -, -, -, -, 61.2, 1.69
San Jose Area, -, -, -, -, -, 59.7, 1.88