YUROK CALIFORNIA, Humboldt, CA01, -123.857, 41.290, 495, 48.2, M
HAGAN'S MEADOW, El Dorado, CA03, -119.940, 38.850, 7776, 30.5, 2.20
BLUE LAKES, Alpine, CA05, -119.920, 38.610, 8057, 27.5, 2.10
POISON FLAT, Alpine, CA03, -119.630, 38.510, 7736, 29.0, 1.50
SONORA PASS, Mono, CA03, -119.600, 38.310, 8827, 27.9, 1.70
LEAVITT MEADOWS, Mono, CA03, -119.550, 38.300, 7198, 32.3, 1.30
VIRGINIA LAKES RIDGE, Mono, CA03, -119.230, 38.070, 9445, 27.8, 1.60
LOBDELL LAKE, Mono, CA03, -119.370, 38.440, 9233, 26.1, 1.20
EBBETTS PASS, Alpine, CA03, -119.800, 38.550, 8765, 29.8, 3.10
HEAVENLY VALLEY, El Dorado, CA03, -119.920, 38.920, 8582, 29.0, 2.10
LEAVITT LAKE, Mono, CA03, -119.610, 38.280, 9617, 27.5, 2.70
SPRATT CREEK, Alpine, CA03, -119.820, 38.670, 6115, 34.9, 1.30
MONITOR PASS, Alpine, CA03, -119.610, 38.670, 8310, 30.0, 1.30
BURNSIDE LAKE, Alpine, CA03, -119.890, 38.720, 8129, 26.0, 2.60
SUMMIT MEADOW, Mono, CA03, -119.540, 38.400, 9313, 27.4, 1.40
FORESTDALE CREEK, Alpine, CA03, -119.960, 38.680, 8017, 30.9, 3.60
HORSE MEADOW, Alpine, CA03, -119.890, 38.840, 8557, 29.6, 1.60
CARSON PASS, Alpine, CA02, -119.990, 38.690, 8353, 29.3, 2.60
CROWDER FLAT, Modoc, CA01, -120.750, 41.890, 5170, 32.3, 1.60
CEDAR PASS, Modoc, CA02, -120.300, 41.580, 7030, 28.6, 2.30
DISMAL SWAMP, Modoc, CA03, -120.180, 41.990, 7360, 25.3, 3.90
ADIN MTN, Modoc, CA02, -120.790, 41.240, 6190, 29.8, 2.20
INDEPENDENCE CREEK, Sierra, CA03, -120.280, 39.490, 6456, 31.4, 2.30
INDEPENDENCE CAMP, Sierra, CA03, -120.290, 39.450, 7003, 31.2, 2.00
INDEPENDENCE LAKE, Nevada, CA03, -120.310, 39.430, 8352, 29.4, 3.10
POLLOCK PINES 0.5 NW, El Dorado, CA02, -120.578, 38.757, 3895, M, 0.96
EUREKA 3.0 SSW, Humboldt, CA01, -124.181, 40.757, 100, M, 2.38
MCKINLEYVILLE 0.7 ESE, Humboldt, CA01, -124.104, 40.950, 127, M, 2.97
TEHACHAPI 2.2 W, Kern, CA05, -118.480, 35.132, 3945, M, 0.60
DIAMOND BAR 1.9 NNE, Los Angeles, CA06, -117.796, 34.023, 935, M, 1.17
LA CRESCENTA-MONTROSE 3.9 NW, Los Angeles, CA06, -118.287, 34.270, 1974, M, 0.58
RANCHO PALOS VERDES 2.0 NW, Los Angeles, CA06, -118.385, 33.780, 1083, M, 0.53
YOSEMITE LAKES 4.7 S, Madera, CA05, -119.761, 37.124, 1598, M, 0.75
MARIPOSA 12.5 E, Mariposa, CA05, -119.740, 37.462, 2940, M, 3.63
BIG SUR 7.2 NNW, Monterey, CA04, -121.818, 36.353, 2434, M, 3.04
NEVADA CITY 6.1 W, Nevada, CA02, -121.135, 39.261, 2124, M, 2.61
IRVINE 2.9 WSW, Orange, CA06, -117.838, 33.640, 193, M, 0.50
MISSION VIEJO 3.5 SSE(K6WTA), Orange, CA06, -117.639, 33.563, 613, M, 1.29
IRVINE 4.1 NNE, Orange, CA06, -117.772, 33.718, 152, M, 0.58
ANAHEIM 4.9 E, Orange, CA06, -117.787, 33.847, 374, M, 0.91
LOS ALTOS HILLS 1.3 N, Santa Clara, CA04, -122.135, 37.387, 194, M, 0.87
SAN DIEGO 7.6 NNW, San Diego, CA06, -117.188, 32.916, 383, M, 1.22
CHULA VISTA 3.1SE, San Diego, CA06, -117.051, 32.604, 200, M, 1.20
TRUCKEE #2, Placer, CA03, -120.180, 39.300, 6509, 33.8, 2.80
WARD CREEK #3, Placer, CA03, -120.220, 39.140, 6655, 32.6, 4.60
TAHOE CITY CROSS, Placer, CA03, -120.150, 39.170, 6797, 34.4, 3.00
SQUAW VALLEY G.C., Placer, CA03, -120.260, 39.190, 8029, 30.3, 4.30
CSS LAB, Nevada, CA02, -120.370, 39.330, 6855, 32.6, 4.80
RUBICON #2, El Dorado, CA03, -120.130, 39.000, 7689, 31.9, 3.20
ECHO PEAK, El Dorado, CA03, -120.080, 38.850, 7670, 32.4, 4.10
FALLEN LEAF, El Dorado, CA03, -120.050, 38.930, 6236, 33.1, 2.60
ROSE VALLEY CALIFORNIA, Ventura, CA06, -119.184, 34.543, 3331, 43.6, M
ROUND MOUNTAIN, Siskiyou, CA02, -121.464, 41.427, 5258, 34.3, M
ROSE PEAK CALIFORNIA, Alameda, CA04, -121.735, 37.502, 3060, 44.7, M
RUSH CREEK CALIFORNIA, Modoc, CA02, -120.864, 41.294, 4800, 34.4, M
RUTH CALIFORNIA, Trinity, CA01, -123.316, 40.251, 2732, 43.0, M
SACRAMENTO NWR CALIFORNIA, Glenn, CA02, -122.182, 39.417, 120, 52.3, M
SADDLEBACK BUTTE CALIFORNIA, Los Angeles, CA07, -117.821, 34.685, 2590, 47.6, M
SAUGUS CALIFORNIA, Los Angeles, CA06, -118.525, 34.425, 1450, 55.9, M
SAWYERS BAR CALIFORNIA, Siskiyou, CA01, -123.132, 41.300, 2192, 43.0, M
SANTA BARBARA ISLAND CALIFORNI, Santa Barbara, CA06, -119.033, 33.483, 176, 53.6, M
SANTA CRUZ ISLAND CALIFORNIA, Santa Barbara, CA06, -119.722, 33.996, 250, 55.2, M
SCORPION CALIFORNIA, Trinity, CA01, -122.697, 41.112, 4400, 42.3, M
SODA CREEK CALIFORNIA, Lake, CA01, -122.977, 39.425, 1773, 44.2, M
SECRET TOWN CALIFORNIA, Nevada, CA02, -120.885, 39.184, 2826, 45.8, M
SANTA FE DAM CALIFORNIA, Los Angeles, CA06, -117.946, 34.121, 500, 59.3, M
SHAVER CALIFORNIA, Fresno, CA05, -119.256, 37.135, 5746, 35.9, M
SCHOOL HOUSE CALIFORNIA, Humboldt, CA01, -123.906, 41.138, 2640, 42.7, M
SHIP MTN. CALIFORNIA, Del Norte, CA01, -123.792, 41.736, 5300, 33.8, M
SHADEQUARTER CALIFORNIA, Tulare, CA05, -118.956, 36.567, 4069, 43.8, M
SIMS CALIFORNIA, Shasta, CA02, -122.373, 41.075, 2400, 45.2, M
SIMI VALLEY CALIFORNIA, Ventura, CA06, -118.814, 34.291, 914, 56.5, M
SLATER BUTTE CALIFORNIA, Siskiyou, CA01, -123.352, 41.859, 4670, 36.1, M
SAN MIGUEL CALIFORNIA, San Diego, CA06, -116.974, 32.685, 425, 57.4, M
SAN LUIS NWR CALIFORNIA, Merced, CA05, -120.794, 37.182, 65, 51.5, M
SANTA RITA CALIFORNIA, San Benito, CA05, -120.598, 36.348, 5000, 41.7, M
SOLDIER MOUNTAIN CALIFORNIA, Shasta, CA02, -121.586, 40.926, 3710, 39.4, M
SOMES BAR CALIFORNIA, Siskiyou, CA01, -123.496, 41.390, 920, 47.2, M
SQUAW SPRINGS CALIFORNIA, San Bernardino, CA07, -117.568, 35.370, 3620, 50.4, M
SQUAW LAKE CALIFORNIA, Imperial, CA07, -114.494, 32.908, 300, 61.8, M