Name, County, ClimateDivision, Longitude, Latitude, Elevation, MeanAvgTemperature, TotalPrecipitation
IMPERIAL, Imperial, CA07, -115.567, 32.849, -64, 68.1, 0.07
EL CAPITAN DAM, San Diego, CA06, -116.815, 32.886, 600, 58.6, 2.18
LAKESIDE 2 E, San Diego, CA06, -116.895, 32.854, 690, M, 2.07
POWAY VALLEY, San Diego, CA06, -117.031, 33.020, 648, 61.2, 2.08
JULIAN CDF, San Diego, CA06, -116.592, 33.076, 4215, 54.7, 3.99
CARLSBAD MCCLELLAN PALOMAR AP, San Diego, CA06, -117.277, 33.130, 313, 59.1, 1.43
HENSHAW DAM, San Diego, CA06, -116.761, 33.237, 2700, 54.2, 4.16
VISTA, San Diego, CA06, -117.232, 33.235, 430, 59.5, 1.47
OCEANSIDE MARINA, San Diego, CA06, -117.395, 33.210, 10, 57.2, 1.29
NILAND, Imperial, CA07, -115.524, 33.278, -60, M, 0.00
BORREGO DESERT PARK, San Diego, CA07, -116.404, 33.256, 810, 72.3, 0.33
PALOMAR MTN OBSERVATORY, San Diego, CA06, -116.840, 33.378, 5550, 52.9, 5.29
MECCA FIRE STATION, Riverside, CA07, -116.073, 33.570, -183, M, 0.09
LAGUNA BEACH, Orange, CA06, -117.781, 33.545, 44, M, 1.34
BLYTHE ASOS, Riverside, CA07, -114.715, 33.619, 395, 73.3, 0.14
DESERT RESORTS REGIONAL AP, Riverside, CA07, -116.164, 33.632, -118, 71.1, 0.06
BARSTOW-DAGGETT AIRPORT, San Bernardino, CA07, -116.787, 34.854, 1919, 67.0, 0.18
MERCED, Merced, CA05, -120.516, 37.289, 154, 60.8, 2.23
SAN DIEGO MONTGOMERY FIELD, San Diego, CA06, -117.137, 32.815, 418, 60.4, 1.16
SAN DIEGO INTERNATIONAL AP, San Diego, CA06, -117.183, 32.734, 15, 61.1, 0.88
SAN DIEGO MIRAMAR NAS, San Diego, CA06, -117.133, 32.867, 477, 59.9, 1.27
NORTH ISLAND NAS, San Diego, CA06, -117.210, 32.692, 14, 63.4, 1.03
SAN FRANCISCO INTERNATIONAL AP, San Mateo, CA04, -122.366, 37.620, 10, 56.9, 2.79
SAN LUIS OBISPO MCCHESNEY FIELD, San Luis Obispo, CA04, -120.644, 35.238, 183, 58.4, 3.01
CEDARVILLE, Modoc, CA03, -120.179, 41.530, 4688, 47.3, 1.86
CHICO UNIVERSITY FARM, Butte, CA02, -121.821, 39.691, 185, 58.7, 2.35
CHULA VISTA, San Diego, CA06, -117.086, 32.640, 56, 60.8, 0.81
COLFAX, Placer, CA02, -120.947, 39.090, 2373, 54.9, 6.06
CUYAMACA, San Diego, CA06, -116.587, 32.990, 4640, 48.6, 4.60
DAVIS 2 WSW EXP FARM, Yolo, CA02, -121.776, 38.535, 60, 59.6, 2.01
DEATH VALLEY NATIONAL PARK, Inyo, CA07, -116.867, 36.463, -194, 78.6, 0.23
FAIRMONT, Los Angeles, CA07, -118.430, 34.705, 3060, 58.5, 2.30
FORT BRAGG 5 N, Mendocino, CA01, -123.756, 39.510, 123, 50.4, 2.94
HANFORD 1 S, Kings, CA05, -119.637, 36.316, 237, 61.6, 1.39
HAPPY CAMP RANGER STATION, Siskiyou, CA01, -123.375, 41.796, 1142, 48.7, 4.74
HEALDSBURG, Sonoma, CA01, -122.866, 38.629, 177, 58.1, 3.47
INDIO FIRE STATION, Riverside, CA07, -116.215, 33.709, -21, 73.5, T
LEMON COVE, Tulare, CA05, -119.026, 36.382, 513, 61.1, 4.11
LIVERMORE, Alameda, CA04, -121.751, 37.682, 529, 59.2, 2.01
LODI, San Joaquin, CA05, -121.288, 38.106, 40, 58.8, 2.30
MERCED MUNICIPAL AP, Merced, CA05, -120.518, 37.286, 152, 61.2, 1.69
NAPA STATE HOSPITAL, Napa, CA01, -122.265, 38.278, 35, 59.3, 2.48
OJAI, Ventura, CA06, -119.227, 34.448, 745, 59.2, 2.33
ORLAND, Glenn, CA02, -122.200, 39.746, 254, 59.6, 1.67
ORLEANS, Humboldt, CA01, -123.532, 41.309, 403, 55.2, 4.39
PASADENA, Los Angeles, CA06, -118.145, 34.148, 864, 65.0, 3.14
PASO ROBLES, San Luis Obispo, CA04, -120.685, 35.628, 730, 57.7, 2.60
PETALUMA AIRPORT, Sonoma, CA01, -122.608, 38.258, 20, 56.3, 1.56
QUINCY, Plumas, CA02, -120.947, 39.937, 3420, 47.2, 5.79
REDLANDS, San Bernardino, CA06, -117.195, 34.037, 1410, 63.9, 1.58
SANTA BARBARA, Santa Barbara, CA06, -119.684, 34.417, 16, 59.3, 3.15
SANTA CRUZ, Santa Cruz, CA04, -122.000, 36.988, 70, 56.9, 3.10
SANTA ROSA, Sonoma, CA01, -122.713, 38.456, 166, 56.7, 2.43
TAHOE CITY, Placer, CA03, -120.143, 39.168, 6230, 40.4, 2.53
UKIAH, Mendocino, CA01, -123.210, 39.147, 636, 55.6, 1.55
WASCO, Kern, CA05, -119.352, 35.589, 291, 62.6, 1.50
WEAVERVILLE, Trinity, CA01, -122.940, 40.737, 2058, 51.9, 2.92
WILLOWS 6 W, Glenn, CA02, -122.305, 39.523, 234, 59.4, 1.36
YOSEMITE PARK HEADQUARTERS, Mariposa, CA05, -119.590, 37.750, 4018, 51.1, 4.45
YREKA, Siskiyou, CA01, -122.641, 41.703, 2709, 50.1, 1.28
BERKELEY, Alameda, CA04, -122.260, 37.874, 310, 56.3, 2.96
BLYTHE, Riverside, CA07, -114.597, 33.613, 268, 72.9, 0.08
EUREKA WFO WOODLEY ISLAND, Humboldt, CA01, -124.160, 40.810, 20, 50.3, 4.76
INDEPENDENCE, Inyo, CA07, -118.204, 36.798, 3950, 61.7, 0.02
SAN LUIS OBISPO POLY, San Luis Obispo, CA04, -120.662, 35.306, 308, 59.5, 3.69
BURNEY, Shasta, CA02, -121.655, 40.880, 3198, 46.7, 3.33
IMPERIAL BEACH REAM FIELD NAS, San Diego, CA06, -117.117, 32.568, 24, 61.5, 0.40
CAMPO, San Diego, CA06, -116.470, 32.626, 2630, 55.9, 2.85
EL CENTRO 2 SSW, Imperial, CA07, -115.562, 32.767, -30, 71.9, 0.00
IMPERIAL COUNTY AP, Imperial, CA07, -115.577, 32.835, -55, 71.3, 0.06
EL CENTRO NAF, Imperial, CA07, -115.664, 32.832, -46, 71.0, 0.08
ALPINE, San Diego, CA06, -116.777, 32.836, 1695, 59.2, 2.77
DEEP CANYON LAB, Riverside, CA07, -116.376, 33.651, 1200, M, 0.59
ELSINORE, Riverside, CA06, -117.346, 33.686, 1268, 63.9, 1.18
SANTA ANA JOHN WAYNE AP, Orange, CA06, -117.867, 33.680, 43, 62.0, 1.06
HAYFIELD PUMPING PLANT, Riverside, CA07, -115.629, 33.704, 1370, 69.2, 0.37
IDYLLWILD FIRE DEPT, Riverside, CA06, -116.707, 33.757, 5380, 51.2, 3.91
SAN JACINTO, Riverside, CA06, -116.975, 33.797, 1525, 63.3, 1.22
HEMET, Riverside, CA06, -116.894, 33.738, 1811, 63.1, 1.47
SANTA ANA FIRE STATION, Orange, CA06, -117.867, 33.744, 135, 63.9, 3.09
EAGLE MOUNTAIN, Riverside, CA07, -115.451, 33.809, 973, 71.1, 0.25
PALM SPRINGS, Riverside, CA07, -116.510, 33.828, 425, 75.6, 0.14
LONG BEACH DAUGHERTY AP, Los Angeles, CA06, -118.147, 33.812, 34, 63.1, 1.53
PALOS VERDES ES FC43D, Los Angeles, CA06, -118.391, 33.800, 220, M, 1.70
FULLERTON MUNICIPAL AP, Orange, CA06, -117.986, 33.872, 86, 65.3, 0.95
BEAUMONT #2, Riverside, CA07, -116.990, 33.926, 2591, M, 1.74
MARCH AFB, Riverside, CA06, -117.250, 33.900, 1536, 60.7, 0.79
YORBA LINDA, Orange, CA06, -117.819, 33.890, 350, M, 0.34
DOWNEY FIRE DEPT. FC107C, Los Angeles, CA06, -118.145, 33.930, 110, M, 1.85
HAWTHORNE MUNICIPAL AP, Los Angeles, CA06, -118.333, 33.924, 55, 61.5, 1.89
LOS ANGELES INTL AP, Los Angeles, CA06, -118.387, 33.938, 97, 59.7, 1.51
RIVERSIDE FIRE STATION 3, Riverside, CA06, -117.388, 33.951, 840, 64.8, 1.01
RIVERSIDE MUNICIPAL AP, Riverside, CA06, -117.435, 33.953, 845, 64.6, 0.87
CHINO AP, San Bernardino, CA06, -117.625, 33.976, 636, 62.4, 0.62
WHITTIER CITY YARD FC106C, Los Angeles, CA06, -118.022, 33.976, 446, M, 0.83
CULVER CITY, Los Angeles, CA06, -118.414, 34.005, 92, 59.8, 1.59
SANTA MONICA MUNICIPAL AP, Los Angeles, CA06, -118.447, 34.021, 175, 59.9, 1.43
SANTA MONICA PIER, Los Angeles, CA06, -118.500, 34.008, 14, 58.4, 0.34
ONTARIO INTL AP, San Bernardino, CA06, -117.577, 34.053, 924, 62.9, 1.31
POMONA/FAIRPLEX, Los Angeles, CA06, -117.766, 34.082, 999, 63.4, 0.56
COVINA CITY YARD FC387B, Los Angeles, CA06, -117.880, 34.092, 607, M, 2.02
U C L A, Los Angeles, CA06, -118.443, 34.070, 430, 60.5, 1.82
TOPANGA PATROL FC-6, Los Angeles, CA06, -118.599, 34.084, 745, M, 1.03
IRON MOUNTAIN, San Bernardino, CA07, -115.122, 34.147, 922, 74.1, 0.26
TWENTYNINE PALMS, San Bernardino, CA07, -116.037, 34.128, 1975, 68.3, 0.00
JOSHUA TREE, San Bernardino, CA07, -116.275, 34.147, 2563, 64.5, 0.14
SAN DIMAS FIRE FC 95, Los Angeles, CA06, -117.802, 34.105, 958, M, 1.95
SAN GABRIEL FIRE DEPT, Los Angeles, CA06, -118.100, 34.084, 363, 61.9, 1.72
POINT MUGU NF, Ventura, CA06, -119.123, 34.124, 12, 55.5, 0.03
ALTADENA, Los Angeles, CA06, -118.138, 34.182, 1127, M, 2.97
SAN GABRIEL CANYON PH, Los Angeles, CA06, -117.908, 34.155, 744, 66.0, 3.39
WOODLAND HILLS PIERCE COLLEGE, Los Angeles, CA06, -118.574, 34.182, 790, 63.0, 1.96
LYTLE CREEK R S, San Bernardino, CA06, -117.471, 34.238, 2730, M, 0.00
SAN GABRIEL DAM FC425B-E, Los Angeles, CA06, -117.861, 34.205, 1481, 60.1, 4.33
MT WILSON CBS, Los Angeles, CA06, -118.071, 34.231, 5710, 53.4, 2.51
VAN NUYS AP, Los Angeles, CA06, -118.491, 34.212, 785, 62.7, 2.34
CAMARILLO AP, Ventura, CA06, -119.088, 34.211, 71, 57.8, 1.69
OXNARD VENTURA COUNTY AP, Ventura, CA06, -119.204, 34.200, 39, 57.8, 1.89
PARKER RESRVOIR, San Bernardino, CA07, -114.171, 34.290, 738, 74.1, 0.30
TWENTYNINE PALMS MC, San Bernardino, CA07, -116.147, 34.294, 2003, M, 0.00
BIG BEAR LAKE, San Bernardino, CA06, -116.917, 34.243, 6753, 45.7, 2.15
CHATSWORTH FC 24 F, Los Angeles, CA06, -118.600, 34.250, 950, M, 2.12
VENTURA, Ventura, CA06, -119.292, 34.283, 105, M, 2.15
CRYSTAL LAKE FC238C, Los Angeles, CA06, -117.842, 34.318, 5345, M, 3.97
BIG TUJUNGA DAM FC46, Los Angeles, CA06, -118.188, 34.295, 2326, M, 3.05
PACOIMA DAM FC33A-E, Los Angeles, CA06, -118.400, 34.329, 1550, M, 2.60
PIRU 2 ESE, Ventura, CA06, -118.757, 34.406, 712, M, 1.96
SANTA BARBARA MUNI AP, Santa Barbara, CA06, -119.842, 34.424, 8, 55.4, 2.22
JUNCAL DAM, Santa Barbara, CA06, -119.507, 34.491, 2260, M, 3.86
VICTORVILLE, San Bernardino, CA07, -117.293, 34.529, 2880, 60.8, 0.84
ACTON ESCONDIDO FC261, Los Angeles, CA06, -118.271, 34.494, 2833, M, 1.56
GIBRALTAR DAM NO. 2, Santa Barbara, CA06, -119.682, 34.523, 1558, M, 2.98
AMBOY, San Bernardino, CA07, -115.744, 34.559, 648, 73.0, 0.30
PALMDALE, Los Angeles, CA07, -118.094, 34.588, 2612, 61.8, 0.71
SAUGUS POWER PLANT 1, Los Angeles, CA06, -118.454, 34.590, 2161, 60.3, 2.57
LOS PRIETOS RS, Santa Barbara, CA06, -119.791, 34.544, 1024, M, 3.19
CACHUMA LAKE, Santa Barbara, CA06, -119.982, 34.582, 789, 58.8, 3.21
SALSIPUEDES GAGING STATION, Santa Barbara, CA06, -120.408, 34.585, 254, M, 3.36
PALMDALE AP, Los Angeles, CA07, -118.083, 34.629, 2509, 60.2, 0.62
LOMPOC, Santa Barbara, CA06, -120.451, 34.654, 75, 57.5, 2.47
LANCASTER, Los Angeles, CA06, -118.213, 34.741, 2338, 60.1, 0.82
SANDBERG, Los Angeles, CA06, -118.724, 34.744, 4510, 51.7, 1.53
LEBEC, Kern, CA05, -118.865, 34.833, 3575, 51.4, 1.55
NEW CUYAMA FIRE STATION, Santa Barbara, CA06, -119.683, 34.946, 2160, 55.9, 0.88
TWITCHELL DAM, Santa Barbara, CA06, -120.321, 34.988, 582, 60.7, 2.60
TEHACHAPI AP, Kern, CA05, -118.432, 35.131, 3960, 49.9, 0.38
PISMO BEACH, San Luis Obispo, CA04, -120.683, 35.160, 39, 56.6, 1.88
BAKER, San Bernardino, CA07, -116.063, 35.276, 962, 70.2, 0.16
SALINAS DAM, San Luis Obispo, CA04, -120.504, 35.337, 1392, 59.5, 3.38
RANDSBURG, Kern, CA07, -117.652, 35.369, 3570, 63.5, 0.12
SANTA MARGARITA BOOST, San Luis Obispo, CA04, -120.637, 35.374, 1148, 59.5, 4.50
MORRO BAY FIRE DEPT, San Luis Obispo, CA04, -120.845, 35.367, 118, 60.6, 2.15
BAKERSFIELD AP, Kern, CA05, -119.055, 35.434, 490, 63.4, 1.62
BUTTONWILLOW, Kern, CA05, -119.470, 35.403, 225, 63.3, 1.22
GLENNVILLE, Kern, CA05, -118.701, 35.727, 3140, 50.3, 4.23
TRONA, San Bernardino, CA07, -117.391, 35.764, 1695, 66.2, 0.16
DELANO, Kern, CA05, -119.260, 35.768, 302, 62.4, 1.76
BRADLEY TELEMETERING, Monterey, CA04, -120.868, 35.930, 443, M, 2.20
PORTERVILLE MUNICIPAL AIRPORT, Tulare, CA05, -119.062, 36.029, 442, 60.2, 2.29
KETTLEMAN CITY, Kings, CA05, -119.960, 36.007, 240, 61.8, 1.24
HAIWEE, Inyo, CA07, -117.953, 36.139, 3825, 61.4, 0.03
CORCORAN IRRIGATION DIST., Kings, CA05, -119.582, 36.098, 200, 62.5, 0.94
COALINGA, Fresno, CA05, -120.361, 36.136, 670, 59.5, T
KING CITY, Monterey, CA04, -121.138, 36.207, 320, 59.3, 2.01
LINDSAY, Tulare, CA05, -119.054, 36.203, 435, 58.8, 3.85
BIG SUR STATION, Monterey, CA04, -121.780, 36.247, 200, 54.5, 4.44
VISALIA, Tulare, CA05, -119.300, 36.328, 303, 59.6, 2.78
FIVE POINTS 5 SSW, Fresno, CA05, -120.156, 36.364, 285, 62.8, 1.02
SAN CLEMENTE DAM, Monterey, CA04, -121.709, 36.438, 600, M, 2.41
ASH MOUNTAIN, Tulare, CA05, -118.825, 36.491, 1708, 56.0, 4.97
THREE RIVERS EDISON PH 1, Tulare, CA05, -118.862, 36.465, 1140, 60.0, 5.35
PINNACLES NATIONAL PARK, San Benito, CA04, -121.182, 36.482, 1307, 56.2, 1.61
CARMEL VALLEY, Monterey, CA04, -121.724, 36.481, 480, 55.7, 2.49
LODGEPOLE, Tulare, CA05, -118.732, 36.604, 6735, 39.3, 6.31
PANOCHE 2 W, San Benito, CA05, -120.884, 36.607, 1400, M, 1.14
MONTEREY, Monterey, CA04, -121.855, 36.593, 122, 54.1, 2.49
SALINAS NO. 2, Monterey, CA04, -121.666, 36.659, 45, 56.0, 2.05
SALINAS AP, Monterey, CA04, -121.609, 36.664, 73, 57.8, 1.85
GRANT GROVE, Tulare, CA05, -118.962, 36.738, 6580, 43.4, 6.37
PINE FLAT DAM, Fresno, CA05, -119.337, 36.821, 615, 60.8, 3.20
LOS BANOS ARBURUA RANCH, Merced, CA05, -120.939, 36.875, 843, M, 0.91
HOLLISTER 2, San Benito, CA04, -121.421, 36.848, 275, 57.0, 2.94
BALCH POWER HOUSE, Fresno, CA05, -119.088, 36.909, 1735, 56.8, 4.41
WATSONVILLE WATERWORKS, Santa Cruz, CA04, -121.769, 36.931, 95, 57.1, 3.13
FRIANT GOVERNMENT CAMP, Fresno, CA05, -119.707, 36.997, 410, 58.6, 2.04
MADERA, Madera, CA05, -120.038, 36.954, 270, 60.9, 1.03
WISHON DAM, Fresno, CA05, -118.984, 37.007, 6550, M, 3.58
GILROY, Santa Clara, CA04, -121.561, 37.003, 194, 58.5, 1.02
AUBERRY 2 NW, Fresno, CA05, -119.513, 37.092, 2090, 56.8, 3.73
LOS BANOS, Merced, CA05, -120.867, 37.056, 120, 62.3, 0.90
BEN LOMOND NO. 4, Santa Cruz, CA04, -122.080, 37.086, 420, 61.1, 3.86
MORGAN HILL, Santa Clara, CA04, -121.602, 37.136, 375, 67.0, 0.00
ASPENDELL, Inyo, CA01, -118.599, 37.232, 8470, 40.5, 0.46
HUNTINGTON LAKE, Fresno, CA05, -119.221, 37.228, 7020, M, 5.04
NORTH FORK RS, Madera, CA05, -119.510, 37.233, 2645, 52.3, 4.55
LOS GATOS, Santa Clara, CA04, -121.959, 37.232, 365, 57.9, 2.16
NEWMAN, Stanislaus, CA05, -121.018, 37.281, 90, 63.9, 0.97
MOUNT HAMILTON, Santa Clara, CA04, -121.635, 37.343, 4220, 48.5, 3.92
BISHOP AIRPORT, Inyo, CA07, -118.359, 37.371, 4110, 55.5, 0.23
MOFFETT FEDERAL AIRFIELD, Santa Clara, CA04, -122.048, 37.406, 39, 59.1, 1.68
WOODSIDE FIRE STATION 1, San Mateo, CA04, -122.256, 37.429, 380, 58.9, 3.74
TURLOCK #2, Stanislaus, CA05, -120.846, 37.502, 103, 60.7, 1.64
PALO ALTO, Santa Clara, CA04, -122.140, 37.444, 25, 57.0, 1.99
REDWOOD CITY, San Mateo, CA04, -122.239, 37.477, 31, 58.7, 3.12
HALF MOON BAY, San Mateo, CA04, -122.443, 37.473, 27, 53.6, 2.41
SO ENTRANCE YOSEMITE N.P., Mariposa, CA05, -119.633, 37.512, 5047, 43.2, 2.17
MARIPOSA R S, Mariposa, CA05, -119.986, 37.495, 2100, M, 4.70
NEWARK, Alameda, CA04, -122.032, 37.515, 10, 58.3, 2.24
MODESTO AP, Stanislaus, CA05, -120.955, 37.625, 87, 60.9, 2.25
HAYWARD AIR TERMINAL, Alameda, CA04, -122.121, 37.659, 31, 57.5, 2.82
TRACY CARBONA, San Joaquin, CA05, -121.347, 37.682, 135, 59.2, 1.73
LIVERMORE MUNICIPAL AP, Alameda, CA04, -121.815, 37.693, 393, 58.4, 1.84
OAKLAND INTERNATIONAL AIRPORT, Alameda, CA04, -122.233, 37.718, 5, 56.5, 2.98
UPPER SAN LEANDRO FILTERS, Alameda, CA04, -122.167, 37.772, 394, M, 3.45
SAN FRANCISCO DOWNTOWN, San Francisco, CA04, -122.427, 37.771, 150, 56.1, 2.74
SAN FRANCISCO OCEANSIDE, San Francisco, CA04, -122.505, 37.728, 8, 53.4, 1.28
GROVELAND 2, Tuolumne, CA05, -120.226, 37.844, 2800, 51.2, 6.45
TRACY PUMPING PLANT, Alameda, CA05, -121.583, 37.796, 61, 61.9, 1.93
OAKLAND MUSEUM, Alameda, CA04, -122.264, 37.798, 30, 58.3, 2.61
TUOLUMNE MEADOWS R.S., Tuolumne, CA05, -119.344, 37.877, 8694, 37.0, 0.00
MOUNT DIABLO JUNCTION, Contra Costa, CA04, -121.930, 37.879, 2170, 52.8, 4.41
STOCKTON AP, San Joaquin, CA05, -121.226, 37.890, 27, 60.1, 2.03
RICHMOND, Contra Costa, CA04, -122.377, 37.919, 20, 59.8, 2.34
MUIR WOODS, Marin, CA01, -122.569, 37.898, 220, M, 1.51
HETCH HETCHY, Tuolumne, CA05, -119.783, 37.961, 3870, 50.6, 4.99
CHERRY VALLEY DAM, Tuolumne, CA05, -119.916, 37.975, 4765, 48.8, 6.06
SONORA, Tuolumne, CA05, -120.387, 37.967, 1675, 53.1, 4.96
STOCKTON FIRE STA 4, San Joaquin, CA05, -121.318, 37.999, 12, 62.4, 1.82
ANTIOCH PUMPING PLANT #3, Contra Costa, CA05, -121.752, 37.983, 60, 61.7, M
CONCORD BUCHANAN FIELD, Contra Costa, CA04, -122.053, 37.992, 23, 58.9, 2.41
CONCORD WASTEWATER PLANT, Contra Costa, CA04, -122.069, 37.983, 40, 60.7, 2.59
SAN RAFAEL-CIVIC CENTER, Marin, CA01, -122.537, 37.998, 120, 57.9, 0.15
KENTFIELD, Marin, CA01, -122.545, 37.957, 145, 57.0, 2.41
MARTINEZ WATER PLANT, Contra Costa, CA04, -122.114, 38.013, 40, 59.3, 2.94
BODIE CALIFORNIA STATE HISTORIC PARK, Mono, CA03, -119.014, 38.212, 8370, 37.1, 0.23
ACAMPO 5NE, San Joaquin, CA05, -121.201, 38.218, 87, M, 2.57
NAPA COUNTY AIRPORT, Napa, CA04, -122.280, 38.208, 16, 56.4, 1.73
BRIDGEPORT, Mono, CA03, -119.229, 38.258, 6470, 42.8, 0.05
CALAVERAS BIG TREES, Calaveras, CA05, -120.311, 38.277, 4695, 45.0, 6.52
CAMP PARDEE, Calaveras, CA05, -120.843, 38.249, 658, 58.3, 4.37
TRAVIS FIELD AFB, Solano, CA02, -121.933, 38.267, 62, M, 2.65
FAIRFIELD, Solano, CA02, -122.068, 38.274, 40, 59.8, 2.31
SONOMA, Sonoma, CA01, -122.462, 38.299, 97, 57.1, 1.82
SUTTER HILL CDF, Amador, CA05, -120.801, 38.377, 1586, 55.4, 2.33
WEST POINT, Calaveras, CA05, -120.545, 38.378, 2775, M, 5.39
ATLAS ROAD BROWN, Napa, CA01, -122.248, 38.427, 1680, M, 3.76
GRATON, Sonoma, CA01, -122.865, 38.431, 200, 56.2, 2.85
OCCIDENTAL, Sonoma, CA01, -122.966, 38.386, 865, 54.6, 3.31
FIDDLETOWN DEXTER RCH, Amador, CA05, -120.698, 38.525, 2170, M, 6.80
SACRAMENTO AP ASOS, Sacramento, CA02, -121.496, 38.507, 19, 59.4, 2.42
WINTERS, Yolo, CA02, -121.978, 38.525, 135, 61.4, 2.06
LAKE SOLANO, Solano, CA02, -122.004, 38.492, 187, 60.3, 2.10
SAINT HELENA, Napa, CA01, -122.471, 38.507, 225, 58.9, 3.34
SAINT HELENA 4 WSW, Napa, CA01, -122.538, 38.493, 1780, M, 3.84
FORT ROSS, Sonoma, CA01, -123.245, 38.515, 112, 51.1, 2.17
SACRAMENTO 5 ESE, Sacramento, CA02, -121.418, 38.555, 38, 61.3, 2.65
ANGWIN PACIFIC UNION COLLEGE, Napa, CA01, -122.440, 38.573, 1715, 53.5, 2.87
CALISTOGA, Napa, CA01, -122.578, 38.577, 350, 56.2, 3.01
VENADO, Sonoma, CA01, -123.018, 38.609, 1260, M, 3.44
WOODLAND 1 WNW, Yolo, CA02, -121.794, 38.683, 67, 61.7, 2.12
PLACERVILLE IFG, El Dorado, CA02, -120.733, 38.733, 2755, 51.5, 7.66
SACRAMENTO METROPOLITAN AP, Sacramento, CA02, -121.595, 38.701, 24, 60.2, 1.91
PACIFIC HOUSE, El Dorado, CA02, -120.503, 38.758, 3450, 48.8, 7.94
MIDDLETOWN, Lake, CA02, -122.626, 38.748, 1121, M, 3.20
CLOVERDALE, Sonoma, CA01, -123.026, 38.793, 400, 58.5, 2.57
KELSEY 1 N, El Dorado, CA02, -120.821, 38.809, 2000, M, 5.94
SOUTH LAKE TAHOE AP, El Dorado, CA03, -119.996, 38.898, 6257, 42.3, 0.93
GEORGETOWN RS, El Dorado, CA02, -120.801, 38.933, 3001, 51.6, 5.01
AUBURN, Placer, CA02, -121.084, 38.907, 1292, 56.4, 6.47
NICOLAUS #2, Sutter, CA02, -121.545, 38.926, 43, M, 2.24
YORKVILLE, Mendocino, CA01, -123.231, 38.905, 1100, M, 3.24
CLEARLAKE 4 SE, Lake, CA02, -122.567, 38.924, 1349, 54.7, 2.49
FORESTHILL RANGER STATION, Placer, CA02, -120.845, 39.010, 3015, M, 7.73
MARYSVILLE AIRPORT (ASOS), Yuba, CA02, -121.569, 39.102, 62, 60.3, 2.82
UKIAH MUNICIPAL AP, Mendocino, CA01, -123.200, 39.128, 603, 55.5, 1.35
UKIAH 4 WSW, Mendocino, CA01, -123.272, 39.127, 1328, M, 3.27
GOLD RUN 4 SW, Placer, CA02, -120.900, 39.150, 3220, M, 9.56
WILLIAMS, Colusa, CA02, -122.150, 39.150, 85, M, 4.28
GRASS VALLEY NO. 2, Nevada, CA02, -121.068, 39.204, 2400, 51.4, 8.79
HARRY L. ENGLEBRIGHT DAM, Nevada, CA02, -121.267, 39.237, 800, M, 4.79
COLUSA 2 SSW, Colusa, CA02, -122.027, 39.188, 50, 60.9, 1.63
BLUE CANYON NYACK AP, Placer, CA02, -120.709, 39.276, 5286, 46.4, 6.20
NEVADA CITY, Nevada, CA02, -121.001, 39.247, 2781, 51.4, 10.67
TRUCKEE AIRPORT, Nevada, CA03, -120.139, 39.320, 5900, 39.0, 2.06
DONNER MEMORIAL ST PARK, Nevada, CA03, -120.233, 39.324, 5937, 41.2, 3.15
COLGATE POWERHOUSE, Yuba, CA02, -121.192, 39.331, 595, M, 5.57
MOULTON WEIR, Colusa, CA02, -122.017, 39.333, 76, M, 1.20
BOCA, Nevada, CA03, -120.094, 39.389, 5575, 42.3, 1.60
POTTER VALLEY POWERHOUSE, Mendocino, CA01, -123.129, 39.362, 1018, 55.9, 2.79
FARAD, Nevada, CA03, -120.033, 39.428, 5153, M, 1.27
WILLITS 1 NE, Mendocino, CA01, -123.342, 39.419, 1353, 49.9, 3.12
BOWMAN DAM, Nevada, CA02, -120.656, 39.454, 5385, 45.0, 9.74
OROVILLE, Butte, CA02, -121.553, 39.518, 171, 58.8, 3.90
OROVILLE MUNICIPAL AP, Butte, CA02, -121.622, 39.494, 187, 59.6, 2.34
SIERRAVILLE RS, Sierra, CA02, -120.370, 39.583, 4975, 45.8, 2.62
DOWNIEVILLE, Sierra, CA02, -120.824, 39.563, 2915, 50.9, 8.51
STRAWBERRY VALLEY, Yuba, CA02, -121.108, 39.563, 3808, 46.7, 11.69
STONY GORGE RESERVOIR, Glenn, CA02, -122.534, 39.586, 800, 55.3, 1.31
BRUSH CREEK RANGER STATION, Butte, CA02, -121.345, 39.695, 3560, M, 8.20
PARADISE, Butte, CA02, -121.624, 39.754, 1750, 57.5, 5.47
COVELO, Mendocino, CA01, -123.244, 39.816, 1413, 52.1, 3.14
VINTON, Plumas, CA02, -120.186, 39.806, 4950, 48.6, 0.84
PORTOLA, Plumas, CA02, -120.472, 39.805, 4850, 45.2, 2.83
DE SABLA, Butte, CA02, -121.611, 39.872, 2710, 52.2, 6.80
LEGGETT, Mendocino, CA01, -123.720, 39.874, 703, M, 5.72
BUCKS CREEK, Plumas, CA02, -121.315, 39.937, 1891, M, 8.98
DOYLE 4 SSE, Lassen, CA03, -120.083, 39.972, 4390, 49.9, 0.56
DOYLE, Lassen, CA03, -120.105, 40.027, 4293, M, 0.32
CANYON DAM, Plumas, CA02, -121.089, 40.171, 4560, 44.1, 4.97
MIRANDA 4 SE, Humboldt, CA01, -123.776, 40.182, 266, M, 5.32
FORT SEWARD, Humboldt, CA01, -123.632, 40.218, 220, M, 5.04
HONEYDEW 1 SW, Humboldt, CA01, -124.132, 40.238, 373, M, 5.92
CHESTER, Plumas, CA02, -121.242, 40.303, 4530, 43.3, 4.47
MINERAL, Tehama, CA02, -121.609, 40.346, 4875, 37.8, 7.50
COLEMAN FISHERIES STATION, Shasta, CA02, -122.143, 40.400, 420, M, 3.46
VOLTA PH, Shasta, CA02, -121.866, 40.458, 2220, M, 2.51
SCOTIA, Humboldt, CA01, -124.104, 40.483, 136, 54.3, 3.84
MANZANITA LAKE, Shasta, CA02, -121.577, 40.541, 5750, 39.2, 3.77
WHISKEYTOWN RESERVOIR, Shasta, CA02, -122.528, 40.612, 1295, 55.0, 4.42
SHASTA DAM, Shasta, CA02, -122.416, 40.714, 1075, 56.5, 5.30
TRINITY RIVER HATCHERY, Trinity, CA01, -122.795, 40.726, 1861, 51.6, 2.14
BIG BAR 4 E, Trinity, CA01, -123.208, 40.741, 1253, 54.9, 2.83
BUCKHORN, Shasta, CA02, -121.932, 40.880, 3700, M, 6.26
HAT CREEK, Shasta, CA02, -121.543, 40.932, 3015, 48.8, 2.78
PIT RIVER PH 5, Shasta, CA02, -121.977, 40.987, 1458, M, 6.33
WILLOW CREEK 1 NW, Humboldt, CA01, -123.636, 40.947, 464, 54.5, 3.08
FALL RIVER MILLS, Shasta, CA02, -121.435, 41.008, 3300, M, 2.59
ADIN RANGER STATION, Modoc, CA02, -120.945, 41.193, 4202, M, 2.06
DUNSMUIR TREATMENT PL, Siskiyou, CA02, -122.282, 41.183, 2169, 49.6, 7.70
JESS VALLEY, Modoc, CA02, -120.295, 41.268, 5400, 43.9, 1.91
MCCLOUD, Siskiyou, CA02, -122.138, 41.252, 3233, 43.8, 5.65
ORICK, Humboldt, CA01, -124.067, 41.283, 5, M, 6.12
CALLAHAN, Siskiyou, CA01, -122.825, 41.338, 3085, 49.9, 1.96
SAWYERS BAR RS, Siskiyou, CA01, -123.133, 41.301, 2255, 47.0, 3.32
ORLEANS RS, Humboldt, CA01, -123.534, 41.303, 433, M, 3.96
CANBY 3 SW, Modoc, CA02, -120.902, 41.422, 4310, M, 0.00
ALTURAS, Modoc, CA02, -120.544, 41.490, 4378, 45.5, 1.60
FORT JONES RS, Siskiyou, CA01, -122.848, 41.601, 2729, 46.1, 0.90
LAVA BEDS NAT MON, Siskiyou, CA01, -121.501, 41.702, 4770, 42.7, 2.36
MOUNT HEBRON RS, Siskiyou, CA01, -122.045, 41.783, 4265, 46.0, 0.80
CRESCENT CITY 3 NNW, Del Norte, CA01, -124.215, 41.796, 43, 50.1, 8.68
CRESCENT CITY MCNAMARA AP, Del Norte, CA01, -124.238, 41.784, 56, 49.5, 6.38
OAK KNOLL W. C., Siskiyou, CA01, -122.850, 41.839, 1980, M, 1.12
FORT BIDWELL, Modoc, CA03, -120.157, 41.872, 4739, 47.0, 1.86
GASQUET RS, Del Norte, CA01, -123.965, 41.845, 387, 48.7, 12.15
FORT DICK RIVER, Del Norte, CA01, -124.135, 41.881, -, M, 10.96
TULELAKE, Siskiyou, CA01, -121.474, 41.960, 4038, 45.6, 0.98
COPCO NO 1 DAM, Siskiyou, CA01, -122.338, 41.980, 2665, 50.0, 2.25
ELK VALLEY, Del Norte, CA01, -123.718, 41.988, 1708, M, 7.48
PACIFICA 4 SSE, San Mateo, CA04, -122.472, 37.592, 475, 53.0, 3.34
BARSTOW, San Bernardino, CA07, -117.022, 34.893, 2220, 63.1, 0.64
PEARBLOSSOM, Los Angeles, CA07, -117.897, 34.503, 3101, 63.1, 0.92
EL CAJON, San Diego, CA06, -116.928, 32.801, 495, 61.7, 1.54
MARKLEY COVE, Napa, CA02, -122.124, 38.492, 480, 57.7, 3.38
LORAINE 5 NNE, Kern, CA05, -118.412, 35.384, 4235, 52.3, 3.60
DEL MAR FIRE DEPT, San Diego, CA06, -117.262, 32.972, 12, M, 0.46
IMPERIAL BEACH FIRE DEPT, San Diego, CA06, -117.114, 32.576, 22, M, 0.00
LEMON GROVE FIRE DEPARTMENT, San Diego, CA06, -117.030, 32.738, 427, 60.4, 0.32
LEE VINING, Mono, CA07, -119.119, 37.957, 6797, 49.6, 0.34
ANAHEIM, Orange, CA06, -117.842, 33.865, 235, 65.1, 3.20
RED BLUFF TREATMENT PLANT, Tehama, CA02, -122.220, 40.162, 265, M, 1.90
NEW MELONES DAM HQ, Tuolumne, CA05, -120.486, 38.005, 960, 57.5, 4.19
MAMMOTH LAKES RS, Mono, CA07, -118.962, 37.648, 7804, 41.1, 1.12
FRAZIER PARK 9 SW, Ventura, CA05, -119.104, 34.733, 5169, M, 1.40
MONTEREY WFO, Monterey, CA04, -121.855, 36.593, 122, 53.8, 2.23
SKYLINE RIDGE PRESERVE, San Mateo, CA04, -122.185, 37.313, 2270, 50.4, 4.34
FREMONT, Alameda, CA04, -122.016, 37.542, 38, 58.0, 2.13
MAD RIVER 12 SE, Trinity, CA01, -123.374, 40.319, 2763, M, 7.20
NEWHALL 5NW, Los Angeles, CA06, -118.594, 34.393, 1765, 62.9, 1.62
TEHACHAPI 4 SE, Kern, CA05, -118.422, 35.101, 4220, 50.4, 2.09
WRIGHTWOOD, San Bernardino, CA07, -117.639, 34.362, 6000, M, 1.43
REDDING CDF, Shasta, CA02, -122.299, 40.519, 502, M, 3.86
NORTHRIDGE CAL STATE, Los Angeles, CA06, -118.525, 34.245, 904, 62.6, 2.13
OXNARD WFO, Ventura, CA06, -119.137, 34.207, 52, 58.6, 2.02
HANFORD MUNICIPAL AP, Kings, CA05, -119.623, 36.311, 249, 61.7, 1.79
RAMONA AIRPORT, San Diego, CA06, -116.916, 33.038, 1385, 56.2, 1.54
VACAVILLE/NUT TREE AP ASOS, Solano, CA02, -121.959, 38.378, 104, 59.5, 2.27
ALTURAS MUNICIPAL AP, Modoc, CA02, -120.561, 41.484, 4383, 45.5, 1.64
MADERA MUNICIPAL AP, Madera, CA05, -120.111, 36.985, 251, 60.0, 1.59
BAKERSFIELD 5 NW, Kern, CA05, -119.051, 35.419, 470, 61.6, 1.73
FRESNO 5 NE, Fresno, CA05, -119.709, 36.767, 338, 62.9, 1.83
OCEANSIDE MUNICIPAL AP, San Diego, CA06, -117.350, 33.219, 30, 57.3, 1.21
SAN DIEGO SEAWORLD, San Diego, CA06, -117.231, 32.765, 14, 58.7, 1.18
ARCATA EUREKA AP, Humboldt, CA01, -124.105, 40.978, 211, 49.5, 5.66
NEWPORT BEACH HARBOR, Orange, CA06, -117.884, 33.603, 10, 58.1, 1.09
ESCONDIDO NO. 2, San Diego, CA06, -117.090, 33.121, 600, 61.7, 1.74
REDDING AP, Shasta, CA02, -122.298, 40.515, 501, 58.1, 2.73
AVALON CATALINA AP, Los Angeles, CA06, -118.415, 33.404, 1565, 58.3, 1.65
SANTA MARIA PUBLIC AP, Santa Barbara, CA06, -120.452, 34.894, 243, 56.7, 2.31
MOUNT SHASTA, Siskiyou, CA02, -122.333, 41.333, 3535, 47.6, 4.44
RED BLUFF MUNI AP, Tehama, CA02, -122.255, 40.152, 354, 59.3, 1.48
