BRADLEY CALIFORNIA, Monterey, CA04, -120.803, 35.864, 537, 52.1, M
BEAR PEAK CALIFORNIA, Tulare, CA05, -118.052, 35.884, 8228, 34.9, M
BENTON CALIFORNIA, Mono, CA07, -118.478, 37.843, 5450, 37.2, M
BEAUMONT CALIFORNIA, Riverside, CA06, -116.950, 33.931, 2604, 51.5, M
BEVERLY HILLS CALIFORNIA, Los Angeles, CA06, -118.412, 34.125, 1260, 59.5, M
BANGOR CALIFORNIA, Butte, CA02, -121.386, 39.398, 803, 50.9, M
BIG HILL CALIFORNIA, Humboldt, CA01, -123.636, 41.098, 3570, 41.0, M
BIG PINES CALIFORNIA, Los Angeles, CA07, -117.692, 34.379, 6917, 39.1, M
BIG ROCK CALIFORNIA, Marin, CA01, -122.570, 38.039, 1500, 52.0, M
BLACK DIAMOND CALIFORNIA, Contra Costa, CA04, -121.884, 37.950, 1600, 50.4, M
BLUE DOOR CALIFORNIA, Lassen, CA02, -120.337, 41.055, 5615, 32.5, M
BLUE RIDGE (KNF) CALIFORNIA, Siskiyou, CA01, -123.187, 41.269, 5956, 35.3, M
BEN BOLT CALIFORNIA, El Dorado, CA05, -120.934, 38.591, 905, 50.9, M
BEN LOMOND CALIFORNIA, Santa Cruz, CA04, -122.170, 37.132, 2630, 48.4, M
BOGARD R.S. CALIFORNIA, Lassen, CA02, -121.083, 40.598, 5650, 33.5, M
BOONVILLE CALIFORNIA, Mendocino, CA01, -123.349, 38.988, 644, 51.9, M
BIG PINE FLAT CALIFORNIA, San Bernardino, CA07, -117.013, 34.319, 6861, 37.3, M
BRIDGEPORT 4NW CALIFORNIA, Mono, CA03, -119.289, 38.272, 6650, 35.9, M
BRANCH MOUNTAIN CALIFORNIA, San Luis Obispo, CA04, -120.083, 35.189, 3770, 45.5, M
BEAR FLAT CALIFORNIA, Modoc, CA02, -120.313, 41.295, 6200, 39.5, M
BRIONES CALIFORNIA, Contra Costa, CA04, -122.118, 37.944, 1450, 51.1, M
BROOKS CALIFORNIA, Yolo, CA02, -122.145, 38.738, 354, 52.3, M
BIG SUR CALIFORNIA, Monterey, CA04, -121.785, 36.236, 450, 56.1, M
BULL FLAT CALIFORNIA, Lassen, CA03, -120.114, 40.481, 4395, 35.9, M
BURNS CANYON CALIFORNIA, San Bernardino, CA07, -116.634, 34.210, 6000, 43.3, M
BUTTERCUP CALIFORNIA, Imperial, CA07, -114.884, 32.740, 217, 60.7, M
BEAVER CAMP LOC CALIFORNIA, Amador, CA05, -120.325, 38.488, 5000, 43.1, M
BRAZIE RANCH CALIFORNIA, Siskiyou, CA01, -122.594, 41.685, 3000, 42.4, M
CALLAHAN CALIFORNIA, Siskiyou, CA01, -122.796, 41.308, 3136, 41.4, M
CAMERON FIRE STATION CALIFORNI, San Diego, CA06, -116.463, 32.721, 3443, 47.5, M
CANBY CALIFORNIA, Modoc, CA02, -120.868, 41.434, 4312, 38.5, M
CARRIZO CALIFORNIA, San Luis Obispo, CA05, -119.773, 35.096, 2490, 50.5, M
CATHEYS VALLEY CALIFORNIA, Mariposa, CA05, -120.111, 37.468, 1200, 51.0, M
CEDAR GROVE CALIFORNIA, Fresno, CA05, -118.656, 36.788, 4720, 38.7, M
CHEESEBORO CALIFORNIA, Ventura, CA06, -118.717, 34.185, 1650, 56.7, M
CHILAO CALIFORNIA, Los Angeles, CA06, -118.030, 34.332, 5450, 45.6, M
CHUCHUPATE CALIFORNIA, Ventura, CA05, -119.012, 34.808, 4900, 38.6, M
CLAREMONT CALIFORNIA, Los Angeles, CA06, -117.707, 34.137, 1645, 55.0, M
CLEAR CREEK CALIFORNIA, Los Angeles, CA06, -118.152, 34.271, 3000, 51.0, M
CLARK CALIFORNIA, Riverside, CA06, -117.309, 33.877, 1720, 54.7, M
CALAVERAS ROAD CALIFORNIA, Alameda, CA04, -121.844, 37.553, 1230, 52.4, M
CASE MOUNTAIN CALIFORNIA, Tulare, CA05, -118.809, 36.411, 6450, 41.8, M
COHASSET CALIFORNIA, Butte, CA02, -121.769, 39.872, 1733, 49.0, M
COLLINS BALDY CALIFORNIA, Siskiyou, CA01, -122.950, 41.775, 5493, 35.1, M
CONVERSE CALIFORNIA, San Bernardino, CA06, -116.913, 34.194, 5618, 42.7, M
COOSKIE MOUNTAIN CALIFORNIA, Humboldt, CA01, -124.266, 40.257, 2950, 44.7, M
CORRALITOS CALIFORNIA, Santa Cruz, CA04, -121.798, 36.991, 450, 53.6, M
COUNTY LINE CALIFORNIA, Lake, CA02, -122.412, 39.019, 2085, 48.0, M
CAMP 9 CALIFORNIA, Los Angeles, CA06, -118.422, 34.362, 4000, 48.2, M
CRANE FLAT LOOKOUT CALIFORNIA, Mariposa, CA05, -119.825, 37.762, 6644, 38.6, M
CRESTVIEW CALIFORNIA, Mono, CA07, -118.983, 37.745, 7600, 31.3, M
CORNING CALIFORNIA, Tehama, CA02, -122.170, 39.939, 294, 51.0, M
CARPENTER RIDGE CALIFORNIA, Butte, CA02, -121.582, 40.069, 4812, 38.6, M
CRANSTON CALIFORNIA, Riverside, CA06, -116.841, 33.740, 1950, 54.3, M
CRAZY PEAK CALIFORNIA, Del Norte, CA01, -123.604, 41.992, 3970, 40.9, M
CASHMAN CALIFORNIA, Plumas, CA02, -120.915, 40.002, 4520, 39.3, M
DESCANSO CALIFORNIA, San Diego, CA06, -116.622, 32.857, 3480, 48.9, M
DEVILS GARDEN CALIFORNIA, Modoc, CA02, -120.671, 41.530, 5022, 35.5, M
DIABLO GRANDE CALIFORNIA, Stanislaus, CA05, -121.294, 37.329, 1850, 50.2, M
DEMOCRAT CALIFORNIA, Kern, CA05, -118.630, 35.532, 2356, 48.2, M
DINKEY CALIFORNIA, Fresno, CA05, -119.039, 37.066, 5668, 36.7, M
DOG VALLEY CALIFORNIA, Sierra, CA03, -120.048, 39.562, 5976, 32.9, M
DOYLE CALIFORNIA, Lassen, CA03, -120.106, 40.022, 4240, 38.7, M
DUNCAN CALIFORNIA, Placer, CA02, -120.509, 39.144, 7100, 33.5, M
DEL VALLE CALIFORNIA, Los Angeles, CA06, -118.683, 34.431, 1278, 55.5, M
DEVORE CALIFORNIA, San Bernardino, CA06, -117.404, 34.221, 2057, 54.7, M
EAGLE PEAK CALIFORNIA, Tehama, CA02, -122.657, 39.928, 3713, 41.8, M
EEL RIVER CAMP CALIFORNIA, Humboldt, CA01, -123.824, 40.138, 446, 51.5, M
EEL RIVER CALIFORNIA, Mendocino, CA01, -123.083, 39.833, 1500, 47.6, M
EL CARISO CALIFORNIA, Riverside, CA06, -117.411, 33.647, 3038, 53.9, M
MOUNT ELIZABETH CALIFORNIA, Tuolumne, CA05, -120.247, 38.063, 4933, 40.5, M
EL MIRAGE CALIFORNIA, San Bernardino, CA07, -117.550, 34.634, 2880, 55.4, M
FANCHER CREEK CALIFORNIA, Fresno, CA05, -119.466, 36.884, 920, 53.5, M
FAWNSKIN CALIFORNIA, San Bernardino, CA06, -116.899, 34.266, 6900, 37.7, M
FENCE MEADOW CALIFORNIA, Fresno, CA05, -119.175, 36.961, 5048, 42.9, M
FORT HUNTER LIGGET CALIFORNIA, Monterey, CA04, -121.242, 36.012, 1100, 51.2, M
FIGUEROA CALIFORNIA, Santa Barbara, CA06, -120.007, 34.733, 3200, 51.3, M
FISH CREEK MTN CALIFORNIA, Imperial, CA07, -116.067, 32.990, 760, 61.1, M
FIVE MILE CALIFORNIA, Inyo, CA07, -117.918, 35.872, 4150, 46.2, M
FORESTHILL CALIFORNIA, Placer, CA02, -120.732, 39.091, 4355, 42.0, M
FOUNTAIN SPRINGS CALIFORNIA, Tulare, CA05, -118.915, 35.892, 210, 52.3, M
FREMONT CANYON CALIFORNIA, Orange, CA06, -117.711, 33.808, 1781, 57.1, M
FRIEND MOUNTAIN CALIFORNIA, Trinity, CA01, -123.342, 40.505, 4000, 38.9, M
GRASSHOPPER CALIFORNIA, Lassen, CA03, -120.784, 40.782, 6158, 32.4, M
GOOSE VALLEY CALIFORNIA, San Diego, CA06, -116.846, 33.074, 1530, 56.4, M
GORDON CALIFORNIA, Lassen, CA03, -120.896, 40.759, 6200, 31.5, M
GREEN SPRING CALIFORNIA, Tuolumne, CA05, -120.500, 37.833, 1020, 51.1, M
HASTINGS CALIFORNIA, Monterey, CA04, -121.552, 36.389, 1885, 51.3, M
HAWKEYE CALIFORNIA, Sonoma, CA01, -122.917, 38.782, 2000, 49.3, M
HAYFORK CALIFORNIA, Trinity, CA01, -123.165, 40.550, 2323, 43.2, M
HELL HOLE CALIFORNIA, Placer, CA02, -120.422, 39.072, 5240, 39.2, M
HERNANDEZ CALIFORNIA, San Benito, CA04, -120.856, 36.383, 3733, 45.8, M
HIGH GLADE LOOKOUT CALIFORNIA, Lake, CA02, -122.808, 39.208, 4840, 40.0, M
HIGH SIERRA CALIFORNIA, Fresno, CA05, -119.038, 37.315, 7403, 32.9, M
HOPLAND CALIFORNIA, Mendocino, CA01, -123.081, 39.031, 2682, 46.7, M
HOLLISTER CALIFORNIA, San Benito, CA04, -121.362, 36.842, 404, 53.6, M
HUNTER MOUNTAIN CALIFORNIA, Inyo, CA07, -117.474, 36.563, 6880, 34.7, M
HORSE LAKE CALIFORNIA, Lassen, CA03, -120.503, 40.631, 5100, 34.6, M
HOOPA CALIFORNIA, Humboldt, CA01, -123.671, 41.048, 375, 49.8, M
HORSE THIEF SPRINGS CALIFORNIA, San Bernardino, CA07, -115.909, 35.771, 5000, 43.2, M
HURLEY CALIFORNIA, Fresno, CA05, -119.568, 37.015, 1201, 47.6, M
INDIAN WELL CALIFORNIA, Siskiyou, CA01, -121.538, 41.742, 4770, 36.9, M
JARBO GAP CALIFORNIA, Butte, CA02, -121.489, 39.736, 2490, 45.4, M
JERSEYDALE CALIFORNIA, Mariposa, CA05, -119.839, 37.544, 3900, 44.4, M
JOHNSONDALE CALIFORNIA, Tulare, CA05, -118.545, 35.972, 4700, 39.6, M
JUANITA LAKE CALIFORNIA, Siskiyou, CA01, -122.006, 41.786, 5400, 36.3, M
JULIAN CALIFORNIA, San Diego, CA07, -116.591, 33.076, 4240, 46.1, M
JUNIPER CREEK CALIFORNIA, Modoc, CA02, -120.472, 41.332, 4372, 37.9, M
KEENWILD CALIFORNIA, Riverside, CA06, -116.767, 33.667, 4920, 46.0, M
KETTLEMAN HILLS CALIFORNIA, Kings, CA05, -120.057, 36.033, 810, 53.6, M
KNOXVILLE CREEK CALIFORNIA, Lake, CA02, -122.417, 38.862, 2200, 47.6, M
KONOCTI CALIFORNIA, Lake, CA02, -122.706, 38.912, 2163, 48.1, M
LOS BANOS CALIFORNIA, Merced, CA05, -121.053, 37.055, 350, 52.9, M
MT. LAGUNA CALIFORNIA, San Diego, CA07, -116.420, 32.880, 5760, 40.8, M
LA HONDA CALIFORNIA, San Mateo, CA04, -122.255, 37.305, 872, 52.6, M
LA PANZA CALIFORNIA, San Luis Obispo, CA04, -120.187, 35.381, 1630, 49.0, M
LAURAL MOUNTAIN CALIFORNIA, Kern, CA07, -117.699, 35.478, 4390, 45.2, M
LASSEN LODGE CALIFORNIA, Tehama, CA02, -121.714, 40.344, 4159, 41.8, M
LAUFMAN CALIFORNIA, Lassen, CA03, -120.353, 40.142, 5800, 36.4, M
LAYTONVILLE CALIFORNIA, Mendocino, CA01, -123.485, 39.702, 1820, 46.9, M
LADDER BUTTE CALIFORNIA, Lassen, CA02, -121.297, 40.807, 5750, 35.2, M
LEO CARRILLO CALIFORNIA, Los Angeles, CA06, -118.936, 34.046, 50, 60.5, M
LOS GATOS CALIFORNIA, Santa Clara, CA04, -121.943, 37.203, 2000, 51.4, M
LOST HORSE CALIFORNIA, Riverside, CA07, -116.188, 34.018, 4200, 44.2, M
LINCOLN CALIFORNIA, Placer, CA02, -121.268, 38.883, 200, 51.5, M
LOWER KLAMATH CALIFORNIA, Siskiyou, CA01, -121.700, 41.999, 4098, 37.5, M
LOS PRIETOS CALIFORNIA, Santa Barbara, CA06, -119.783, 34.536, 1020, 54.4, M
LAS TABLAS CALIFORNIA, San Luis Obispo, CA04, -120.924, 35.656, 994, 50.2, M
LITTLE TUJUNGA CALIFORNIA, Los Angeles, CA06, -118.361, 34.294, 1390, 55.7, M
LYONS VALLEY CALIFORNIA, Lake, CA01, -123.074, 39.126, 3200, 43.8, M
LYTLE CREEK CALIFORNIA, San Bernardino, CA06, -117.480, 34.234, 2792, 51.4, M
MALIBU HILLS CALIFORNIA, Los Angeles, CA06, -118.633, 34.058, 1575, 58.4, M
MANZANITA LAKE CALIFORNIA, Shasta, CA02, -121.580, 40.540, 5660, 34.1, M
MILL CREEK (BDF) CALIFORNIA, San Bernardino, CA06, -117.035, 34.084, 2950, 47.5, M
MCGUIRES CALIFORNIA, Mendocino, CA01, -123.601, 39.353, 593, 50.5, M
MEANS LAKE CALIFORNIA, San Bernardino, CA07, -116.517, 34.391, 2900, 48.4, M
MENDOCINO PASS CALIFORNIA, Mendocino, CA01, -122.945, 39.808, 5420, 39.1, M
METCALF GAP CALIFORNIA, Madera, CA05, -119.768, 37.409, 3077, 47.7, M
MID HILLS CALIFORNIA, San Bernardino, CA07, -115.411, 35.123, 5413, 41.2, M
MILL CREEK (ANF) CALIFORNIA, Los Angeles, CA06, -118.082, 34.390, 5021, 45.2, M
MILO CALIFORNIA, Tulare, CA05, -118.869, 36.231, 1923, 51.7, M
MALLORY RIDGE CALIFORNIA, Contra Costa, CA05, -121.779, 37.817, 2040, 49.6, M
MONTECITO CALIFORNIA, Santa Barbara, CA06, -119.648, 34.461, 1500, 57.6, M
MODOC NWR CALIFORNIA, Modoc, CA02, -120.354, 41.459, 4380, 45.8, M
MOUNTAIN REST CALIFORNIA, Fresno, CA05, -119.371, 37.054, 4100, 45.2, M
MARKLEEVILLE CALIFORNIA, Alpine, CA03, -119.767, 38.683, 5501, 36.4, M
MT. SHASTA CALIFORNIA, Siskiyou, CA02, -122.316, 41.316, -, 40.1, M
MARIPOSA CALIFORNIA, Mariposa, CA05, -119.987, 37.504, 2231, 48.2, M
MOUNT ZION CALIFORNIA, Amador, CA05, -120.651, 38.389, 2960, 47.4, M
NORTH FORK CALIFORNIA, Madera, CA05, -119.505, 37.233, 2720, 47.1, M
OAK KNOLL CALIFORNIA, Siskiyou, CA01, -122.850, 41.839, 1940, 44.0, M
OAK MOUNTAIN CALIFORNIA, Shasta, CA02, -121.983, 41.006, 1700, 43.6, M
OAK CREEK CALIFORNIA, Inyo, CA07, -118.259, 36.843, 4855, 41.6, M
OAK GROVE CALIFORNIA, San Diego, CA06, -116.795, 33.393, 2752, 50.3, M
OAKLAND NORTH CALIFORNIA, Contra Costa, CA04, -122.221, 37.865, 1403, 50.9, M
OAK OPENING CALIFORNIA, Tulare, CA05, -118.702, 36.175, 3240, 47.9, M
OAKLAND SOUTH CALIFORNIA, Alameda, CA04, -122.145, 37.786, 1095, 51.6, M
OPAL MOUNTAIN CALIFORNIA, San Bernardino, CA07, -117.176, 35.154, 3240, 49.2, M
OWENS CAMP LOC CALIFORNIA, El Dorado, CA02, -120.245, 38.733, 5240, 38.6, M
OWENS VALLEY CALIFORNIA, Inyo, CA07, -118.551, 37.390, 4640, 41.9, M
OZENA CALIFORNIA, Ventura, CA06, -119.354, 34.682, 3670, 47.0, M
PANAMINT CALIFORNIA, Inyo, CA07, -117.088, 36.120, 6880, 38.2, M
PARKFIELD CALIFORNIA, Monterey, CA04, -120.432, 35.899, 1535, 49.7, M
PATTY MOCUS CALIFORNIA, Tehama, CA02, -122.867, 40.295, 3500, 42.6, M
PINE HILLS CALIFORNIA, San Diego, CA06, -116.634, 33.016, -, 48.3, M
PIERCE CALIFORNIA, Plumas, CA02, -120.642, 40.246, 5700, 35.6, M
PINEHURST CALIFORNIA, Fresno, CA05, -119.000, 36.685, 4060, 45.4, M
PIKE COUNTY LOOKOUT CALIFORNIA, Yuba, CA02, -121.202, 39.475, 3714, 43.4, M
PILOT HILL CALIFORNIA, El Dorado, CA02, -121.009, 38.833, 1200, 49.2, M
PARK RIDGE CALIFORNIA, Tulare, CA05, -118.942, 36.724, 7540, 37.1, M
PINNACLES CALIFORNIA, San Benito, CA04, -121.147, 36.471, 1322, 52.3, M
POPPY PARK CALIFORNIA, Los Angeles, CA07, -118.383, 34.733, 2760, 49.2, M
POTRERO CALIFORNIA, San Diego, CA06, -116.609, 32.606, 2345, 50.7, M
POVERTY CALIFORNIA, Santa Clara, CA04, -121.771, 37.443, 2066, 50.7, M
PANOCHE ROAD CALIFORNIA, Fresno, CA05, -120.766, 36.727, 2032, 50.7, M
PULGAS CALIFORNIA, San Mateo, CA04, -122.298, 37.475, 644, 54.8, M
QUARTZ HILL CALIFORNIA, Siskiyou, CA01, -122.934, 41.599, 4225, 39.5, M
QUINCY RD CALIFORNIA, Plumas, CA02, -120.942, 39.973, 3500, 40.4, M
RAVENDALE CALIFORNIA, Lassen, CA03, -120.316, 40.731, 5298, 34.4, M
RANCHITA CALIFORNIA, San Diego, CA07, -116.497, 33.222, 4415, 47.1, M
READER RANCH CALIFORNIA, Nevada, CA02, -121.117, 39.304, 1968, 48.4, M
REDDING AIRPORT CALIFORNIA, Shasta, CA02, -122.291, 40.516, 500, 50.3, M
RICE VALLEY CALIFORNIA, Riverside, CA07, -114.732, 34.061, 820, 55.2, M
ROCK CREEK, Mono, CA07, -118.667, 37.551, 7040, 33.3, M
RODEO VALLEY, Mendocino, CA01, -123.321, 39.668, 2428, 45.8, M
ROSE VALLEY CALIFORNIA, Ventura, CA06, -119.184, 34.543, 3331, 45.3, M
ROUND MOUNTAIN, Siskiyou, CA02, -121.464, 41.427, 5258, 34.3, M
ROSE PEAK CALIFORNIA, Alameda, CA04, -121.735, 37.502, 3060, 45.9, M
RUSH CREEK CALIFORNIA, Modoc, CA02, -120.864, 41.294, 4800, 35.3, M
RUTH CALIFORNIA, Trinity, CA01, -123.316, 40.251, 2732, 44.5, M
SANTA ROSA ISLAND CALIFORNIA, Santa Barbara, CA06, -120.078, 33.978, 1298, 55.6, M
SANTA ROSA PLATEAU CALIFORNIA, Riverside, CA06, -117.231, 33.529, 1980, 54.3, M
SANTA ROSA CALIFORNIA, Sonoma, CA01, -122.712, 38.479, 576, 53.1, M
STAMPEDE CALIFORNIA, Sierra, CA03, -120.075, 39.483, 6867, 33.8, M
STONYFORD CALIFORNIA, Colusa, CA02, -122.575, 39.367, 1200, 49.0, M
SUGARLOAF (SHF) CALIFORNIA, Shasta, CA02, -122.438, 40.917, 4200, 42.1, M
SPRING VALLEY CALIFORNIA, San Mateo, CA04, -122.436, 37.563, 1075, 52.9, M
TANBARK CALIFORNIA, Los Angeles, CA06, -117.761, 34.207, 2600, 52.9, M
TEMESCAL (LPF) CALIFORNIA, Ventura, CA06, -118.756, 34.481, 1140, 54.4, M
THOMES CREEK CALIFORNIA, Tehama, CA02, -122.610, 39.864, 1040, 49.4, M
TIMBER MOUNTAIN CALIFORNIA, Modoc, CA01, -121.298, 41.629, 4960, 35.4, M
MOUNT TOM CALIFORNIA, Fresno, CA05, -119.178, 37.376, 9018, 33.6, M
LAS TRAMPAS CALIFORNIA, Contra Costa, CA04, -122.067, 37.834, 1760, 50.2, M
TRINITY CAMP CALIFORNIA, Trinity, CA01, -122.804, 40.786, 3308, 41.1, M
TRIMMER CALIFORNIA, Fresno, CA05, -119.305, 36.911, 1540, 49.5, M
UHL / HOT SPRINGS, Tulare, CA05, -118.633, 35.889, 3720, 46.0, M
UNDERWOOD CALIFORNIA, Trinity, CA01, -123.495, 40.722, 2600, 44.0, M
VALLEY CENTER CALIFORNIA, San Diego, CA06, -117.009, 33.237, 1483, 55.4, M
VAN BREMMER CALIFORNIA, Siskiyou, CA01, -121.794, 41.643, 4928, 36.2, M
VALYERMO CALIFORNIA, Los Angeles, CA07, -117.851, 34.446, 3780, 44.8, M
VANDENBERG CALIFORNIA, Santa Barbara, CA06, -120.486, 34.759, 1050, 55.6, M
WALKER CALIFORNIA, Mono, CA03, -119.459, 38.565, 5440, 38.9, M
WALKER PASS CALIFORNIA, Kern, CA05, -118.057, 35.665, 5572, 42.1, M
WARM SPRINGS CALIFORNIA, Los Angeles, CA06, -118.579, 34.596, 4930, 47.3, M
WEED AIRPORT CALIFORNIA, Siskiyou, CA01, -122.454, 41.479, 2930, 42.6, M
WESTWOOD CALIFORNIA, Lassen, CA02, -120.900, 40.307, 5800, 34.1, M
WHITE CLOUD CALIFORNIA, Nevada, CA02, -120.837, 39.317, 4320, 42.0, M
WHITTIER HILLS CALIFORNIA, Los Angeles, CA06, -118.010, 33.984, 950, 59.4, M
WHITMORE CALIFORNIA, Shasta, CA02, -121.899, 40.619, 2417, 45.0, M
WILEY RIDGE CALIFORNIA, Ventura, CA06, -118.841, 34.372, 1645, 54.8, M
WOFFORD HEIGHTS CALIFORNIA, Kern, CA05, -118.499, 35.722, 3150, 45.6, M
WOLVERTON CALIFORNIA, Tulare, CA05, -118.703, 36.445, 5240, 43.9, M
WOODACRE CALIFORNIA, Marin, CA01, -122.645, 37.991, 1400, 50.8, M
WHITAKER PEAK CALIFORNIA, Los Angeles, CA06, -118.740, 34.569, 4120, 47.6, M
WHITE WOLF CALIFORNIA, Tuolumne, CA05, -119.650, 37.851, 8025, 32.5, M
YOLLA BOLLA CALIFORNIA, Trinity, CA01, -123.066, 40.338, 4524, 39.6, M
YUCCA VALLEY CALIFORNIA, San Bernardino, CA07, -116.408, 34.123, 3260, 47.1, M
YUROK CALIFORNIA, Humboldt, CA01, -123.857, 41.290, 495, 49.6, M
HAGAN'S MEADOW, El Dorado, CA03, -119.940, 38.850, 7776, 31.8, 3.40
BLUE LAKES, Alpine, CA05, -119.920, 38.610, 8057, 29.6, 5.60
POISON FLAT, Alpine, CA03, -119.630, 38.510, 7736, 30.4, 3.00
SONORA PASS, Mono, CA03, -119.600, 38.310, 8827, 29.3, 3.60
LEAVITT MEADOWS, Mono, CA03, -119.550, 38.300, 7198, 33.4, 3.40
VIRGINIA LAKES RIDGE, Mono, CA03, -119.230, 38.070, 9445, 29.6, 2.00
LOBDELL LAKE, Mono, CA03, -119.370, 38.440, 9233, 28.6, 1.80
EBBETTS PASS, Alpine, CA03, -119.800, 38.550, 8765, 30.4, 7.20
HEAVENLY VALLEY, El Dorado, CA03, -119.920, 38.920, 8582, 30.3, 3.60
LEAVITT LAKE, Mono, CA03, -119.610, 38.280, 9617, 28.9, 7.10
SPRATT CREEK, Alpine, CA03, -119.820, 38.670, 6115, 35.9, 3.80
MONITOR PASS, Alpine, CA03, -119.610, 38.670, 8310, 31.9, 2.10
BURNSIDE LAKE, Alpine, CA03, -119.890, 38.720, 8129, 28.7, 6.00
SUMMIT MEADOW, Mono, CA03, -119.540, 38.400, 9313, 29.1, 3.50
FORESTDALE CREEK, Alpine, CA03, -119.960, 38.680, 8017, 31.6, 7.00
HORSE MEADOW, Alpine, CA03, -119.890, 38.840, 8557, 30.5, 3.30
CARSON PASS, Alpine, CA02, -119.990, 38.690, 8353, 29.4, 6.60
CROWDER FLAT, Modoc, CA01, -120.750, 41.890, 5170, 35.2, 3.90
CEDAR PASS, Modoc, CA02, -120.300, 41.580, 7030, 31.3, 6.10
DISMAL SWAMP, Modoc, CA03, -120.180, 41.990, 7360, 28.5, 9.40
ADIN MTN, Modoc, CA02, -120.790, 41.240, 6190, 32.1, 4.30
INDEPENDENCE CREEK, Sierra, CA03, -120.280, 39.490, 6456, 33.4, 5.00
INDEPENDENCE CAMP, Sierra, CA03, -120.290, 39.450, 7003, 33.6, 5.50
INDEPENDENCE LAKE, Nevada, CA03, -120.310, 39.430, 8352, 29.5, 8.80
TRUCKEE #2, Placer, CA03, -120.180, 39.300, 6509, 34.6, 5.50
WARD CREEK #3, Placer, CA03, -120.220, 39.140, 6655, 33.6, 10.60
TAHOE CITY CROSS, Placer, CA03, -120.150, 39.170, 6797, 35.3, 5.50
SQUAW VALLEY G.C., Placer, CA03, -120.260, 39.190, 8029, 31.5, 8.70
CSS LAB, Nevada, CA02, -120.370, 39.330, 6855, 33.5, 12.40
RUBICON #2, El Dorado, CA03, -120.130, 39.000, 7689, 32.9, 5.10
ECHO PEAK, El Dorado, CA03, -120.080, 38.850, 7670, 33.6, 7.70
FALLEN LEAF, El Dorado, CA03, -120.050, 38.930, 6236, 35.7, 3.80
BEAR VALLEY F.D., Kern, CA01, -118.644, 35.166, 4100, 40.9, 5.26
GRIDLEY 0.4 NNE, Butte, CA02, -121.693, 39.369, 86, M, 9.19
WASCO 0.8 SSW, Kern, CA05, -119.348, 35.583, 325, M, 2.02
NEVADA CITY 1.7 SSE, Nevada, CA02, -121.006, 39.238, 3168, M, 17.29
LA MESA 2.6E, San Diego, CA06, -116.979, 32.770, 1014, M, 4.05
OAKLAND 5.0 NNE, Alameda, CA04, -122.198, 37.841, 1312, M, 13.41
BERKELEY 4.0 E, Alameda, CA04, -122.226, 37.857, 1148, M, 14.47
CARLSBAD 1.3ENE, San Diego, CA06, -117.331, 33.166, 194, M, 4.90
SAN MATEO 1.2 SW, San Mateo, CA04, -122.329, 37.550, 114, M, 12.54
RED BLUFF 4.9 SE, Tehama, CA02, -122.175, 40.124, 265, M, 10.00
CHICO 0.2 ESE, Butte, CA02, -121.803, 39.753, 257, M, 8.35
CRESCENT CITY 7.8 NNE, Del Norte, CA01, -124.144, 41.862, 95, M, 17.13
MISSION VIEJO 3.9 NNE, Orange, CA06, -117.626, 33.665, 1051, M, 3.40
RAMONA 3.8 ENE, San Diego, CA06, -116.809, 33.056, 2018, M, 0.86
BOULDER CREEK 3.0 NW, Santa Cruz, CA04, -122.164, 37.169, 875, M, 12.24
FELTON 4.5 NNE, Santa Cruz, CA04, -122.047, 37.105, 838, M, 21.08
RED BLUFF 4.3 W, Tehama, CA02, -122.322, 40.179, 396, M, 11.55
LINDSAY 0.5 N, Tulare, CA05, -119.088, 36.213, 378, M, 0.45
TERRA BELLA 6.3 W, Tulare, CA05, -119.149, 35.950, 374, M, 2.52
VISALIA 0.7 SSE, Tulare, CA05, -119.318, 36.315, 318, M, 2.68
DOUGLAS CITY 2.4 SW, Trinity, CA01, -122.978, 40.633, 1689, M, 9.32
HAWKINS BAR 0.6 NW, Trinity, CA01, -123.530, 40.877, 674, M, 8.80
MAD RIVER 7.4 SE, Trinity, CA01, -123.376, 40.321, 2762, M, 14.27
TRINITY CENTER 0.6 ESE, Trinity, CA01, -122.696, 40.983, 2427, M, 13.02
THOUSAND OAKS 2.1 WSW, Ventura, CA06, -118.898, 34.177, 692, M, 5.39
FRAZIER PARK 10.7 WSW, Ventura, CA06, -119.110, 34.746, 5274, M, 3.30
SIMI VALLEY 3.8 SW, Ventura, CA06, -118.805, 34.231, 1081, M, 0.00
VENTURA 0.5 WNW, Ventura, CA06, -119.276, 34.273, 56, M, 4.29
OJAI 0.3 WNW, Ventura, CA06, -119.251, 34.451, 797, M, 5.64
SIMI VALLEY 1.0 NW, Ventura, CA06, -118.764, 34.272, 848, M, 4.51
THOUSAND OAKS 2.5 WSW, Ventura, CA06, -118.909, 34.179, 703, M, 5.14
CHALLENGE-BROWNSVILLE 1.3 WSW, Yuba, CA02, -121.280, 39.452, 2049, M, 19.91
DAVIS 1.2 SE, Yolo, CA02, -121.721, 38.543, 36, M, 10.08
DAVIS 0.8 NE, Yolo, CA02, -121.724, 38.562, 41, M, 9.31
DAVIS 1.4 SSE, Yolo, CA02, -121.722, 38.538, 4, M, 6.14
DAVIS 6.1 WNW, Yolo, CA02, -121.845, 38.578, 83, M, 8.48
DAVIS 2.7 W, Yolo, CA02, -121.786, 38.552, 57, M, 9.34
WOODLAND 2.8 SE, Yolo, CA02, -121.732, 38.647, 38, M, 8.86
PLACERVILLE 3 ENE, El Dorado, CA02, -120.742, 38.785, 2658, 46.9, 10.26
TAHOMA, El Dorado, CA03, -120.129, 39.060, 6315, 32.5, 4.73
CORONA MUNICIPAL AIRPORT, Riverside, -, -117.602, 33.898, 533, 54.6, 0.01
OAKLAND 4.4 NNW, Alameda, CA04, -122.250, 37.832, 191, M, 13.52
SAN LORENZO 0.5 NNW, Alameda, CA04, -122.133, 37.682, 30, M, 11.24
OROVILLE 4.8 E, Butte, CA02, -121.477, 39.493, 668, M, 14.22
MCKINLEYVILLE 4.3 E, Humboldt, CA01, -124.034, 40.953, 173, M, 12.79
KNEELAND 0.4 NNW, Humboldt, CA01, -123.999, 40.766, 2008, M, 16.16
BISHOP 8.8 WNW, Inyo, CA07, -118.547, 37.411, 4537, M, 0.08
CLAREMONT 0.5 E, Los Angeles, CA06, -117.707, 34.121, 1465, M, 5.69
LOS ANGELES 4.3 NNW, Los Angeles, CA06, -118.435, 34.171, 675, M, 5.37
LANCASTER 6.5 ENE, Los Angeles, CA07, -118.066, 34.718, 2366, M, 1.16
FOOTHILL RANCH 0.3 NW, Orange, CA06, -117.664, 33.689, 1045, M, 3.89
CARLSBAD 2.2SE, San Diego, CA06, -117.321, 33.143, 22, M, 2.92
DESCANSO 0.3 WNW, San Diego, CA06, -116.621, 32.854, 3442, M, 4.79
SAN DIEGO 5.2WNW, San Diego, CA06, -117.245, 32.735, 251, M, 3.44
VISTA 1.2SE, San Diego, CA06, -117.231, 33.186, 505, M, 4.00
FORESTVILLE 0.7 SW, Sonoma, CA01, -122.897, 38.473, 201, M, 20.20
RIALTO 2.1 N, San Bernardino, CA06, -117.381, 34.144, 1482, M, 6.13
THREE RIVERS 1.7 NE, Tulare, CA05, -118.886, 36.458, 1010, M, 4.03
TRINITY CENTER 0.2 ENE, Trinity, CA01, -122.704, 40.986, 2481, M, 16.63
VERDI 2W, Sierra, CA03, -120.027, 39.521, 5429, 36.4, 4.04
CHICO 1.2 NNW, Butte, CA02, -121.814, 39.770, 251, M, 11.49
PASADENA 2.0 SE, Los Angeles, CA06, -118.116, 34.139, 739, M, 5.14
RAYMOND 6.8 NE, Madera, CA05, -119.802, 37.272, 1802, M, 4.17
SUNNYVALE 3.6 S (W6NW), Santa Clara, CA04, -122.018, 37.334, 170, M, 8.86
PIONEER 6.4 NE, Amador, CA05, -120.499, 38.505, 4073, M, 3.80
CRESCENT CITY 4.2 NE, Del Norte, CA01, -124.143, 41.800, 98, M, 16.11
POLLOCK PINES 0.5 NW, El Dorado, CA02, -120.578, 38.757, 3895, M, 11.88
EUREKA 3.0 SSW, Humboldt, CA01, -124.181, 40.757, 100, M, 9.31
TEHACHAPI 2.2 W, Kern, CA05, -118.480, 35.132, 3945, M, 2.21
DIAMOND BAR 1.9 NNE, Los Angeles, CA06, -117.796, 34.023, 935, M, 5.40
LA CRESCENTA-MONTROSE 3.9 NW, Los Angeles, CA06, -118.287, 34.270, 1974, M, 5.17
YOSEMITE LAKES 4.7 S, Madera, CA05, -119.761, 37.124, 1598, M, 3.68
MARIPOSA 12.5 E, Mariposa, CA05, -119.740, 37.462, 2940, M, 6.36
BIG SUR 7.2 NNW, Monterey, CA04, -121.818, 36.353, 2434, M, 10.11
IRVINE 2.9 WSW, Orange, CA06, -117.838, 33.640, 193, M, 2.86
MISSION VIEJO 3.5 SSE(K6WTA), Orange, CA06, -117.639, 33.563, 613, M, 4.70
IRVINE 4.1 NNE, Orange, CA06, -117.772, 33.718, 152, M, 4.33
ANAHEIM 4.9 E, Orange, CA06, -117.787, 33.847, 374, M, 4.82
SACRAMENTO NWR CALIFORNIA, Glenn, CA02, -122.182, 39.417, 120, 52.5, M
SADDLEBACK BUTTE CALIFORNIA, Los Angeles, CA07, -117.821, 34.685, 2590, 47.1, M
SAUGUS CALIFORNIA, Los Angeles, CA06, -118.525, 34.425, 1450, 53.8, M
SAWYERS BAR CALIFORNIA, Siskiyou, CA01, -123.132, 41.300, 2192, 42.8, M
SANTA BARBARA ISLAND CALIFORNI, Santa Barbara, CA06, -119.033, 33.483, 176, 60.9, M
SANTA CRUZ ISLAND CALIFORNIA, Santa Barbara, CA06, -119.722, 33.996, 250, 57.4, M
SCORPION CALIFORNIA, Trinity, CA01, -122.697, 41.112, 4400, 41.5, M
SODA CREEK CALIFORNIA, Lake, CA01, -122.977, 39.425, 1773, 46.2, M
SADDLEBACK CALIFORNIA, Sierra, CA02, -120.865, 39.638, 6670, 33.4, M
SECRET TOWN CALIFORNIA, Nevada, CA02, -120.885, 39.184, 2826, 45.5, M
SANTA FE DAM CALIFORNIA, Los Angeles, CA06, -117.946, 34.121, 500, 61.6, M
SHAVER CALIFORNIA, Fresno, CA05, -119.256, 37.135, 5746, 37.3, M
SCHOOL HOUSE CALIFORNIA, Humboldt, CA01, -123.906, 41.138, 2640, 45.3, M
SHIP MTN. CALIFORNIA, Del Norte, CA01, -123.792, 41.736, 5300, 36.2, M
SHADEQUARTER CALIFORNIA, Tulare, CA05, -118.956, 36.567, 4069, 45.3, M
SIMS CALIFORNIA, Shasta, CA02, -122.373, 41.075, 2400, 46.2, M
SLATER BUTTE CALIFORNIA, Siskiyou, CA01, -123.352, 41.859, 4670, 36.8, M
SAN MIGUEL CALIFORNIA, San Diego, CA06, -116.974, 32.685, 425, 59.7, M
SAN LUIS NWR CALIFORNIA, Merced, CA05, -120.794, 37.182, 65, 51.4, M
SANTA RITA CALIFORNIA, San Benito, CA05, -120.598, 36.348, 5000, 50.4, M
SOLDIER MOUNTAIN CALIFORNIA, Shasta, CA02, -121.586, 40.926, 3710, 39.6, M
SOMES BAR CALIFORNIA, Siskiyou, CA01, -123.496, 41.390, 920, 47.6, M
SQUAW SPRINGS CALIFORNIA, San Bernardino, CA07, -117.568, 35.370, 3620, 48.0, M
SQUAW LAKE CALIFORNIA, Imperial, CA07, -114.494, 32.908, 300, 59.2, M
GARBERVILLE 1.1 WSW, Humboldt, CA01, -123.810, 40.089, 510, M, 3.54
CAZADERO 1.3 SSE, Sonoma, CA01, -123.078, 38.515, 179, M, 23.86
KENWOOD 1.4 NNW, Sonoma, CA01, -122.551, 38.435, 490, M, 7.99
BARSTOW 0.8 SSE, San Bernardino, CA07, -117.059, 34.867, 2609, M, 0.96
APTOS 1.4 N, Santa Cruz, CA04, -121.901, 37.012, 601, M, 10.62
DAVIS 1.7 SE, Yolo, CA02, -121.711, 38.541, 54, M, 9.46
MCOLF CAMP PENDLETON RED BEACH AIRPORT, San Diego, -, -117.456, 33.286, 89, 58.0, 2.50
SOUTH LAKE F.S, Kern, CA05, -118.361, 35.647, 2654, 46.6, 2.75
CAMPO ASOS, San Diego, CA07, -116.468, 32.626, 2641, 48.3, 3.61
Burbank Glendale Pasadena Area, -, -, -, -, -, 57.1, 3.36
Camarillo Area, -, -, -, -, -, 57.6, 4.08
Needles Area, -, -, -, -, -, 55.6, 0.39
Oxnard Area, -, -, -, -, -, 57.2, 4.42
Palm Springs Area, -, -, -, -, -, 58.6, 0.80
Riverside Area, -, -, -, -, -, 56.6, 2.95
Ramona Area, -, -, -, -, -, 51.8, 3.67
