Name, County, ClimateDivision, Longitude, Latitude, Elevation, MeanAvgTemperature, TotalPrecipitation
BARSTOW-DAGGETT AIRPORT, San Bernardino, CA07, -116.787, 34.854, 1919, 62.1, 0.12
MERCED, Merced, CA05, -120.516, 37.289, 154, 56.5, 3.90
SAN DIEGO MONTGOMERY FIELD, San Diego, CA06, -117.137, 32.815, 418, 61.0, 1.08
SAN DIEGO INTERNATIONAL AP, San Diego, CA06, -117.183, 32.734, 15, 62.7, 0.76
SAN DIEGO MIRAMAR NAS, San Diego, CA06, -117.133, 32.867, 477, 62.1, 1.21
NORTH ISLAND NAS, San Diego, CA06, -117.210, 32.692, 14, 59.2, 0.87
SAN FRANCISCO INTERNATIONAL AP, San Mateo, CA04, -122.366, 37.620, 10, 57.7, 5.14
SAN LUIS OBISPO MCCHESNEY FIELD, San Luis Obispo, CA04, -120.644, 35.238, 183, 58.9, 3.95
CEDARVILLE, Modoc, CA03, -120.179, 41.530, 4688, 42.5, 1.04
CHICO UNIVERSITY FARM, Butte, CA02, -121.821, 39.691, 185, 54.9, 7.90
CHULA VISTA, San Diego, CA06, -117.086, 32.640, 56, 61.2, 0.84
COLFAX, Placer, CA02, -120.947, 39.090, 2373, 51.1, 13.69
CUYAMACA, San Diego, CA06, -116.587, 32.990, 4640, 49.1, 2.56
DAVIS 2 WSW EXP FARM, Yolo, CA02, -121.776, 38.535, 60, 57.0, 5.20
DEATH VALLEY NATIONAL PARK, Inyo, CA07, -116.867, 36.463, -194, 71.1, 0.01
FAIRMONT, Los Angeles, CA07, -118.430, 34.705, 3060, 56.5, 2.61
FORT BRAGG 5 N, Mendocino, CA01, -123.756, 39.510, 123, 51.1, 12.81
HANFORD 1 S, Kings, CA05, -119.637, 36.316, 237, 59.0, 1.99
HAPPY CAMP RANGER STATION, Siskiyou, CA01, -123.375, 41.796, 1142, 48.0, 11.95
INDIO FIRE STATION, Riverside, CA07, -116.215, 33.709, -21, 72.0, 0.00
LEMON COVE, Tulare, CA05, -119.026, 36.382, 513, 58.8, 3.04
LIVERMORE, Alameda, CA04, -121.751, 37.682, 529, 55.9, 3.30
MERCED MUNICIPAL AP, Merced, CA05, -120.518, 37.286, 152, 56.4, 2.39
NAPA STATE HOSPITAL, Napa, CA01, -122.265, 38.278, 35, 55.7, 8.36
OJAI, Ventura, CA06, -119.227, 34.448, 745, 56.0, 2.94
ORLAND, Glenn, CA02, -122.200, 39.746, 254, 56.2, 4.74
ORLEANS, Humboldt, CA01, -123.532, 41.309, 403, 52.0, 12.24
PASADENA, Los Angeles, CA06, -118.145, 34.148, 864, 62.0, 3.65
PASO ROBLES, San Luis Obispo, CA04, -120.685, 35.628, 730, 55.9, 2.92
PETALUMA AIRPORT, Sonoma, CA01, -122.608, 38.258, 20, 54.4, 6.63
QUINCY, Plumas, CA02, -120.947, 39.937, 3420, 44.4, 18.26
REDLANDS, San Bernardino, CA06, -117.195, 34.037, 1410, M, 1.41
SANTA BARBARA, Santa Barbara, CA06, -119.684, 34.417, 16, 61.0, 3.01
SANTA CRUZ, Santa Cruz, CA04, -122.000, 36.988, 70, 56.9, 7.65
TAHOE CITY, Placer, CA03, -120.143, 39.168, 6230, 36.8, 6.90
WASCO, Kern, CA05, -119.352, 35.589, 291, 60.9, 0.75
WEAVERVILLE, Trinity, CA01, -122.940, 40.737, 2058, 48.1, 10.17
WILLOWS 6 W, Glenn, CA02, -122.305, 39.523, 234, 55.8, 4.53
YOSEMITE PARK HEADQUARTERS, Mariposa, CA05, -119.590, 37.750, 4018, 47.3, 7.45
YREKA, Siskiyou, CA01, -122.641, 41.703, 2709, 46.7, 4.30
BERKELEY, Alameda, CA04, -122.260, 37.874, 310, 56.6, 7.93
BLYTHE, Riverside, CA07, -114.597, 33.613, 268, 67.7, 0.00
EUREKA WFO WOODLEY ISLAND, Humboldt, CA01, -124.160, 40.810, 20, 52.1, 8.11
INDEPENDENCE, Inyo, CA07, -118.204, 36.798, 3950, 56.9, 0.22
SAN LUIS OBISPO POLY, San Luis Obispo, CA04, -120.662, 35.306, 308, 57.6, 5.84
IMPERIAL BEACH REAM FIELD NAS, San Diego, CA06, -117.117, 32.568, 24, 59.9, 1.16
CAMPO, San Diego, CA06, -116.470, 32.626, 2630, 53.5, 1.05
EL CENTRO 2 SSW, Imperial, CA07, -115.562, 32.767, -30, 67.0, 0.00
IMPERIAL COUNTY AP, Imperial, CA07, -115.577, 32.835, -55, 69.2, T
EL CENTRO NAF, Imperial, CA07, -115.664, 32.832, -46, 70.5, T
ALPINE, San Diego, CA06, -116.777, 32.836, 1695, 57.8, 1.53
CULVER CITY, Los Angeles, CA06, -118.414, 34.005, 92, 61.2, 1.91
SANTA MONICA MUNICIPAL AP, Los Angeles, CA06, -118.447, 34.021, 175, 60.6, 1.93
SANTA MONICA PIER, Los Angeles, CA06, -118.500, 34.008, 14, M, 0.00
ONTARIO INTL AP, San Bernardino, CA06, -117.577, 34.053, 924, 61.7, 1.41
POMONA/FAIRPLEX, Los Angeles, CA06, -117.766, 34.082, 999, 61.6, 1.64
COVINA CITY YARD FC387B, Los Angeles, CA06, -117.880, 34.092, 607, M, 1.99
U C L A, Los Angeles, CA06, -118.443, 34.070, 430, 61.9, 2.23
IRON MOUNTAIN, San Bernardino, CA07, -115.122, 34.147, 922, 70.7, 0.00
TWENTYNINE PALMS, San Bernardino, CA07, -116.037, 34.128, 1975, 66.5, 0.03
JOSHUA TREE, San Bernardino, CA07, -116.275, 34.147, 2563, 58.4, 0.03
SAN GABRIEL FIRE DEPT, Los Angeles, CA06, -118.100, 34.084, 363, M, 1.32
POINT MUGU NF, Ventura, CA06, -119.123, 34.124, 12, 58.3, 0.09
ALTADENA, Los Angeles, CA06, -118.138, 34.182, 1127, M, 2.81
SAN GABRIEL CANYON PH, Los Angeles, CA06, -117.908, 34.155, 744, M, 2.67
WOODLAND HILLS PIERCE COLLEGE, Los Angeles, CA06, -118.574, 34.182, 790, 62.4, 1.64
SAN GABRIEL DAM FC425B-E, Los Angeles, CA06, -117.861, 34.205, 1481, M, 2.82
MT WILSON CBS, Los Angeles, CA06, -118.071, 34.231, 5710, 51.3, 4.59
VAN NUYS AP, Los Angeles, CA06, -118.491, 34.212, 785, 62.4, 1.71
CAMARILLO AP, Ventura, CA06, -119.088, 34.211, 71, 58.6, 1.91
OXNARD VENTURA COUNTY AP, Ventura, CA06, -119.204, 34.200, 39, 58.5, 2.18
PARKER RESRVOIR, San Bernardino, CA07, -114.171, 34.290, 738, 69.9, 0.05
TWENTYNINE PALMS MC, San Bernardino, CA07, -116.147, 34.294, 2003, M, 0.04
BIG BEAR LAKE, San Bernardino, CA06, -116.917, 34.243, 6753, 41.9, 2.20
CHATSWORTH FC 24 F, Los Angeles, CA06, -118.600, 34.250, 950, M, 0.89
BIG TUJUNGA DAM FC46, Los Angeles, CA06, -118.188, 34.295, 2326, M, 3.19
PACOIMA DAM FC33A-E, Los Angeles, CA06, -118.400, 34.329, 1550, M, 2.27
PIRU 2 ESE, Ventura, CA06, -118.757, 34.406, 712, M, 2.01
SANTA BARBARA MUNI AP, Santa Barbara, CA06, -119.842, 34.424, 8, 58.7, 2.51
JUNCAL DAM, Santa Barbara, CA06, -119.507, 34.491, 2260, M, 4.36
VICTORVILLE, San Bernardino, CA07, -117.293, 34.529, 2880, 56.2, 0.56
GIBRALTAR DAM NO. 2, Santa Barbara, CA06, -119.682, 34.523, 1558, 55.1, 4.22
AMBOY, San Bernardino, CA07, -115.744, 34.559, 648, 69.9, 0.07
PALMDALE, Los Angeles, CA07, -118.094, 34.588, 2612, 57.8, 1.40
SAUGUS POWER PLANT 1, Los Angeles, CA06, -118.454, 34.590, 2161, M, 3.04
LOS PRIETOS RS, Santa Barbara, CA06, -119.791, 34.544, 1024, M, 4.07
CACHUMA LAKE, Santa Barbara, CA06, -119.982, 34.582, 789, 58.1, 3.02
SALSIPUEDES GAGING STATION, Santa Barbara, CA06, -120.408, 34.585, 254, M, 3.47
PALMDALE AP, Los Angeles, CA07, -118.083, 34.629, 2509, 56.1, 0.83
LOMPOC, Santa Barbara, CA06, -120.451, 34.654, 75, 58.8, 2.62
LOMPOC AP, Santa Barbara, CA06, -120.467, 34.667, 88, 56.3, 2.22
LANCASTER, Los Angeles, CA06, -118.213, 34.741, 2338, 56.5, 0.62
SANDBERG, Los Angeles, CA06, -118.724, 34.744, 4510, 52.4, 1.17
LEBEC, Kern, CA05, -118.865, 34.833, 3575, 48.4, 2.12
NEW CUYAMA FIRE STATION, Santa Barbara, CA06, -119.683, 34.946, 2160, 52.6, 0.89
TWITCHELL DAM, Santa Barbara, CA06, -120.321, 34.988, 582, 49.4, 3.97
BORON, Kern, CA07, -117.650, 35.004, 2450, M, 0.53
MOJAVE, Kern, CA07, -118.162, 35.049, 2735, 56.9, 0.40
PISMO BEACH, San Luis Obispo, CA04, -120.683, 35.160, 39, 58.1, 2.31
TAFT, Kern, CA05, -119.430, 35.150, 773, M, 0.51
SALINAS DAM, San Luis Obispo, CA04, -120.504, 35.337, 1392, M, 5.05
RANDSBURG, Kern, CA07, -117.652, 35.369, 3570, 56.3, 0.70
SANTA MARGARITA BOOST, San Luis Obispo, CA04, -120.637, 35.374, 1148, M, 7.23
MORRO BAY FIRE DEPT, San Luis Obispo, CA04, -120.845, 35.367, 118, M, 3.70
BAKERSFIELD AP, Kern, CA05, -119.055, 35.434, 490, 60.5, 0.45
BUTTONWILLOW, Kern, CA05, -119.470, 35.403, 225, 58.9, 0.95
LOST HILLS, Kern, CA05, -119.689, 35.618, 288, M, 0.47
GLENNVILLE, Kern, CA05, -118.701, 35.727, 3140, 48.2, 3.10
TRONA, San Bernardino, CA07, -117.391, 35.764, 1695, 61.5, 0.04
DELANO, Kern, CA05, -119.260, 35.768, 302, 58.3, 0.58
BRADLEY TELEMETERING, Monterey, CA04, -120.868, 35.930, 443, M, 0.66
KETTLEMAN CITY, Kings, CA05, -119.960, 36.007, 240, 58.0, 0.70
HAIWEE, Inyo, CA07, -117.953, 36.139, 3825, 51.6, 0.01
CORCORAN IRRIGATION DIST., Kings, CA05, -119.582, 36.098, 200, 58.2, 0.92
COALINGA, Fresno, CA05, -120.361, 36.136, 670, 59.5, 1.03
KING CITY, Monterey, CA04, -121.138, 36.207, 320, 57.1, 2.94
LINDSAY, Tulare, CA05, -119.054, 36.203, 435, 58.0, 2.37
WESTHAVEN, Fresno, CA05, -119.997, 36.227, 285, M, 2.32
BIG SUR STATION, Monterey, CA04, -121.780, 36.247, 200, 54.7, 11.68
VISALIA, Tulare, CA05, -119.300, 36.328, 303, 58.0, 1.96
FIVE POINTS 5 SSW, Fresno, CA05, -120.156, 36.364, 285, 58.1, 1.11
SAN CLEMENTE DAM, Monterey, CA04, -121.709, 36.438, 600, M, 5.47
ASH MOUNTAIN, Tulare, CA05, -118.825, 36.491, 1708, 54.9, 2.14
THREE RIVERS EDISON PH 1, Tulare, CA05, -118.862, 36.465, 1140, 55.8, 4.34
PINNACLES NATIONAL PARK, San Benito, CA04, -121.182, 36.482, 1307, 54.6, 3.50
CARMEL VALLEY, Monterey, CA04, -121.724, 36.481, 480, 55.8, 5.54
LODGEPOLE, Tulare, CA05, -118.732, 36.604, 6735, 35.0, 6.49
PANOCHE 2 W, San Benito, CA05, -120.884, 36.607, 1400, M, 2.25
MONTEREY, Monterey, CA04, -121.855, 36.593, 122, 56.3, 5.98
SALINAS NO. 2, Monterey, CA04, -121.666, 36.659, 45, 57.3, 4.36
SALINAS AP, Monterey, CA04, -121.609, 36.664, 73, 57.1, 3.45
GRANT GROVE, Tulare, CA05, -118.962, 36.738, 6580, 40.3, 7.02
LOS BANOS ARBURUA RANCH, Merced, CA05, -120.939, 36.875, 843, M, 1.98
HOLLISTER 2, San Benito, CA04, -121.421, 36.848, 275, 55.4, 3.48
BALCH POWER HOUSE, Fresno, CA05, -119.088, 36.909, 1735, 55.1, 4.99
WATSONVILLE WATERWORKS, Santa Cruz, CA04, -121.769, 36.931, 95, 57.7, 8.03
FRIANT GOVERNMENT CAMP, Fresno, CA05, -119.707, 36.997, 410, 56.2, 3.96
MADERA, Madera, CA05, -120.038, 36.954, 270, 57.2, 3.84
WISHON DAM, Fresno, CA05, -118.984, 37.007, 6550, M, 7.13
GILROY, Santa Clara, CA04, -121.561, 37.003, 194, 57.2, 6.46
AUBERRY 2 NW, Fresno, CA05, -119.513, 37.092, 2090, 52.7, 5.44
LOS BANOS, Merced, CA05, -120.867, 37.056, 120, 59.1, 2.24
BEN LOMOND NO. 4, Santa Cruz, CA04, -122.080, 37.086, 420, 54.8, 14.56
MORGAN HILL, Santa Clara, CA04, -121.602, 37.136, 375, 64.5, M
HUNTINGTON LAKE, Fresno, CA05, -119.221, 37.228, 7020, M, 6.63
NORTH FORK RS, Madera, CA05, -119.510, 37.233, 2645, 48.8, 6.96
RAYMOND, Madera, CA05, -119.909, 37.210, 919, M, 5.50
LOS GATOS, Santa Clara, CA04, -121.959, 37.232, 365, 56.8, 6.17
NEWMAN, Stanislaus, CA05, -121.018, 37.281, 90, 59.0, 3.32
MOUNT HAMILTON, Santa Clara, CA04, -121.635, 37.343, 4220, 46.2, 9.50
BISHOP AIRPORT, Inyo, CA07, -118.359, 37.371, 4110, 52.0, 0.07
MOFFETT FEDERAL AIRFIELD, Santa Clara, CA04, -122.048, 37.406, 39, 57.9, 3.25
TURLOCK #2, Stanislaus, CA05, -120.846, 37.502, 103, 61.1, 3.43
PALO ALTO, Santa Clara, CA04, -122.140, 37.444, 25, 56.2, 3.33
REDWOOD CITY, San Mateo, CA04, -122.239, 37.477, 31, 56.4, 6.82
HALF MOON BAY, San Mateo, CA04, -122.443, 37.473, 27, 54.4, 7.24
SO ENTRANCE YOSEMITE N.P., Mariposa, CA05, -119.633, 37.512, 5047, 40.7, 6.65
MARIPOSA R S, Mariposa, CA05, -119.986, 37.495, 2100, M, 7.26
NEWARK, Alameda, CA04, -122.032, 37.515, 10, 57.6, 2.68
EXCHEQUER DAM, Mariposa, CA05, -120.267, 37.585, 442, M, 6.27
MODESTO AP, Stanislaus, CA05, -120.955, 37.625, 87, 59.1, 3.80
HAYWARD AIR TERMINAL, Alameda, CA04, -122.121, 37.659, 31, 57.7, 4.15
TRACY CARBONA, San Joaquin, CA05, -121.347, 37.682, 135, 57.2, 1.74
LIVERMORE MUNICIPAL AP, Alameda, CA04, -121.815, 37.693, 393, 55.7, 3.54
OAKLAND INTERNATIONAL AIRPORT, Alameda, CA04, -122.233, 37.718, 5, 57.8, 4.80
UPPER SAN LEANDRO FILTERS, Alameda, CA04, -122.167, 37.772, 394, M, 8.67
SAN FRANCISCO DOWNTOWN, San Francisco, CA04, -122.427, 37.771, 150, 56.8, 6.83
SAN FRANCISCO OCEANSIDE, San Francisco, CA04, -122.505, 37.728, 8, 56.5, 5.75
GROVELAND 2, Tuolumne, CA05, -120.226, 37.844, 2800, 48.3, 10.17
TRACY PUMPING PLANT, Alameda, CA05, -121.583, 37.796, 61, 59.1, 2.60
OAKLAND MUSEUM, Alameda, CA04, -122.264, 37.798, 30, 58.5, 5.92
TUOLUMNE MEADOWS R.S., Tuolumne, CA05, -119.344, 37.877, 8694, 31.0, 4.23
MOUNT DIABLO JUNCTION, Contra Costa, CA04, -121.930, 37.879, 2170, 52.5, 11.42
STOCKTON AP, San Joaquin, CA05, -121.226, 37.890, 27, 57.3, 3.55
RICHMOND, Contra Costa, CA04, -122.377, 37.919, 20, 56.6, 8.35
MUIR WOODS, Marin, CA01, -122.569, 37.898, 220, 55.3, 10.19
HETCH HETCHY, Tuolumne, CA05, -119.783, 37.961, 3870, 47.7, 7.77
CHERRY VALLEY DAM, Tuolumne, CA05, -119.916, 37.975, 4765, 46.5, 11.01
SONORA, Tuolumne, CA05, -120.387, 37.967, 1675, 51.2, 8.09
STOCKTON FIRE STA 4, San Joaquin, CA05, -121.318, 37.999, 12, M, 2.46
ANTIOCH PUMPING PLANT #3, Contra Costa, CA05, -121.752, 37.983, 60, 58.5, 3.37
CONCORD BUCHANAN FIELD, Contra Costa, CA04, -122.053, 37.992, 23, 58.2, 4.96
CONCORD WASTEWATER PLANT, Contra Costa, CA04, -122.069, 37.983, 40, 58.7, 5.77
SAN RAFAEL-CIVIC CENTER, Marin, CA01, -122.537, 37.998, 120, 56.7, 0.01
KENTFIELD, Marin, CA01, -122.545, 37.957, 145, 55.7, 11.48
MARTINEZ WATER PLANT, Contra Costa, CA04, -122.114, 38.013, 40, 54.7, 4.89
SAN ANDREAS 2, Calaveras, CA05, -120.671, 38.191, 1100, 56.0, 7.48
BODIE CALIFORNIA STATE HISTORIC PARK, Mono, CA03, -119.014, 38.212, 8370, 33.6, 1.89
ACAMPO 5NE, San Joaquin, CA05, -121.201, 38.218, 87, M, 4.61
NAPA COUNTY AIRPORT, Napa, CA04, -122.280, 38.208, 16, 53.6, 6.50
BRIDGEPORT, Mono, CA03, -119.229, 38.258, 6470, 37.3, 1.22
CALAVERAS BIG TREES, Calaveras, CA05, -120.311, 38.277, 4695, 42.1, 13.31
CAMP PARDEE, Calaveras, CA05, -120.843, 38.249, 658, M, 5.85
TRAVIS FIELD AFB, Solano, CA02, -121.933, 38.267, 62, 57.1, 4.03
FAIRFIELD, Solano, CA02, -122.068, 38.274, 40, 57.1, 6.92
SONOMA, Sonoma, CA01, -122.462, 38.299, 97, 54.6, 6.83
SUTTER HILL CDF, Amador, CA05, -120.801, 38.377, 1586, 54.4, 3.76
WEST POINT, Calaveras, CA05, -120.545, 38.378, 2775, M, 10.56
ATLAS ROAD BROWN, Napa, CA01, -122.248, 38.427, 1680, M, 13.94
GRATON, Sonoma, CA01, -122.865, 38.431, 200, 55.3, 12.05
OCCIDENTAL, Sonoma, CA01, -122.966, 38.386, 865, 52.7, 13.57
FIDDLETOWN DEXTER RCH, Amador, CA05, -120.698, 38.525, 2170, M, 9.46
SACRAMENTO AP ASOS, Sacramento, CA02, -121.496, 38.507, 19, 57.0, 5.07
WINTERS, Yolo, CA02, -121.978, 38.525, 135, 57.5, 7.27
LAKE SOLANO, Solano, CA02, -122.004, 38.492, 187, 57.6, 7.64
SAINT HELENA, Napa, CA01, -122.471, 38.507, 225, 56.5, 10.07
SAINT HELENA 4 WSW, Napa, CA01, -122.538, 38.493, 1780, M, 14.26
FORT ROSS, Sonoma, CA01, -123.245, 38.515, 112, 53.0, 9.69
SACRAMENTO 5 ESE, Sacramento, CA02, -121.418, 38.555, 38, 58.6, 4.64
ANGWIN PACIFIC UNION COLLEGE, Napa, CA01, -122.440, 38.573, 1715, 51.8, 11.49
CALISTOGA, Napa, CA01, -122.578, 38.577, 350, 55.4, 12.29
VENADO, Sonoma, CA01, -123.018, 38.609, 1260, M, 23.78
WOODLAND 1 WNW, Yolo, CA02, -121.794, 38.683, 67, 58.3, 7.13
SACRAMENTO METROPOLITAN AP, Sacramento, CA02, -121.595, 38.701, 24, 56.3, 6.31
PACIFIC HOUSE, El Dorado, CA02, -120.503, 38.758, 3450, 46.1, 14.60
MIDDLETOWN, Lake, CA02, -122.626, 38.748, 1121, M, 13.55
CLOVERDALE, Sonoma, CA01, -123.026, 38.793, 400, 56.4, 13.50
KELSEY 1 N, El Dorado, CA02, -120.821, 38.809, 2000, M, 10.88
SOUTH LAKE TAHOE AP, El Dorado, CA03, -119.996, 38.898, 6257, 38.2, 3.94
GEORGETOWN RS, El Dorado, CA02, -120.801, 38.933, 3001, 47.7, 14.41
AUBURN, Placer, CA02, -121.084, 38.907, 1292, 54.3, 7.55
NICOLAUS #2, Sutter, CA02, -121.545, 38.926, 43, M, 7.87
YORKVILLE, Mendocino, CA01, -123.231, 38.905, 1100, M, 15.58
CLEARLAKE 4 SE, Lake, CA02, -122.567, 38.924, 1349, 51.6, 8.88
FORESTHILL RANGER STATION, Placer, CA02, -120.845, 39.010, 3015, M, 16.17
HELL HOLE, Placer, CA02, -120.415, 39.058, 4850, M, 11.41
MARYSVILLE AIRPORT (ASOS), Yuba, CA02, -121.569, 39.102, 62, 56.3, 7.54
UKIAH MUNICIPAL AP, Mendocino, CA01, -123.200, 39.128, 603, 53.8, 9.20
UKIAH 4 WSW, Mendocino, CA01, -123.272, 39.127, 1328, M, 12.04
EL CAPITAN DAM, San Diego, CA06, -116.815, 32.886, 600, 63.8, 1.88
LAKESIDE 2 E, San Diego, CA06, -116.895, 32.854, 690, M, 1.45
POWAY VALLEY, San Diego, CA06, -117.031, 33.020, 648, 60.8, 1.17
JULIAN CDF, San Diego, CA06, -116.592, 33.076, 4215, 51.4, 1.98
CARLSBAD MCCLELLAN PALOMAR AP, San Diego, CA06, -117.277, 33.130, 313, 59.4, 1.01
HENSHAW DAM, San Diego, CA06, -116.761, 33.237, 2700, 52.1, 2.76
VISTA, San Diego, CA06, -117.232, 33.235, 430, 59.0, 1.80
OCEANSIDE MARINA, San Diego, CA06, -117.395, 33.210, 10, 58.0, 0.97
NILAND, Imperial, CA07, -115.524, 33.278, -60, M, 0.00
BORREGO DESERT PARK, San Diego, CA07, -116.404, 33.256, 810, 69.0, 0.32
PALOMAR MTN OBSERVATORY, San Diego, CA06, -116.840, 33.378, 5550, 50.2, 2.47
MECCA FIRE STATION, Riverside, CA07, -116.073, 33.570, -183, 67.3, 0.00
LAGUNA BEACH, Orange, CA06, -117.781, 33.545, 44, M, 0.00
BLYTHE ASOS, Riverside, CA07, -114.715, 33.619, 395, 69.1, T
DESERT RESORTS REGIONAL AP, Riverside, CA07, -116.164, 33.632, -118, 68.2, T
GOLD RUN 4 SW, Placer, CA02, -120.900, 39.150, 3220, M, 15.64
WILLIAMS, Colusa, CA02, -122.150, 39.150, 85, M, 15.35
GRASS VALLEY NO. 2, Nevada, CA02, -121.068, 39.204, 2400, 48.3, 16.62
HARRY L. ENGLEBRIGHT DAM, Nevada, CA02, -121.267, 39.237, 800, M, 11.41
COLUSA 2 SSW, Colusa, CA02, -122.027, 39.188, 50, 57.0, 4.48
BLUE CANYON NYACK AP, Placer, CA02, -120.709, 39.276, 5286, 42.3, 19.01
NEVADA CITY, Nevada, CA02, -121.001, 39.247, 2781, 46.0, 19.22
TRUCKEE AIRPORT, Nevada, CA03, -120.139, 39.320, 5900, 37.2, 5.98
TRUCKEE RS, Nevada, CA03, -120.173, 39.333, 5823, M, 0.44
COLGATE POWERHOUSE, Yuba, CA02, -121.192, 39.331, 595, M, 11.81
MOULTON WEIR, Colusa, CA02, -122.017, 39.333, 76, M, 4.43
BOCA, Nevada, CA03, -120.094, 39.389, 5575, 39.2, 4.69
POTTER VALLEY POWERHOUSE, Mendocino, CA01, -123.129, 39.362, 1018, 53.3, 14.32
FARAD, Nevada, CA03, -120.033, 39.428, 5153, M, 4.24
BOWMAN DAM, Nevada, CA02, -120.656, 39.454, 5385, 40.5, 22.12
OROVILLE, Butte, CA02, -121.553, 39.518, 171, 55.1, 8.92
OROVILLE MUNICIPAL AP, Butte, CA02, -121.622, 39.494, 187, 56.6, 6.84
SIERRAVILLE RS, Sierra, CA02, -120.370, 39.583, 4975, 40.7, 7.57
DOWNIEVILLE, Sierra, CA02, -120.824, 39.563, 2915, 46.2, 22.28
STRAWBERRY VALLEY, Yuba, CA02, -121.108, 39.563, 3808, 44.6, 28.61
STONY GORGE RESERVOIR, Glenn, CA02, -122.534, 39.586, 800, 52.1, 5.12
BRUSH CREEK RANGER STATION, Butte, CA02, -121.345, 39.695, 3560, M, 23.68
PARADISE, Butte, CA02, -121.624, 39.754, 1750, 53.2, 16.19
VINTON, Plumas, CA02, -120.186, 39.806, 4950, 46.7, 3.03
PORTOLA, Plumas, CA02, -120.472, 39.805, 4850, 41.0, 7.38
DE SABLA, Butte, CA02, -121.611, 39.872, 2710, 49.2, 19.17
LEGGETT, Mendocino, CA01, -123.720, 39.874, 703, M, 11.24
BUCKS CREEK, Plumas, CA02, -121.315, 39.937, 1891, M, 20.47
DOYLE, Lassen, CA03, -120.105, 40.027, 4293, M, 0.41
CANYON DAM, Plumas, CA02, -121.089, 40.171, 4560, 41.7, 13.12
MIRANDA 4 SE, Humboldt, CA01, -123.776, 40.182, 266, M, 17.35
FORT SEWARD, Humboldt, CA01, -123.632, 40.218, 220, M, 15.54
HONEYDEW 1 SW, Humboldt, CA01, -124.132, 40.238, 373, M, 26.65
CHESTER, Plumas, CA02, -121.242, 40.303, 4530, 39.8, 10.31
MINERAL, Tehama, CA02, -121.609, 40.346, 4875, 33.8, 15.49
COLEMAN FISHERIES STATION, Shasta, CA02, -122.143, 40.400, 420, M, 6.63
VOLTA PH, Shasta, CA02, -121.866, 40.458, 2220, M, 5.77
SCOTIA, Humboldt, CA01, -124.104, 40.483, 136, 54.1, 12.25
MANZANITA LAKE, Shasta, CA02, -121.577, 40.541, 5750, 36.9, 8.36
WHISKEYTOWN RESERVOIR, Shasta, CA02, -122.528, 40.612, 1295, 52.2, 19.19
SHASTA DAM, Shasta, CA02, -122.416, 40.714, 1075, 53.8, 17.35
TRINITY RIVER HATCHERY, Trinity, CA01, -122.795, 40.726, 1861, 48.5, 6.61
BIG BAR 4 E, Trinity, CA01, -123.208, 40.741, 1253, 50.0, 9.04
BUCKHORN, Shasta, CA02, -121.932, 40.880, 3700, M, 18.68
HAT CREEK, Shasta, CA02, -121.543, 40.932, 3015, 45.2, 4.01
PIT RIVER PH 5, Shasta, CA02, -121.977, 40.987, 1458, M, 21.86
WILLOW CREEK 1 NW, Humboldt, CA01, -123.636, 40.947, 464, 52.9, 8.96
FALL RIVER MILLS, Shasta, CA02, -121.435, 41.008, 3300, M, 4.88
ADIN RANGER STATION, Modoc, CA02, -120.945, 41.193, 4202, M, 2.33
DUNSMUIR TREATMENT PL, Siskiyou, CA02, -122.282, 41.183, 2169, 45.5, 19.75
JESS VALLEY, Modoc, CA02, -120.295, 41.268, 5400, 38.2, 1.83
MCCLOUD, Siskiyou, CA02, -122.138, 41.252, 3233, 42.9, 13.24
ORICK, Humboldt, CA01, -124.067, 41.283, 5, M, 10.26
CALLAHAN, Siskiyou, CA01, -122.825, 41.338, 3085, 46.6, 4.25
SAWYERS BAR RS, Siskiyou, CA01, -123.133, 41.301, 2255, 46.9, 11.25
ORLEANS RS, Humboldt, CA01, -123.534, 41.303, 433, M, 11.71
ALTURAS, Modoc, CA02, -120.544, 41.490, 4378, 42.3, 0.49
FORT JONES RS, Siskiyou, CA01, -122.848, 41.601, 2729, 43.7, 4.87
LAVA BEDS NAT MON, Siskiyou, CA01, -121.501, 41.702, 4770, 40.5, 2.62
MOUNT HEBRON RS, Siskiyou, CA01, -122.045, 41.783, 4265, 44.5, 0.80
CRESCENT CITY MCNAMARA AP, Del Norte, CA01, -124.238, 41.784, 56, 51.3, 10.11
OAK KNOLL W. C., Siskiyou, CA01, -122.850, 41.839, 1980, M, 4.56
FORT BIDWELL, Modoc, CA03, -120.157, 41.872, 4739, 42.0, 2.73
GASQUET RS, Del Norte, CA01, -123.965, 41.845, 387, M, 19.07
FORT DICK RIVER, Del Norte, CA01, -124.135, 41.881, -, M, 15.08
TULELAKE, Siskiyou, CA01, -121.474, 41.960, 4038, 41.9, 1.58
COPCO NO 1 DAM, Siskiyou, CA01, -122.338, 41.980, 2665, 46.1, 3.97
ELK VALLEY, Del Norte, CA01, -123.718, 41.988, 1708, M, 19.86
BARSTOW, San Bernardino, CA07, -117.022, 34.893, 2220, 59.8, 0.34
PEARBLOSSOM, Los Angeles, CA07, -117.897, 34.503, 3101, 58.3, 0.75
EL CAJON, San Diego, CA06, -116.928, 32.801, 495, 61.4, 0.96
MARKLEY COVE, Napa, CA02, -122.124, 38.492, 480, 54.7, 8.46
DEEP CANYON LAB, Riverside, CA07, -116.376, 33.651, 1200, M, 0.02
ELSINORE, Riverside, CA06, -117.346, 33.686, 1268, 61.3, 0.74
SANTA ANA JOHN WAYNE AP, Orange, CA06, -117.867, 33.680, 43, 60.9, 1.11
HAYFIELD PUMPING PLANT, Riverside, CA07, -115.629, 33.704, 1370, 64.3, 0.05
IDYLLWILD FIRE DEPT, Riverside, CA06, -116.707, 33.757, 5380, 46.9, 2.28
SAN JACINTO, Riverside, CA06, -116.975, 33.797, 1525, 60.1, 1.14
HEMET, Riverside, CA06, -116.894, 33.738, 1811, 60.5, 0.41
SANTA ANA FIRE STATION, Orange, CA06, -117.867, 33.744, 135, 63.7, 0.97
EAGLE MOUNTAIN, Riverside, CA07, -115.451, 33.809, 973, 68.0, 0.00
PALM SPRINGS, Riverside, CA07, -116.510, 33.828, 425, M, T
LONG BEACH DAUGHERTY AP, Los Angeles, CA06, -118.147, 33.812, 34, 61.8, 0.92
PALOS VERDES ES FC43D, Los Angeles, CA06, -118.391, 33.800, 220, M, 1.62
FULLERTON MUNICIPAL AP, Orange, CA06, -117.986, 33.872, 86, 63.3, 0.92
BEAUMONT #2, Riverside, CA07, -116.990, 33.926, 2591, M, 1.61
MARCH AFB, Riverside, CA06, -117.250, 33.900, 1536, 57.7, 0.56
YORBA LINDA, Orange, CA06, -117.819, 33.890, 350, M, 1.33
HAWTHORNE MUNICIPAL AP, Los Angeles, CA06, -118.333, 33.924, 55, 62.1, 1.52
LOS ANGELES INTL AP, Los Angeles, CA06, -118.387, 33.938, 97, 60.5, 1.46
RIVERSIDE FIRE STATION 3, Riverside, CA06, -117.388, 33.951, 840, 62.4, 0.82
RIVERSIDE MUNICIPAL AP, Riverside, CA06, -117.435, 33.953, 845, 62.4, 0.78
CHINO AP, San Bernardino, CA06, -117.625, 33.976, 636, 61.7, 1.00
LORAINE 5 NNE, Kern, CA05, -118.412, 35.384, 4235, 47.8, 1.90
LEMON GROVE FIRE DEPARTMENT, San Diego, CA06, -117.030, 32.738, 427, M, 1.27
LEE VINING, Mono, CA07, -119.119, 37.957, 6797, 43.5, 1.33
ANAHEIM, Orange, CA06, -117.842, 33.865, 235, 64.0, 1.02
NEW MELONES DAM HQ, Tuolumne, CA05, -120.486, 38.005, 960, 55.1, 7.01
MAMMOTH LAKES RS, Mono, CA07, -118.962, 37.648, 7804, 38.0, 3.52
FRAZIER PARK 9 SW, Ventura, CA05, -119.104, 34.733, 5169, M, 1.89
MONTEREY WFO, Monterey, CA04, -121.855, 36.593, 122, 55.3, 5.16
SKYLINE RIDGE PRESERVE, San Mateo, CA04, -122.185, 37.313, 2270, 51.0, 15.23
FREMONT, Alameda, CA04, -122.016, 37.542, 38, 57.1, 3.96
MAD RIVER 12 SE, Trinity, CA01, -123.374, 40.319, 2763, M, 0.00
TEHACHAPI 4 SE, Kern, CA05, -118.422, 35.101, 4220, 46.8, 1.65
WRIGHTWOOD, San Bernardino, CA07, -117.639, 34.362, 6000, M, 1.90
VALLEJO, Solano, CA01, -122.187, 38.100, 341, 58.0, 4.95
NORTHRIDGE CAL STATE, Los Angeles, CA06, -118.525, 34.245, 904, M, 1.61
OXNARD WFO, Ventura, CA06, -119.137, 34.207, 52, 58.6, 2.16
HANFORD MUNICIPAL AP, Kings, CA05, -119.623, 36.311, 249, 57.6, 2.00
RAMONA AIRPORT, San Diego, CA06, -116.916, 33.038, 1385, 54.6, 1.41
VACAVILLE/NUT TREE AP ASOS, Solano, CA02, -121.959, 38.378, 104, 57.7, 7.04
ALTURAS MUNICIPAL AP, Modoc, CA02, -120.561, 41.484, 4383, 41.9, 1.84
MADERA MUNICIPAL AP, Madera, CA05, -120.111, 36.985, 251, 57.0, 3.12
BAKERSFIELD 5 NW, Kern, CA05, -119.051, 35.419, 470, 59.8, 0.53
FRESNO 5 NE, Fresno, CA05, -119.709, 36.767, 338, 59.9, 2.59
OCEANSIDE MUNICIPAL AP, San Diego, CA06, -117.350, 33.219, 30, 57.7, 1.21
SAN DIEGO SEAWORLD, San Diego, CA06, -117.231, 32.765, 14, 59.4, 1.17
ARCATA EUREKA AP, Humboldt, CA01, -124.105, 40.978, 211, 52.2, 10.48
NEWPORT BEACH HARBOR, Orange, CA06, -117.884, 33.603, 10, 60.0, 0.84
ESCONDIDO NO. 2, San Diego, CA06, -117.090, 33.121, 600, 62.1, 1.27
REDDING AP, Shasta, CA02, -122.298, 40.515, 501, 56.7, 10.36
AVALON CATALINA AP, Los Angeles, CA06, -118.415, 33.404, 1565, 57.2, 1.69
SANTA MARIA PUBLIC AP, Santa Barbara, CA06, -120.452, 34.894, 243, 58.3, 3.08
MOUNT SHASTA, Siskiyou, CA02, -122.333, 41.333, 3535, 44.6, 11.21
RED BLUFF MUNI AP, Tehama, CA02, -122.255, 40.152, 354, 56.1, 6.21
NEEDLES AIRPORT, San Bernardino, CA07, -114.618, 34.768, 888, 69.3, 0.03
CHINA LAKE NAF, Kern, CA07, -117.693, 35.688, 2230, 58.7, T
COARSEGOLD 4SE, Madera, CA05, -119.690, 37.212, 2218, M, 5.43
TWENTYNINE PALMS 12E - WONDER VALLEY, San Bernardino, CA07, -115.850, 34.121, 1376, 65.2, 0.00
MORONGO VALLEY NORTH, San Bernardino, CA07, -116.562, 34.086, 3145, 58.6, 0.20
SHAFTER 6E, Kern, CA05, -119.146, 35.487, 404, 58.5, 0.59
TRUCKEE-TAHOE AP, Nevada, CA03, -120.145, 39.318, 5900, 37.2, 5.98
HEARST CASTLE, San Luis Obispo, CA04, -121.168, 35.684, 1526, 55.9, 8.81
GETTY CENTER, Los Angeles, CA06, -118.479, 34.087, 1117, 59.5, 2.43
HESPERIA 2E, San Bernardino, CA07, -117.266, 34.421, 3055, 57.0, 0.84
RANCHO BERNARDO, San Diego, CA06, -117.081, 33.022, 690, 60.2, 1.53
APPLE VALLEY #2, San Bernardino, CA07, -117.279, 34.536, 2780, M, 0.18
OCOTILLO WELLS 2W, San Diego, CA07, -116.169, 33.155, 390, 71.7, 0.05
IRVINE RANCH, Orange, CA06, -117.723, 33.720, 540, 63.9, 1.39
MT. LAGUNA #3, San Diego, CA07, -116.419, 32.867, 5920, 50.2, 1.05
AVALON INLAND, Los Angeles, CA06, -118.330, 33.338, 90, 54.6, 0.01
DESERT CENTER 2 NNE, Riverside, CA07, -115.392, 33.738, 747, 52.0, 0.01
TORRANCE AP, Los Angeles, CA06, -118.342, 33.802, 90, 60.9, 1.52
MERCED 23 WSW, Merced, CA05, -120.882, 37.238, 78, 54.9, 2.82
REDDING 12 WNW, Shasta, CA02, -122.607, 40.651, 1418, 52.3, 14.70
STOVEPIPE WELLS 1 SW, Inyo, CA07, -117.145, 36.602, 84, 70.3, 0.00
