Name, County, ClimateDivision, Longitude, Latitude, Elevation, MeanAvgTemperature, TotalPrecipitation
IMPERIAL, Imperial, CA07, -115.567, 32.849, -64, 73.9, 0.11
EL CAPITAN DAM, San Diego, CA06, -116.815, 32.886, 600, M, 0.35
LAKESIDE 2 E, San Diego, CA06, -116.895, 32.854, 690, M, 0.82
POWAY VALLEY, San Diego, CA06, -117.031, 33.020, 648, M, 0.57
JULIAN CDF, San Diego, CA06, -116.592, 33.076, 4215, 59.9, 0.21
CARLSBAD MCCLELLAN PALOMAR AP, San Diego, CA06, -117.277, 33.130, 313, 66.5, 0.67
HENSHAW DAM, San Diego, CA06, -116.761, 33.237, 2700, 59.8, 0.70
VISTA, San Diego, CA06, -117.232, 33.235, 430, 66.8, 1.05
OCEANSIDE MARINA, San Diego, CA06, -117.395, 33.210, 10, 65.2, 0.78
NILAND, Imperial, CA07, -115.524, 33.278, -60, M, 0.00
BORREGO DESERT PARK, San Diego, CA07, -116.404, 33.256, 810, 75.2, 0.29
PALOMAR MTN OBSERVATORY, San Diego, CA06, -116.840, 33.378, 5550, 57.3, 1.01
MECCA FIRE STATION, Riverside, CA07, -116.073, 33.570, -183, 77.1, 1.88
BLYTHE ASOS, Riverside, CA07, -114.715, 33.619, 395, 73.9, 0.85
DESERT RESORTS REGIONAL AP, Riverside, CA07, -116.164, 33.632, -118, 76.0, 0.82
BARSTOW-DAGGETT AIRPORT, San Bernardino, CA07, -116.787, 34.854, 1919, 67.6, T
MERCED, Merced, CA05, -120.516, 37.289, 154, 64.4, 0.13
SAN DIEGO MONTGOMERY FIELD, San Diego, CA06, -117.137, 32.815, 418, 68.6, 0.50
SAN DIEGO INTERNATIONAL AP, San Diego, CA06, -117.183, 32.734, 15, 69.2, 0.57
SAN DIEGO MIRAMAR NAS, San Diego, CA06, -117.133, 32.867, 477, 69.8, 0.58
NORTH ISLAND NAS, San Diego, CA06, -117.210, 32.692, 14, 67.5, T
SAN FRANCISCO INTERNATIONAL AP, San Mateo, CA04, -122.366, 37.620, 10, 62.7, 0.16
SAN LUIS OBISPO MCCHESNEY FIELD, San Luis Obispo, CA04, -120.644, 35.238, 183, 65.0, 0.50
CEDARVILLE, Modoc, CA03, -120.179, 41.530, 4688, 50.5, 0.55
CHICO UNIVERSITY FARM, Butte, CA02, -121.821, 39.691, 185, 63.6, 0.52
CHULA VISTA, San Diego, CA06, -117.086, 32.640, 56, 66.9, 0.10
COLFAX, Placer, CA02, -120.947, 39.090, 2373, 66.0, 0.03
CUYAMACA, San Diego, CA06, -116.587, 32.990, 4640, 55.5, 0.38
DAVIS 2 WSW EXP FARM, Yolo, CA02, -121.776, 38.535, 60, 66.4, 0.03
DEATH VALLEY NATIONAL PARK, Inyo, CA07, -116.867, 36.463, -194, 80.4, 0.07
FAIRMONT, Los Angeles, CA07, -118.430, 34.705, 3060, 64.4, 0.00
FORT BRAGG 5 N, Mendocino, CA01, -123.756, 39.510, 123, 54.5, 1.08
HANFORD 1 S, Kings, CA05, -119.637, 36.316, 237, 66.1, 0.04
HAPPY CAMP RANGER STATION, Siskiyou, CA01, -123.375, 41.796, 1142, 60.5, 1.09
HEALDSBURG, Sonoma, CA01, -122.866, 38.629, 177, 66.5, 1.34
INDIO FIRE STATION, Riverside, CA07, -116.215, 33.709, -21, 77.5, 0.41
LEMON COVE, Tulare, CA05, -119.026, 36.382, 513, 67.8, 0.57
LIVERMORE, Alameda, CA04, -121.751, 37.682, 529, 63.8, 0.18
MERCED MUNICIPAL AP, Merced, CA05, -120.518, 37.286, 152, 64.6, T
NAPA STATE HOSPITAL, Napa, CA01, -122.265, 38.278, 35, 64.6, 0.22
OJAI, Ventura, CA06, -119.227, 34.448, 745, 64.6, 0.06
ORLAND, Glenn, CA02, -122.200, 39.746, 254, 65.7, 0.86
PASADENA, Los Angeles, CA06, -118.145, 34.148, 864, 69.7, 0.39
PASO ROBLES, San Luis Obispo, CA04, -120.685, 35.628, 730, 62.9, 0.28
PETALUMA AIRPORT, Sonoma, CA01, -122.608, 38.258, 20, 63.4, 1.34
QUINCY, Plumas, CA02, -120.947, 39.937, 3420, 50.9, 0.87
REDLANDS, San Bernardino, CA06, -117.195, 34.037, 1410, M, 0.87
SANTA BARBARA, Santa Barbara, CA06, -119.684, 34.417, 16, 66.6, 0.86
SANTA CRUZ, Santa Cruz, CA04, -122.000, 36.988, 70, 64.0, 0.05
SANTA ROSA, Sonoma, CA01, -122.713, 38.456, 166, 63.8, 1.37
TAHOE CITY, Placer, CA03, -120.143, 39.168, 6230, 45.9, 0.82
WASCO, Kern, CA05, -119.352, 35.589, 291, 67.0, 0.00
WEAVERVILLE, Trinity, CA01, -122.940, 40.737, 2058, 58.0, 0.51
WILLOWS 6 W, Glenn, CA02, -122.305, 39.523, 234, 68.8, 0.73
YOSEMITE PARK HEADQUARTERS, Mariposa, CA05, -119.590, 37.750, 4018, 55.2, 1.28
YREKA, Siskiyou, CA01, -122.641, 41.703, 2709, 53.2, 0.56
BERKELEY, Alameda, CA04, -122.260, 37.874, 310, 62.8, 0.12
BLYTHE, Riverside, CA07, -114.597, 33.613, 268, M, 0.89
EUREKA WFO WOODLEY ISLAND, Humboldt, CA01, -124.160, 40.810, 20, 54.0, 0.85
SAN LUIS OBISPO POLY, San Luis Obispo, CA04, -120.662, 35.306, 308, 66.1, 0.70
IMPERIAL BEACH REAM FIELD NAS, San Diego, CA06, -117.117, 32.568, 24, 64.4, 0.08
CAMPO, San Diego, CA06, -116.470, 32.626, 2630, 61.5, 0.08
EL CENTRO 2 SSW, Imperial, CA07, -115.562, 32.767, -30, 74.7, 0.02
IMPERIAL COUNTY AP, Imperial, CA07, -115.577, 32.835, -55, 75.0, 0.02
EL CENTRO NAF, Imperial, CA07, -115.664, 32.832, -46, 75.1, 0.02
ALPINE, San Diego, CA06, -116.777, 32.836, 1695, 66.3, 0.23
DEEP CANYON LAB, Riverside, CA07, -116.376, 33.651, 1200, M, 1.08
ELSINORE, Riverside, CA06, -117.346, 33.686, 1268, 69.0, 1.40
SANTA ANA JOHN WAYNE AP, Orange, CA06, -117.867, 33.680, 43, 69.6, 0.84
HAYFIELD PUMPING PLANT, Riverside, CA07, -115.629, 33.704, 1370, 70.9, 1.05
IDYLLWILD FIRE DEPT, Riverside, CA06, -116.707, 33.757, 5380, 56.0, 0.54
SAN JACINTO, Riverside, CA06, -116.975, 33.797, 1525, 68.0, 0.51
HEMET, Riverside, CA06, -116.894, 33.738, 1811, 68.8, 0.95
SANTA ANA FIRE STATION, Orange, CA06, -117.867, 33.744, 135, 71.0, 0.80
EAGLE MOUNTAIN, Riverside, CA07, -115.451, 33.809, 973, 72.9, 1.50
PALM SPRINGS, Riverside, CA07, -116.510, 33.828, 425, M, 0.62
LONG BEACH DAUGHERTY AP, Los Angeles, CA06, -118.147, 33.812, 34, 70.0, 0.55
PALOS VERDES ES FC43D, Los Angeles, CA06, -118.391, 33.800, 220, M, 0.62
FULLERTON MUNICIPAL AP, Orange, CA06, -117.986, 33.872, 86, 70.3, 0.85
MARCH AFB, Riverside, CA06, -117.250, 33.900, 1536, 65.7, 0.98
HAWTHORNE MUNICIPAL AP, Los Angeles, CA06, -118.333, 33.924, 55, 69.0, 0.59
LOS ANGELES INTL AP, Los Angeles, CA06, -118.387, 33.938, 97, 68.7, 0.58
RIVERSIDE FIRE STATION 3, Riverside, CA06, -117.388, 33.951, 840, M, 1.00
RIVERSIDE MUNICIPAL AP, Riverside, CA06, -117.435, 33.953, 845, 69.8, 1.10
CHINO AP, San Bernardino, CA06, -117.625, 33.976, 636, 70.3, 0.79
CULVER CITY, Los Angeles, CA06, -118.414, 34.005, 92, 67.7, 0.72
SANTA MONICA MUNICIPAL AP, Los Angeles, CA06, -118.447, 34.021, 175, 70.0, 0.62
ONTARIO INTL AP, San Bernardino, CA06, -117.577, 34.053, 924, 70.3, 0.39
COVINA CITY YARD FC387B, Los Angeles, CA06, -117.880, 34.092, 607, M, 1.12
U C L A, Los Angeles, CA06, -118.443, 34.070, 430, 68.8, 0.69
IRON MOUNTAIN, San Bernardino, CA07, -115.122, 34.147, 922, 75.5, 1.12
TWENTYNINE PALMS, San Bernardino, CA07, -116.037, 34.128, 1975, 69.6, 1.50
JOSHUA TREE, San Bernardino, CA07, -116.275, 34.147, 2563, 65.5, 1.72
SAN GABRIEL FIRE DEPT, Los Angeles, CA06, -118.100, 34.084, 363, M, 0.28
POINT MUGU NF, Ventura, CA06, -119.123, 34.124, 12, 64.3, 0.14
ALTADENA, Los Angeles, CA06, -118.138, 34.182, 1127, M, 1.05
SAN GABRIEL CANYON PH, Los Angeles, CA06, -117.908, 34.155, 744, M, 0.90
WOODLAND HILLS PIERCE COLLEGE, Los Angeles, CA06, -118.574, 34.182, 790, 69.5, 0.32
SAN GABRIEL DAM FC425B-E, Los Angeles, CA06, -117.861, 34.205, 1481, M, 0.67
VAN NUYS AP, Los Angeles, CA06, -118.491, 34.212, 785, 71.8, 0.32
CAMARILLO AP, Ventura, CA06, -119.088, 34.211, 71, 67.2, 0.14
OXNARD VENTURA COUNTY AP, Ventura, CA06, -119.204, 34.200, 39, 65.8, 0.16
PARKER RESRVOIR, San Bernardino, CA07, -114.171, 34.290, 738, 75.3, 1.36
BIG BEAR LAKE, San Bernardino, CA06, -116.917, 34.243, 6753, 48.4, 0.91
BIG TUJUNGA DAM FC46, Los Angeles, CA06, -118.188, 34.295, 2326, M, 0.58
PACOIMA DAM FC33A-E, Los Angeles, CA06, -118.400, 34.329, 1550, M, 0.43
PIRU 2 ESE, Ventura, CA06, -118.757, 34.406, 712, M, 0.19
SANTA BARBARA MUNI AP, Santa Barbara, CA06, -119.842, 34.424, 8, 63.4, 0.42
JUNCAL DAM, Santa Barbara, CA06, -119.507, 34.491, 2260, M, 0.18
VICTORVILLE, San Bernardino, CA07, -117.293, 34.529, 2880, 63.1, 1.02
GIBRALTAR DAM NO. 2, Santa Barbara, CA06, -119.682, 34.523, 1558, 64.7, 0.18
AMBOY, San Bernardino, CA07, -115.744, 34.559, 648, 74.5, 0.87
PALMDALE, Los Angeles, CA07, -118.094, 34.588, 2612, 65.0, 0.00
SAUGUS POWER PLANT 1, Los Angeles, CA06, -118.454, 34.590, 2161, M, 0.04
CACHUMA LAKE, Santa Barbara, CA06, -119.982, 34.582, 789, 66.0, 0.17
SALSIPUEDES GAGING STATION, Santa Barbara, CA06, -120.408, 34.585, 254, M, 0.80
PALMDALE AP, Los Angeles, CA07, -118.083, 34.629, 2509, 64.1, 0.03
LOMPOC, Santa Barbara, CA06, -120.451, 34.654, 75, 64.4, 0.72
LOMPOC AP, Santa Barbara, CA06, -120.467, 34.667, 88, 62.2, 0.63
LANCASTER, Los Angeles, CA06, -118.213, 34.741, 2338, 62.2, T
SANDBERG, Los Angeles, CA06, -118.724, 34.744, 4510, 62.3, 0.05
LEBEC, Kern, CA05, -118.865, 34.833, 3575, 58.8, 0.00
NEW CUYAMA FIRE STATION, Santa Barbara, CA06, -119.683, 34.946, 2160, 61.2, 0.00
TWITCHELL DAM, Santa Barbara, CA06, -120.321, 34.988, 582, 65.5, 0.29
MOJAVE, Kern, CA07, -118.162, 35.049, 2735, 63.9, 0.00
SALINAS DAM, San Luis Obispo, CA04, -120.504, 35.337, 1392, M, 0.91
RANDSBURG, Kern, CA07, -117.652, 35.369, 3570, 64.6, 0.00
SANTA MARGARITA BOOST, San Luis Obispo, CA04, -120.637, 35.374, 1148, M, 0.61
MORRO BAY FIRE DEPT, San Luis Obispo, CA04, -120.845, 35.367, 118, M, 0.61
BAKERSFIELD AP, Kern, CA05, -119.055, 35.434, 490, 69.0, 0.00
BUTTONWILLOW, Kern, CA05, -119.470, 35.403, 225, 65.5, T
LOST HILLS, Kern, CA05, -119.689, 35.618, 288, M, 1.15
GLENNVILLE, Kern, CA05, -118.701, 35.727, 3140, 56.6, 0.01
TRONA, San Bernardino, CA07, -117.391, 35.764, 1695, 70.8, 0.08
DELANO, Kern, CA05, -119.260, 35.768, 302, 67.8, 0.01
KETTLEMAN CITY, Kings, CA05, -119.960, 36.007, 240, 66.9, 0.00
CORCORAN IRRIGATION DIST., Kings, CA05, -119.582, 36.098, 200, 65.4, 0.72
COALINGA, Fresno, CA05, -120.361, 36.136, 670, 66.0, 0.00
KING CITY, Monterey, CA04, -121.138, 36.207, 320, 63.5, 0.10
LINDSAY, Tulare, CA05, -119.054, 36.203, 435, 64.9, 0.12
BIG SUR STATION, Monterey, CA04, -121.780, 36.247, 200, 61.0, 0.45
VISALIA, Tulare, CA05, -119.300, 36.328, 303, 65.9, 0.00
FIVE POINTS 5 SSW, Fresno, CA05, -120.156, 36.364, 285, 66.3, 0.21
SAN CLEMENTE DAM, Monterey, CA04, -121.709, 36.438, 600, M, 0.32
ASH MOUNTAIN, Tulare, CA05, -118.825, 36.491, 1708, 66.6, 1.29
THREE RIVERS EDISON PH 1, Tulare, CA05, -118.862, 36.465, 1140, 65.0, 0.27
PINNACLES NATIONAL PARK, San Benito, CA04, -121.182, 36.482, 1307, 63.5, 0.18
CARMEL VALLEY, Monterey, CA04, -121.724, 36.481, 480, 63.1, 0.39
LODGEPOLE, Tulare, CA05, -118.732, 36.604, 6735, 43.5, 3.30
PANOCHE 2 W, San Benito, CA05, -120.884, 36.607, 1400, M, 0.00
MONTEREY, Monterey, CA04, -121.855, 36.593, 122, 61.0, 0.16
SALINAS AP, Monterey, CA04, -121.609, 36.664, 73, 62.1, 0.67
GRANT GROVE, Tulare, CA05, -118.962, 36.738, 6580, 48.0, 0.00
LOS BANOS ARBURUA RANCH, Merced, CA05, -120.939, 36.875, 843, M, T
HOLLISTER 2, San Benito, CA04, -121.421, 36.848, 275, 62.2, 0.17
BALCH POWER HOUSE, Fresno, CA05, -119.088, 36.909, 1735, 65.7, 0.61
WATSONVILLE WATERWORKS, Santa Cruz, CA04, -121.769, 36.931, 95, 63.2, 0.10
FRIANT GOVERNMENT CAMP, Fresno, CA05, -119.707, 36.997, 410, 65.7, 0.23
MADERA, Madera, CA05, -120.038, 36.954, 270, 63.8, 0.01
GILROY, Santa Clara, CA04, -121.561, 37.003, 194, 64.1, 0.00
AUBERRY 2 NW, Fresno, CA05, -119.513, 37.092, 2090, 64.0, 0.09
LOS BANOS, Merced, CA05, -120.867, 37.056, 120, 66.2, T
BEN LOMOND NO. 4, Santa Cruz, CA04, -122.080, 37.086, 420, 64.4, 0.02
ASPENDELL, Inyo, CA01, -118.599, 37.232, 8470, 42.4, 0.15
NORTH FORK RS, Madera, CA05, -119.510, 37.233, 2645, 59.7, 0.52
RAYMOND, Madera, CA05, -119.909, 37.210, 919, M, 0.60
LOS GATOS, Santa Clara, CA04, -121.959, 37.232, 365, 63.5, 0.00
NEWMAN, Stanislaus, CA05, -121.018, 37.281, 90, 69.1, 0.01
MOUNT HAMILTON, Santa Clara, CA04, -121.635, 37.343, 4220, 59.6, 0.11
BISHOP AIRPORT, Inyo, CA07, -118.359, 37.371, 4110, 56.8, 0.40
MOFFETT FEDERAL AIRFIELD, Santa Clara, CA04, -122.048, 37.406, 39, 64.3, T
TURLOCK #2, Stanislaus, CA05, -120.846, 37.502, 103, 66.7, 0.05
REDWOOD CITY, San Mateo, CA04, -122.239, 37.477, 31, 62.8, 0.00
HALF MOON BAY, San Mateo, CA04, -122.443, 37.473, 27, 57.4, 0.11
SO ENTRANCE YOSEMITE N.P., Mariposa, CA05, -119.633, 37.512, 5047, 50.2, 2.03
NEWARK, Alameda, CA04, -122.032, 37.515, 10, 63.4, 0.03
EXCHEQUER DAM, Mariposa, CA05, -120.267, 37.585, 442, M, 0.33
MODESTO AP, Stanislaus, CA05, -120.955, 37.625, 87, 66.0, 0.01
HAYWARD AIR TERMINAL, Alameda, CA04, -122.121, 37.659, 31, 64.8, T
TRACY CARBONA, San Joaquin, CA05, -121.347, 37.682, 135, 62.0, 0.92
LIVERMORE MUNICIPAL AP, Alameda, CA04, -121.815, 37.693, 393, 64.4, 0.03
OAKLAND INTERNATIONAL AIRPORT, Alameda, CA04, -122.233, 37.718, 5, 62.2, 0.07
UPPER SAN LEANDRO FILTERS, Alameda, CA04, -122.167, 37.772, 394, M, 0.01
SAN FRANCISCO DOWNTOWN, San Francisco, CA04, -122.427, 37.771, 150, 62.3, 0.21
SAN FRANCISCO OCEANSIDE, San Francisco, CA04, -122.505, 37.728, 8, 59.5, 0.37
GROVELAND 2, Tuolumne, CA05, -120.226, 37.844, 2800, 57.4, 0.63
TRACY PUMPING PLANT, Alameda, CA05, -121.583, 37.796, 61, 68.0, 0.26
OAKLAND MUSEUM, Alameda, CA04, -122.264, 37.798, 30, 65.2, 0.05
TUOLUMNE MEADOWS R.S., Tuolumne, CA05, -119.344, 37.877, 8694, 40.3, 0.90
MOUNT DIABLO JUNCTION, Contra Costa, CA04, -121.930, 37.879, 2170, 63.5, 0.50
STOCKTON AP, San Joaquin, CA05, -121.226, 37.890, 27, 66.1, 1.28
RICHMOND, Contra Costa, CA04, -122.377, 37.919, 20, 63.8, 0.00
MUIR WOODS, Marin, CA01, -122.569, 37.898, 220, M, 1.29
HETCH HETCHY, Tuolumne, CA05, -119.783, 37.961, 3870, 57.9, 0.57
CHERRY VALLEY DAM, Tuolumne, CA05, -119.916, 37.975, 4765, 57.3, 0.42
SONORA, Tuolumne, CA05, -120.387, 37.967, 1675, 60.3, 0.48
ANTIOCH PUMPING PLANT #3, Contra Costa, CA05, -121.752, 37.983, 60, 66.3, 0.00
CONCORD BUCHANAN FIELD, Contra Costa, CA04, -122.053, 37.992, 23, 66.8, 0.01
CONCORD WASTEWATER PLANT, Contra Costa, CA04, -122.069, 37.983, 40, 66.8, 0.02
SAN RAFAEL-CIVIC CENTER, Marin, CA01, -122.537, 37.998, 120, 64.2, 2.12
KENTFIELD, Marin, CA01, -122.545, 37.957, 145, 63.5, 1.76
MARTINEZ WATER PLANT, Contra Costa, CA04, -122.114, 38.013, 40, 61.6, 0.06
BODIE CALIFORNIA STATE HISTORIC PARK, Mono, CA03, -119.014, 38.212, 8370, 32.3, 0.01
ACAMPO 5NE, San Joaquin, CA05, -121.201, 38.218, 87, M, 0.56
NAPA COUNTY AIRPORT, Napa, CA04, -122.280, 38.208, 16, 61.6, 0.00
BRIDGEPORT, Mono, CA03, -119.229, 38.258, 6470, 42.9, 0.19
CALAVERAS BIG TREES, Calaveras, CA05, -120.311, 38.277, 4695, 52.8, 1.29
CAMP PARDEE, Calaveras, CA05, -120.843, 38.249, 658, M, 0.55
TRAVIS FIELD AFB, Solano, CA02, -121.933, 38.267, 62, M, 0.00
FAIRFIELD, Solano, CA02, -122.068, 38.274, 40, 67.0, 0.07
SONOMA, Sonoma, CA01, -122.462, 38.299, 97, 64.1, 1.61
SUTTER HILL CDF, Amador, CA05, -120.801, 38.377, 1586, 65.6, 0.48
WEST POINT, Calaveras, CA05, -120.545, 38.378, 2775, M, 0.24
GRATON, Sonoma, CA01, -122.865, 38.431, 200, 62.7, 1.12
OCCIDENTAL, Sonoma, CA01, -122.966, 38.386, 865, 61.1, 2.24
FIDDLETOWN DEXTER RCH, Amador, CA05, -120.698, 38.525, 2170, M, 0.39
SACRAMENTO AP ASOS, Sacramento, CA02, -121.496, 38.507, 19, 65.2, 0.04
WINTERS, Yolo, CA02, -121.978, 38.525, 135, 66.8, 0.08
LAKE SOLANO, Solano, CA02, -122.004, 38.492, 187, 66.8, 0.07
SAINT HELENA, Napa, CA01, -122.471, 38.507, 225, 65.6, 0.85
SAINT HELENA 4 WSW, Napa, CA01, -122.538, 38.493, 1780, M, 0.48
FORT ROSS, Sonoma, CA01, -123.245, 38.515, 112, 54.9, 1.86
SACRAMENTO 5 ESE, Sacramento, CA02, -121.418, 38.555, 38, 67.0, 0.04
ANGWIN PACIFIC UNION COLLEGE, Napa, CA01, -122.440, 38.573, 1715, 63.0, 1.44
CALISTOGA, Napa, CA01, -122.578, 38.577, 350, 63.7, 1.35
VENADO, Sonoma, CA01, -123.018, 38.609, 1260, M, 0.08
WOODLAND 1 WNW, Yolo, CA02, -121.794, 38.683, 67, 66.4, 0.06
SACRAMENTO METROPOLITAN AP, Sacramento, CA02, -121.595, 38.701, 24, 64.1, 1.70
PACIFIC HOUSE, El Dorado, CA02, -120.503, 38.758, 3450, 62.1, 1.12
MIDDLETOWN, Lake, CA02, -122.626, 38.748, 1121, M, 1.04
CLOVERDALE, Sonoma, CA01, -123.026, 38.793, 400, 63.6, 1.64
KELSEY 1 N, El Dorado, CA02, -120.821, 38.809, 2000, M, 0.33
SOUTH LAKE TAHOE AP, El Dorado, CA03, -119.996, 38.898, 6257, 45.5, 0.99
GEORGETOWN RS, El Dorado, CA02, -120.801, 38.933, 3001, 61.7, 1.05
AUBURN, Placer, CA02, -121.084, 38.907, 1292, 58.3, 1.19
NICOLAUS #2, Sutter, CA02, -121.545, 38.926, 43, M, 0.00
CLEARLAKE 4 SE, Lake, CA02, -122.567, 38.924, 1349, 62.7, 1.00
FORESTHILL RANGER STATION, Placer, CA02, -120.845, 39.010, 3015, M, 0.55
HELL HOLE, Placer, CA02, -120.415, 39.058, 4850, M, 0.72
MARYSVILLE AIRPORT (ASOS), Yuba, CA02, -121.569, 39.102, 62, 65.4, 0.14
UKIAH MUNICIPAL AP, Mendocino, CA01, -123.200, 39.128, 603, 62.6, 1.33
UKIAH 4 WSW, Mendocino, CA01, -123.272, 39.127, 1328, M, 1.10
GOLD RUN 4 SW, Placer, CA02, -120.900, 39.150, 3220, M, 0.78
GRASS VALLEY NO. 2, Nevada, CA02, -121.068, 39.204, 2400, 59.5, 0.92
HARRY L. ENGLEBRIGHT DAM, Nevada, CA02, -121.267, 39.237, 800, M, 0.72
COLUSA 2 SSW, Colusa, CA02, -122.027, 39.188, 50, 65.1, 0.46
BLUE CANYON NYACK AP, Placer, CA02, -120.709, 39.276, 5286, 55.8, 1.33
NEVADA CITY, Nevada, CA02, -121.001, 39.247, 2781, 60.8, 0.53
TRUCKEE AIRPORT, Nevada, CA03, -120.139, 39.320, 5900, 44.5, 0.58
COLGATE POWERHOUSE, Yuba, CA02, -121.192, 39.331, 595, M, 0.68
BOCA, Nevada, CA03, -120.094, 39.389, 5575, 44.8, 0.59
POTTER VALLEY POWERHOUSE, Mendocino, CA01, -123.129, 39.362, 1018, 62.4, 1.24
FARAD, Nevada, CA03, -120.033, 39.428, 5153, M, 0.56
BOWMAN DAM, Nevada, CA02, -120.656, 39.454, 5385, 52.5, 1.13
OROVILLE, Butte, CA02, -121.553, 39.518, 171, 67.2, 2.00
OROVILLE MUNICIPAL AP, Butte, CA02, -121.622, 39.494, 187, 66.4, 0.41
SIERRAVILLE RS, Sierra, CA02, -120.370, 39.583, 4975, 48.6, 0.25
DOWNIEVILLE, Sierra, CA02, -120.824, 39.563, 2915, 56.2, 0.73
STRAWBERRY VALLEY, Yuba, CA02, -121.108, 39.563, 3808, 56.8, 1.01
STONY GORGE RESERVOIR, Glenn, CA02, -122.534, 39.586, 800, 63.0, 1.08
BRUSH CREEK RANGER STATION, Butte, CA02, -121.345, 39.695, 3560, M, 1.15
PARADISE, Butte, CA02, -121.624, 39.754, 1750, 65.6, 0.14
VINTON, Plumas, CA02, -120.186, 39.806, 4950, 49.8, 0.52
PORTOLA, Plumas, CA02, -120.472, 39.805, 4850, 48.1, 0.09
DE SABLA, Butte, CA02, -121.611, 39.872, 2710, M, 0.23
CANYON DAM, Plumas, CA02, -121.089, 40.171, 4560, 50.5, 1.30
MIRANDA 4 SE, Humboldt, CA01, -123.776, 40.182, 266, M, 1.52
FORT SEWARD, Humboldt, CA01, -123.632, 40.218, 220, M, 0.92
HONEYDEW 1 SW, Humboldt, CA01, -124.132, 40.238, 373, M, 0.48
CHESTER, Plumas, CA02, -121.242, 40.303, 4530, 49.7, 0.38
MINERAL, Tehama, CA02, -121.609, 40.346, 4875, 48.2, 1.31
COLEMAN FISHERIES STATION, Shasta, CA02, -122.143, 40.400, 420, M, 0.35
VOLTA PH, Shasta, CA02, -121.866, 40.458, 2220, M, 1.13
SCOTIA, Humboldt, CA01, -124.104, 40.483, 136, 58.4, 1.24
MANZANITA LAKE, Shasta, CA02, -121.577, 40.541, 5750, 46.8, 1.95
WHISKEYTOWN RESERVOIR, Shasta, CA02, -122.528, 40.612, 1295, 65.8, 1.31
SHASTA DAM, Shasta, CA02, -122.416, 40.714, 1075, 67.3, 1.14
TRINITY RIVER HATCHERY, Trinity, CA01, -122.795, 40.726, 1861, 57.7, 0.01
BUCKHORN, Shasta, CA02, -121.932, 40.880, 3700, M, 3.98
HAT CREEK, Shasta, CA02, -121.543, 40.932, 3015, 50.7, 1.65
PIT RIVER PH 5, Shasta, CA02, -121.977, 40.987, 1458, M, 0.95
WILLOW CREEK 1 NW, Humboldt, CA01, -123.636, 40.947, 464, 58.0, 1.03
FALL RIVER MILLS, Shasta, CA02, -121.435, 41.008, 3300, M, 1.89
COFFEE CREEK RS, Trinity, CA01, -122.709, 41.089, 2503, M, 0.56
ADIN RANGER STATION, Modoc, CA02, -120.945, 41.193, 4202, M, 1.61
DUNSMUIR TREATMENT PL, Siskiyou, CA02, -122.282, 41.183, 2169, 54.9, 1.03
JESS VALLEY, Modoc, CA02, -120.295, 41.268, 5400, 44.8, 1.57
MCCLOUD, Siskiyou, CA02, -122.138, 41.252, 3233, 52.3, 1.04
CALLAHAN, Siskiyou, CA01, -122.825, 41.338, 3085, 52.7, 0.44
SAWYERS BAR RS, Siskiyou, CA01, -123.133, 41.301, 2255, M, 0.66
ORLEANS RS, Humboldt, CA01, -123.534, 41.303, 433, M, 0.75
FORT JONES RS, Siskiyou, CA01, -122.848, 41.601, 2729, 49.8, 0.31
LAVA BEDS NAT MON, Siskiyou, CA01, -121.501, 41.702, 4770, 48.8, 0.01
MOUNT HEBRON RS, Siskiyou, CA01, -122.045, 41.783, 4265, 46.7, 0.33
CRESCENT CITY MCNAMARA AP, Del Norte, CA01, -124.238, 41.784, 56, 54.3, 1.58
OAK KNOLL W. C., Siskiyou, CA01, -122.850, 41.839, 1980, M, 0.40
FORT BIDWELL, Modoc, CA03, -120.157, 41.872, 4739, 47.9, 1.07
GASQUET RS, Del Norte, CA01, -123.965, 41.845, 387, M, 2.55
TULELAKE, Siskiyou, CA01, -121.474, 41.960, 4038, 48.4, 0.57
COPCO NO 1 DAM, Siskiyou, CA01, -122.338, 41.980, 2665, 55.9, 0.63
ELK VALLEY, Del Norte, CA01, -123.718, 41.988, 1708, M, 2.34
BARSTOW, San Bernardino, CA07, -117.022, 34.893, 2220, 65.7, 0.03
PEARBLOSSOM, Los Angeles, CA07, -117.897, 34.503, 3101, 65.6, 0.23
EL CAJON, San Diego, CA06, -116.928, 32.801, 495, 69.1, 0.54
MARKLEY COVE, Napa, CA02, -122.124, 38.492, 480, 65.1, 0.47
LORAINE 5 NNE, Kern, CA05, -118.412, 35.384, 4235, 58.9, 0.02
LEE VINING, Mono, CA07, -119.119, 37.957, 6797, 48.5, 0.22
ANAHEIM, Orange, CA06, -117.842, 33.865, 235, 72.1, 0.66
NEW MELONES DAM HQ, Tuolumne, CA05, -120.486, 38.005, 960, 66.9, 0.57
MAMMOTH LAKES RS, Mono, CA07, -118.962, 37.648, 7804, 43.2, 0.69
FRAZIER PARK 9 SW, Ventura, CA05, -119.104, 34.733, 5169, M, 0.00
MONTEREY WFO, Monterey, CA04, -121.855, 36.593, 122, 60.4, 0.20
SKYLINE RIDGE PRESERVE, San Mateo, CA04, -122.185, 37.313, 2270, 62.7, 0.02
FREMONT, Alameda, CA04, -122.016, 37.542, 38, 62.7, T
MAD RIVER 12 SE, Trinity, CA01, -123.374, 40.319, 2763, M, 1.48
TEHACHAPI 4 SE, Kern, CA05, -118.422, 35.101, 4220, 55.2, 0.01
REDDING CDF, Shasta, CA02, -122.299, 40.519, 502, M, 0.45
VALLEJO, Solano, CA01, -122.187, 38.100, 341, 66.6, 0.07
OXNARD WFO, Ventura, CA06, -119.137, 34.207, 52, 66.9, 0.16
HANFORD MUNICIPAL AP, Kings, CA05, -119.623, 36.311, 249, 65.4, 0.04
RAMONA AIRPORT, San Diego, CA06, -116.916, 33.038, 1385, 64.4, 0.99
VACAVILLE/NUT TREE AP ASOS, Solano, CA02, -121.959, 38.378, 104, 65.7, 0.06
ALTURAS MUNICIPAL AP, Modoc, CA02, -120.561, 41.484, 4383, 46.2, 1.26
MADERA MUNICIPAL AP, Madera, CA05, -120.111, 36.985, 251, 67.1, T
BAKERSFIELD 5 NW, Kern, CA05, -119.051, 35.419, 470, 67.5, T
FRESNO 5 NE, Fresno, CA05, -119.709, 36.767, 338, 69.8, 0.10
OCEANSIDE MUNICIPAL AP, San Diego, CA06, -117.350, 33.219, 30, 64.3, 0.38
SAN DIEGO SEAWORLD, San Diego, CA06, -117.231, 32.765, 14, M, 0.18
ARCATA EUREKA AP, Humboldt, CA01, -124.105, 40.978, 211, 52.9, 0.89
NEWPORT BEACH HARBOR, Orange, CA06, -117.884, 33.603, 10, 67.1, 0.53
ESCONDIDO NO. 2, San Diego, CA06, -117.090, 33.121, 600, 68.9, 0.77
REDDING AP, Shasta, CA02, -122.298, 40.515, 501, 66.6, 0.52
AVALON CATALINA AP, Los Angeles, CA06, -118.415, 33.404, 1565, 66.1, 0.88
SANTA MARIA PUBLIC AP, Santa Barbara, CA06, -120.452, 34.894, 243, 65.0, 0.35
MOUNT SHASTA, Siskiyou, CA02, -122.333, 41.333, 3535, 51.6, 0.57
RED BLUFF MUNI AP, Tehama, CA02, -122.255, 40.152, 354, 67.0, 0.49
NEEDLES AIRPORT, San Bernardino, CA07, -114.618, 34.768, 888, 76.4, 0.58
CHINA LAKE NAF, Kern, CA07, -117.693, 35.688, 2230, 66.6, 0.19
SUSANVILLE 2SW, Lassen, CA03, -120.663, 40.417, 4212, 50.6, 0.55
TEJON RANCHO, Kern, CA05, -118.750, 35.023, 1425, 68.4, 0.08
BURBANK GLENDALE PASADENA AP, Los Angeles, CA06, -118.365, 34.200, 731, 68.6, 0.31
CHICO 2.9 W, Butte, CA02, -121.861, 39.749, 190, M, 0.43
CHICO 1.8 SW, Butte, CA02, -121.832, 39.737, 209, M, 0.10
MAGALIA 2.3 SE, Butte, CA02, -121.582, 39.804, 2327, M, 0.15
CHICO 5.5 NW, Butte, CA02, -121.891, 39.800, 191, M, 0.32
MORAGA 2.4 NNW, Contra Costa, CA04, -122.138, 37.870, 748, M, 0.02
SMITH RIVER 1.1 SSE, Del Norte, CA01, -124.136, 41.915, 120, M, 2.41
FORT DICK 0.2 SSW, Del Norte, CA01, -124.151, 41.865, 49, M, 2.08
CAMINO 2.6 ESE, El Dorado, CA02, -120.634, 38.719, 3108, M, 0.17
CLOVIS 1.3 NE, Fresno, CA05, -119.681, 36.833, 375, M, 0.51
FRESNO 2.4 NW, Fresno, CA05, -119.822, 36.805, 319, M, 0.04
SUSANVILLE 3.5 SSW, Lassen, CA03, -120.674, 40.363, 4347, M, 0.27
SUSANVILLE 0.6 WSW, Lassen, CA03, -120.660, 40.407, 4220, M, 0.00
AHWAHNEE 2.5 NNW, Madera, CA05, -119.738, 37.400, 2840, M, 0.74
WESTPORT 1.6 NNE, Mendocino, CA01, -123.770, 39.657, 722, M, M
ALBION 4.0 SE, Mendocino, CA01, -123.710, 39.188, 636, M, 1.25
LAYTONVILLE 9.8 NNW, Mendocino, CA01, -123.534, 39.814, 2078, M, 1.06
ALTA SIERRA 2.3 WSW, Nevada, CA02, -121.089, 39.106, 1677, M, 0.16
GRASS VALLEY 1.3 NNE, Nevada, CA02, -121.046, 39.238, 2782, M, 1.00
GRASS VALLEY 2.7 SW, Nevada, CA02, -121.092, 39.194, 2334, M, 1.46
ORANGE 3.0 ENE, Orange, CA06, -117.778, 33.826, 649, M, 1.48
ROCKLIN 1.1 N, Placer, CA02, -121.244, 38.818, 550, M, 1.05
ROSEVILLE 2.4 SE, Placer, CA02, -121.257, 38.740, 156, M, 0.28
APPLEGATE 0.5 SE, Placer, CA02, -120.986, 38.996, 1983, M, 1.05
MURRIETA 4.3 ENE, Riverside, CA06, -117.140, 33.584, 1312, M, 0.79
ENCINITAS 2.7N, San Diego, CA06, -117.292, 33.076, 188, M, 1.67
ESCONDIDO 7.2 SE, San Diego, CA06, -116.992, 33.056, 1585, M, 0.93
RAMONA 3ENE, San Diego, CA06, -116.828, 33.051, 2034, M, 0.59
RANCHO BERNARDO 1.9WSW, San Diego, CA06, -117.106, 33.014, 687, M, 1.23
SAN DIEGO 13.9N, San Diego, CA06, -117.163, 32.917, 406, M, 0.83
REDDING 2.8 NW, Shasta, CA02, -122.401, 40.602, 661, M, 0.53
SHINGLETOWN 3.5 ENE, Shasta, CA02, -121.834, 40.519, 3796, M, 1.53
MOUNT SHASTA 5.1 NW, Siskiyou, CA02, -122.397, 41.364, 3911, M, 1.07
DORRIS 0.2 SW, Siskiyou, CA01, -121.923, 41.963, 4249, M, 0.83
TEMPLETON 5.5 WSW, San Luis Obispo, CA04, -120.804, 35.535, 1469, M, 0.24
HALF MOON BAY 0.7 NW, San Mateo, CA04, -122.445, 37.478, 36, M, 0.08
EL GRANADA 0.7 W, San Mateo, CA04, -122.479, 37.509, 78, M, 0.06
CAZADERO 6.9 WNW, Sonoma, CA01, -123.206, 38.565, 645, M, 1.62
CAZADERO 5.6 W, Sonoma, CA01, -123.189, 38.532, 1211, M, 1.84
GUERNEVILLE 2.0 SSW, Sonoma, CA01, -123.005, 38.485, 69, M, 1.88
GLEN ELLEN 1.9 NNW, Sonoma, CA01, -122.551, 38.382, 365, M, 1.53
RANCHO CUCAMONGA 1.6 W, San Bernardino, CA06, -117.598, 34.122, 1379, M, 0.85
BARSTOW 4.2 NE, San Bernardino, CA07, -117.018, 34.924, 2170, M, 0.12
FAWNSKIN 0.3 NE, San Bernardino, CA06, -116.938, 34.271, 7030, M, 1.39
SOQUEL 0.8 NE, Santa Cruz, CA04, -121.936, 37.002, 414, M, 0.11
RED BLUFF 6.0 W, Tehama, CA02, -122.352, 40.159, 418, M, 0.44
COTTONWOOD 7.7 SSW, Tehama, CA02, -122.333, 40.287, 635, M, 0.08
RED BLUFF 7.2 WNW, Tehama, CA02, -122.360, 40.224, 557, M, 0.26
COTTONWOOD 4.4 ESE, Tehama, CA02, -122.201, 40.369, 567, M, 0.37
RED BLUFF 5.1 NNW, Tehama, CA02, -122.281, 40.242, 497, M, 0.40
COTTONWOOD 9.1 SW, Tehama, CA02, -122.378, 40.282, 639, M, 0.61
RED BLUFF 4.5 W, Tehama, CA02, -122.326, 40.171, 501, M, 0.40
COTTONWOOD 3.6 SSW, Tehama, CA02, -122.302, 40.341, 554, M, 0.81
