Name, County, ClimateDivision, Longitude, Latitude, Elevation, MeanAvgTemperature, TotalPrecipitation
KETTLEMAN CITY, Kings, CA05, -119.960, 36.007, 240, 84.5, 0.00
CORCORAN IRRIGATION DIST., Kings, CA05, -119.582, 36.098, 200, 83.3, T
COALINGA, Fresno, CA05, -120.361, 36.136, 670, 83.9, 0.00
KING CITY, Monterey, CA04, -121.138, 36.207, 320, 72.5, 0.02
LINDSAY, Tulare, CA05, -119.054, 36.203, 435, 83.1, 0.00
BIG SUR STATION, Monterey, CA04, -121.780, 36.247, 200, 68.1, 0.00
VISALIA, Tulare, CA05, -119.300, 36.328, 303, 82.9, 0.00
FIVE POINTS 5 SSW, Fresno, CA05, -120.156, 36.364, 285, 84.1, 0.00
ASH MOUNTAIN, Tulare, CA05, -118.825, 36.491, 1708, 85.0, 0.00
THREE RIVERS EDISON PH 1, Tulare, CA05, -118.862, 36.465, 1140, 90.0, 0.00
PINNACLES NATIONAL PARK, San Benito, CA04, -121.182, 36.482, 1307, 75.3, 0.00
CARMEL VALLEY, Monterey, CA04, -121.724, 36.481, 480, 70.1, 0.04
LODGEPOLE, Tulare, CA05, -118.732, 36.604, 6735, 63.9, 0.00
PANOCHE 2 W, San Benito, CA05, -120.884, 36.607, 1400, M, 0.00
SALINAS AP, Monterey, CA04, -121.609, 36.664, 73, 67.4, T
LOS BANOS ARBURUA RANCH, Merced, CA05, -120.939, 36.875, 843, M, 0.00
HOLLISTER 2, San Benito, CA04, -121.421, 36.848, 275, 70.2, 0.00
BALCH POWER HOUSE, Fresno, CA05, -119.088, 36.909, 1735, 84.0, 0.00
WATSONVILLE WATERWORKS, Santa Cruz, CA04, -121.769, 36.931, 95, 65.4, 0.01
FRIANT GOVERNMENT CAMP, Fresno, CA05, -119.707, 36.997, 410, 83.3, 0.00
MADERA, Madera, CA05, -120.038, 36.954, 270, 82.5, 0.00
GILROY, Santa Clara, CA04, -121.561, 37.003, 194, 73.2, 0.03
LOS BANOS, Merced, CA05, -120.867, 37.056, 120, 81.6, 0.00
BEN LOMOND NO. 4, Santa Cruz, CA04, -122.080, 37.086, 420, 73.7, 0.04
ASPENDELL, Inyo, CA01, -118.599, 37.232, 8470, 60.4, 0.00
NORTH FORK RS, Madera, CA05, -119.510, 37.233, 2645, 77.9, 0.09
RAYMOND, Madera, CA05, -119.909, 37.210, 919, M, 0.00
NEWMAN, Stanislaus, CA05, -121.018, 37.281, 90, 83.0, 0.00
MOUNT HAMILTON, Santa Clara, CA04, -121.635, 37.343, 4220, 74.1, 0.00
BISHOP AIRPORT, Inyo, CA07, -118.359, 37.371, 4110, 80.1, T
TURLOCK #2, Stanislaus, CA05, -120.846, 37.502, 103, 80.8, 0.01
REDWOOD CITY, San Mateo, CA04, -122.239, 37.477, 31, 72.1, 0.00
HALF MOON BAY, San Mateo, CA04, -122.443, 37.473, 27, 60.7, 0.30
SO ENTRANCE YOSEMITE N.P., Mariposa, CA05, -119.633, 37.512, 5047, 67.5, 0.00
NEWARK, Alameda, CA04, -122.032, 37.515, 10, 71.1, 0.01
EXCHEQUER DAM, Mariposa, CA05, -120.267, 37.585, 442, 84.9, 0.00
MODESTO AP, Stanislaus, CA05, -120.955, 37.625, 87, 82.1, T
HAYWARD AIR TERMINAL, Alameda, CA04, -122.121, 37.659, 31, 71.6, 0.09
TRACY CARBONA, San Joaquin, CA05, -121.347, 37.682, 135, 77.9, 0.00
LIVERMORE MUNICIPAL AP, Alameda, CA04, -121.815, 37.693, 393, 77.2, 0.11
OAKLAND INTERNATIONAL AIRPORT, Alameda, CA04, -122.233, 37.718, 5, 69.1, 0.04
UPPER SAN LEANDRO FILTERS, Alameda, CA04, -122.167, 37.772, 394, M, 0.04
SAN FRANCISCO DOWNTOWN, San Francisco, CA04, -122.427, 37.771, 150, 62.9, 0.01
SAN FRANCISCO OCEANSIDE, San Francisco, CA04, -122.505, 37.728, 8, 57.7, 0.03
GROVELAND 2, Tuolumne, CA05, -120.226, 37.844, 2800, 76.0, 0.01
TRACY PUMPING PLANT, Alameda, CA05, -121.583, 37.796, 61, 81.6, 0.08
OAKLAND MUSEUM, Alameda, CA04, -122.264, 37.798, 30, 67.3, 0.02
TUOLUMNE MEADOWS R.S., Tuolumne, CA05, -119.344, 37.877, 8694, 57.2, 0.63
MOUNT DIABLO JUNCTION, Contra Costa, CA04, -121.930, 37.879, 2170, 76.4, 0.23
STOCKTON AP, San Joaquin, CA05, -121.226, 37.890, 27, 81.9, T
RICHMOND, Contra Costa, CA04, -122.377, 37.919, 20, 67.4, 0.00
MUIR WOODS, Marin, CA01, -122.569, 37.898, 220, M, 0.16
HETCH HETCHY, Tuolumne, CA05, -119.783, 37.961, 3870, 75.1, 0.00
CHERRY VALLEY DAM, Tuolumne, CA05, -119.916, 37.975, 4765, 76.5, 0.03
SONORA, Tuolumne, CA05, -120.387, 37.967, 1675, 77.6, 0.01
ANTIOCH PUMPING PLANT #3, Contra Costa, CA05, -121.752, 37.983, 60, 78.9, 0.04
CONCORD BUCHANAN FIELD, Contra Costa, CA04, -122.053, 37.992, 23, 77.7, 0.02
KENTFIELD, Marin, CA01, -122.545, 37.957, 145, 71.9, 0.07
BODIE CALIFORNIA STATE HISTORIC PARK, Mono, CA03, -119.014, 38.212, 8370, 59.9, 1.50
ACAMPO 5NE, San Joaquin, CA05, -121.201, 38.218, 87, M, T
NAPA COUNTY AIRPORT, Napa, CA04, -122.280, 38.208, 16, 70.3, 0.05
BRIDGEPORT, Mono, CA03, -119.229, 38.258, 6470, 62.0, 0.20
CALAVERAS BIG TREES, Calaveras, CA05, -120.311, 38.277, 4695, 71.2, 0.04
CAMP PARDEE, Calaveras, CA05, -120.843, 38.249, 658, M, 0.00
FAIRFIELD, Solano, CA02, -122.068, 38.274, 40, 78.0, 0.00
SONOMA, Sonoma, CA01, -122.462, 38.299, 97, 74.3, 0.00
SUTTER HILL CDF, Amador, CA05, -120.801, 38.377, 1586, 81.2, 0.00
WEST POINT, Calaveras, CA05, -120.545, 38.378, 2775, M, 0.00
GRATON, Sonoma, CA01, -122.865, 38.431, 200, 71.5, 0.11
OCCIDENTAL, Sonoma, CA01, -122.966, 38.386, 865, 68.3, 0.15
FIDDLETOWN DEXTER RCH, Amador, CA05, -120.698, 38.525, 2170, M, T
SACRAMENTO AP ASOS, Sacramento, CA02, -121.496, 38.507, 19, 79.5, 0.02
WINTERS, Yolo, CA02, -121.978, 38.525, 135, 79.7, 0.01
LAKE SOLANO, Solano, CA02, -122.004, 38.492, 187, 80.4, 0.00
SAINT HELENA, Napa, CA01, -122.471, 38.507, 225, 76.2, 0.00
FORT ROSS, Sonoma, CA01, -123.245, 38.515, 112, 53.1, 0.22
SACRAMENTO 5 ESE, Sacramento, CA02, -121.418, 38.555, 38, 82.3, 0.01
ANGWIN PACIFIC UNION COLLEGE, Napa, CA01, -122.440, 38.573, 1715, 72.7, 0.17
CALISTOGA, Napa, CA01, -122.578, 38.577, 350, 74.9, 0.00
WOODLAND 1 WNW, Yolo, CA02, -121.794, 38.683, 67, 79.6, 0.00
SACRAMENTO METROPOLITAN AP, Sacramento, CA02, -121.595, 38.701, 24, 79.5, T
PACIFIC HOUSE, El Dorado, CA02, -120.503, 38.758, 3450, 75.1, 0.00
MIDDLETOWN, Lake, CA02, -122.626, 38.748, 1121, M, 0.07
CLOVERDALE, Sonoma, CA01, -123.026, 38.793, 400, 74.7, 0.27
KELSEY 1 N, El Dorado, CA02, -120.821, 38.809, 2000, M, T
SOUTH LAKE TAHOE AP, El Dorado, CA03, -119.996, 38.898, 6257, 64.9, 0.03
GEORGETOWN RS, El Dorado, CA02, -120.801, 38.933, 3001, 79.5, 0.00
AUBURN, Placer, CA02, -121.084, 38.907, 1292, 72.8, 0.00
NICOLAUS #2, Sutter, CA02, -121.545, 38.926, 43, M, 0.03
CLEARLAKE 4 SE, Lake, CA02, -122.567, 38.924, 1349, 79.2, 0.05
FORESTHILL RANGER STATION, Placer, CA02, -120.845, 39.010, 3015, M, 0.00
HELL HOLE, Placer, CA02, -120.415, 39.058, 4850, M, 0.00
MARYSVILLE AIRPORT (ASOS), Yuba, CA02, -121.569, 39.102, 62, 80.6, 0.11
UKIAH MUNICIPAL AP, Mendocino, CA01, -123.200, 39.128, 603, 78.2, 0.08
UKIAH 4 WSW, Mendocino, CA01, -123.272, 39.127, 1328, M, 0.13
IMPERIAL, Imperial, CA07, -115.567, 32.849, -64, 95.3, 0.00
EL CAPITAN DAM, San Diego, CA06, -116.815, 32.886, 600, M, 0.00
LAKESIDE 2 E, San Diego, CA06, -116.895, 32.854, 690, M, 0.00
POWAY VALLEY, San Diego, CA06, -117.031, 33.020, 648, M, 0.00
JULIAN CDF, San Diego, CA06, -116.592, 33.076, 4215, 77.9, 0.02
CARLSBAD MCCLELLAN PALOMAR AP, San Diego, CA06, -117.277, 33.130, 313, 72.7, 0.00
HENSHAW DAM, San Diego, CA06, -116.761, 33.237, 2700, 76.2, 0.00
VISTA, San Diego, CA06, -117.232, 33.235, 430, 74.5, 0.00
OCEANSIDE MARINA, San Diego, CA06, -117.395, 33.210, 10, 69.7, 0.00
BORREGO DESERT PARK, San Diego, CA07, -116.404, 33.256, 810, 95.9, 0.00
PALOMAR MTN OBSERVATORY, San Diego, CA06, -116.840, 33.378, 5550, 78.0, 0.06
MECCA FIRE STATION, Riverside, CA07, -116.073, 33.570, -183, M, 0.00
BLYTHE ASOS, Riverside, CA07, -114.715, 33.619, 395, 98.7, 0.00
DESERT RESORTS REGIONAL AP, Riverside, CA07, -116.164, 33.632, -118, 96.3, T
SAN GABRIEL DAM FC425B-E, Los Angeles, CA06, -117.861, 34.205, 1481, M, 0.00
VAN NUYS AP, Los Angeles, CA06, -118.491, 34.212, 785, 82.8, T
CAMARILLO AP, Ventura, CA06, -119.088, 34.211, 71, 72.7, 0.00
OXNARD VENTURA COUNTY AP, Ventura, CA06, -119.204, 34.200, 39, 67.4, 0.01
PARKER RESRVOIR, San Bernardino, CA07, -114.171, 34.290, 738, 99.3, 0.00
BIG BEAR LAKE, San Bernardino, CA06, -116.917, 34.243, 6753, 66.7, 2.29
BIG TUJUNGA DAM FC46, Los Angeles, CA06, -118.188, 34.295, 2326, M, 0.00
PACOIMA DAM FC33A-E, Los Angeles, CA06, -118.400, 34.329, 1550, M, 0.00
PIRU 2 ESE, Ventura, CA06, -118.757, 34.406, 712, M, 0.00
SANTA BARBARA MUNI AP, Santa Barbara, CA06, -119.842, 34.424, 8, 67.7, T
JUNCAL DAM, Santa Barbara, CA06, -119.507, 34.491, 2260, M, 0.00
MOJAVE, Kern, CA07, -118.162, 35.049, 2735, 81.0, 0.00
SALINAS DAM, San Luis Obispo, CA04, -120.504, 35.337, 1392, M, 0.15
RANDSBURG, Kern, CA07, -117.652, 35.369, 3570, 83.1, 0.00
SANTA MARGARITA BOOST, San Luis Obispo, CA04, -120.637, 35.374, 1148, M, 0.06
MORRO BAY FIRE DEPT, San Luis Obispo, CA04, -120.845, 35.367, 118, M, 0.00
BAKERSFIELD AP, Kern, CA05, -119.055, 35.434, 490, 87.2, T
BUTTONWILLOW, Kern, CA05, -119.470, 35.403, 225, 84.1, 0.00
TRONA, San Bernardino, CA07, -117.391, 35.764, 1695, 92.1, 0.00
DELANO, Kern, CA05, -119.260, 35.768, 302, 83.8, 0.00
GOLD RUN 4 SW, Placer, CA02, -120.900, 39.150, 3220, M, 0.00
GRASS VALLEY NO. 2, Nevada, CA02, -121.068, 39.204, 2400, 76.3, 0.02
HARRY L. ENGLEBRIGHT DAM, Nevada, CA02, -121.267, 39.237, 800, M, 0.00
COLUSA 2 SSW, Colusa, CA02, -122.027, 39.188, 50, 77.8, 0.00
BLUE CANYON NYACK AP, Placer, CA02, -120.709, 39.276, 5286, 72.8, T
NEVADA CITY, Nevada, CA02, -121.001, 39.247, 2781, 75.5, 0.00
TRUCKEE AIRPORT, Nevada, CA03, -120.139, 39.320, 5900, 65.1, 0.09
COLGATE POWERHOUSE, Yuba, CA02, -121.192, 39.331, 595, M, 0.00
BOCA, Nevada, CA03, -120.094, 39.389, 5575, 65.6, 0.16
POTTER VALLEY POWERHOUSE, Mendocino, CA01, -123.129, 39.362, 1018, 78.0, 0.14
BOWMAN DAM, Nevada, CA02, -120.656, 39.454, 5385, 70.2, 0.00
OROVILLE, Butte, CA02, -121.553, 39.518, 171, 80.1, 0.00
OROVILLE MUNICIPAL AP, Butte, CA02, -121.622, 39.494, 187, 83.5, T
DOWNIEVILLE, Sierra, CA02, -120.824, 39.563, 2915, 72.7, 0.15
STRAWBERRY VALLEY, Yuba, CA02, -121.108, 39.563, 3808, 71.1, T
STONY GORGE RESERVOIR, Glenn, CA02, -122.534, 39.586, 800, 80.5, 0.09
PARADISE, Butte, CA02, -121.624, 39.754, 1750, 81.6, 0.00
PORTOLA, Plumas, CA02, -120.472, 39.805, 4850, 67.7, 0.10
DE SABLA, Butte, CA02, -121.611, 39.872, 2710, 79.4, 0.00
BUCKS CREEK, Plumas, CA02, -121.315, 39.937, 1891, M, 0.10
CANYON DAM, Plumas, CA02, -121.089, 40.171, 4560, 70.0, 0.00
CHESTER, Plumas, CA02, -121.242, 40.303, 4530, 68.5, 0.06
MINERAL, Tehama, CA02, -121.609, 40.346, 4875, 65.3, 0.13
CULVER CITY, Los Angeles, CA06, -118.414, 34.005, 92, 72.8, 0.00
SANTA MONICA MUNICIPAL AP, Los Angeles, CA06, -118.447, 34.021, 175, 71.0, T
ONTARIO INTL AP, San Bernardino, CA06, -117.577, 34.053, 924, 83.4, T
COVINA CITY YARD FC387B, Los Angeles, CA06, -117.880, 34.092, 607, M, 0.00
U C L A, Los Angeles, CA06, -118.443, 34.070, 430, 73.3, 0.00
IRON MOUNTAIN, San Bernardino, CA07, -115.122, 34.147, 922, 100.4, 0.00
TWENTYNINE PALMS, San Bernardino, CA07, -116.037, 34.128, 1975, 93.3, 0.03
JOSHUA TREE, San Bernardino, CA07, -116.275, 34.147, 2563, 88.6, 0.01
SAN GABRIEL FIRE DEPT, Los Angeles, CA06, -118.100, 34.084, 363, M, 0.00
POINT MUGU NF, Ventura, CA06, -119.123, 34.124, 12, 67.9, T
ALTADENA, Los Angeles, CA06, -118.138, 34.182, 1127, M, 0.00
SAN GABRIEL CANYON PH, Los Angeles, CA06, -117.908, 34.155, 744, M, 0.00
WOODLAND HILLS PIERCE COLLEGE, Los Angeles, CA06, -118.574, 34.182, 790, 81.6, 0.00
COLEMAN FISHERIES STATION, Shasta, CA02, -122.143, 40.400, 420, M, 0.20
VOLTA PH, Shasta, CA02, -121.866, 40.458, 2220, M, 0.09
SCOTIA, Humboldt, CA01, -124.104, 40.483, 136, 64.2, 0.05
MANZANITA LAKE, Shasta, CA02, -121.577, 40.541, 5750, 65.2, 0.25
WHISKEYTOWN RESERVOIR, Shasta, CA02, -122.528, 40.612, 1295, 84.8, 0.00
SHASTA DAM, Shasta, CA02, -122.416, 40.714, 1075, 85.1, 0.00
TRINITY RIVER HATCHERY, Trinity, CA01, -122.795, 40.726, 1861, 76.7, 0.14
BUCKHORN, Shasta, CA02, -121.932, 40.880, 3700, M, 1.90
HAT CREEK, Shasta, CA02, -121.543, 40.932, 3015, 70.5, 0.50
PIT RIVER PH 5, Shasta, CA02, -121.977, 40.987, 1458, M, 0.03
WILLOW CREEK 1 NW, Humboldt, CA01, -123.636, 40.947, 464, 71.8, 0.00
FALL RIVER MILLS, Shasta, CA02, -121.435, 41.008, 3300, M, 0.00
ADIN RANGER STATION, Modoc, CA02, -120.945, 41.193, 4202, M, 0.12
DUNSMUIR TREATMENT PL, Siskiyou, CA02, -122.282, 41.183, 2169, 73.5, 0.03
MCCLOUD, Siskiyou, CA02, -122.138, 41.252, 3233, 67.1, 0.00
SAWYERS BAR RS, Siskiyou, CA01, -123.133, 41.301, 2255, 76.5, M
FORT JONES RS, Siskiyou, CA01, -122.848, 41.601, 2729, 73.8, 0.15
LAVA BEDS NAT MON, Siskiyou, CA01, -121.501, 41.702, 4770, 68.6, 0.00
CRESCENT CITY MCNAMARA AP, Del Norte, CA01, -124.238, 41.784, 56, 59.6, 0.02
FORT BIDWELL, Modoc, CA03, -120.157, 41.872, 4739, 71.6, 0.09
GASQUET RS, Del Norte, CA01, -123.965, 41.845, 387, M, 0.00
TULELAKE, Siskiyou, CA01, -121.474, 41.960, 4038, 67.6, T
COPCO NO 1 DAM, Siskiyou, CA01, -122.338, 41.980, 2665, 76.2, 1.29
BARSTOW, San Bernardino, CA07, -117.022, 34.893, 2220, 88.8, T
PEARBLOSSOM, Los Angeles, CA07, -117.897, 34.503, 3101, 85.4, 0.00
EL CAJON, San Diego, CA06, -116.928, 32.801, 495, 79.5, 0.00
MARKLEY COVE, Napa, CA02, -122.124, 38.492, 480, 80.1, 0.00
DEEP CANYON LAB, Riverside, CA07, -116.376, 33.651, 1200, M, 0.00
ELSINORE, Riverside, CA06, -117.346, 33.686, 1268, 83.2, 0.00
SANTA ANA JOHN WAYNE AP, Orange, CA06, -117.867, 33.680, 43, 76.0, 0.00
HAYFIELD PUMPING PLANT, Riverside, CA07, -115.629, 33.704, 1370, 95.0, 0.00
IDYLLWILD FIRE DEPT, Riverside, CA06, -116.707, 33.757, 5380, 73.9, 0.08
SAN JACINTO, Riverside, CA06, -116.975, 33.797, 1525, 83.9, 0.07
HEMET, Riverside, CA06, -116.894, 33.738, 1811, 84.2, 0.80
SANTA ANA FIRE STATION, Orange, CA06, -117.867, 33.744, 135, 77.6, 0.00
EAGLE MOUNTAIN, Riverside, CA07, -115.451, 33.809, 973, 97.0, 0.00
PALM SPRINGS, Riverside, CA07, -116.510, 33.828, 425, M, 0.00
LONG BEACH DAUGHERTY AP, Los Angeles, CA06, -118.147, 33.812, 34, 75.9, 0.00
PALOS VERDES ES FC43D, Los Angeles, CA06, -118.391, 33.800, 220, M, 0.00
FULLERTON MUNICIPAL AP, Orange, CA06, -117.986, 33.872, 86, 79.2, 0.00
MARCH AFB, Riverside, CA06, -117.250, 33.900, 1536, 80.9, 0.00
HAWTHORNE MUNICIPAL AP, Los Angeles, CA06, -118.333, 33.924, 55, 73.5, T
LOS ANGELES INTL AP, Los Angeles, CA06, -118.387, 33.938, 97, 71.5, 0.00
RIVERSIDE FIRE STATION 3, Riverside, CA06, -117.388, 33.951, 840, M, 0.00
RIVERSIDE MUNICIPAL AP, Riverside, CA06, -117.435, 33.953, 845, 82.8, 0.00
CHINO AP, San Bernardino, CA06, -117.625, 33.976, 636, 84.2, 0.00
VICTORVILLE, San Bernardino, CA07, -117.293, 34.529, 2880, 83.8, 0.00
GIBRALTAR DAM NO. 2, Santa Barbara, CA06, -119.682, 34.523, 1558, 77.2, T
PALMDALE, Los Angeles, CA07, -118.094, 34.588, 2612, 83.2, 0.10
SAUGUS POWER PLANT 1, Los Angeles, CA06, -118.454, 34.590, 2161, M, 0.00
CACHUMA LAKE, Santa Barbara, CA06, -119.982, 34.582, 789, 76.1, 0.00
SALSIPUEDES GAGING STATION, Santa Barbara, CA06, -120.408, 34.585, 254, M, T
PALMDALE AP, Los Angeles, CA07, -118.083, 34.629, 2509, 84.8, 0.07
LOMPOC, Santa Barbara, CA06, -120.451, 34.654, 75, 66.2, 0.00
LOMPOC AP, Santa Barbara, CA06, -120.467, 34.667, 88, 65.7, 0.02
LANCASTER, Los Angeles, CA06, -118.213, 34.741, 2338, 84.6, T
SANDBERG, Los Angeles, CA06, -118.724, 34.744, 4510, 80.0, 0.00
LEBEC, Kern, CA05, -118.865, 34.833, 3575, 76.3, 0.00
NEW CUYAMA FIRE STATION, Santa Barbara, CA06, -119.683, 34.946, 2160, 79.6, 0.00
TWITCHELL DAM, Santa Barbara, CA06, -120.321, 34.988, 582, 70.6, 0.05
LORAINE 5 NNE, Kern, CA05, -118.412, 35.384, 4235, 75.9, 0.00
LEE VINING, Mono, CA07, -119.119, 37.957, 6797, 68.6, 0.75
ANAHEIM, Orange, CA06, -117.842, 33.865, 235, 79.6, 0.00
NEW MELONES DAM HQ, Tuolumne, CA05, -120.486, 38.005, 960, 84.6, 0.00
SKYLINE RIDGE PRESERVE, San Mateo, CA04, -122.185, 37.313, 2270, 73.6, 0.20
FREMONT, Alameda, CA04, -122.016, 37.542, 38, 69.8, 0.01
TEHACHAPI 4 SE, Kern, CA05, -118.422, 35.101, 4220, 75.2, 0.05
REDDING CDF, Shasta, CA02, -122.299, 40.519, 502, M, 0.05
VALLEJO, Solano, CA01, -122.187, 38.100, 341, 74.0, 0.03
OXNARD WFO, Ventura, CA06, -119.137, 34.207, 52, 71.1, 0.01
HANFORD MUNICIPAL AP, Kings, CA05, -119.623, 36.311, 249, 83.1, 0.00
RAMONA AIRPORT, San Diego, CA06, -116.916, 33.038, 1385, 76.3, 0.00
VACAVILLE/NUT TREE AP ASOS, Solano, CA02, -121.959, 38.378, 104, 80.0, T
ALTURAS MUNICIPAL AP, Modoc, CA02, -120.561, 41.484, 4383, 67.8, 0.12
MADERA MUNICIPAL AP, Madera, CA05, -120.111, 36.985, 251, 81.4, T
BAKERSFIELD 5 NW, Kern, CA05, -119.051, 35.419, 470, 85.4, 0.00
FRESNO 5 NE, Fresno, CA05, -119.709, 36.767, 338, 84.8, 0.00
OCEANSIDE MUNICIPAL AP, San Diego, CA06, -117.350, 33.219, 30, 72.8, 0.00
SAN DIEGO SEAWORLD, San Diego, CA06, -117.231, 32.765, 14, 71.7, 0.00
ARCATA EUREKA AP, Humboldt, CA01, -124.105, 40.978, 211, 58.6, 0.02
NEWPORT BEACH HARBOR, Orange, CA06, -117.884, 33.603, 10, 70.8, 0.00
ESCONDIDO NO. 2, San Diego, CA06, -117.090, 33.121, 600, 80.4, 0.00
REDDING AP, Shasta, CA02, -122.298, 40.515, 501, 84.5, 0.05
AVALON CATALINA AP, Los Angeles, CA06, -118.415, 33.404, 1565, 73.7, 0.00
SANTA MARIA PUBLIC AP, Santa Barbara, CA06, -120.452, 34.894, 243, 66.8, 0.06
MOUNT SHASTA, Siskiyou, CA02, -122.333, 41.333, 3535, 71.2, 0.10
RED BLUFF MUNI AP, Tehama, CA02, -122.255, 40.152, 354, 83.9, T
NEEDLES AIRPORT, San Bernardino, CA07, -114.618, 34.768, 888, 100.5, 0.00
CHINA LAKE NAF, Kern, CA07, -117.693, 35.688, 2230, 90.0, T
SUSANVILLE 2SW, Lassen, CA03, -120.663, 40.417, 4212, 71.7, T
TEJON RANCHO, Kern, CA05, -118.750, 35.023, 1425, 85.6, 0.00
BURBANK GLENDALE PASADENA AP, Los Angeles, CA06, -118.365, 34.200, 731, 79.6, T
MORAGA 2.4 NNW, Contra Costa, CA04, -122.138, 37.870, 748, M, 0.04
SMITH RIVER 1.1 SSE, Del Norte, CA01, -124.136, 41.915, 120, M, 0.19
FORT DICK 0.2 SSW, Del Norte, CA01, -124.151, 41.865, 49, M, 0.12
FRESNO 2.4 NW, Fresno, CA05, -119.822, 36.805, 319, M, 0.00
SUSANVILLE 3.5 SSW, Lassen, CA03, -120.674, 40.363, 4347, M, 0.06
AHWAHNEE 2.5 NNW, Madera, CA05, -119.738, 37.400, 2840, M, 0.04
ALBION 4.0 SE, Mendocino, CA01, -123.710, 39.188, 636, M, 0.00
LAYTONVILLE 9.8 NNW, Mendocino, CA01, -123.534, 39.814, 2078, M, 0.00
GRASS VALLEY 1.3 NNE, Nevada, CA02, -121.046, 39.238, 2782, M, 0.07
GRASS VALLEY 2.7 SW, Nevada, CA02, -121.092, 39.194, 2334, M, 0.02
ORANGE 3.0 ENE, Orange, CA06, -117.778, 33.826, 649, M, 0.00
APPLEGATE 0.5 SE, Placer, CA02, -120.986, 38.996, 1983, M, T
SAN JOSE 5.8 NNE, Santa Clara, CA04, -121.824, 37.386, 293, M, 0.04
ENCINITAS 2.7N, San Diego, CA06, -117.292, 33.076, 188, M, 0.00
SAN DIEGO 13.9N, San Diego, CA06, -117.163, 32.917, 406, M, 0.00
REDDING 2.8 NW, Shasta, CA02, -122.401, 40.602, 661, M, 0.02
DORRIS 0.2 SW, Siskiyou, CA01, -121.923, 41.963, 4249, M, 0.70
HALF MOON BAY 0.7 NW, San Mateo, CA04, -122.445, 37.478, 36, M, 0.36
CAZADERO 5.6 W, Sonoma, CA01, -123.189, 38.532, 1211, M, 0.19
GUERNEVILLE 2.0 SSW, Sonoma, CA01, -123.005, 38.485, 69, M, 0.04
GLEN ELLEN 1.9 NNW, Sonoma, CA01, -122.551, 38.382, 365, M, 0.18
RANCHO CUCAMONGA 1.6 W, San Bernardino, CA06, -117.598, 34.122, 1379, M, 0.00
BARSTOW 4.2 NE, San Bernardino, CA07, -117.018, 34.924, 2170, M, 0.00
SOQUEL 0.8 NE, Santa Cruz, CA04, -121.936, 37.002, 414, M, 0.01
RED BLUFF 6.0 W, Tehama, CA02, -122.352, 40.159, 418, M, 0.12
RED BLUFF 7.2 WNW, Tehama, CA02, -122.360, 40.224, 557, M, 0.00
COTTONWOOD 4.4 ESE, Tehama, CA02, -122.201, 40.369, 567, M, 0.11
COTTONWOOD 9.1 SW, Tehama, CA02, -122.378, 40.282, 639, M, 0.18
COTTONWOOD 3.6 SSW, Tehama, CA02, -122.302, 40.341, 554, M, 0.12
MOUNT SHASTA, Siskiyou, CA02, -122.317, 41.322, 3613, 78.0, 0.11
WATSONVILLE MUNICIPAL AIRPORT, Santa Cruz, CA04, -121.790, 36.939, 162, 64.0, T
SANTA ROSA SONOMA CO AP, Sonoma, CA04, -122.811, 38.504, 119, 71.0, 0.09
COARSEGOLD 4SE, Madera, CA05, -119.690, 37.212, 2218, M, 0.00
MORONGO VALLEY NORTH, San Bernardino, CA07, -116.562, 34.086, 3145, M, T
TRUCKEE-TAHOE AP, Nevada, CA03, -120.145, 39.318, 5900, 65.1, 0.13
HEARST CASTLE, San Luis Obispo, CA04, -121.168, 35.684, 1526, 73.1, 0.00
HESPERIA 2E, San Bernardino, CA07, -117.266, 34.421, 3055, 83.4, T
RANCHO BERNARDO, San Diego, CA06, -117.081, 33.022, 690, 75.7, 0.00
OCOTILLO WELLS 2W, San Diego, CA07, -116.169, 33.155, 390, 100.3, 0.00
IRVINE RANCH, Orange, CA06, -117.723, 33.720, 540, 78.3, 0.00
MT. LAGUNA #3, San Diego, CA07, -116.419, 32.867, 5920, 76.1, 0.30
TORRANCE AP, Los Angeles, CA06, -118.342, 33.802, 90, 71.4, 0.00
MERCED 23 WSW, Merced, CA05, -120.882, 37.238, 78, 77.1, 0.00
REDDING 12 WNW, Shasta, CA02, -122.607, 40.651, 1418, 82.6, 0.00
STOVEPIPE WELLS 1 SW, Inyo, CA07, -117.145, 36.602, 84, 103.2, 0.12
RED BLUFF 2.8 N, Tehama, CA02, -122.243, 40.215, 406, M, 0.04
LOS ANGELES DOWNTOWN/USC, Los Angeles, CA06, -118.291, 34.024, 179, 76.7, 0.00
FRESNO YOSEMITE INT'L, Fresno, CA05, -119.720, 36.780, 334, 86.2, T
MONTEREY PENINSUL AP, Monterey, CA04, -121.849, 36.590, 160, 68.3, 0.01
PASO ROBLES MUNICIPAL AP, San Luis Obispo, CA04, -120.629, 35.669, 820, 77.4, 0.10
MONTAGUE SISKIYOU AIRPORT, Siskiyou, CA01, -122.468, 41.774, 2645, 75.3, 1.77
SAN JOSE, Santa Clara, CA04, -121.924, 37.359, 49, 73.7, 0.01
PALM SPRINGS ASOS, Riverside, CA07, -116.504, 33.822, 409, 97.3, 0.00
SAN DIEGO BROWN FIELD, San Diego, CA06, -116.994, 32.576, 521, 74.1, 0.00
Bakersfield Area, -, -, -, -, -, 87.2, T
Bishop Area, -, -, -, -, -, 80.1, T
Los Angeles Downtown Area, -, -, -, -, -, 76.7, 0.00
Eureka Area, -, -, -, -, -, 59.5, 0.08
Fresno Area, -, -, -, -, -, 86.2, T
Los Angeles Airport Area, -, -, -, -, -, 71.5, 0.00
Long Beach Area, -, -, -, -, -, 75.9, 0.00
Redding Area, -, -, -, -, -, 84.5, 0.05
Sacramento Area, -, -, -, -, -, 79.5, 0.02
San Diego Area, -, -, -, -, -, 73.6, T
Stockton Area, -, -, -, -, -, 81.9, T
San Francisco Airport Area, -, -, -, -, -, 67.0, 0.05
Santa Maria Area, -, -, -, -, -, 66.8, 0.06
LEMOORE REEVES NAS, Fresno, CA05, -119.950, 36.333, 232, 84.6, 0.01
COTTONWOOD 3.9 SW, Tehama, CA02, -122.342, 40.358, 447, M, 0.11
ARVIN, Kern, CA05, -118.834, 35.211, 450, 84.0, 0.00
CHIRIACO SUMMIT, Riverside, CA07, -115.721, 33.662, 1706, 92.4, 0.00
FALLBROOK 5 NE, San Diego, CA06, -117.190, 33.439, 1140, 77.9, 0.00
SANTA BARBARA 11 W, Santa Barbara, CA06, -119.880, 34.414, 18, 66.1, 0.09
BODEGA 6 WSW, Sonoma, CA01, -123.075, 38.321, 63, 58.1, 0.07
YOSEMITE VILLAGE 12 W, Mariposa, CA05, -119.821, 37.759, 6620, 71.1, 0.00
YUCCA MESA, San Bernardino, CA07, -116.407, 34.218, 3445, 87.6, 0.10
YUCCA VALLEY, San Bernardino, CA07, -116.388, 34.129, 3249, 83.8, 0.07
JOHNSON VALLEY, San Bernardino, CA07, -116.538, 34.359, 3167, 86.5, 0.00
REDONDO BEACH, Los Angeles, CA06, -118.376, 33.834, 142, 70.9, 0.00
FRESNO 3NW, Madera, CA05, -119.801, 36.909, 380, M, 0.00
BURBANK VALLEY PUMP PLANT, Los Angeles, CA06, -118.348, 34.187, 655, 77.6, 0.00
PIEDMONT 1.0 SE, Alameda, CA04, -122.216, 37.812, 372, M, T
CASTRO VALLEY 0.4 NNE, Alameda, CA04, -122.059, 37.717, 536, M, 0.10
PLEASANTON 1.8 SSE, Alameda, CA04, -121.875, 37.648, 351, M, 0.23
PLEASANTON 0.4 ESE, Alameda, CA04, -121.881, 37.670, 344, M, 0.21
MARTINEZ 0.8 SSE, Contra Costa, CA04, -122.108, 37.990, 252, M, 0.03
WALNUT CREEK 1.7 SSE, Contra Costa, CA04, -122.034, 37.878, 243, M, 0.16
LAFAYETTE 0.7 E, Contra Costa, CA04, -122.104, 37.894, 248, M, 0.04
LAFAYETTE 1.9 WSW, Contra Costa, CA04, -122.153, 37.888, 518, M, 0.00
MARTINEZ 2.2 SW, Contra Costa, CA04, -122.138, 37.974, 692, M, 0.02
ANTIOCH 2.2 WSW, Contra Costa, CA05, -121.838, 37.979, 178, M, 0.06
CONCORD 0.8 WNW, Contra Costa, CA04, -122.013, 37.978, 124, M, T
WALNUT CREEK 1.4 SSE, Contra Costa, CA04, -122.028, 37.885, 277, M, 0.14
CRESCENT CITY 5.5 NNE, Del Norte, CA01, -124.148, 41.824, 65, M, 0.04
PLACERVILLE 3.7 SW, El Dorado, CA02, -120.849, 38.695, 1755, M, T
PLACERVILLE 0.9 NE, El Dorado, CA02, -120.785, 38.739, 2036, M, 0.00
CLOVIS 2.9 N, Fresno, CA05, -119.693, 36.861, 382, M, T
HELM 2.7 NNE, Fresno, CA05, -120.089, 36.570, 183, M, T
ARCATA 1.1 NE, Humboldt, CA01, -124.069, 40.881, 420, M, 0.14
MCKINLEYVILLE 2.7 SE, Humboldt, CA01, -124.084, 40.923, 325, M, 0.13
MCKINLEYVILLE 7.3 ESE, Humboldt, CA01, -123.998, 40.896, 366, M, 0.07
TRINIDAD 1.5 NNW, Humboldt, CA01, -124.152, 41.078, 201, M, 0.13
MCKINLEYVILLE 2.3 NE, Humboldt, CA01, -124.086, 40.978, 270, M, 0.14
MIRANDA 4.1 SW, Humboldt, CA01, -123.894, 40.209, 539, M, T
WILLOW CREEK 4.5 NNE, Humboldt, CA01, -123.624, 40.939, 655, M, T
BRIDGEVILLE 5.2 ENE, Humboldt, CA01, -123.701, 40.473, 2675, M, 0.03
FORTUNA 0.1 NW, Humboldt, CA01, -124.141, 40.587, 65, M, 0.08
GARBERVILLE 2.2 SW, Humboldt, CA01, -123.824, 40.077, 415, M, 0.00
EUREKA 2.2 S, Humboldt, CA01, -124.148, 40.764, 194, M, 0.13
BISHOP 1.7 NW, Inyo, CA07, -118.414, 37.388, 4181, M, 0.01
LEMOORE 0.3 SW, Kings, CA05, -119.791, 36.295, 223, M, 0.00
HANFORD 3.6 N, Kings, CA05, -119.653, 36.377, 258, M, T
HANFORD 1.7 WNW, Kings, CA05, -119.674, 36.335, 245, M, T
INYOKERN 9.4 WSW, Kern, CA07, -117.978, 35.635, 4319, M, T
ONYX 2.8 ENE, Kern, CA05, -118.174, 35.702, 3039, M, 0.00
GLENDALE 2.4 WSW, Los Angeles, CA06, -118.295, 34.169, 511, M, 0.00
TORRANCE 2.8 SW, Los Angeles, CA06, -118.337, 33.790, 200, M, 0.00
SHERMAN OAKS 1.7 ENE, Los Angeles, CA06, -118.420, 34.154, 638, M, 0.00
WHITTIER 2.9 WNW, Los Angeles, CA06, -118.066, 33.986, 171, M, 0.00
CANYON COUNTRY 2.6 E, Los Angeles, CA06, -118.427, 34.427, 1617, M, 0.00
MIDDLETOWN 3.3 SSE, Lake, CA02, -122.603, 38.706, 1273, M, 0.05
SUSANVILLE 3.2 SSW, Lassen, CA03, -120.674, 40.368, 4353, M, 0.06
UKIAH 8.4 NW, Mendocino, CA01, -123.331, 39.221, 2492, M, 0.12
BOONVILLE 2.2 WSW, Mendocino, CA01, -123.408, 39.006, 1061, M, 0.06
UKIAH 1.2 NW, Mendocino, CA01, -123.225, 39.158, 746, M, 0.29
REDWOOD VALLEY 1.5 ENE, Mendocino, CA01, -123.178, 39.272, 912, M, 0.16
LAYTONVILLE 1.1 SW, Mendocino, CA01, -123.490, 39.672, 1647, M, 0.05
LEE VINING 5.9 NW, Mono, CA03, -119.170, 38.034, 7094, M, 0.36
MARIPOSA 3.7 NNW, Mariposa, CA05, -119.988, 37.540, 2942, M, T
MARIPOSA 12.5 E, Mariposa, CA05, -119.742, 37.461, 2952, M, 0.04
WOODACRE 0.6 SW, Marin, CA01, -122.635, 38.005, 439, M, 0.14
SAN ANSELMO 0.4 NE, Marin, CA01, -122.564, 37.987, 107, M, 0.12
PETALUMA 10.1 W, Marin, CA01, -122.812, 38.248, 119, M, 0.05
TOMALES 1.3 ENE, Marin, CA01, -122.883, 38.251, 128, M, 0.05
MILL VALLEY 1.5 S, Marin, CA01, -122.544, 37.886, 209, M, 0.12
LOCKWOOD 3.6 NW, Monterey, CA04, -121.117, 35.981, 1181, M, 0.00
CARMEL VALLEY VILLAGE 0.7 SSE, Monterey, CA04, -121.720, 36.476, 446, M, 0.00
CASTROVILLE 1.6 ENE, Monterey, CA04, -121.727, 36.777, 17, M, 0.05
CALISTOGA 0.4 SSE, Napa, CA01, -122.578, 38.576, 348, M, 0.11
